"It is at the cabinet exam in Meseberg and greets kindly. Well, maybe she&#39;s just explaining the thing about eSport to Seehofer Horst"
😂
I also don&#39;t 😎
We have halved the number of unemployed in Germany in the past twelve years. We have a record job. And Hartz IV made a decisive contribution to this with its concept of “promoting and demanding”.
LEUTHEUSSER-SCHNARRENBERGER: &quot;Personal information was not part of the postal data. Sending campaign flyers specifically to a street or a district is in accordance with data protection law.&quot; @Liberale_News @fdp @fdpbt http://www.deutschlandfunk.de/post-datenweitergabe-leutheusser-schnarrenberger-fdp.1939.de.html?drn:news_id=867960…
"BEER: &quot;Without a doubt, people with Hartz IV live very modestly, you can also say: poor. But Hartz IV is only supposed to bridge the way back to work &amp; should not be a lifelong achievement.&quot; @Liberale_News https://www.nwzonline.de/interview/religionsrechte_a_50,1,1106698987.html…"
"BEER: &quot;Hartz IV is a success story &amp; has proven itself. Only not for the left and parts of the SPD, which is almost masochistically plagued by Schröder&#39;s legacy.&quot; @Liberale_News https://www.nwzonline.de/interview/religionsrechte_a_50,1,1106698987.html…"
"BEER: &quot;Religious freedom belongs to Germany. It applies to Jews, Buddhists, Christians, Hindus &amp; of course Muslims who live here. Even to atheists. Religious freedom is part of our order of values, our basic law.&quot; @Liberale_News https://www.nwzonline.de/interview/religionsrechte_a_50,1,1106698987.html…"
"BEER: &quot;We urgently need to talk about how we can speed up the competition authorities&#39; audits, because #fundamental rights apply everywhere &amp; can therefore be protected promptly and effectively even in digital systems&quot; @Liberale_News #Facebook http://www.handelsblatt.com/politik /deutschland/facebook-google-und-co-fdp-will-wettbewerbshueter- gegen-web-giganten-staerken/21132598.html…"
FDP: FDP is skeptical about Scheuer&#39;s &quot;mobile phone summit&quot; https://www.welt.de/newsticker/news1/article175085558/FDP-FDP-sennt-Scheuers-Mobilfunkgipfel-skeptisch.html?wtmc=socialmedia.twitter.shared.web… via @world
Yesterday&#39;s tweet was of course an April Fool&#39;s joke. Nicola Beer does not require school classes to appoint data protection officers from among them. (Team Beer) #Class Data Protection Officer https://twitter.com/nicolabeerfdp/status/980342937258217472…
Yesterday&#39;s tweet was of course an April Fool&#39;s joke. Nicola Beer does not require school classes to appoint data protection officers from among them. (Team Beer) #Class Data Protection Officer
Read the copyright notice on the tile. (Team Beer)
"BEER criticizes Facebook&#39;s dreams of smashing @Die_Gruenen: &quot;Existing competition and antitrust law offers all the instruments to also sanction digital corporations in the event of data misuse and, if necessary, to change their structure.&quot; @Liberale_News http://www.handelsblatt.com/21132598 .html? share = twitter…"
Simmer! (This Beer)
FDP-Beer🍓 on Seehofers Braunbär🐻 plans: observe and identify the danger - now it shows how inside and home belong together! (Team Beer 🍺) @Liberale_News @fdpbt @fdp http://www.tagesschau.de/inland/seehofer-braunbaer-101.html…
BEER on the implementation of the #DSGVO in German schools: The choice of a data protection officer in a school class must be as natural as the choice of the class representative. #DSGVO #BDSG #Datenschutz @Liberale_News @loadev @c_netz @heiseonline @telepolis_news (Team Beer) pic.twitter.com/gX199Fqosz
Happy Easter everyone! Ostern # Easter2018 #Easter pic.twitter.com/Rg9pKkWPvO
"Panel discussion &quot;Unsatisfied people&quot;: BEER not only sees responsibility for the state, but also for young people. One had &quot;bred a claim that everything would be done for you&quot;. http://www.maz-online.de/Lokales/Oberhavel/Glienicke/Wie-begeistert-man-junge-Leute-fuer-Politik… via @maz_online @Liberale_News"
Great house Berlin! Motto: Save yourself who can. The blame has started. The #chancellor is silent. 🤐 Committee of Inquiry Now! #PUA #BAMF #bamfgate @Liberale_News @fdpbt @fdp https://twitter.com/DLFNachrichten/status/1003517863301349383…
BEER: &quot;The #AfD is nothing sacred when it comes to seeking attention and provocation. The best thing would be to simply ignore these calculated failures. These #Gaulandries speak against themselves.&quot; @Liberale_News https://www.welt.de/politik/deutschland/article176936864/Kritik-an-Gauland-SPD-General-Klingbeil-sennt-perfide-AfD-Strategie.html… via @welt
 https://twitter.com/nicolabeerfdp/status/1003259617332355072?s=19 …
Goes fast. You just have to want &amp; don&#39;t sit out. @Liberale_News @fdp @fdpbt https://twitter.com/ciffi/status/1003264599595126784…
The @fdp would have shown: 1. Humanity. 2. Addressed the #Bundestag. 3. Immediately call a #EU crisis summit. @Liberale_News @fdpbt @welt https://twitter.com/ciffi/status/1003239777951502337…
Destructive criticism from the head of the agency. How long will the # Chancellor and her refugee coordinator remain silent? https://www.welt.de/politik/deutschland/article176921262/BAMF-Weise-wies-schon-2017-auf-BAMF-Missstaende-hin-auch-Merkel-war-informiert.html&amp;wtmc=socialmedia.twitter.shared. web… via @welt @Liberale_News
"Ui, that seems to have hit you really hard, that everyone who does not think that the RI block lists have been pushed by ÖRR-Böhmermann is now criticized afterwards. More love please and all. Team Beer"
"Former # Bamf head of authority, Weise: There was &quot;organizational failure in the crisis&quot; &amp; &quot;de facto bankruptcy of the Bamf&quot;. We need political reappraisal by a # investigation committee. http://spon.de/affaY @Liberale_News #bamfskandal #bamfgate"
There is an explicit requirement to retrofit Euro 4 and Euro 5 diesel. It&#39;s all about this. Discussions about what you still want to describe as old or new really do not advance the discussion. Team Beer
Did you just discover the EU for the first time? And no: none of the other EU members are interested in a weak German trade policy position. Team Beer
Good thing we solved that. Nice weekend Team Beer
"Since Germany does not negotiate the treaties, but the EU is competent for it, the audible construct is called # ALDE = Group of the Alliance of Liberals and Democrats for Europe, with the Christian Democrats and Socialists part of the majority in the European Parliament. (TB)"
"Repetition does not make it any more true: the tweet has never been deleted, stop claiming such nonsense. https://twitter.com/loewe_lukas/status/1002272189494779905… Team Beer"
This is simply wrong. The tweet was never deleted. Please don&#39;t spread such nonsense. https://twitter.com/loewe_lukas/status/1002272189494779905… Team Beer
It is very gratifying that so many supporters for #free trade🌍 suddenly speak out in the discussion about the #trumpet tariffs imposed by #trump🇺🇸 in the emerging #trade war! #TTIP #CETA #Japan pic.twitter.com/HykBRoRr9h
"The entire federal board as a collegial body, of course, especially Theurer &amp; Luksic. The Beer office had also insisted on a few points. Beer office"
"We tried that. So far. They can be seen in &quot;Top&quot;, but not in &quot;Latest&quot;. We have qualifilters off by default. You saw attitude doesn&#39;t make a difference? Do you want to send us an email to nicola Punkt beer ät fdp Punkt de? Team Beer"
"Herr Aßmann, if you are right for the left and left for the right, then as a Free Democrat you did everything right. Team Beer"
"This is wrong: You can ONLY report to the Federal Office of Justice that nothing has been deleted, NOT that TOO MUCH has been deleted. We always pointed out this #construction error. Registration form BfJ: https://www.bundesjustizamt.de/DE/Themen/Buergerdienste/NetzDG/Service/Formulare/Meldung/Formular_node.html… @Liberale_News @loadev @jimmyschulz #NetzDG https://twitter.com/EskenSaskia/status / 1002438016898686976…"
Discussion event in the new grammar school #Glienicke in the district #Oberhavel: &quot;What do we have to do to rekindle the desire of many people for democracy?&quot; pic.twitter.com/AJpxHcsVdd
# FDP Secretary General Nicola Beer gave &quot;T-Online&quot; the following interview CLICK 👇 https://www.liberale.de/content/beer-interview-wir-muessen-die-buerger-auf-veraenderungen-vor prepared… via @tonline_news @ tonline_digital #Zuckerberg #DSGVO #Facebook
"Yes, you have the right. But you had questioned #press freedom above. Team Beer"
"Panel discussion on June 19 in Berlin: Does Islam belong to Germany? With Seyran Ates, founder of the Ibn Rushd Goethe Mosque, FDP general secretary Nicola Beer &amp; Sebastian Czaja, FDP parliamentary group leader in Berlin. Register here👇 https://www.berliner-woche.de/moabit/c-politik/gehoert-der-islam-zu-deutschland_a164630… @Liberale_News"
FDP general secretary Nicola Beer tweeted who &quot;still divides the political world into the left and right categories in the 21st century&quot; needs &quot;new glasses&quot; and &quot;politics past people&quot;. https://www.heise.de/tp/features/BAMF-Affaere-Seehofer-und-Cordt-vor-dem- Interior Committee-4060657.html… @Liberale_News via @telepolis_news
"&quot;The right to say and print what we think is the right of every free person, which could not be taken away from him without the most obnoxious tyranny.&quot; Voltaire"
"Of course, such a comparison can be written within the framework of the #press freedom. Whether it&#39;s tasteless or over the top is a completely different question. Under no circumstances should the magazine be threatened! Team Beer"
The French political magazine @LePoint has my full support and is allowed to report and write about #Erdogan what it wants. We call it #press freedom! http://spon.de/afeWr via @SPIEGELONLINE @Liberale_News
"However, we do not count the victims and the perpetrators of violence against each other, that is tasteless, Mr. Frankenberger. Please don&#39;t do that. Team Beer"
Where exactly are you missing Tacheles?
"Justus #Haucap, professor of competition economics at the University of Düsseldorf: “Data is collected everywhere in customer contact, even in the travel agency. How should you differentiate who pays data tax and who doesn&#39;t? ”Http://www.faz.net/-ikh-9ana2?GEPC=s3… via @faznet @haucap @Liberale_News"
#FAZ: &quot;Beginning writing: How to learn to write&quot; ✒️ You cannot do without a neat handwriting even in the digital age. Because people really understand their environment in the truest sense of the word. http://www.faz.net/-in2-98s6v?GEPC=s3… via @faznet @Liberale_News
"Where do you lack quality? It is now easier for SMEs to act in other European countries because they do not have to observe 27 completely different data protection rights. And for the first time in Europe, the consumer has a level of protection similar to that of the Federal Data Protection Act"
"If you are to abolish fundamental rights, you are here with the wrong party. Nothing speaks against the protection of personal data if it is implemented properly. The #DSGVO is in parts of life. Team Beer"
"Because we as a European market with 28 different data protection laws (+ 16 different national laws in DE) do not stand a chance internationally against online markets such as the USA, China and India. Team Beer"
Today the #DSGVO comes into force. Finally # uniform data protection across the EU. But criticism is also appropriate because the implementation was not ideal. #That&#39;s Going Better pic.twitter.com/5JjXlqINx8
"Nicola Beer reaffirms demand for a # investigation committee on the Bamf affair. &quot;It&#39;s just the tip of the iceberg,&quot; Beer says. Possibly &quot;structural deficiencies&quot; were used to illegally issue asylum decisions. https://www.huffingtonpost.de/entry/markus-lanz-investigativ-journalist-berichte-vom-chaos-im-bamf_de_5b063dcee4b0784cd2b12492… @Liberale_News"
"In the # BAMF scandal, @fdp wants a # investigation committee. Markus #Lanz said yesterday: &quot;If things go well, it could be a great moment in democracy.&quot; #bamfgate #Seehofer #Merkel @ZDF pic.twitter.com/lA2QdGYGBn"
Team Beer likes to hear that!
EndungShow with Nicola Beer at Markus Lanz about the #BAMF scandal &amp; the political responsibility of #Seehofer &amp; #Merkel here online.⬇️ The events must be clarified before a # investigation committee https://www.zdf.de/gesellschaft/markus-lanz/markus-lanz-vom-23-mai-2018-100.html… via @ZDF @Liberale_News
. @ Tagesschau on # Facebook hearing: &quot;Nicola Beer from @fdp described the format of the survey as&quot; cheeky &quot;&amp; also brought into play the request that #Zuckerberg answer the questions that remain unanswered in writing. http: // www. tagesschau.de/ausland/zuckerberg-eu-113.html… @Liberale_News
If multigrain rolls are sold out - then yes!
He just wants to play ... ;-) (Team Beer)
"We do not need a #conducting culture, we need a #value system that everyone has to abide by without exception. Our guiding culture is the # Basic Law. Congratulations on your 69th birthday! @Liberale_News pic.twitter.com/ZEMSjAo81K"
Daaaaanke 😙 from Team Beer
Equation is unacceptable. Corresponds to #Erdogan | s anti-Israeli polemic for a long time &amp; trivializes the #Holocaust. Reject the content and tone of his speech. http://www.faz.net/-gq5-9ab5h?GEPC=s33… via @faznet @Liberale_News @JuedischeOnline #Israel # Turkey
"We basically have extremely high engagement values, and this tweet was retweeted because it first went online at a very bad time. It was kind of a test whether it worked better with a holiday retweet. Obviously not. What else do you want to know? Team Beer"
We wish everyone a happy Pentecost. Team Beer pic.twitter.com/loshGWFpg0
"Oh, how beautiful! The Underdog vom Main is German cup winner! ⚽🇩🇪🦅 Thanks @Eintracht, thanks Ante Rebic, thanks Niko Kovac! http://spon.de/afeA8 @Liberale_News"
My recommendation: Housing shortage in Berlin: politics bypassing the citizen - nobody intends to approve an apartment. How a green building senator exacerbates the housing shortage. @Liberale_News @fdp_berlin https://www.tagesspiegel.de/berlin/wohnungsnot-in-berlin-n nobody-hat-die-absicht-eine-wohnung-zu-genehmigen/22581126.html…
How so? Is there a beer?
Do you want to talk about the development of electricity prices for the population and what role the Greens play in it? With pleasure. Team Beer
"#FDP: For the Free Democratic Group, there is no way around a #BAMF # investigation committee. This is the only way to make a relentless reprocessing possible. http://www.spiegel.de/politik/deutschland/bamf-affaere-fdp-forder-untersuchungsausschuss-horst-seehofer-unbesorgt-a-1208212.html… via @SPIEGELONLINE @Liberale_News"
That is 🐻 or 🍺 or stop 🍓
"No, we have been requesting this for over a year: https://www.fdp.de/pressemitteilung/theurer-interview-kreuzzug- Gegen-den-diesel… (Team Beer)"
Very worth reading # Interview📰 of our Bavarian # top candidate for the #Landtag election Martin Hagen. @realMartinHagen #Bayern # ltw18 https://www.welt.de/politik/deutschland/article176436321/Bayernwahl-Warum-ein-FDP-Politiker-empf recommend-die-AfD-zu-waehlen.html… via @welt @Liberale_News
"No, because the way you ask this suggests that politicians who were in election campaign appointments in the weeks leading up to BTW17 20h a day should have known RG. Back then we blocked trolls individually, as we do now."
You can google my statements about the AfD BEFORE BTW17 if you are not familiar with them.
"Merkel does not want to &quot;weaken the cause of the diesel scandal through political measures&quot;, for example VW, which achieved record sales and record results in 2017. I request hardware retrofitting at the manufacturer&#39;s expense! http://spon.de/afeqN via @SPIEGELONLINE @Liberale_News"
Greetings back!
"💬📺 Speech by our #ALDE guest, Mayor of the City # Mechelen &amp; Group Chairman of the Flemish Liberals in the Committee of the Regions @ALDE_CoR &amp; in the Flemish Parliament @vlaparl Bart SOMERS @BartSomers at the #Federal Conference of @fdp https://www.youtube.com/watch ? v = Rbdd6bgLyKE… @Liberale_News"
"FrauFantastic Mrs. Fisher, you put a lot of effort into it. I&#39;ll feed that into our party strategists!"
Missed Nicola Beer&#39;s speech at the Federal Party Congress? Here&#39;s another best of to check out # bpt18 #innovationnation @liberale_nieuws pic.twitter.com/PAG38Mb1Ao
"The lady down here in the video criticizes, by the way, not speaking as an opposition but as a coalition of which she is part. It&#39;s hard to believe ... #GroKo @Liberale_News https://twitter.com/ARD_BaB/status/996710834419191809…"
"Nonsense. I said that systematic blocking is not a solution, no matter from the right or from the left. What do you want to hear Write with &quot;The Twitter block practices of the AfD and its parliamentary group do not help the political discourse and intensify filter bubbles.&quot;"
"Yes, because we have a state monopoly on violence. It is the sole responsibility of the state to prosecute criminal behavior. Not from private companies, not from auxiliary sheriffs."
So I can&#39;t wait until Follower Friday: We welcome the Federal Association of LIBERAL WOMEN on Twitter! CLICK here 👉 @DerFrauen #FF @Liberale_News @fdp @fdpbt
"But you trust, like me, the independence of our #Judicative."
"No, they should stay. Both RG and RI should show everyone how much they increase filter bubbles and top-down communication with their black lists &amp; spam campaigns and destroy political discourse!"
"There is one from the RI &amp; RG Troll Group again, we already missed you! Did the daily order come late? Team Beer"
"It is the rule of law. Every accused is entitled to the best possible defense, whether tax offense or murderer. And we RAe swear by the GG &amp; standing up for these principles without looking at the person seeking help. @Liberale_News @fdpbt"
"Mr. Thiele, you will not be able to dispute that the malicious joy among your party friends is gigantic, even though Habeck has taken Lindner into protection and the taz reports fairly about it. Team Beer"
"Everyone&#39;s opinion. But unlike many other parties, we are fighting to continue to express this opinion in the future. That is the difference. Team Beer"
It is exciting that both members of the Blue and the Green can now let off steam among the social media posts of the FDP. The FDP seems to have done something right. Team Beer
"Wrong punctuation, stupid. Schadenfreude seems to be huge. Nice that we were able to contribute to the amusement. Team Beer"
"Ah, the RIler again. How are you? Where&#39;s the love Or has the motto been given internally that all critics of the black lists should be placed in the right corner? Hmmm? What was issued as a command on the Discord server? Best regards, Team Beer"
Nope. (Team Beer)
We are happy to help you break down further prejudices. (Team Beer)
FDP general secretary Nicola Beer calls for more investment in education and modern administration before the party conference begins. Germany must use its potential because it is the only way to create growth and prosperity. (TB) # bpt18 🚀 # InnovationNation https://www.inforadio.de/programm/schema/sendung/int/201805/12/233229.html…
Speech by FDP Federal Chairman Christian Lindner. (TB) # bpt18 #InnovationNation @c_lindner pic.twitter.com/eAbKzQnhEi
They&#39;re not awake so early in the morning ... (Team Beer)
We'll think about it...😉 (Team Beer)
"Maybe you should take a look at the game first - thanks to the prize money, it can now be implemented. Connects reading in the virtual and real world. I think it&#39;s great! Just like more women in the industry."
Here we go! 69th FDP Federal Party Congress 2018 in Berlin! # bpt18 #InnovatioNation @Liberale_News (TB) pic.twitter.com/XxPxQtwahw
Full house at the Female Morning Meeting! #InnovationNation # bpt18 pic.twitter.com/vSSDABlw5T
"This is actually a fundamental consideration: we do not comment under the accounts / timelines of other parties, we want to talk about our own ideas, solutions &amp; content and thus convince. (Team Beer)"
"so, no, no contradicting statements, some of the messages also came from a common pool from which all candidates in the constituency could avail themselves. (Team Beer)"
"The articles are misleading. We have defined target groups for advertising channels, for example for advertising district candidates, advertising tiles have been restricted to the constituency (saves money). Not contradicting messages to different target groups, that would be something else and unfair. (Team Beer)"
"I understand from your question that they want to downplay, justify and defend such blacklists. Do you think &quot;Resist the Beginnings&quot;? Then apply the principle indiscriminately to right and left."
"&quot;Jan Böhmermann shows how totalitarian thinking can become cool again.&quot; In conversation with the media, the ZDF program director said about the blacklists: &quot;We have nothing to do with it &amp; we would not have done it either.&quot; Http: // meedia. de / 2018/05/11 / review-on-internet-pillory-for-rights-jan-boehmermann-shows-how-total-thinking-can-become-cool-again / ... via @meedia @Liberale_News"
"Ultimately, you are helping to strengthen echo chambers and top-down communication even further, which helps democratic discourse exactly how? Your action is certainly well-intentioned, but in the end it is just as bad as the behavior of those on the net who are fighting it."
"Blocking or sending hearts Emojis are not a contribution to political dialogue. Blacklists, whether from the right or the left, do not solve a single political problem. Blacklists are illiberal and intolerant. @Liberale_News https://twitter.com/trotzendorff/status/994863801358053376…"
The head of the online @FAZ_Feuilleton &amp; broadcasting expert @MichaelHanfeld reports on the data comparison between the # ÖRR #Beitragsservice and the residents&#39; registration offices and the forthcoming hearing before the # Federal Constitutional Court. http://www.faz.net/aktuell/feuilleton/medien/dieser-tage-geht-es-vielerorts-um-den-rundfunkbeitrag-15580612.html… via @faznet @Liberale_News
# Mühlbauer on @heise_de_tp on the plans of the federal states to abandon the goal of restricting public service broadcasting. #Rundfunk @Liberale_News @hansjoachimotto @loadev https://www.heise.de/tp/features/Laender-haben-Ziel-einer-Beschraenken-der-oeffständig-rechtlichen-Programme-klammheimlich-auf-4046287.html… via @ The H
"📺The full interview of the @fdp Secretary General this morning at @ZDF @morgenmagazin with the topics #Russia, # tax surplus &amp; #women&#39;s quota is now available here on ZDF # Mediathek📱 -&gt; CLICK👇 https://www.zdf.de /nachrichten/zdf-morgenmagazin/videos/fdp-nicola-beer-100.html… (Team Beer)"
"The German environmental aid (that is the complainant with the #Diesel) has to send schoolchildren to collect donations, and the school supervision stops the action. Why the association still receives funding is inexplicable to me ... https://www.focus.de/auto/news/abgas-skandal/schulen-schulaufsicht-stoppt-spendensammlung-fuer-umwelthilfe_id_8903915.html… @Liberale_News #Dieselgate"
Thank you. (Team Beer)
Please read Orwell. You don&#39;t get stupid.
"Such nonsense, Mr. Pyak, and you know that ..."
Haven&#39;t read George Orwell&#39;s &quot;1984&quot; for a long time? The &quot;Ministry of Love&quot; also &quot;trolls with love&quot; - in the service of the surveillance state!
". @ JochenBittner: &quot;Define bad thinking broadly and good thinking narrowly and claim that there are many, many more enemies of a better humanity than you think. The discourse suffocation is done.&quot; https://www.zeit.de/politik/deutschland/2018-05/jan-boehmermann-reconquista-internet-5vor8?wt_zmc=sm.ext.zonaudev.twitter.ref.zeitde.share.link.x… via @ zeitonline @Liberale_News"
Recon offender! Are you crazy? http://www.faz.net/-gpg-99zsz?GEPC=s33… via @faznet @Liberale_News
"Question 5: Playing out &amp; replacing one radicalism with another. Question 6: yes. Are allegations part of your way of working? Question 7: The FDP fights against every form of radicalism, whether from the right or from the left. Blacklists don&#39;t solve a single political problem."
Question 1: You have to ask a representative of neoliberalism. The FDP is the party of optimism and belief in the better future. Question 2: You have to ask Mr. Henkel. Question 3: Rhetorical question. Question 4: leading question. 1.2
"Via @spiegelonline: The FDP general secretary Nicola Beer tweeted: &quot;The AfD continues to tolerate Björn Höcke in its ranks, the deputy of shame, who only stands out because of history and anti-Semitic provocations.&quot; http://spon.de/afeac @Liberale_News"
"#AfD continues to tolerate Björn Höcke in their ranks, the deputy of shame, who stands out only because of historical relevance and anti-Semitic provocations. @Liberale_News https://twitter.com/ZDFheute/status/994125760490287104…"
"And once again my answer already given: Resist the beginnings. Such lists, whether right or left, conservative or progressive, are the beginning of such dictatorships. What follows as the next escalation level when everyone has blacklisted each other?"
Then I&#39;m looking forward to your DM.
"Dear form, if the gentleman appears under criminal law, the investigative authorities should take care of it. Other tweets are legally protected by freedom of expression. This protects left &amp; right, fat &amp; thin, bad &amp; good taste."
