"Congratulations, deserve it! Nicola Beer"
"Look at ... Berlin&#39;s ex-commissioner for foreigners, Barbara John (CDU), calls for a &quot;reversal of thrusts in the right of asylum and immigration&quot;: &quot;We have to switch from a comm system to a fetch system.&quot; This is 100% pure @ fdp line.https: //www.welt.de/politik/deutschland/article176569172/Asyl-Barbara-John-kritisiert-Regelungen-in-Deutschland-scharf.html… via @welt @Liberale_News"
Tonight #Facebook CEO Mark #Zuckerberg will answer the questions in the #European Parliament. Zuckerberg&#39;s answers at the US Congress in April hadn&#39;t convinced me. We will comment on that. 🎥 Live stream from 18h20 CET here ⬇️ http://www.europarl.europa.eu/ep-live/en/other-events/video?event=20180522-1820-SPECIAL-UNKN… @Liberale_News @fdp
"When discussing what is going on in the Federal Office for Migration &amp; Refugees, it is often forgotten that Merkel #Responsibility had moved to the Chancellery in 2015. We have to investigate the incidents with an investigation committee. # BAMF @Liberale_News https://www.tagesspiegel.de/politik/fluechtlinge-angela-merkel-macht-fluechtlingspolitik-zur-chefsache/12416088.html…"
"Nicola BEER: For a #Football World Cup⚽ in #Russia without politicians, without journalists, but in three words: unity and right and freedom! @Liberale_News @DFB @fifacom_de @FIFAcom @fifaworldcup_de @olympia https://www.liberale.de/content/beer-gastbeitrag-fussball-wm-ohne-politiker…"
"However, this does not solve the problem of those who are left alone individually with more than € 5k worth of value and possibly driving ban. Team Beer"
"The liberal men&#39;s club, of course, or what did you think? (Team Beer)"
Welcome to the club! (TB)
"Yes, that&#39;s exactly what we mean, Mr. Klose. Always hit it with the moral, educational index finger. Always on the right side morally, even if electricity prices go through the roof for the population. Team Beer"
The Greens&#39; easy handling of facts. But - importantly - always up to date morally. Very readable article. #Glyphosate #Trinkwassser #Angst #Strompreis http://meedia.de/2018/05/17/trinkwasserpreis-glyphosat-co-der-manmale-problematik-umgang-der-gruenen-mit-der-wahrheit/… via @meedia @Liberale_News
"Of course, washing machine and dishwasher. Beer Team Beer"
The discussion with Mark Zuckerberg should be a HPublic Hearing. EU citizens are not 2nd class #Facebook users. | The discussion with Mark Zuckerberg should be a public hearing in the EU Parliament🇪🇺. EU citizens are not 2nd class Facebook users. @Liberale_News @loadev https://twitter.com/jduch/status/997035967411351552…
Nicola Beer on the digitization podium at the Day of the German Construction Industry🏗️ on the challenges and goals of #digitalization.💾 (TB) @dtbauindustrie @DJanecek #bim #digitalisierung #bauindustrie @Liberale_News pic.twitter.com/tAxFpdo9ef
"&quot;The Cleaners&quot;, a film about the deletion teams at social media operators and the question of whether large corporations use it to determine our thinking. (Team Beer) #NetzDG #freedom of expression #Facebook http://www.faz.net/aktuell/feuilleton/kino/dokumentation-the-cleaners-facebook-bestetermined-was-wir-sehen-15593540.html?GEPC=s33… via @faznet @Liberale_News"
"Dear Prof. Hüther, since @civey_de claims to conduct representative surveys, you should better clarify this question among yourself. However, we would be interested in the outcome of the discussion. Sincerely, Team Beer"
How much crime is there in Berlin&#39;s schools? Our Berlin # FDP interior expert Marcel Luthe MdA had to sue the Berlin Constitutional Court &amp; 689 (!) Small inquiries to get the data. https://www.bild.de/regional/berlin/schule/so-viel-kriminalitaet-herrscht-an-berliner-schulen-55718768.bild.html?utm_source=dlvr.it&amp;utm_medium=twitter… @LutheMdA @fdp_berlin @Liberale_News
"Dear Mr. Mees, the discussion about the meaning and nonsense of these lists also runs on the Discord Server. Likewise, the dispute as to whether RI is politically neutral or not (in my opinion naively believing RI is neutral). Purpose does not justify means. RI does not accept criticism of this."
"This is simply untrue, the discussion about the sense and nonsense of these lists is also held on the Discord Server."
"As already explained, the discussion about the sense or nonsense of these lists also runs on the Discord Server."
"That is exactly the point: you can only solve these problems in political discourse. Blocking and sparring does not advance the political discourse, but solidifies the filter bubbles. But public criticism is not accepted by RI."
"That&#39;s the point. To use the same critical means in the fight against law, but not to accept criticism of it."
"The criticism of these lists also runs on the Discord Server. Centrally non-transparent blacklists do not advance political discourse, but criticism of them is not accepted by RI. Too bad."
Do you know that FDP members are also on the black lists?
The controversy as to whether RI is neutral is still on the Discord server. There is a falling apart between desire (= code) and reality. The idea that RI is politically neutral is naive.
"What I have already said everywhere: We condemn blacklists / blocklists, whether from the right or the left, they do not continue in the political discourse."
That is exactly the problem. RI does not accept criticism of the choice of funds. This discussion also runs on the Discord Server. The wave of indignation here is uncritical and incapable of self-reflection. This is a pity.
"The end does not justify the means. You also have the criticism and discussion about lists on the Discord Server, as well as a discussion of whether RI is politically neutral or not (in my opinion naive, of course RI is not neutral). Criticism of RI funds is generally not accepted."
"BEER: The Free Democrats have long been committed to enforcing the rule of law than Alice Weidel &amp; the AfD. When it comes to controlled immigration, it is important to us that we maintain cohesion in society. http://www.faz.net/aktuell/politik/inland/fdp-generalsekretaerin-beer-verwehrigt-lindners-baeckerei-anekdote-15590106.html?printPagedArticle=true#pageIndex_0… @Liberale_News"
The armies of the new right # ReconquistaGermanica &amp; the &quot;politically neutral&quot; Böhmermannkids #ReconquistaInternet are waiting for their daily orders to create blacklists &amp; spam timelines with the aim of strengthening filter bubbles &amp; top down communication🤦‍♀️ @Liberale_News
The question of tax justice has long been brought into play by the FDP (Team Beer) https://www.focus.de/politik/experten/gastbeitrag-von-fdp-europapolitiker-theurer-der-steuer-schlag- gegen- apple-is-good-but-that-can-only-be-the-beginning_id_5886128.html…
"Completely right Mrs. de Nève, because where gender becomes ideology, we reject it. (Team Beer)"
"In the political battle, gender ideology uses the struggle for gender equality to exercise domination itself. (Team Beer)"
"OK, do we agree on this version? &quot;We want to offer a political home to women who do not fall for the left-wing state economy and gender ideology, but also reject the old role models like that of the CSU,&quot; @nicolabeerfdp said. # BPT18 (Team Beer)"
Group picture with federal office and the many hard-working helpers of the 69th federal party congress of @fdp. Thank you all! Have a safe trip home! # bpt18 #InnovationNation pic.twitter.com/6YzQHPfpNJ
"The general secretary of @fdp Nicola Beer closes the 69th Federal Party Congress and thanks everyone who contributed to the success! We wish everyone a safe journey home, see you next time! Nicola Beer &amp; Team Beer # bpt18 #InnovationNation pic.twitter.com/jk2kumOJS7"
"Speech by Secretary General Nicola Beer: &quot;3K - at US we stand for the manifestation of freedom for the Three Kings, NOT for children, kitchen, church.&quot; # bpt18 #InnovationNation @Liberale_News"
"We have strong women with the Free Democrats today - at all levels. Whether that&#39;s on site or here in Berlin in the Bundestag. However, we believe that more can be done. We want it to be more! # bpt18 #InnovationNation @Liberale_News"
"&quot;If we don&#39;t keep up with the key technologies, we are putting our prosperity and our welfare state at risk.&quot; # bpt18 #InnovationNation @Liberale_News pic.twitter.com/bholuUT8V4"
&quot;Innovation: We are currently experiencing in real time how technology from science fiction films becomes everyday reality.&quot; # bpt18 #InnovationNation @Liberale_News pic.twitter.com/h483rKru63
These are the ideas in the hall that shine so brightly. (Team Beer)
"Is that the next level? To move Beer close to the AfD to put it on the updated blacklist? How do you go about the action? Do you use the search function, or do you generally no longer see tweets towards the AfD because of your blocklist? (Team Beer)"
We would be very excited to receive an answer from Schwarzer to this very question ...! (Team Beer)
Picture of Alice Schwarzer always works to anteaseas ;-) (Team Beer)
The problem with such comments is that logical thinking can only be taught to a limited extent 🤦 @fdpbay @realMartinHagen @Liberale_News https://twitter.com/MichaelKuffer/status/994594001599655937…
We are pleased that the Mayor of Mechel Bart Somers speaks to us tomorrow at @fdp #Bundesparteitag about his integration concept &amp; his model against crime. Here is his appearance with Markus Lanz: https://www.zdf.de/gesellschaft/markus-lanz/markus-lanz-vom-19-april-2018-100.html… @Liberale_News @BartSomers #InnovationNation
Böhmermann&#39;s black list: who is actually blocking whom? http://www.bento.de/gadgets/jan-boehmermanns-schwarze-listen-und-keiner-will-es-gewesen-sein-2374947/… @Liberale_News
You should also not believe everything that is told about #ReconquistaInternet.
One thing is clear: Certainly not by uploading lists and blocking accounts. Listen to Niggemeier on Radio 1: https://www.radioeins.de/programm/sendung/modo1619/wissen-machen-meinen/stefan-niggemeier.html…
But there seems to be a divergence between claim and reality. This screenshot was sent to me. Articles from reputable sources that are popular in &quot;wrong circles&quot; are released for shooting. Is that the willingness to talk you are talking about? pic.twitter.com/UWVSXzqGGA
The general secretary of @fdp Nicola Beer this morning in the @ZDF @morgenmagazin 📺Interview about #GroKo&#39;s current #Russia policy. @Liberale_News https://twitter.com/ZDFheute/status/994821327042334720…
"Wait a minute, we&#39;ll sort it out. (Team Beer)"
"This is an internal RI call and RI reasoning, dear Jacqueline ... If content is divided into wrong &quot;bubbles&quot;, it is &quot;showered with love&quot; or spammed. A discussion about content is not desired. The methods of the right and left are similar in this respect."
#Women&#39;s Quota #Quote @Liberale_News https://twitter.com/morgenmagazin/status/994814101200269312…
Is the Scholz Relief Plan a mock pack? @ fdp financial expert Florian Toncar speaks of a &quot;bad joke&quot;. The government is already selling it to citizens as a relief &quot;if they have to pay the same amount as before&quot;. https://m.bild.de/politik/inland/olaf-scholz/ist-seine-steuersicherung-eine-mogelpackung-55656220.bildMobile.html… @Liberale_News
"Full house at the 60th birthday d @FNFreiheit. Very good speeches from v @ c_lindner, Angela Merkel, Wolfgang Gerhardt, Norbert Lammert, Jürgen Morlok &amp; Karl-Heinz Paquet, all together the importance of the commitment to freedom. A good that is increased through use &amp; disappears through non-use pic.twitter.com/TjWyPQGg3m"
Then do away with the #Soli immediately! @_A_K_K_ @cducsubt @CDU @Liberale_News https://twitter.com/CDU/status/994260165871505408…
"Publishing black lists, whether from the right or from the left, does not solve a single political problem. It not only leads to blocking, but is also used as an invitation to spam, slander, and politically suspect. There are no &quot;good&quot; blacklists."
"So, the IT staff have fixed the error, it may take a while until all systems have adopted it, but the address will be up again tomorrow morning at the latest. Thanks for reporting, thank god we could fix it now! Greetings from Team Beer"
"Thanks for noticing the bug !! The address should actually go, the IT staff are sitting there. We&#39;ll get in touch. Team Beer"
Franfurter Rundschau is right! &quot;The benevolent behavior of BReg &amp; Lower Saxony LReg in the exhaust gas scandal can be understood as a further signal that @Volkswagen can afford pretty much anything in Germany.&quot; https://www.fr.de/politik/meinung/leitartikel/abgasskandal-die-politik-schont-vw-a-1500888?GEPC=s3… via @fr @Liberale_News
"We have clarified: Yes, you can. But please register beforehand under diversity at fdp dot de. Greetings Team Beer"
FDP general secretary Beer has demanded a rapid abolition of school fees in childcare training. It should not be the case that many young people first have to bring money to take up the profession. http://www.deutschlandfunk.de/erzieher-auch-fdp-forder-abschaffe-des-schulgelds.1939.de.html?drn:news_id=879428… @Liberale_News via @DLF
"A nice portrait of our Bremen Liberal Lencke Steiner: https://www.weser-kurier.de/bremen/buergerschaftswahl-2019_artikel,-der-steinerstil-_arid,1726431.html… @Liberale_News @FDPBremen via @weserkurier"
"FDP general secretary Nicola Beer in the #SWR 📻Radio interview of the week on @Markus_Soeder: &quot;#Crusade against secularism&quot; ✝️, on #GroKo&#39;s #digitalization policy, on #Ellwangen, #Anchorage Centers, #Imigration Act http: //www.ardmediathek. de / goto / radio / 52158866… via @ARDde @Liberale_News"
We are just clarifying this (Team Beer).
"I beg your pardon? How can a Minister of State for Culture express such a strange understanding of democracy? Fortunately, she has so little to say in her role that she cannot do any further damage. @Liberale_News @loadev https://twitter.com/cduberlin/status/992393542990532608…"
"The Chairman of the Digital Committee, Jimmy Schulz (FDP), described the EU General Data Protection Regulation as &quot;progress&quot;, which is not yet sufficient. He recommended to users &quot;as an alternative to Facebook &amp; Co. good European and German services&quot;. @Liberale_News https://www.bild.de/politik/inland/datenschutzlösungen/mittelstand-klagt-ueber-eu-datenschutz-richtlinie-55616900.bildMobile.html?wtmc=twttr.shr…"
"Well, for example, the federal state of Hesse generated a higher GDP in 2017 than half of the EU member states. Representation for location policy in Brussels makes sense. (Team Beer)"
Overdue: Fundamental reform # Educational federalism. One thing is clear: money in concrete &amp; equipment alone is not enough. We need: investment in quality AND minds. Now national and federal government enforce nationwide educational standards! @Liberale_News http://www.deutschlandfunk.de/grundgesetzaenderung-kooperationsverbot-soll-gelockert.680.de.html?dram:article_id=417010…
"Has the market regulated what politicians have failed to do, or is Cambridge Analytica deliberately going bankrupt? @Liberale_News http://www.handelsblatt.com/unternehmen/it-medien/nach-facebook-datenskandal-datenanalyse-firma-cambridge-analytica-soll-schluss-werden/21237152.html… via @handelsblatt"
"Crazy! When it comes to digitization, the makers of re: publica always spit great tones. But when it comes to #cyber security, members of the German parliamentary army would disturb the guests ... 🙄 #fail @Liberale_News @bundeswehrInfo # republica18 @MAStrackZi http://meedia.de/2018/05/02/die-ausgesperrte-bundeswehr-bei-der -republica-when-filter-blow-let-please-don&#39;t-disturb /? utm_campaign = NEWSLETTER_ABEND &amp; utm_source = newsletter &amp; utm_medium = email…"
Attacks on teachers: violence and bullying at every second school - politics can no longer leave those with the future of children in the rain. We need a round table with parents. http://spon.de/afdPL via @SPIEGELONLINE @Liberale_News @gew_bund
How about if you implement a fundamental realignment of the #EU after the #Brexit instead of spending more than the first billion? @Liberale_News @ARDBruessel https://twitter.com/markuspreiss/status/991553649632477184…
Do ARD &amp; ZDF really want to give up basic terrestrial coverage and explore the limits of the 4th broadcasting judgment / Lower Saxony judgment? @SDPfab @ARD_Presse @ZDFpresse @Thomas_Bellut @HugoMuellerVogg @HPSiebenhaar https://www.heise.de/tp/features/Empfangssignal-wird-abgeschalten-Buerger-sollen-trotzdem-weiterzahlen-4038294.html…
Less investment in record tax revenues and simultaneous investment backlog? The #GroKo drives Germany to wear! @Liberale_News http://sz.de/1.3962861
#Scholz will cut investment significantly by 2022 - in favor of rising social spending. The #GroKo is driving Germany&#39;s future against the wall! @Liberale_News http://www.handelsblatt.com/21232836.html?share=twitter…
"All are brought to justice indiscriminately. Those who abuse their right to stay and have been convicted of serious crimes will also be deported under applicable law, of course. (Team Beer)"
What distinction do you mean? (Team Beer)
Talking bad is not a solution (Team Beer)
"Nicola Beer in the BILD talk: &quot;In response to the trade problems with the US, we should now send out a signal and finally ratify #CETA.&quot; via @BILD @Liberale_News @fdp https://m.bild.de/politik/inland/die-richtigen-fragen/ist-ab-morgen-handelskrieg-55551566.bildMobile.html…"
The general secretary of @fdp Nicola Beer now live at the picture talk &quot;The right questions&quot; on the subject of trade war with the USA and anti-Semitism in Germany. https://www.bild.de/video/clip/die-richtigen-fragen/die-richtigen-fragen-live-55528226.bild.html… via @BILD @Liberale_News (Team Beer)
8 a.m. today: The general secretary of @fdp Nicola Beer live at the BILD talk &quot;The right questions&quot; about the EU&#39;s trade conflict with the USA and anti-Semitism. https://www.bild.de/politik/inland/die-richtigen-fragen/ist-ab-morgen-handelskrieg-55551566.bildMobile.html?wtmc=twttr.shr… @Liberale_News via @BILD
 https://www.fdp.de/verband/2024 
 https://www.fdp.de/wp-modul/btw17-wp-a-26 …
"Nonsense. Everyone can - and should! - exercise his right to vote. On the other hand, if you don&#39;t vote yourself, you can vote. Only those who vote and thus support our democracy should not be insulted for it."
"If everyone joins in, yes. For me, a democratic matter of course. But unfortunately not for everyone - in my hometown Frankfurt not even 30.6 percent in the runoff election to OB. Sad! Especially when there is always a call for more direct democracy ..."
Very much! LTW19 can come.
# DCP2018 with Barbara Schöneberger in #Munich: whether Horst Seehofer already knows that he is now eSports Minister? And then soon Olympic!? !! pic.twitter.com/Ag8WjoGD3q
He just blocked Nicola Beer&#39;s account 🙄 (Team Beer).
My follower friday recommendations: 🖱️📱📣 @KH_Paque @realMartinHagen @loadev @Jac_Krueger @SebCzaja @Liberale_News @Sarna_Roeser @DuinFDP @ anncathrin87 #thanksforfollowing #FF #FollowerFriday #FollowFriday
"Mr. Braun, please send us the links where you expect answers and have never received them. We like to look at that. (Team Beer)"
"Honestly, it also depends on the tone. As you know, he makes the music. (Team Beer)"
Absolutely correct! That is why our bill to do so. I wonder what the CDU and SPD will do in committee.
Such nonsense.
Reduction in bureaucracy is needed in 🇩🇪: prepayment d Social security costs the economy 1.4 billion each year. @fdp therefore wants 12 instead of 24 bills in the future. MdB Straubinger @cducsubt @CSU thinks this in the #Bundestag debate for &quot;alleged reduction in bureaucracy.&quot; Amount too small?
Exciting topic!
Hooray! We can pay! There are supposed to be political opponents for whom the current tax burden is still too low ... @Liberale_News @fdp #steuerpayer https://www.welt.de/wirtschaft/article175842986/Steuerlast-Nur-ein-Land- demands-even-higher-tax-contributions-from-the-citizens.html? wtmc = socialmedia.twitter.shared.web…
Nicola Beer&#39;s speech in the Bundestag on the #Beresregierung&#39;s #Professional Training Report 2018: &quot;We have to increase the training ability👩🏻‍🏫👨🏻‍🏫 of young people and make vocational training👷🏻‍♀️👷🏻‍♂️ more attractive again.&quot; (TB) http://www.bundestag.de/mediathek?videoid=7221636#url=L21lZGlhdGhla292ZXJsYXk/dmlkZW9pZD03MjIxNjM2&amp;mod=mediathek… @Liberale_News @fdpbt
#GirlsDay: Every child must have the chance to reach for the stars💫 and become what they want: professions have no gender. # Accelerator of progress🚀 @Liberale_News pic.twitter.com/2Z07YVnl2M
#GroKo # Pension plans priceless💶 &amp; irresponsible! Finally design #rente #enkelfit and #generational fair. Need flexible retirement and removal of all additional earnings limits. @Liberale_News @FNFreiheit http://www.sueddeutsche.de/wirtschaft/altersvorsorge-rentenplaene-der-koalition-sind-unbezahlbar-1.3955885…
"That&#39;s right. As long as Ms. Nahles does not have her own account, we refer to it. (TB)"
#Frankfurt is also always worth a visit! Especially without @spdde 😉👍
⚒️ Happiness on @spdnahles: 100 percent renewal with 66 percent support is a tough job for a @spdde # rubble woman. http://spon.de/afdqT via @SPIEGELONLINE @Liberale_News
"&quot;This case is too important to be dismissed as a routine,&quot; said EU Justice Commissioner Věra Jourová. Practices that target citizens with propaganda &amp; fake news without consent should not continue. https://www.heise.de/newsticker/meldung/Facebook-Datenskandal-EU-Parlament-vergleich-sich-hoechst-alarmiert-4027100.html… @Liberale_News @loadev @fdp"
"Impressively simple business model at @maxplanckpress: &quot;We are simply looking for the best minds who bring their topics with them.&quot; Martin Stratmann, President of the Max Planck Society. # Freedom of research # Innovation # Basic research pic.twitter.com/Wln2D8NWwf"
Schnuck (TB)
"#Vocational training report: Number of young people without a vocational qualification &amp; unsupported young people as well as the contract solution rate are increasing alarmingly. Here, among other things, urgent reworking is required when it comes to career orientation &amp; placement &amp; training skills. https://www.bmbf.de/de/vielfaeltige-chancen-fuer-junge-menschen-6030.html… @Liberale_News"
"#Vocational training report #GroKo: Knowledge about #data protection and security should only be taken into account in IT, metal and electrical professions. When does #GroKo understand that precisely this knowledge = opportunity for export hits &quot;#Data security made in DE&quot;? https://www.bmbf.de/de/vielfaeltige-chancen-fuer-junge-menschen-6030.html… @Liberale_News"
"At an event organized by the German Evangelical Alliance in Berlin, I spoke about political beliefs and debates on values in the German Bundestag. @EKD @Liberale_News @fdpbt https://www.pro-medienmagazin.de/politik/2018/04/18/beer-verwehrigt-neuregelung-des-paragrafen-219a/…"
"Officially not, because we would need an amendment to the statutes. We haven&#39;t done that yet. However, for some years now we have been opening the right to speak. Without the amendment of the articles of association, each BPT has to decide that for itself (Team Beer)."
"# Echocaust-As a lawyer, I&#39;m aware of the freedom of art and satire, but that&#39;s not the point. It is a question of endorsing this tasteless provocation with a price. Here, values have shifted. @Liberale_News https://www.welt.de/kultur/pop/article175435796/Oliver-Polak-ueber-den-Echo-und-Kollegah.html&amp;wtmc=socialmedia.twitter.shared.web… via @welt"
#Syria deployment #Syria #SyriaStrike @Liberale_News https://twitter.com/dw_politik/status/985065953229705216…
With colleague @nouripour at the [Königswinter] [Conference] on German-British relations after the #Brexit. Of enormous importance for #Frankfurt as a financial metropolis. @KebleOxford @FT @FAZ_Politik @Liberale_News pic.twitter.com/Ipp9zALdXB
Today #JomhaSchoa in #Israel stood still for a minute to commemorate the 6 million murdered #Jewans. #NieWieder must also mean for us in #Germany to stand against unilateral #Israeli criticism. http://www.tagesschau.de/ausland/israel-holocaust-gedenkenag-105.html… via @tagesschau @fdp
. @ cdu flirts with @dieLinke. Complete arbitrariness of the Union🙄. The main thing is to stay in power. #Pattex @Liberale_News https://www.berliner-zeitung.de/berlin/brandenburg/koalitionsfrage-erstmals-flirten-cdu-und-linke-29998506…
"Nice pictures from the #Klausurtagung from #Meseberg. Pure harmony. Ringelpiez with hands. But how long does the castle peace last? And when do we talk about #digitization, or will the #future be overslept? @Liberale_News http://www.deutschlandfunk.de/klausurtagung-arbeit-kann-auf-breiter-front-beginnen.2932.de.html?drn:news_id=870763…"
"Congratulations to Max Hollein. As much as we regret having to hand him over to #Frankfurt, we are very pleased with this appointment for him and the #Metropolitan. https://mobile.nytimes.com/2018/04/10/arts/design/met-museum-director-max-hollein.html…"
&quot;No wonder that FDP general secretary Nicola Beer calls for the&quot; digital package insert &quot;on Twitter so that everyone knows what he is getting into. Facebook does not want to educate users.&quot; http://www.journal.lu/article/hot-or-not/… via @letzjournal #facebook @Liberale_News
And hopefully what that is 😉
