Worth reading. # South German: &quot;The US has no # deficit with the EU&quot; http://sz.de/1.4010706 via @SZ
Team Beer thinks that 😎
"Thank you very much, but that is not the way of speaking and the way we speak. Team Beer"
"In Android it remains permanently switched off, but apparently has no effect ... (Team Beer)"
In the wording we thank you for your material. Team Beer
There is a separation of powers in Germany. You are addressing this question to the wrong violence. (Team Beer)
We have been on a savings course for years.
What about Wire? (TB)
Congratulations to the new board! https://twitter.com/loadev/status/988149556171898880…
They can answer before the courts. (Team Beer)
"And after the temporary ban has expired, are the comments &quot;correct&quot; again, or as in the case of non-banned ones? TB"
Who knows more about it? Team Beer https://www.heise.de/amp/meldung/Twitter-will-stoerende-Trolle-kuenftig-haeufiger-verstecken-4050079.html…
"No, it is not in the paper linked above in the 10-point plan. Team Beer"
"Question: 1) Is there also #ShadowBanning limited to individual countries, ie eg only shadowed in DE, but not in AT? 2) Has anyone already acted against his #Shadowban with a lawyer? Does anyone know of cases from the United States? Team Beer"
"Exciting misperception, please explain. (Team Beer)"
"Wait, let&#39;s do some research (team beer)"
We stick to it: informant registries are a threat to democracy. Team Beer
Would you explain that in more detail with the Notification Ban and the aggressive follow / unfollow? Thank you. Team Beer
"What&#39;s wrong now? And: If there is another argument about what has been arranged and what is not, when will it finally be dealt with? #EUCO #EUGipfel #Asylstreit https://www.deutschlandfunk.de/nach-eu-gipfel-tschechien-und-ungarn-dementieren.2932.de.html?drn:news_id=898594… via @DLF @Liberale_News"
AstGuest contribution by Nicola BEER in @focusonline: Germany has been delaying the digital #education | offensive for years. https://www.focus.de/politik/experten/beer/gastbeitrag-von-nicola-beer-fdp-generalsekretaerin-die-groko-verpennt-die-digitale-bildung-schon-wieder_id_9183101.html… @Liberale_News
"Where are independent responsibilities for FRONTEX, comprehensive registration at the EU&#39;s external borders, uniform standards and asylum procedures to limit the internal migration of refugees? Nobody will implement @CDU Merkel&#39;s summit result, dear @CSU https://www.welt.de/politik/deutschland/live178075478/FDP-Chef-Lindner-CSU-mit-Asylwende-krachend-gescheitert-Liveticker-zum-Asylstreit .html…"
You wrote that as the Vice President of the Bundestag you would have to accept something like threats of murder and rape. I do not tolerate this trivialization and public approval.
"No, there is a limit to bad taste &amp; it&#39;s called criminal law. No matter if someone is prominent, poor, rich, fat or thin, nobody has to accept death threats. That is why society has agreed that such threats are punitive. @Liberale_News"
"#uploadfilter: The #GroKO &quot;does not adhere to the coalition agreement,&quot; says the @ fdp digital politician @jimmyschulz. The coalition there had rejected upload filters as &quot;disproportionate&quot;. http://m.faz.net/aktuell/wirtschaft/diginomics/uploadfilter-sorgen-fuer-proteststurm-ueber-parteigrenzen-15666093.html… @Liberale_News"
"Tilt # upload filter &amp; # ancillary copyright in plenary? Representatives of @fdp, ÖVP, FPÖ and @neos_eu have announced that they will vote differently than the representatives of their groups in the Legal Affairs Committee. https://www.heise.de/tp/features/Kippen-Upload-Filter-und-Leistungsschutzrecht-im-Plenum-4094294.html… via @telepolis_news @Liberale_News @loadev"
Hmmm ... that&#39;s right. Next time we send an intern with a bucket of blue paint that &quot;FDP&quot; brushes over. But only if they paint the Ministry of Environment in yellow. Such crap on the other hand is improper. (Team Beer)
Working lunch at the #ALDE Leaders&#39; Meeting in Brussels ahead of the EU summit. @ALDEParty @Liberale_News @fdp pic.twitter.com/gAldZJnVnQ
I beg your pardon??? @nicolabeerfdp @jimmyschulz @telepolis_news @loadev https://twitter.com/tj_tweets/status/1012608745396981760…
The general secretary of @fdp Nicola Beer with the # FDP MEP @nadjahirsch with the @ALDEParty chairman @hansvanbaalen at the ALDE Leadership Meeting in Brussels. @ALDEgroup @Liberale_News @liberalinternat pic.twitter.com/sqq9U38ho2
The general secretary of the #FDP talks to the @ALDEgroup group leader @guyverhofstadt at the #ALDE Leaders&#39; Meeting in # Brussels in the run-up to the EU summit. @Liberale_News @fdp pic.twitter.com/cVfeoOyTfZ
"What a shame, 😢 what else can you talk about? &quot;It&#39;s not a wish concert&quot; (Jürgen Klopp) http://www.spiegel.de/sport/fussball/wm-2018-deutschland-scheidet-nach-niederlage- Gegen-suedkorea-aus-a-1215348.html…"
The general secretary of the #FDP Nicola Beer talks to the Dutch Prime Minister @markrutte at the @ALDEParty Leaders&#39; Meeting in Brussels. @Liberale_News @fdp pic.twitter.com/cBYcQQoQHE
Group photo of the #ALDE Leaders&#39; Meeting in #Bruessel in the run-up to the EU summit taking place today &amp; tomorrow. @ALDEParty @fdp @Liberale_News @EUCouncil pic.twitter.com/dqDyypRdM2
"&quot;If people who can already live well here in the 2nd or 3rd generation still reject our way of doing our social model, then this raises questions about the effectiveness of our integration policy,&quot; said Secretary General Nicola Beer. https://www.pz-news.de/nachrichten_artikel,-Deutschland-bleibt-fuer-Erdogan-eine-sichere-Bank-_arid,1237194.html… @Liberale_News"
"1) general officials were criticized, 2) FDP Berlin xberg, 3) colleague Schulz. They wanted to have this discussion in public. Voilà. Team Beer"
Because Beer was marked in the initial tweet above and you addressed it from this mailing list. (TB)
"Unfortunately, like you, you have to disappoint. The Greens are the party of the higher earners. (TB) -&gt; CLICK http://www.taz.de/!5059363/"
"Not correct. I block accounts of tweets that are outrageous or offensive, or that I think I have to actively promote other parties under my tweets. The sound makes the music."
"No, there were two ALDE members in the legal committee from France &amp; Portugal who think differently on this issue. The vote in the EU plenary is still pending. FDP MEP @nadjahirsch is fighting #Uploadfilter."
"You do not have. 2 Alde MPs from France and Portugal have it, they see it differently. The vote in plenary is still pending."
We noticed. We are now evaluating the feedback from the Bundestag&#39;s Scientific Service. Concerning. We are neutral on the question of one-sidedness. Taking victim roles doesn&#39;t help much. The only criterion is freedom of expression &amp; pol. Decision-making. Team Beer
Team Beer says Daaaaanke!
"No Filipe, it's not what Nicola Beer said. She asks if the Greens in Germany would be tolerant enough to accept a national flag on Claudia Roths balcony. If you read the comments, it's probably not the case. (Team Beer)"
The main argument of the # Greenpeace group that they don&#39;t want to have anything to do with the accidents is the reference to their supposed moral superiority. Bravo! Greatly done __twitter_impression = true… via @focusonline @Liberale_News
"Yes, the FDP MEP @nadjahirsch has been fighting it all the time: https://twitter.com/nadjahirsch/status/1009428119466455040?s=19…"
"BEER: &quot;The goal for the Free Democrats is a pan-European immigration &amp; asylum policy and improved control of the EU&#39;s external borders. If this does not succeed, Germany will have to return to the Dublin III agreement.&quot; https://www.liberale.de/content/regierung-ist-nicht-handlungsfaehig… @Liberale_News #Asylstreit"
"No, it is not due to insufficient briefings, as @nadjahirsch and I have been explaining for days. Unfortunately, the two gentlemen are resistant to advice on the question, which is why we will now force a vote in the plenary."
"The @FDP in the European Parliament continues to fight against the introduction of #Uploadfilter | n and the European #Page Protection Law, which was decided today in the Legal Affairs Committee, and will force a vote in plenary. @nadjahirsch @jimmyschulz @Liberale_News https://www.golem.de/news/urheberrrecht-eu-ausschuss-fuer-leistungsschutzrecht-und-uploadfilter-1806-135041.html…"
The FDP in the European Parliament is against upload filters. There were two ALDE members of the Legal Affairs Committee who see it differently. Now we will have the plenary vote again. @nadjahirsch
"If we do not see the Schengen external borders as a border and we do not agree on a uniform immigration law across the EU, we will not get it resolved - and then we will lose the freedom of internal borders."
BEER in the 📻Interview: #Merkel gave promises worth billions to # Macron yesterday through staged disputes between @CDU &amp; @CSU. @Fdp advocates immigration law based on points system. https://www.br.de/nachrichten/asylstreit-nicola-beer-fdp-deutsche-erpressbar-geworden-100.html… @Liberale_News
"Tell me, because my answer would unsettle you."
"BEER in a radio interview. For an objective policy that tackles and solves problems, instead of paralyzing an entire government with blurry explanations and vigorous messages, to paralyze an entire country. #WirHabenWichtigeresZuTun https://www.ndr.de/info/Beer-warnt-Union-vor-weiterem-Kraeftemessen,audio416186.html… via @NDRinfo @Liberale_News"
What do the #SPD and the # Greens say about the systematic surveillance of Austria&#39;s intelligence agencies from 1999-2006 under red-green government responsibility? @spdde @spdbt @Die_Gruenen https://www.welt.de/politik/ausland/article177670336/Kurz-ueber-BND-Skandal-Das-Ausmass-der-Ueberüberwachung-war-ein-Enormes.html?wtmc=socialmedia. twitter.shared.web… via @welt @Liberale_News
"No, Özdemir did not just ask in this article. Then just criticize the article and not the tweet. By the way, Team Beer PS Grütze is a dessert made from BEERs."
"As long as you do not realize a criminal offense, you can compare what you want. (TB)"
"No, the ALDE is split. Then next time you have to elect more than 3 FDP members to the European Parliament if you want to have more FDP influence in the ALDE."
"Because it is not true, the FDP in the European Parliament is against upload filters, research @nadjahirsch and then see who the two big parties are that want upload filters with German support. And leave out your filthy vocabulary."
"No, this is determined by the respective political groups at the beginning of a legislative period."
Yes that is correct. In 2009 we were ripped off in the coalition agreement. And since then ALL FDP network politicians have protested against the LSR. Google for Jimmy Schulz &amp; Manuel Höferlin.
In the case of Mr Cavada the French voter and in the case of Mr Marinho e Pinto the Portuguese voter.
Why so bad?
The problem is less the ALDE than the two ALDE MEPs who sit on the Legal Affairs Committee. (TB)
"You have to get out of your filter bubble, Mr. Masztalerz. (TB) https://mhoeferlin.ablamente.fdpbt.de/uploadfilter-sind-automatisiert-zensur…"
"Nicola Beer at @phoenix_de &#39;unter den linden&#39; &quot;Squabble Asylum Policy - Is the Coalition Broken?&quot; in an argument with @MikeMohring (CDU Thuringia), moderated by Michaela #Kolster. https://www.phoenix.de/sendung/gespraeche/unter-den-linden/zankapfel-asylpolitik--zerbricht-die-koalition-a-257647.html… @Liberale_News pic.twitter.com/125ulkyGIY"
Understand. Such behavior do you mean: http://www.faz.net/aktuell/politik/so-teile-juergen-tretin- Gegen-fdp-und-csu-aus-15225845.html… (TB)
Do you actually follow what the FDP has been demanding in the diesel scandal since spring 2017? (TB)
Warm greetings to the Federal Assembly of Liberal Women in #Erfurt! @DerFrauen @katja_grosch @gesine_meissner @KatjaSuding @MAStrackZi pic.twitter.com/jA2YMa9nJU
That does not matter. The bucket of dirt that is distributed anonymously or not anonymously via Claudia Roth - threats of violence &amp; rape - that is not appropriate. Anyone who approves or supports this should immediately follow me. @Liberale_News @Die_Gruenen @fdp
I beg your pardon?
Required reading. https://claudia-roth.de/persoenliche-erklaerung-von-claudia-roth-zur-inszenierten-schweigeminute-der-afd-im-deutschen-bundestag/…
Because Haschke does not understand that the hearts are not likes but favorites. Twitter had switched the symbol from star to heart to increase the interaction rate. This effect had also set in. Team Beer
The first #peasant victims? #Seehofer fires # BAMF boss Jutta Cordt #bamfskandal Whether that&#39;s enough ..? https://www.n-tv.de/20483029 via @ntvde @Liberale_News
"Yes, it&#39;s our turn. A little more patience. Team Beer"
"Which devices have to be decided on site. We not only demand equipment, but also modernize learning content and teacher training and further education. Everyone should be so fit to be able to help shape, responsible citizens!"
"We would have given up if everyone gave up. But if we don&#39;t get our rate, the others will get it. We are of course not ready for this."
"Haschke does not understand this, in his profile description the corresponding note is missing ... (TB)"
We are sincerely pleased for you! (TB)
"Dear Free Minded, dear @ZDFheute: as evidenced by the Bundestag, that was the actual voting result! @fdpbt closed against GroKo law on party financing! pic.twitter.com/zmhEUyzfxc"
That&#39;s not true. The FDP in the EP is on the 13th. Ask @nadjahirsch. (Team Beer)
Today @dieLinke celebrates a man who sent opposition members to death without a court sentence. Veneration for a murderer by self-proclaimed philanthropists. @Liberale_News https://twitter.com/dieLinke/status/1006876893302444033…
"Yes and no. I basically agree with your statement. But if we are already dealing here, why not finally a deal in favor of the affected diesel owner?"
"&quot;Affected diesel owners remain alone&quot; If one of max. 5000, - EUR costs for hardware retrofitting, one could have retrofitted at least 200,000 affected cars with fines. dieselaffaere-vw-must-billions-fine-pay.html… via @TOnline_News @Liberale_News"
"As Mrs Hirsch has already said, this is only about the two votes of the ALDE members of the Legal Affairs Committee."
"We are currently working on #shadowbanning, please be patient. (Team Beer)"
Lawsuit against #NetzDG: # FDP politicians want to #BVerfG: @jimmyschulz and @ManuelHoeferlin are the two protagonists of a story whose outcome could be spectacular https://www.lto.de/recht/nachrichten/n/fdp-politiker -sue-bverfg-netzdg-deletion-overblocking-determination-interest-admissibility /… @Liberale_News @loadev
We have the BReg on the screen. Have you already contacted the BReg and the ministries involved? What answer did you get? (Team Beer)
.@nadjahirsch
Ms. Beer&#39;s perspective on block lists has already been discussed in detail here on Twitter and in the press. (Team Beer)
The subsidiary you have 90% control does not have that many assets. Did @BLM_Bayern finance the purchase or provide collateral? We will definitely look at the balance sheet next year.
"Your &quot;opinion corridor&quot; is worth discussing. Therefore, wanting to abolish sedition and insult to religion does not solve the problem. The problem is NetzDG with &quot;HateSpeech&quot; (is not in the StGB) &amp; non-transparent range limitation through algorithms (#shadowbanning etc.) TB"
"In DE, we have a constitutional system of freedom of speech, not of freedom, as in the USA. These sections are the result of balancing various fundamental rights. The BVerfG is to be endorsed in its outcome. Team Beer"
Would you like to make sedition and the abuse of confessions and religious societies free of punishment? (TB)
With which standards of the StGB do you see problems? Team Beer
"United States # North Korea Summit: #Trump and #Kim sign unclear agreement. Now it is time to wait, because: &quot;You should recognize them by their deeds!&quot; http://www.tagesschau.de/ausland/trump-kim-143.html… via @tagesschau @Liberale_News #USNorthKorea"
"Jason Lanier, a founding father of virtual reality and the author of ""Ten Arguments for Deleting Your Social Media Accounts Right Now"", talks about how we are being manipulated by social media and the internet.  https://ted.com/talks/jaron_lanier_how_we_need_to_remake_the_internet?utm_source=twitter.com&utm_medium=social&utm_campaign=tedspread … via @TEDTalks @Liberale_News @loadev"
Is this the beginning of the end of the GroKo? @cducsubt @spdbt #unionsstreit @fdpbt @SPIEGELONLINE @faznet @BILD https://twitter.com/floriangathmann/status/1006193096839847937…
Welt reports: &quot;Rejection of asylum seekers: Presentation of Seehofer&#39;s asylum master plan apparently postponed&quot; The coalition agreement does not seem to have been negotiated so well if not even #CDU &amp; #CSU understood it immediately. https://www.welt.de/politik/deutschland/article177358200/Abweisung-von-Asylbewerbern-Praesentation-von-Seehofers-Asyl-Masterplan-offenbar-verschoben.html?wtmc=socialmedia.twitter.shared.web… via @ world @Liberale_News
"The @SPIEGELONLINE writes that #Merkel relies on two messages at @AnneWillTalk ... For me, however, only one message was received: This woman has finished. This tired face can no longer embody necessary political reforms. http://www.spiegel.de/kultur/tv/angela-merkel-bei-anne-will-die-kanzlerin-kaempft-a-1212045.html… @Liberale_News"
"Members #IGS, whose umbrella organization is to be funded with almost 300 T € tax money from the EU fund for #InnerSecurity, located at the #BKA, by the end of 2019, are again expected in large numbers on an anti-Semitic Al-Quds march. #AlQuds https://www.bild.de/politik/inland/iran/frage-gruene-zu-igs-54579528.bildMobile.html?wtmc=twttr.shr… via @BILD"
"Got it done, we blocked it. Team Beer"
"Mr. Genig, please behave here. And delete the tweet with the insults above. Team Beer"
What exactly do you mean? What exactly is the impact you have observed? Team Beer
"FDP Secretary General Beer considers the environmental organization&#39;s actions against the blanket ban to be unjustified. On Twitter, she wrote: &quot;Crusade of the warning association &#39;Deutsche Umwelthilfe&#39; (...) continues.&quot; https://www.t-online.de/auto/recht-und-verkehr/id_83899510/dieselfahrverbot-in-aachen-erstes-verfahren-nach-urteil.html… via @TOnline_News @Liberale_News"
And who should then conduct a survey on Twitter and collect feedback? (TB)
Thank you! (TB)
Thank you! (TB)
"Well, we are reassured ... (TB)"
"No, we maintain certain manners and a certain tone here. Unfortunately, you don&#39;t. So thank you very much. Team Beer"
"Yes, that too. First collect everything. Can you prove that? Team Beer"
How much tweet activity do you have on such a day before a ban? Are the tweets reported beforehand and are your account shadowed? Or do you think this happens automatically? Team Beer
But the result of shadowban and withheld is basically the same: hiding content? Team Beer
"Yeah, but in the end it has to be explained to politicians as they have to decide whether or not legislation is needed. I'm no IT guy, but I am briefing politicians who are making laws. So the more & better we understand, the better we can decide what to do.
Team Beer"
"In the Twitter Android app version 7.48.0, the quality filter is always off in the settings, but we cannot see the tweets with #ShadowBanning. Are there any differences between Android and iOS apps? Team Beer"
"And it used to be the same, only limited to 24 hours? Would you like to be informed about temporary shadowban? Do both exist in parallel today? Are there any examples of geographically restricted #shadowban? Mixed forms? Are there any recognizable patterns? Team Beer"
"Ok, next time there will be a less controversial email account. Promised. (Team Beer)"
Let us know why you think Seehofer&#39;s suggestions would &quot;promote something like #ShadowBanning&quot;. Team Beer
Because the Beer team works on a voluntary basis on Twitter and it is simply faster. (TB)
Write to us what you mean by perfider. When is &quot;filtered&quot; and how? We really want to be able to understand this as precisely as possible. Team Beer
"We want to know exactly how common #shadowbanning is, in which cases tw uses it and why the practice is so opaque. Possibly. we will then confront the results with tw. Team Beer # freedom of expression"
"CALL! The Beer office collects material on the subject of # ShadowBanning.🤐 Please send info, screenshots &amp; material to shadowbanning at gmail dot com. Emails are treated confidentially. We plan to address the results of the investigation. (TB) #Shadowban @Liberale_News"
"KreuzYour! Crusade of the warning association &quot;Deutsche Umwelthilfe&quot;, which is financed by tax money &amp; warnings, continues http://now.Now, as predicted, driving bans for petrol and gas cars are required. Deny non-profit status! 🛑 https: //www.heise .de / autos / articles / DUH-driving bans-also-for-petrol-4072639.html… #DUH #Diesel @Liberale_News"
# Bamf scandal: A member of the Bamf top is said to have yelled at a high-ranking employee when they discovered irregularities. &quot;What do you think of? We definitely didn&#39;t send Josefa Schmid to Bremen to clear up. ”Https://www.merkur.de/politik/bamf-skandal-mitarbeiter-packen-aus-und-rechen-mit-chefin-cordt-ab-9926178.html … @Liberale_News
"@The @Morgenmagazin of @ZDF says # FDP Secretary General Nicola Beer: &quot;The FDP calls for a # investigation committee, because in contrast to the interior committee it is allowed to investigate and summon witnesses.&quot; #BamfSkandal #BAMF #PUA #bamf CLICK👇 https://www.zdf.de/nachrichten/zdf-morgenmagazin/nicola-beer-zur-bamf-affaere-100.html…"
You mix different topics here and seem to want to answer a breach of law A with a breach of law B. You ended up here with the wrong party. Team Beer
#GroKo - Irrwitz with #BauKindergeld. Better: Introduce a tax-free allowance to real estate tax! We want to enable property creation without bureaucratic monsters and interference in life planning. @Liberale_News http://www.sueddeutsche.de/news/wirtschaft/bau-baukindergeld-nur-bis-120-quadratmeter-wohnflaeche-dpa.urn-newsml-dpa-com-20090101-180623-99-847693…
"No, the two gentlemen are hardliners. I can&#39;t manage to convince you that the two gentlemen couldn&#39;t be convinced."
What do you suggest?
"Without protecting the EU&#39;s external borders and without EU-wide coordination on this issue, nobody will achieve anything. pic.twitter.com/sitZW2LehA"
Maximum speed 80 - even on the highway. There would have been driving bans on 26 weekends a year. That would have been the consequence of the Greens&#39; energy policy demands in a Jamaican coalition. @Liberale_News https://amp.focus.de/auto/news/koalitionsverhandlungen-tempo-80-auf-autobahnen-alle-14-tage-fahrverbot-was-die-gruenen-klimaziele-bedeutet-haetten_id_8972882.html?__twitter_impression= true…
What has that got to do with the initial tweet?!? (TB)
"As if the United States couldn&#39;t reform it from the inside out. I suspect that even in a reformed council, Trump would not be reinstated. So sad."
"Of course, the #UN #Human Rights Council should be reformed. If, however, the #USA leaves an international body again, it shows that one does not believe in multilateral solutions &amp; open discussion channels. Too bad. @Liberale_News http://spon.de/affXp"
"No, not the group, but a French and a Portuguese #alde MP. The @fdp in the European Parliament has clearly positioned itself against the upload filter &amp; is now forcing voting in plenary. @nadjahirsch"
Beautiful good day!
Can you prove that? Otherwise we cannot investigate. Team Beer
"Please follow my colleague @nadjahirsch in the European Parliament, or here: https://youtu.be/WZ_3llm9Y-0"
"Diaper-soft compromise, decision only postponed until July 1st. If Merkel is not successful with EU partners, the same theater will start again in 2 weeks. Federal government disagrees and unable to act! http://www.spiegel.de/politik/deutschland/horst-seehofer-will-bei-zurueck Route- step by step-procedure-newsblog-a-1213534.html… via @SPIEGELONLINE @Liberale_News"
The #taz in the round with the @Die_Gruenen as a stirrup holder for #Merkel. Just no criticism of the Chancellor could be seen as an insult to the court. # Greens no longer capable of opposition - or does the bride just make herself beautiful? 👰 @Liberale_News @tazgezwitscher https://twitter.com/tazgezwitscher/status/1008627125828636672…
;-)
My pleasure.
"OK, then Nicola Beer at the Hessen Festival of the Pancake Hessian Representation. (Team Beer)"
"Nicola Beer at the #Hessenfest of the Berlin Hessian Representation with the Head of Frankfurt Legal Medicine Prof. Marcel #Verhoff, Dr. Christoph Riess HGF # Chamber of Crafts Rhein-Main and OLG &amp; State Court President Roman #Poseck. Photo: Sabrina Feige pic.twitter.com/N6uuPLWvcr"
"Yes, the text yesterday is also mandatory reading. It&#39;s about the content, not prejudice."
Nice weekly review from NRW. (TB) https://twitter.com/RainerMatheisen/status/1007713470748520448…
There are dozens of sources. Search for FDP and Diesel in search engines. (Team Beer) https://www.fdp.de/umwelt_vw-will-dieselfahrer-doppel-belasten?amp…
"We are still waiting for research results from the scientific service of the Bundestag. We are not SEO experts, but what feedback we have so far is enough to address #ShadowBanning in public. (Team Beer)"
...or not anymore.
"Not in this tone, please. (Team Beer)"
