"Rarely read such nonsense about the ⚽️WM. The question is: Would the party @Die_Gruenen be tolerant enough for a Germany flag Deutschland on Claudia Roth&#39;s balcony, or would Roth be excommunicated? http://spon.de/affO9 via @SPIEGELONLINE @Liberale_News"
Now that honors you that you want to knock your coalition partner into the pan! Very big (TB)
So that all other parties get even more because the pot is distributed proportionately?
Do you want the Lord to be given a prize for setting priorities? (TB)
"Oh, that&#39;s a nice and lovely gesture! When are there tablets for students? And why are prisons in front of schools being digitized? What planet does this Senator of Justice Dirk Behrendt from the Greens actually live on? ... 🤔 @Liberale_News @fdp_berlin https://twitter.com/morgenpost/status/1007118797520687105…"
Here you can find my colleague @solms&#39;s speech on our rejection positioning: https://dbtg.tv/fvid/7245924
"No, we voted against. Who said that?"
"Ain&#39;t it all, all FakeNews 😉 (TB)"
"If you are the left to the right and the right to the left, then welcome to us Free Democrats!"
"After participating in the hate demo, the Mullah Association should no longer receive state funding in view of the participation of central figures from #IGS in the al-Quds march, #FDP Secretary General Nicola Beer demands from @BILD. https://www.bild.de/politik/inland/iran/igs-foerderung-ueberpruefung-56005726.bildMobile.html?wtmc=twttr.shr… @Liberale_News @JuedischeOnline #alquds"
It is unfortunate that you see it this way ...
Were not legal processes that could even be called a process remotely. Otherwise: http://www.taz.de/!5193800/
"What goes down completely today: I, like the entire @fdp Group, voted for # CETA ratification today. Incredible: #GroKo conjures up multilateral agreements and international trade in response to Trump, but votes against ratification #CETA! @Liberale_News pic.twitter.com/nJUhln4dfJ"
"At least he is not now threatened with a forced shutdown. But this is a separate discussion (WRC, VHF in crises, etc.). This is about the private radio antennas &amp; I would like to know if the purchase price was higher than the sales price of the media broadcast."
"VHF antennas have been privately owned since the federal post-privatization in 1995, so they have been without problems for 23 years. The dispute over FM, ADR, DAB, DVB-H, DAB + seems to be a perennial favorite between countries, DLM, ÖRR &amp; industry. Unfortunately at the expense of the radio listeners."
#The #Peace Award of the German Book Trade goes to Aleida and Jan #Assmann this year for their educational work on the cultural memory of nations and basic questions about the cultural and religious conflicts of our time. Congratulation! http://www.spiegel.de/kultur/literatur/friedenspreis-des-deutschen-buchhandels-aleida-und-jan-assmann-werden-auszeich-a-1212452.html… @boev
"This question can also be discussed, but we don&#39;t want to distract @BLM_Bayern too much from the answer to the question about the purchase price."
"An overview of Facebook&#39;s #data scandal #CambridgeAnalytica: &quot;In view of the ongoing revelations, it can be assumed that further data scandals relating to #Facebook will come to light.&quot; https://www.basicthinking.de/blog/2018/06/12/datenskandale-facebook/… via @basicthinking @Liberale_News"
"Honestly: This is an extremely fast-moving medium, a lot in between, because of 280 character restrictions, often shortening, mistakes cannot always be avoided, but errors &amp; ambiguities cannot be systematically planned, and only very rarely as a provocation (sometimes already ...)"
"I would be interested to know how much the Bayerische Landesmedienanstalt @BLM_Bayern, financed by the #Rundfunkbeitrag, paid for # FM radio network in #Bayern, even if #BLM would like to keep this secret! @heiseonline @telepolis_news @Liberale_News https://www.heise.de/newsticker/meldung/Bayern-Landesmedienanstalt-kauft-UKW-Anlagen-von-Media-Broadcast-4075887.html…"
"We will hold back a little and limit ourselves to being tired and politically tired, at least that&#39;s how we wanted to understand it."
#CeBIT is in crisis &amp; therefore reinvents itself. Even German business can only create new products with #Innovation in the competition for relegation. #GroKo&#39;s digital policy is hot air. #DenkenWirNeu #InnovationNation # CEBIT18 https://www.heise.de/newsticker/meldung/Wirtschaftsminister-auf-Cebit-Deutschland-kaempft-um-digitalen-Spitzenplatz-4076476.html… @Liberale_News
§130 StGB has its justification. Its abolition does not solve the range restriction or the non-transparent deletion of posts in social networks. That is why we address #NetzDG &amp; #shadowbanning. (TB)
"Today, our @fdp members of the Bundestag @jimmyschulz &amp; @ManuelHoeferlin file a lawsuit against the #NetzDG. The two are legally supported by the law professor @HGersdorf. http://www.tagesschau.de/inland/netzdg-klage-101.html… via @tagesschau @ARDde @UllaRamone @Liberale_News #NetzDG"
@nadjahirsch ?
"We have, the group&#39;s first bill was last year. The draft doesn&#39;t get a majority ..."
Clear edge of @ fdp treasurer #Solms: &quot;increase in party financing cannot be justified&quot; http://www.deutschlandfunk.de/fdp-schatzmeister-solms-erhoehung-der-parteienfinanzierung.1939.de.html?drn:news_id= 891244… @Liberale_News @solms
Exclusive FAZ: # FDP politicians complain against the #Netzwerk enforcement law http://www.faz.net/-gpg-9b23g?GEPC=s3… via @faznet #NetzDG @Liberale_News @loadev @c_netz @fdp @fdpbt # freedom of opinion #censorship
Protests against Israel haters in Berlin Several hundred demonstrators set an example against the anti-Semitic »Al-Quds« day https://www.juedische-allgemeine.de/mobile/article-view?id=31861… #zivilcourage #AlQuds #Israel # antisemitisme @Liberale_News @JuedischeOnline @Volker_Beck
"Do something different with the digital pact: @fdp already called for a federal / state agreement in the case of # BAFöG takeover by the federal government, which ensures that money is reinvested in education. Disaster must not happen twice if GG is changed. @ Liberale_News https://www.welt.de/print/welt_kompakt/print_politik/article177175320/Ausgetrickst-beim-BAfoeG.html?wtmc=socialmedia.twitter.shared.web… via @welt"
Great appearance of my colleague @Lambsdorff on the interim questions of our esteemed colleagues from @Die_Gruenen: https://www.focus.de/politik/deutschland/debatte-im-bundestag-ach-das-ist-ja-super-kritik-von- green-serves-fdp-politician-as-steep-template_id_9058672.html… @fdpbt
Thanks for the call! Was very insightful! Team Beer
What are these followers who are added and then withdrawn? Do not understand the (possible) idea behind it. Team Beer
"I summarize again: There was real agitation under the hashtag, they wanted to regain their sovereignty again, so they got involved in the discussion using the hashtag, and were the algorithm unwanted &quot;banned&quot; from the algorithm, so to speak?"
Why do you think it is that criticism of Islam or Saudi Arabia in particular leads to shadowbanning? Because the tweets / topics are reported more often or because it&#39;s a decision by Twitter? Team Beer
What do you mean by that? Team Beer
Has clarified so far because there are 2 settings. We don&#39;t know why yet. Team Beer
Question: Why do you think it had to do with the hashtag Flensburg? What&#39;s so bad about it Team Beer
"I apologize, the tweet was wrong, I wouldn&#39;t have sent it, political opponents should be allowed to be fought, but even if the opponent tries to attract attention through provocation &amp; tastelessness, the FDP needs the good nursery to some extent."
Do you have any idea what the differences between the two settings are? Team Beer
"Yes, get it now. But what&#39;s the difference between the two settings? Does it have to have any function? Team Beer"
"Ok, thanks, finally found. There are actually &quot;quality filters&quot; twice as a setting. Team Beer"
That sounds interesting. Can you somehow prove that accounts that block many other accounts even see fewer &quot;foreign&quot; accounts? Team Beer
"At the beginning of May, BMBF Minister #Karliczek introduced the GG change to finance the digital pact. It is astonishing that #GroKo has not yet reached @ fdp &amp; @Die_Gruenen. Without us, a 2/3 majority in the BR &amp; BT. http://www.deutschlandfunk.de/grundgesetzaenderung-kooperationsverbot-soll-gelockert.680.de.html?dram:article_id=417010… @Liberale_News"
"Yes, Tweet was wrong, was also clarified on fdpbt."
"Don&#39;t worry, there are more: https://www.volksstimme.de/sachsen-anhalt/bamf-affaere- Gegenwind-fuer-merkel-aus-sachsen-anhalt-cdu… (Team Beer)"
"You have to be able to delegate, otherwise it won&#39;t work."
"It is up to the opposition to criticize the government, act on suspicion of failure, and uncover weaknesses. That is why we use #Internal Committee and #PUA. If you had done that in 2015-17, we would not be in this situation now."
Both (Team Beer).
"Speaking of #framing: why are you mixing up the #BAMF incidents with the #imigration law now? Incidentally, you can already hear the desire for a #PUA from your own ranks. Your party&#39;s failures only brought us into this situation."
Premiere of Chancellor Survey i #Bundestag: @Lambsdorff asks f @fdpbt for ratification of CETA &amp; Free Trade Strategy 🇩🇪🇪🇺. Merkel points to the schedule that should soon be there; SPD grumbles. It&#39;s good that Chancellor is going to Canada soon. Liberal prime minister certainly has suggestions. pic.twitter.com/enEHXdsTJ0
"And that&#39;s exactly why we need a #imigration law, because wanting to solve the # shortage of skilled workers without regulated immigration is naive. https://www.liberale.de/content/fdp-fuer-ein-komplett-neues-einwanderungsgesetzbuch… @Liberale_News https://twitter.com/sarfeld/status/1004304585555632128…"
"The tweet was wrong, fdpbt apologized for it. However, you will not find an apology or insight after a stupid tweet from the Greens. That is the difference."
Minister of Education Karliczek is finally available for questions in the committee. Particularly exciting: when will the digital pact finally start? How? And above all: how do we ensure that quality is invested in? @fdpbt @fdp @Bitkom #Digitalpakt pic.twitter.com/koHpzR5at2
"As long as you continue to provide us with steep slopes, my people can go home earlier in the evening and on Fridays. 🤫"
Aha. Do you now want to justify denunciations and make them fit for hope? Team Beer
"https://www.youtube.com/watch?v=q8a2vG1pvso… Regards, Team Beer"
"Strange worldview ... 🤔The green #Berlin | Senator for Justice Dirk Behrendt does not consider squatting to be legal, but it is legitimate. @Liberale_News https://www.morgenpost.de/214491283?__pwh=Vi/yZ4Rcjb9aZmEws+hjkA==… @fdp_berlin"
"SteuerRecord tax revenue, but still no complete abolition of the #Soli possible?!? #SPD &amp; #Scholz call it &quot;profile sharpening&quot;, but it is a matter of paying the taxpayer. # Solidarity surcharge http://www.handelsblatt.com/22647880.html?share=twitter… via @handelsblatt @Liberale_News"
In our regular coffee gossip rounds. (Team Beer)
"Doesn&#39;t work here. Technically, you cannot get a nationwide gigabit network with the copper pair. Therefore, the question of openness to technology does not arise here if the goal is comprehensive #Gigabit | connection. (Team Beer)"
&quot;Twitter is a great place to show the world what you think before you have had a chance to think about it.&quot; Chris Pirilio (Team Beer)
EU Court of Auditors: German #Breitband | goals cannot be achieved with #Copper. That is why @fdp called for the nationwide #glass fiber in the Bundestag election program. #Vectoring @Liberale_News @loadev #FTTH #FTTB http://www.spiegel.de/netzwelt/netzpolitik/breitband-internet-in-deutschland-eu-rechnungshof-zweifelt-an-verrealichung-a-1211283.html… via @ MIRROR ONLINE
"Handelsblatt: &quot;Greens are now behaving as if they were sitting on the government bank with Chancellor.&quot; Not completely correct. If the Greens had properly fulfilled their opposition role in 2015-17, we would not have the problem today. @Liberale_News #BAMF http://www.handelsblatt.com/meinung/kommentare/kommentar-gruene-und-sozialdemokrats-merkels-hilfstruppen-in-der-bamf-affaere/22639408.html…"
#CambridgeAnalytica 2.0 #Facebook has been exchanging user data directly with over 60 device manufacturers for over ten years. Can Facebook be controlled at all? Did #Zuckerberg create a digital Frankenstein? https://www.nytimes.com/interactive/2018/06/03/technology/facebook-device-partners-users-friends-data.html… @Liberale_News @loadev
&quot;Get rid of the prejudices and you&#39;re saved.&quot; Marc Aurel
BAMF affair: SPD politicians also for U committee | http://tagesschau.de http://www.tagesschau.de/inland/bamf-untersuchungsausschuss-spd-fdp-101.html… @Liberale_News
Getting involved in politics means taking care of your own affairs.
FDP had requested several times. http://www.handelsblatt.com/unternehmen/industrie/handelspolitik-china-senkt-einfuhrzoelle-fuer-autos-geldsegen-fuer-deutsche-autobauer/22587996.html…
Most of the other member states do not support Merkel&#39;s decision on migration policy. It is no secret. What else do you have? You said &quot;most&quot; above. Team Beer
"No. The British have approved all important decisions in the Council, together with the other member states. The British are not concerned with sovereignty. Team Beer"
I do not think so.
"My recommendations on #FF # FollowerFriday📱 @BraFDP @JBrandenburgFDP @th_sattelberger @BrittaDassler @michael_g_link @carina_konrad @sandra_weeser @ cad59 @starkwatzinger @DerFrauen @Liberale_News and of course @fdp, @fdpessen and @DPHd! @FDPH!"
That is the original quote. signed the intern
"There is also a differentiation in Italy, and there is no general general criticism of the EU as the root of all evils. Is &quot;the EU&quot; (= the decisions of all heads of state and government together in the Council) to blame for all bad political developments?"
"No, the Southerners have no interest in an economically weak Germany, because it would weaken them themselves. Team Beer"
The British want to keep the common market despite leaving. The common market and the common commercial policy are not grounds for Brexit. Team Beer
The elected governments of all member states sit on the Council of the European Union and decide in the last instance on all questions. Where&#39;s your anti-democratic behavior? Team Beer
"Thank you very much, this is valuable criticism. (Team Beer)"
"You are the only one here right now, against a whole profession. Informer lists are a threat to democracy. Team Beer"
Discussion event at the #FDP Main-Kinzig &amp; FDP Hanau with Nicola Beer. https://www.hessen-depesche.de/politik/fdp-generalsekret%C3%A4rin-nicola-beer-diskutiert-mit-der-basis-in-hanau.html… @FDPHessen @brueder_grimm via @HessenDepesche
"School is not neutral, it conveys our order of values. This results from the Basic Law. Part of this set of values is the rejection of reporting points for informers, as triggered here by the AfD. Team Beer"
We have just looked around a little on your timeline and cannot understand the accusation of the aggressive vocabulary. So long. Team Beer
It manifests itself that the Greens prefer to make a statement to impose driving bans on the back of consumers rather than to prevent driving bans at the expense of consumers through retrofitting. Team Beer
What do you say Team Beer
"Call for informer, block lists from left &amp; right, spy tower, block guard ... We have had everything at least twice in recent history. But it didn&#39;t work. Talk to each other! http://m.haz.de/Nachrichten/Politik/Deutschland-Welt/AfD-will-Melde Plattform-fuer-kritische-Lehrer-einrichten… via @HAZ @Liberale_News"
"It may be that the Greens &quot;only&quot; do their party work, but the Greens also have the political choice who they want to burden now: the consumer (who really can not help) or the manufacturer. Here, basic hatred of drivers manifests itself. Team Beer"
How please Mister Pienkny? Team Beer
# Greens call for nationwide # driving bans instead of # retrofitting.😡 This prohibition party would rather #Diesel | drivers coldly expropriate than help those affected. #FDP wants to retrofit to avoid driving bans. @Liberale_News #Dieselgate https://www.focus.de/auto/news/abgas-skandal/unternehmen-oezdemir-fuer-bundesweit-einheitliche-rechte-bei-fahrverboten_id_9008099.html…
"#DSGVO: data protection as a threat to journalists? &quot;Unfortunately, the federal states have not agreed on a standard text for the #media privilege,&quot; regrets media lawyer Wolfgang Schultz from the Hans Bredow Institute. https://www.ndr.de/fernsehen/sendung/zapp/DSGVO-Datenschutz-als-Bedrohung-fuer-Journalisten,datenschutz582.html… @Liberale_News @loadev @DJVde"
"Cavada had positioned itself for this, thus cementing the position of the Alde in the JURI. It is not expected that the Alde will vote with one vote. It will be a split vote. Team Beer"
"That&#39;s not true. The FDP in the European Parliament does not support this. Ask the delegation management @nadjahirsch. It is correct: there is the French Cavada, who absolutely wants that. @Liberale_News @loadev @Senficon @maximhauk"
"#Transparency: All tweets about #Babtchenko that were based on the wrong message were not deleted, but corrected. Team Beer"
Ms. Beer doesn&#39;t need a #mimimi microphone to make herself heard. Beer Team Beer
"Yes, you are absolutely right, that is unfortunate. #FakeNews does not fall under the concept of # freedom of expression. Happens sometimes. Sorry. Team Beer"
Correction: The journalist still seems alive - and death was only staged. https://www.focus.de/politik/ausland/uebereinstimmende-medienberichte-angeblich-in-ukraine-getoeteter-journalist-ist-am-leben_id_9012348.html… https://twitter.com/nicolabeerfdp/status/1001806998130888704…
"Correction: After corresponding reports, the journalist still lives and death was only staged ... https://www.focus.de/politik/ausland/uebereinstimmende-medienberichte-angeblich-in-ukraine-getoeteter-journalist-ist-am- life_id_9012348.html…"
Murder of Russian government critic #Babtschenko: Every murder of a journalist is one murder too many! &quot;The ✒️ ink is the fifth element &amp; the #press is the artillery of thoughts.&quot; (KJ Weber) http://spon.de/afe0X via @SPIEGELONLINE @Liberale_News #Pressefreiheit
"Before you leave yourself vulgar here, just come to the event and join in the civilized discussion. Team Beer"
"No, &quot;fakenews&quot; are false factual claims and are not covered by freedom of expression. Opinions, however, are covered under the Criminal Code. Post-censorship takes place through courts, not through politics. The press is free and can write what it wants. Team Beer"
"EhrVery good analysis, there is still a lot to do before the world&#39;s best education for everyone, but please based on facts, not on mood. #FAZ: &quot;Education and Statistics: The fairy tale of social injustice&quot; http://www.faz.net/-in2-9anj1?GEPC=s3… via @faznet @Liberale_News"
"Nicola Beer visits the T-Online editorial team. In an interview with http://t-online.de, the Secretary General talks about the progress &amp; regression in #data protection, in #digital politics - and in her own party. https://www.t-online.de/digital/id_83841416/fdp-generalsekretaerin-nicola-beer-lobt-die-dsgvo-als-forschritt-.html… via @tonline_news @Liberale_News"
Today we commemorate the victims of #Solingen 25 years ago. We will never forget the terrible deed - and it will always warn us to counter # xenophobia &amp; # racism against everyone at any time and in any place.🕊️ @Liberale_News
"The cake used to get bigger every year. Today politics means: If I give A something, I have to take B away. We have to find answers to the major challenges such as education, pensions, digitization, migration and not fight them schematically in warehouse thinking."
Right - left? 😂 Anyone who still divides the political world into the categories left &amp; right in the 21st century needs new glasses and politics bypasses people. @Liberale_News #Drawer thinking https://twitter.com/dieLinke/status/1001057753086021632…
On the other hand? We actively advocate that the state and KfW separate from its shares in former state-owned companies and from VW. The proceeds are to be invested in infrastructure. (Team Beer)
There is some truth in it. (Team Beer)
"The #FDP announced that it would request that all asylum decisions be checked by external examiners. &quot;In this case, the authority should not control itself,&quot; said FDP interior expert Linda #Teuteberg. http://sz.de/1.3993720 @LindaTeuteberg @Liberale_News #BAMF"
"# BAMF scandal - @GoeringEckardt would like to do best &quot;Enlightenment light&quot; according to the motto &quot;Wash me, but don&#39;t make me wet&quot;. @Die_Gruenen dwarf on the role of the government-loyal opposition. #Verzwergung https://www.welt.de/politik/deutschland/article176734482/Anne-Will-BAMF-Skandal-Goering-Eckardt-steckt-im-Aufklaerungsdilemma.html?wtmc=socialmedia.twitter.shared.web… via @ world @Liberale_News"
We do not share this form of argumentation and manner of political debate. Team Beer
"Regarding the increase in postage, Nicola Beer explains: &quot;How economically does Swiss Post work and at whose expense is it trying to defend the ex-monopoly? How about coupling the postage increase to customer satisfaction?&quot; https://rp-online.de/wirtschaft/unternehmen/post-politik-und-wirtschaft- Gegen-hoeheres-briefporto_aid-22895363?utm_source=twitter&amp;utm_medium=referral&amp;utm_campaign=share… via @rponline @Liberale_News"
Nicola Beer at Markus #Lanz&#39;s @ZDF tonight at 11:15 p.m. She talks about the affair with the Federal Office for Migration and Refugees #BAMF and explains whether she is surprised by the events and what needs to be done. https://www.zdf.de/gesellschaft/markus-lanz/markus-lanz-vom-23-mai-2018-100.html… @Liberale_News (TB)
"Just tip of the iceberg? Insufficient structures in the #BAMF have been known since 2014, apparently nationwide structural deficiencies have not yet been remedied, so the #Examination Board is necessary to regain trust, everywhere in the BAMF. @Liberale_News https://www.zeit.de/politik/deutschland/2018-05/bremer-aussenstelle-des-bamf-darf-keine-asylentscheidungen-mehr-treffen?wt_zmc=sm.ext.zonaudev.twitter.ref. zeitde.share.link.x… via @zeitonline"
"The format of the #Zuckerberg hearing today was outrageous by # Tajani, first all questions were collected, Zuckerberg then answered selectively. #Verhofstadt requests a written answer to all open questions (Team Beer) #Zuckerberg #ZuckerbergHearing #fail @Liberale_News"
#Zuckerberg does not answer the question about shadow profiles (data collection from non-FB users) even on request! #ShadowProfile (Team Beer) 🎥 Livestream here ⬇️ # Zuckerberg #ZuckerbergHearing http://www.europarl.europa.eu/ep-live/en/other-events/video?event=20180522-1820-SPECIAL-UNKN……… @Liberale_News
#Zuckerberg on the monopoly question: &quot;Facebook only combines around 6% of the global advertising market.&quot; Naughty! The gentleman needs tuition in market definition &amp; antitrust law. DG COMP? (Team Beer) 🎥 Livestream here ⬇️ # Zuckerberg #ZuckerbergHearing http://www.europarl.europa.eu/ep-live/en/other-events/video?event=20180522-1820-SPECIAL-UNKN……… @Liberale_News
ALDE chairman @guyverhofstadt asks #Zuckerberg whether #WhatsApp &amp; #Instagram should not be split off from Facebook (Team Beer) 🎥 livestream here ⬇️ # Zuckerberg #ZuckerbergHearing http://www.europarl.europa.eu/ep-live/en / other-events / video? event = 20180522-1820-SPECIAL-UNKN…… @Liberale_News
ALDE chairman @guyverhofstadt - very big - asks #Zuckerberg whether he publishes books to check whether FB is a monopoly &amp; whether he has created a &quot;digital monster&quot; (Team Beer) 🎥 livestream here ⬇️ # Zuckerberg #ZuckerbergHearing http: //www.europarl.europa.eu/ep-live/en/other-events/video?event=20180522-1820-SPECIAL-UNKN… @Liberale_News
# ALDE chairman @guyverhofstadt generally questions whether #Zuckerberg is still able to exercise control over his social media network. (Team Beer) 🎥 Livestream here ⬇️ # Zuckerberg #ZuckerbergHearing http://www.europarl.europa.eu/ep-live/en/other-events/video?event=20180522-1820-SPECIAL-UNKN… @Liberale_News
Shadow profiles: How can non-FB users prevent profiles from being created via them? (Team Beer) 🎥 Livestream here ⬇️ # Zuckerberg #ZuckerbergHearing http://www.europarl.europa.eu/ep-live/en/other-events/video?event=20180522-1820-SPECIAL-UNKN… @Liberale_News
The hashtag only makes trouble with the protection of minors ;-) (Team Beer)
Parliament President #Tajani addresses the important question of the transparency of algorithms in EP hearing. Fake accounts are also addressed &amp; manipulation of EU elections. 🎥 Livestream here ⬇️ # Zuckerberg #ZuckerbergHearing http://www.europarl.europa.eu/ep-live/en/other-events/video?event=20180522-1820-SPECIAL-UNKN……… @Liberale_News
"&quot;Lord, the need is great! The one I called, I will not get rid of the ghosts.&quot; (JW von Goethe) @Liberale_News https://twitter.com/JochenBittner/status/998920594119897088…"
#Zuckerberg and #zuckerberghearing seem to be emerging right now ... (Team Beer)
From 6.20pm we comment on the hearing of the #Facebook CEO Mark #Zuckerberg in the #European Parliament. (Team Beer) Lives The livestream will be available here from 18h20 CET here ⬇️ http://www.europarl.europa.eu/ep-live/en/other-events/video?event=20180522-1820-SPECIAL-UNKN…… @ Liberale_News
