"Had dinner for one Dinner for two. Now come to the new year in peace in #MaHe, all the best, then I&#39;m offline."
"@JosefWinkler Sure, I&#39;m happy ..."
@MGrosseBroemer Prima!
"I learned from @RenateBergmann: Sparkling wine cools on the balcony, potatoes and eggs for the salad simmer, matjes marinated, cost red wine"
@Konstanze_MaHe Likewise ...
National Socialism - Bundestag vice rejects allegations of looted art http://www.welt.de/politik/deutschland/article123414676/Bundestagsvize-weise-Raubkunst-Vorwuerfe-zurueck.html… via @welt
"@MV_AM great, we keep going, was asked today in #MaHe about Inge M. how she was ..."
"There was a lot going on here for a day off, talks with @HollsteinM, newspapers, the @ZDFheute is coming to #MaHe"
#Press release http://www.bundestag.de/presse/pressemitteilungen/2013/pm_131230.html… #Bundestag #Raubkunst
"Did something that apparently went out of style, called the phone and informed me and now have to tell it is very different"
Answer by the federal government to the @Linksfraktion on the subject of looted art and provenance research http://dip21.bundestag.de/dip21/btd/18/002/1800205.pdf…
"Mailbox heard and touched, New Year&#39;s wishes from a good friend from Israel, who was born in Halberstadt in 1927, hope to see you soon"
Wort.lu - Viviane Reding: hibernation and spring awakening: http://www.wort.lu/de/view/viviane-reding-winterschlaf-und-fruehlingserwachen-52bc5e63e4b001492a85672c#.Ur_vkUchxEA.twitter… #privacy #GroKo
@hoehlc We are just #MaHe and happy to be here ...
"it works, now only order has to be learned ..."
"Just had a @tagesschau visit in #MaHe and dared for more #democracy, instead of extending the election period #volksentscheid"
"More and more citizens don&#39;t care whether they can vote every 4 or 5 years, which means a dangerous loss of confidence in parliamentary democracy"
"Call press spokesman @Leftfraktion, because I&#39;m going to switch briefly from the recovery mode to #Democracy for the @tagesschau"
"@rbbinforadio first, minority rights must be reliably guaranteed in the Bundestag, which also includes changes to the Committee of Inquiry Act"
"@whuebner Mhhh, thinking about switching private newspapers to online subscriptions for a long time, so far with fear of loss ... # environmental protection"
"It is as it is, I am in recovery mode and only sporadically on Twitter &amp; Co., who can not stand it continues to follow, I am fine. #MaHe"
"@RAASachsen would be great if you would send the call for 2014 around and then post it, which I signed here last year"
"@Springpfuhl all right, call tomorrow, thanks"
"@MiRo_SPD @tsghessen That&#39;s right, dear colleague! Merry Christmas and please get to work soon!"
@ dynamo1955 @Springpfuhl wanted to make a virtue of necessity and give my stacked paper to the youth for the trip ...
"@Springpfuhl So our paper container in Marzahn has been overflowing for days, so we cannot dispose of who gets the stuff when? Contact?"
@ alm10965 really
@ alm10965 of course I meant herbs on # MaHe- balcony
"@Arfst_Wagner you too, dear Arfst!"
"@ alm10965 Then I do not dream u will harvest tomorrow: strawberries bloom, craters sprout, hot fruits ripen after #MaHe #Christmas"
"Now it&#39;s time: Symphony No. 9, Beethoven on couch in #MaHe"
"Today is really the 25th of December 2013, right? https://www.facebook.com/petra.pau/media_set?set=a.3952073056081.1073741828.1707802901&amp;type=1… #MaHe #Winter #Weihnachten pic.twitter.com/Fr0Tl0UfOj"
#Press release: http://www.linksfraktion.de/pressemitteilungen/buergerrechte-demokratie-teilweise-irreversibel-beschaedigt/… #Datenschutz #GroKo
@eddiotos Thanks! All the best for 2014...
@ Netz4ktivisten Then it became terribly quiet. His second chance could be our last. Let us not let him root!
"@ Netz4ktivisten When he first took office as BMI in 2009, de Maizière had promised more data protection. Then it became terribly quiet."
Petra Pau - The woman of the soft tones http://www.cicero.de/berliner- Republik/petra-pau-die-frau-der-leisen-wort/56679… #cicero_online
"@ reneurban1 later, now keep family peace"
"Holiday in #MaHe: first Wuhletal and now Edgar Wallace without end at @kabel_eins, good opportunity to clear out book boxes"
"&quot;12 x 3&quot;, my personal review of 2013: http://www.petrapau.de/person/lesbar/131230_jahresrueckblick_2013.htm…"
"@kabel_eins Now I&#39;m there too, good idea and lots of memories ..."
Review - brown earth http://no-nazi.net/gute-ideen- Gegen-nazis/rezension-braune-erde/#.UrnnTd-btu8.twitter…
News http://www.petrapau.de/aktuell/news.htm… via @PetraPauMaHe recommend looking back: http://www.petrapau.de/person/lesbar/131230_jahresrueckblick_2013.htm…
"Almost all day offline in #MaHe, really nice, wish everyone who celebrates it &quot;Merry Christmas!&quot; and all the best, too"
@ dynamo1955 @dielinkeberlin Tomorrow there would be another possibility in the constituency office or we can arrange a phone call. Conversation...
@TorbenSchultz @RenateBergmann Cheers!
"@ nazibasher88 @RenateBergmann just privately in #MaHe, I&#39;m just finding out, @ZDFheute let me work today, but didn&#39;t send it"
"@TorbenSchultz @RenateBergmann now has to peel potatoes and eggs, then it&#39;s enough for today, New Year&#39;s Eve can come"
"@TorbenSchultz @RenateBergmann I don&#39;t have it and can&#39;t stand it, but red wine is also a good thing"
Viral hatred: Right-wing extremist communication structures in the Web 2.0 http://netz- Gegen-nazis.de/artikel/viraler-hass-rechtsextreme-kommunikationsstrukturen-im-web-20-9178… via @netzgegennazis http: // netz-gegen-nazis .de / articles / viral-hate-right-wing extremists-communication structures-on-web-20-9178… see #MaHe
"Column for Christmas: Maria and Josef get no asylum | Opinion - Berliner Zeitung http://www.berliner-zeitung.de/meinung/kolumne-zu-weihnachten-maria-und-josef-bekommen-kein-asyl,10808020,25709834.html… via @BLZonline"
"If the extremism clause falls, reason wins. Finally, constantly promote initiatives against right-wing extremism, racism, anti-Semitism"
@MedientanteMT Advertise now for the next Avitall project http://www.we-call-out.de/project.html
"Come from concert with Avitall, The Upper Galilee Choir, Wroclaw Synagogal Choir, advertise for the next project right away http://www.we-call-out.de/project.html"
"Now a break, look forward to Avitall, The Upper Galilee Choir, Synagogal Choir Wrocław afterwards http://www.louis-lewandowski-festival.de/programm in #MaHe"
"@icke_such Is just an exception to the multiple request of people who no longer go out in the dark, normal office hours in #MaHe 16.00 -..."
9102 crimes with an extreme right-wing background until November • Focal points • News • UeNa http://www.uena.de/nachrichten/brennpunkte/3954421/9102-straftaten-mit-rechtsextremem- background-bis-november…
Right-wing extremist motivated criminal and violent acts 2013- now with October figures: http://www.petrapau.de/17_bundestag/dok/down/2013_zf-rechtsextreme-straftaten.pdf…
"A federal government replied, do not yet know which one: http://www.petrapau.de/17_bundestag/dok/down/2013_zf-rechtsextreme-straftaten.pdf ... #Rechtsextremismus #Straftaten #Gewalt"
"I&#39;m confused: 2 hours of housework, filling shopping list, only 3 emails left since office, next appointment tomorrow at 7:00 p.m. in #MaHe ..."
"Postberg worn out, slid back into #MaHe office hours, now I have to start preparing for the coming festivities in a totally surprising way"
"@icke_such Of course also online: http://www.petrapau.de/17_bundestag/index_wk.htm… and http://www.petrapau.de/aktuell/index_t.htm…, otherwise advertised in newspapers"
"@ dynamo1955 @dielinkeberlin well, then in #MaHe"
"1. Advent in #MaHe: We will light the candles in Alt Marzahn, then continue in Mahlsdorf"
@ dynamo1955 @dielinkeberlin either 11:00 in the Bundestag or 1:00 in the constituency office
"@hoehlc if you have called up the mobile version on the PC, with http://www.petrapau.de or http://www.petrapau.eu everything should be O."
@hoehlc why?
"The week is already off to a great start, craftsmen will only come next year, today there was too much traffic jam, now start from #MaHe in the Bundestag"
16.12.2013: Dispute over glass containers (neues-deutschland.de) http://www.neues-deutschland.de/artikel/918246.html… Incredible prankster and against # environmental protection
@domheilig Congratulations!
"@ErhardScherfer @DoroBaer Hope you survived this well and devote myself to completely different things, finally the 3rd Advent is coming"
"@DoroBaer @ErhardScherfer @phoenix_de Actually, I would have expected more care from social democracy ..."
A family brought two savings stockings with a lot of change to the Salvation Army stand on Kollwitzplatz pic.twitter.com/AMfXT5hQtK
"According to the media, sensitive personal data of employees circulates in the BMI free of charge. What do you need # NSA for if you have a BMI? #Privacy"
Campaign supports organization of a Christmas party for the needy - http://asurl.de/i3u I am at 12.30 am on the organ of the Salvation Army
"@rbbonline This is simple prankster and hostile to the environment, especially older residents carefully separate, should now go hiking"
@AnkeJulieMartin @RenateBergmann Does that have to be?
"@RenateBergmann was first sawed on the trunk, then additional branches were turned in, at the end the tip was simply crowned ..."
"@RenateBergmann Oh, I used to hear that from my mom every year, in the end everything shone, including the tree. #Weihnachtsdramen"
News http://www.petrapau.de/aktuell/news.htm… via @PetraPauMaHe
Schildbürger in #MaHe on the way? #Environmental protection becomes a competitive sport ... http://www.uellenbergmarzahnplus.de/glascontainer-werden-abgeraeumt/… #Glascontainer #Altglas
@LichtMarzPlus Schildbürger on the road in #MaHe? #Environmental protection becomes a competitive sport ...
"@MGrosseBroemer @RenateBergmann Again the question is, who would have been &quot;one&quot;? Would have given public support to this personnel immediately."
News http://www.petrapau.de/aktuell/news.htm… via @PetraPauMaHe
"@RenateBergmann @DerStralsunder great, then please Butterstulle and sour cucumbers, lard does it too ..., can do little with cake"
"@RenateBergmann I&#39;m already looking forward to it, please remember, I like it hearty, not a cake, but rather a butter dish or pickled cucumber"
"After the senior Christmas party in #MaHe, it is now back to the center: votes against right: Berlin http://vs.verdi.de/service/veranstaltungen/++co++e38f7584-51fc-11e3-bf07-52540059119e… #NSU"
"Farewell and thanks to Nelson Mandela, today at the South African embassy http://www.suedafrica.org/ pic.twitter.com/4r0p3m0B2a"
"Right-wing violence column: Right-wing murders, helpless police | Opinion - Berliner Zeitung http://www.berliner-zeitung.de/meinung/kolumne-zu-rechte-gewalt-rechte-morde--ratlose-polizei,10808020,25559490.html… via @BLZonline #NSU"
"Misty weather in #MaHe, but somehow you have to be in the air, in other words in the gardens of the world and then mulled wine in Alt-Kaulsdorf"
Event tip: ver.di | VS - Association of German Writers - Votes against Right: Berlin http://vs.verdi.de/service/veranstaltungen/++co++e38f7584-51fc-11e3-bf07-52540059119e… #NSU
"@niyesordunki Nevertheless, they would have enough to do in Hessen, Brandenburg, Bawü, HH and elsewhere u must not unload it at the federal government ..."
"@niyesordunki it remains the big misunderstanding, MPs are not the better investigators or on the road as criminals"
@colonpolis @ dynamo1955 @ZDFheft factual reporting would have been enough and should also be the mandate of public law
"@niyesordunki highly recommend the minutes and the report, many thousands of pages are white ..."
"@ZDFheute what was that? first 3 times fdp, then 1 time lean to jusos, just like the staff, without the content of the debates"
#Press release http://www.linksfraktion.de/pressemitteilungen/datenschutz-brauch-unabhaengigkeit/… #Datenschutz
"Now it goes back to the # electoral district #MaHe, we meet from 13:00 on the Alt-Kaulsdorfer Christmas market, Jesuskirche, Dorfstr. 12"
"From #MaHe to Karl-Liebknecht-Haus, today BAG anti-fascism, against right-wing extremism, racism ..."
"@staatsterrorNSU I stand by the work in # NSU-UA, I reject cover-up by the Bundestag http://www.petrapau.de/17_bundestag/index_nsu-ua.htm…"
Break my head on the way out of the Bundestag after #MaHe about questions of democratic theory + consequences of the practice of the main committee today #GroKo
"Good morning from #MaHe, I&#39;m curious what future #GroKo colleagues will do today in the #Main Committee, later on. Senior Christmas party #Kaulsdorf"
"Immediately go back from the Bundestag to the # electoral district #MaHe, look forward to the seniors in Club 74 http://www.klub74.de/html/klub74.htm"
Today I am in the diplomatic service and receive the CIVS http://www.ambafrance-de.org/CIVS-Entschadigung-antisemitischer… in the Bundestag
"Today the season begins in #MaHe: Advent celebrations in every district, I&#39;m with the mayor at AWO and happy retirees in Mahlsdorf"
Good morning from #MaHe! Then go to Potsdam and learn something while doing it http://www.rosalux.de/fileadmin/ls_bbg/media/Folder_Die_Linke_und_die_Nation.pdf…
@berlinliebich Caution! He sawed me up in the Kalkscheune in 1998 ...
We meet 13.00 in the village of Marzahn: Advent market in a village setting - BerlinOnline.de http://www.berlinonline.de/nachrichten/marzahn/adventsmarkt-in-dorflicher-kulisse-44006#… via @BO_News #MaHe
Nationwide reading day in Hellersdorf - BerlinOnline.de http://www.berlinonline.de/nachrichten/hellersdorf/bundesweiter-vorlesetag-in-hellersdorf-44586#… via @BO_News #MaHe
@thodenk @fr_schirrmacher Kata ... what?
"Will probably make a decision about how to organize the day, it is enough for today with #session socialism, wants to go back #MaHe"
@RenateBergmann Cheers and get well soon!
@DerRostocker ???
News http://www.petrapau.de/aktuell/news.htm… via @PetraPauMaHe
# Storage of data: Gabriel plays with the fear of the citizens http://www.zeit.de/digital/datenschutz/2013-11/kommentar-vorratsdaten-speicherung-koalitionsvertrag-gabriel-oslo… via @zeitonline #GroKo #Demokratie #Datenschutz
"Something new, it rains in #MaHe, start various #LINKE sessions, look forward to Rap Jam 6:00 p.m. in Haus Babylon, Klausdorfer Str."
Asylum seekers: #BND wants to dissolve the survey body - Politics - Süddeutsche.de http://www.sueddeutsche.de/politik/geheimer-krieg-bnd-will-umstrittene-befragungsstelle-aufloesen-1.1831999… via @SZ #NSA
Christmas miracle: craftsmen came this year and were quickly successful. Now start from #MaHe in the Bundestag.
"@ dynamo1955 @dielinkeberlin Let&#39;s talk about it in real life. We can meet at short notice, but today is the Bundestag"
"Closing time in #MaHe, will bring the garbage and the old glass down right away, tons are still there and have to stay! http://www.dielinke-marzahn-hellersdorf.de/uploads/media/hausglastonnen.pdf…"
The @Halina_Waw is right: http://www.linksfraktion.de/im-wortlaut/internetausschuss-darf-keine-spielwiese-werden/… #Internetausschuss
Old glass bins on the house must remain! Here is the position of the #MaHe #LINKE http://www.dielinke-marzahn-hellersdorf.de/uploads/media/hausglastonnen.pdf…
# TTIP trade agreement paves the way for #genetics #fracking #ACTA. Call for the negotiation stop: https://www.campact.de/ttip/appell/ via @campact
"@WulfGallert Some say so and others say so, unfortunately I had to read an honorary chair in the sect newspaper next to each track"
"few, but probably also"
"@Memet_Kilic is i. O. if I have to do it, I need understandable information, I guess I&#39;m not learning Turkish in this life ..."
I was ashamed for self-proclaimed LEFT at the unveiling of the memorial plaque at the KLH while reporting on Stalin&#39;s murder of the Randale family
"@AliKilicCHP @Memet_Kilic Sorry, don&#39;t understand a word ..."
@Dande_Lisbeth Ready !!!
News http://www.petrapau.de/aktuell/news.htm… via @PetraPauMaHe
Memories of the anti-fascist and communist victims of the Great Terror in the Soviet Union from 4 p.m. in the Karl Liebknecht House
Thanks to @Konstanze_MaHe and @bjoernMaHe for the offline requests.
"@peer_juergens Yes, unfortunately not a chance because of a session week in the Bundestag. Otherwise I like to come to you."
Interview of the week on #Civil Rights #Democracy #Rechtsstaat at @Linksfraktion: http://www.linksfraktion.de/interview-der-woche/generalangriff-buergerrechte-demokratie-rechtsstaat/…
"Reading tip, not only for people from #MaHe http://www.die-hellersdorfer.de/cms/upload/pdf/2013/Weihnachten_2013.pdf…"
»Foam fight against #Antisemitismus http://www.publikative.org/2013/12/11/schaumschlaegerei- Gegen-antisemitismus/… via @publikativeorg Recommend also: http://www.petrapau.de/17_bundestag/dok/down/ 18003_umulations_report_expertenkreis_20131128.pdf…
I need and recommend that after this day - Mikis Theodorakis &amp; Pablo Neruda - 1980 - Canto General: http://youtu.be/mMp5PF7jems via @youtube
Reply from Petra Pau to abhabenwatch.de http://tinyurl.com/l58zckw
"Back in #MaHe, let&#39;s see if I still catch @rbb # contrasts to #Verfassungsschutz and #LINKE"
"Back in #MaHe, let&#39;s see if I still catch @rbb #ontraste on #Verfassungsschutz and #LINKE"
"@ dynamo1955 # bundestag work, hear SPD and Union actually want to do this from next week, thanks anyway for the tip"
Reply from Petra Pau to abhabenwatch.de http://tinyurl.com/m9wg88l
"@ dynamo1955 Greetings to everyone in the Babylon house in #MaHe, I&#39;m on my way to the north, but at the sight of the buffet I get a longing"
"@peer_juergens I can look, what should I look for or find? Greetings from rough road in the state of Brandenburg ..."
"Good morning from #MaHe, today the seniors have to sing, dance, celebrate Advent without me, have an appointment far north"
@rbbonline @bmw Why do I immediately believe that it was? #Human rights #Democracy # Charity #Profit
#Pressemitteilung http://www.linksfraktion.de/pressemitteilungen/wer-schweigt-macht-sich-uldig/… #NSA # Bürgerrechte #Demokratie
"also today in #MaHe senior citizen advent celebrations, we meet in Mahlsdorf &quot;Pestalozzitreff&quot;, at Mittendrin eV u district meeting &quot;Mosaik&quot;"
"# Electoral district day in #MaHe: office hours brought life back to life, now it continues to the district center Biesdorf"
"There are things: once at home, called, asked and asked to watch @ZDF on Friday from 10 p.m. and to see if I was trendy"
"@Tinaluchskind like to come if youth celebrates u want me to have a middle-aged box with them, the approx. 20 senior celebrations are compulsory in #MaHe"
"And it continues with the senior Christmas parties in the #MaHe constituency, today we meet in Club 74 and in the Marzahn promenade"
"@MatthiasDeiss @AkademiederK Thanks also to the moderator, it was really exciting"
# NSU murder of Halit Yozgat: no more obscuring important facts - a committee of inquiry must come http://bundespresseportal.de/hessen/item/18262-nsu-mord-an-halit-yozgat-schluss-mit-dem- obfuscate -important-facts-an-investigation-committee-must-come.html? utm_source = dlvr.it &amp; utm_medium = twitter…
"Was so far in the snow flurry of #MaHe, talks with SPÖ comrades, Advent celebrations and opticians Terl - no time to tweet"
#Pressemitteilung http://www.linksfraktion.de/pressemitteilungen/asylantraege-duerfen-nicht-bundeswehr-bundet-werden/…
GDR civil rights activists against #NSA: let&#39;s keep democracy alive! - taz.de http://www.taz.de/!128851/
@IsabellaPfaff Thank you! He&#39;s missing...
Do you still have them all? Dispute in the European Parliament: Stalin splits Europe&#39;s left http://spon.de/ad50S Break with Stalinism was the basis!
New Germany: soldiers should process asylum applications http://ots.de/27e503/st via @na_presseportal Farewell to civil society?
"@IsabellaPfaff Right! So of course I&#39;m not waiting for the doctor, thanks for pointing out that we should talk soon ..."
@IsabellaPfaff I&#39;m getting the impression that parts of the federal institutions are more likely to be the case for the long overdue reform of the healthcare system.
"Good morning from #MaHe! Today desk work in the Bundestag, in the afternoon Advent celebrations with senior citizens in the # electoral district"
"@tsghessen @NancyFaeser High time! It is not clear why there is still no # NSU investigation in Hessen, BaWü and elsewhere"
"Thanks for submission! Train my voice with text, by the way we should think: Loriot Bundestag speech: http://youtu.be/Sgn0dWnfFx4 via @youtube"
"@CHBtm Nope, as a former teacher of German and art education I stick to it: Is culture and historyless = &quot;disregarded&quot;!"
Overdue! Must be reckless and comprehensive: Apparently more victims of right-wing violence than expected - today- news http://www.heute.de/Offenbar-mehr-Opfer-rechte-Gewalt-als-gedacht-30955678.html…
Thank you! What remains (neues-deutschland.de) http://www.neues-deutschland.de/m/artikel/917060.was-bleibt.html…
#Press release: http://www.linksfraktion.de/pressemitteilungen/diskrepanz-nicht-hinnehmbar/… #Rechtsextremismus #Rassismus #LINKE #Bundesregierung
@KonstantinNotz And now?
"We will never achieve such election results in our parties and parliamentary groups. The board of the DPG was elected unanimously, again VIze"
"Thanks for all the good wishes, start from #MaHe for the session marathon: Presidium, AK, General Assembly DPG, parliamentary board, parliamentary group"
"@hildwin @RenateBergmann Thank you! All of them must have been shot by tomorrow&#39;s bureau meeting, i.e. further appointments canceled today."
"Viruses, bacilli and headache hammers that are exposed to me must be picked up immediately, otherwise there is a risk of # chicken broth #Ingwertee # MaHe-Couch"
"Good morning from #MaHe, start in the Bundestag, day begins with board meeting in the DPG, afterwards many discussions"
"@RenateBergmann Yes, there is a lack of culture everywhere. Still wish you a nice evening ..."
"That was another day, I&#39;m back in #MaHe and I&#39;m happy to report on a lively, stimulating debate: https://www.mitmischen.de/diskutieren/topthemen/politikfeld_bundestag/berlinreise_2013/diskussion_pau/index.jsp…"
Should talk to each other a lot more! Exciting debate in the working group on civil society and the activating state at the Friedrich Ebert Foundation
"The day started off turbulently, conversation with @DLF, office round, now young award winners from https://www.kuppelkucker.de/ and http://www.mitmischen.de/"
"@ARDde Please have a look, my computer and laptop choke on media library contributions, soon have to sleep a little ..."
"But, E-Dok was the decision of all factions @faz_net: Main committee: Black-Red puts opposition in its place http://www.faz.net/-hpp-7jw3y #faz"
So much for the main committee - http://www.petrapau.de/17_bundestag/dok/down/131128_erklaerung_%20zum_abstimmungsrechte_hauptausferenz.pdf… @faz_net: Black-Red puts opposition in its place http://www.faz.net/-hpp- 7jw3y #faz
"@martindelius Since SPD has significantly promoted this nonsense, this will not be:"
Congratulations to R. Dressler for the Heinz Galinski Prize 2013
I would like to ask the following in the Bundestag: http://fra.europa.eu/de/press-release/2013/zur-bekampfung-von-antisemitismus-sind-gezieltere-massahmen-notwendig ... To fight #Antisemitismus more targeted measures are necessary
Breakfast and conversation with the culture minister of the Vatican and then the Bundestag will be exciting today
@RenateBergmann I don&#39;t know! Now read the contract 3 times and there is always more ??? Let&#39;s see how the party base translates all of this
"@RenateBergmann Don&#39;t think! Fear only for today&#39;s 63 combo # GroKo adversity, read nothing about HartzIV forced retirees, pushed into early retirement"
"@AndyNeumannBDK No idea ..., Green-Red blocked # NSU-UA in the Bundestag as well as Black-Red, Red-Black, Red-Red, Black-Yellow, etc"
I wish straight away: Hanukkah sameach!
Impudence against the committee of inquiry: Interior Minister Gall opposes the committee of inquiry on #NSU http://www.swp.de/2326218
"@ronaldvonbremen Nö, the representatives of all parliamentary groups were unanimously proposed and then unanimously elected, is a special club."
"@ dynamo1955 in real life I&#39;m still present, but without a working cell phone it&#39;s difficult, cell phone fossil doesn&#39;t like it anymore"
"will have to say goodbye soon, beloved nokia communicator is leaving me more and more, who fills the gap? #nsa #constitutional protection"
Pau: Oversized coalition becomes small-small government | svz.de http://www.svz.de/newsticker-nord/artikeldetail/artikel/pau-uebergrosse-koalition-wird-klein-klein-regierung.html…
"@Tobias_Schulze Just remember red-green extortion number against red-red in Berlin on this topic, urgently need cooling ..."
Parties: Pau: Oversized coalition becomes small-small government http://www.focus.de/3428543 via @focusonline Someone was listening. #LINKE #GroKo
2. An elite main committee in the Bundestag would be against democracy. It cannot be ruled out that this could become a case for &quot;Karlsruhe&quot;.
I just said at #LINKE McPomm: The position of the LEFT is clear: Yes to civil rights! Yes to democracy! Yes to Edward Snowden!
"Good morning from #MaHe, look forward to the #LINKE in McPomm and head towards Greifswald"
@AmadeuAntonio @no_nazi_net Congratulations !!!
"@dielinkeberlin So that no misunderstandings arise: Seniors and police officers celebrate Christmas, @dielinkeberlin has #linkelpt"
