"All right, you are heroes, just sent plenum home."
#Schilkin
 https://www.youtube.com/watch?v=GdNwi079uOk …
12/17/2016: The long-term lie »No NSU reference« (neue-deutschland.de) http://www.neues-deutschland.de/artikel/1035757.die- Durationluege-kein-nsu-bez.html.html? Pk_campaign=SocialMedia ... via @ndaktuell
# DeutscheZustände2016 https://twitter.com/linke_sachsen/status/815132807500627968…
"My team brought together striking facts from my political 2016 via http://www.petrapau.de, 12 x 3: http://www.petrapau.eu/person/down/161230_jahresrueckblick_2016.pdf… Thank you!"
A contribution to the discussion from 2007 came back to me: http://www.petrapau.de/person/down/071013_10-hannah-arendt-tage_lang.pdf… &quot;Democracy annoyance is not a cold ..&quot; https: //twitter.com/netzgegennazis/status/814886387619135488…
# DeutscheZustände2016 #LaLoKa #MaHe https://twitter.com/AStA_ASH_Berlin/status/814485181822287873…
#Chanukka Sameah #MaHe It remains: It doesn&#39;t take a lot of light to illuminate a great darkness #noafd pic.twitter.com/niEZO2jZH4
Can I rent the # Grill-Lator? Wonderful idea for @TeamPetraPau next year in #MaHe https://twitter.com/RenateBergmann/status/814059007543541760…
#Schalom and #Chanukka sameach! Son of terror victim lights fourth light http://www.juedische-allgemeine.de/article/view/id/27360… #JuedischeOnline
You&#39;re right
Chag Hanukkah Sameah! &quot;You don&#39;t need a lot of light to illuminate a great darkness.&quot; 4. Candle burns at #BrandenburgerTor &amp; #MaHe. pic.twitter.com/krNoswkxkd
"#Data protection is not a luxury relic, but the basis for #democracy and #freedom."
I&#39;m offline and wish #Chanukah sameach! #MerryChristmas #Happy Holidays in #MaHe and everywhere!
"Yes, and who cares?"
"Thanks for the wonderful evening to the 7 cantors, Nils Busch-Petersen, IG Kirche Wuhlgarten #LouisLewandowskiFestival pic.twitter.com/nIEMGTvpjG"
"I just gave away &quot;We need a lot more sheep&quot; from @RenateBergmann &amp; my #GottloseType, #Doppelpack gave a lot of joy. pic.twitter.com/POp6RgrkL4"
Right!
"Believe this appeal is supported by all members of the interior committee in the #Bundestag, we are surprised here by some ticker real-time reports. https://twitter.com/bka/status/811532216811581441…"
Petra Pau on security policy https://www.zdf.de/nachrichten/zdf-morgenmagazin/petra-pau-102.html… #Breitscheidplatz
Make me #MaHe on the way to @morgenmagazin https://twitter.com/morgenmagazin/status/811431196764868608…
"Dear Renate Bergmann, would have wished your resolution had inspired colleagues from all parties. #Democracy &amp; # Credibility would have won https://twitter.com/RenateBergmann/status/811081618991513600…"
I&#39;m sad. #Breitscheidplatz But this is also a reality in 2016 http://www.petrapau.de/18_bundestag/dok/down/2016_zf-rechtsextreme-straftaten.pdf… # GermanConditions2016 #Nazis #Democracy defend pic.twitter.com/oNKDtACuiU
"Oh yeah, obviously he rammed me into #Lichtenberg or he has doubles today, my car was stronger but still broken"
Show! Network is not without rights.
"Certainly not, otherwise I would have to use the manure of these people. B. comment from #MaHe will not take place"
There is nothing to add: https://twitter.com/Ralf_Stegner/status/810951264972525572…
"My thoughts are with the dead, injured, relatives and the Berlin police and other helping forces .. #Breitscheidplatz https://twitter.com/PolizeiBerlin_E/status/810945375863500800…"
"My thoughts are with the dead, injured, relatives and the Berlin police and other helpers ... #Breitscheidplatz https://twitter.com/polizeiberlin/status/810940347006197760…"
"# NSU-UA in the #Bundestag on November 15th, 2016 #Kassel #Temme #Morder Investigations &amp; Role of #Verfassungsschutz https://twitter.com/Linksfraktion/status/810846114291347456…"
It is still worthwhile today to investigate the traces that were then ignored in the # Nazi network https://www.linksfraktion.de/themen/nachrichten/detail/nur-mit-angezuzer-handbremse-ermittelt/… #NSU #Dortmund #NRW https://twitter.com/tagesspiegel/status/810430875448000512…
#LouisLewandowskiFestival 2016 Jewish Renaissance and Barack in the
I am now looking forward to a special concert in #Mahe: 7pm the cantor concert begins in the church in the #Wuhlgarten #LouisLewandowskiFestival https://twitter.com/Bezirksamt_MaHe/status/803947456928980992…
"So it was: http://www.die-linke-berlin.de/die_linke/parteitage/6_landesparteitag/1_tagung/rede/pau_zu_lederer/… Thank you, Klaus!"
"Now start from #MaHe, the weather is scary, but at #linkelpt the sun is definitely shining"
"It is for the K .., I also got a letter of attorney from the public prosecutor&#39;s office, should just hang"
Recommend doing nothing about #Manole #Primus #Helfer # Gärtner ....
Personell Gärtner raises questions Telepolis https://www.heise.de/tp/features/NSU-Tatort-Kassel-Hat-der-Verfassungsschutz-einen-V-Mann-untermachen-3574030.html… # NSU-UA in the #Bundestag #Kassel
# NSU crime scene in Kassel: Did the Office for the Protection of the Constitution misappropriate a V-man? | Telepolis https://www.heise.de/tp/features/NSU-Tatort-Kassel-Hat-der-Verfassungsschutz-einen-V-Mann-untermachen-3574030.html…
# DeutscheState2016 https://twitter.com/dpa/status/810117716279488512…
"I had actually forgotten that ... However, it was not a matter of a mutton jump today."
"recommend all files to #Manole from January 2012, unfortunately BKA had simply unsubscribed by the spring of 2016 -ARD-Doku-"
Facts: https://www.linksfraktion.de/themen/nachrichten/detail/nur-mit-angezuzer-handbremse-ermittelt/… #NSU
"You should do this, do not apply the handbrake or even stop investigations when VS is in play"
"No, there are more and more, do not know how many are protected from access #prime protection #Primus"
Police are looking for hundreds of neo-Nazis http://www.tagesspiegel.de/politik/rechtsextremismus-in-deutschland-polizei-fahndet-nach-hunderten-neonazis/14946376.html… Learning from the # NSU disaster would look different.
 http://www.die-linke-berlin.de/die_linke/parteitage/6_landesparteitag/1_tagung/rede/pau/ …
Wake up call from Vienna - Austria after the federal presidential election Inforadio - Better informed. http://www.inforadio.de/programm/schema/sendung/forum/201612/75619.html… #Rechtspopulismus
# DeutscheZustände2016 https://twitter.com/tbb_berlin/status/807515673656229888…
"First #linkelpt, then: politicians organize so that those in need can celebrate Christmas- PrenzlauerBerg -berliner-woche.de http://www.berliner-woche.de/prenzlauer-berg/soziales/politiker-orgeln-damit-beduerftige-weihnachten- celebrate-can-d114031.html…"
"But still today #Christmas evening in the #Bundestag. Have called next meeting for tomorrow 9:00 am, from 10:50 am it concerns # NSU consequences"
http://www.petrapau.de/person/down/161208_juedischer_gemeindetag.pdf… Rede #Gemeindetag
Here is the manuscript: http://www.petrapau.de/person/down/161208_juedischer_gemeindetag.pdf… #Gemeindetag
"AfD and PEGIDA: right-wing populist and anti-democratic - http://www.petrapau.de/person/down/161208_juedischer_gemeindetag.pdf… My contribution yesterday to the Jewish #Community Day,"
I am pleased that Frank Meisler&#39;s autobiography is presented publicly today. Many read them. pic.twitter.com/yGobyYAbJ5
"will be available on http://www.petrapau.de from around 10 p.m., link them after returning from #Gemeindetag"
It is a great honor to be able to speak today at the #Community Day and to be able to discuss strategies against #Rightpopulism with the participants. https://twitter.com/JuedischeOnline/status/806751908564115458…
"# Electoral District Day #MaHe: Zw. 15.00 &amp; 17.00 we can talk about your personal concerns in the STZ Pestalozzi-Treff, Pestalozzistraße 1A #Mahlsdorf"
# Electoral district day in #MaHe: between 10 a.m. and 12 noon you can bring your personal concerns to the constituency office in Henny-Porten-Str. 10 come
"Everything in #MaHe, of course, today and tomorrow. # Electoral district #Consultations for citizens #Senior Christmas party"
"#Christmas evening, tomorrow I&#39;ll be there for you again: 10 a.m. consultation hours # Constituency office &amp; 3 p.m. in the Pestalozzitreff #Mahlsdorf, Pestalozzistraße 1A"
"Yes, hope # r2g will continue to work on the # NSU complex in #Berlin, # education is still necessary"
Make me on the way to @EABBerlin &amp; @rbbinforadio #Europa # Austria #Democracy #Rechtsruck etc ... https://twitter.com/PetraPauMaHe/status/804652795785871360…
"Surprised: Sat. was eaten at the Christmas market #Kaulsdorf, pork steak &amp; tabbouleh, this is now supposed to show Islamization of the district #MaHe"
The season is open: Christmas for the elderly in the AWO meeting #Mahlsdorf with the wonderful Donato Plögert #MaHe pic.twitter.com/L7upl7c7qk
Why don&#39;t I think that is out of the question? # Constitutional protection #NSU
# Data retention: There can be no question of probation or even insight. The federal government is a repeat offender. https://twitter.com/digitalcourage/status/803149027998957569…
"#Data retention: a deep encroachment on securitized civil rights, against democracy."
"I&#39;m sad, Peter Hintze is dead. We used to argue about red socks, later we listened to each other, courted for #respect &amp; #democracy"
"Today we can meet at my favorite #advent market in Alt-Marzahn from 13.00, look forward to it. A nice first Advent! #MaHe https://twitter.com/LichtMarzPlus/status/802449674141659137…"
I&#39;ll do it now: Then just vote online! http://martindelius.de/2016/11/dann-stimm-halt-online-ab/… via @martindelius #fdsakademie
I&#39;ll do it now: Then just vote online! http://martindelius.de/2016/11/dann-stimm-halt-online-ab/… via @martindelius #fdsakademie
"The #constitutional protection is not the solution, but part of the problem. See #Piatto #Corelli #Primus etc. in the # NSU complex"
Now start from #MaHe to the #fdsakademie https://twitter.com/fds_linke/status/801758631968604160…
"In the midst of the #budget debate in the #Bundestag, we paused across groups, no more, but no less ..."
Stunned how many #human enemies are on the road..Care for friends in #Israel # Jewish # Muslim #Christian ...
In # Allgäu and @schrothkur you swear on #Marmot ointment in such a case
"Today I was allowed to receive Advent wreath from #Diakonie for #Bundestag, #Kinderchor des Ev. Johannesstift accompanied. pic.twitter.com/eiH2Nz8ksS"
The Presidium of the Central Council of Jews and the executive party executive @dieLinke met for an exchange of ideas pic.twitter.com/tKyodbIOFr
Police missed the chance to catch # NSU terrorists http://www.morgenpost.de/208475869?__pwh=NPNq1FTI01HtktRSbKEoMA==…
# DeutscheZustände2016 #MaHe https://twitter.com/AStA_ASH_Berlin/status/801795617542508544…
"And it continues with the # reading day, now in a day care center in the # electoral district of @Halina_Waw"
"so it was, before we had asked for adjournment, Fr."
#Reading day in #MaHe: I am happy to be able to introduce &quot;Tom der THW-Helfer&quot; to the children with #THW #SchuleamRosenhain #Ebereschengrundschule
I am already looking forward to the debate at the #Community Day: From kids club to politics http://www.juedische-allgemeine.de/article/view/id/26990… #JuedischeOnline
"The #Gottlose Type reads 15.30 in the series &quot;The Blue Hour&quot; in the community meeting place in Ribnitzer Str. 1b, 13051 Berlin"
"The second consultation hour on the #Wahlkreistag #MaHe will take place from 3 p.m. in the STZ Kiez Treff West, Ahrensfelder Chaussee 148, 12689 Berlin."
"Good morning from #MaHe! Today is #rectoral day, at 10:00 the first consultation hour begins in the # constituency office in Henny-Porten-Str. 10"
"Dear Irmela Schramm, dear Klaus, let&#39;s go together, scrape &amp; spray. It is enough! See # NSU debate https://www.youtube.com/watch?v=GdNwi079uOk… on Fri. https://twitter.com/klauslederer/status/798287513483878400…"
"The #GottloseType is now returning from #Eggesin to #MaHe, where it will continue tomorrow at 2.30pm at Klub 74 eV, Am Baltenring 74, 12619 Berlin"
Report on the # NRW day in the # NSU investigation committee in the #Bundestag #Verfassungsschutz https://twitter.com/Linksfraktion/status/798164593549910017…
"The #GottloseType is in #Eggesin today, from 6.30pm I read in the community center, Bahnhofstr. 7, 17367 Eggesin @Verlag_Eule"
 https://www.youtube.com/watch?v=GdNwi079uOk …
"Also applies to other areas: #Media #Police #Justice From #Verfassungsschutz #BND # MAD, which is said to be reforming, not to mention #NSU https://twitter.com/Alex_Bosch14/status/797841248631582720…"
Thanks for a wonderful evening @RenateBergmann in the #Distel in #Berlin pic.twitter.com/A7HHgkFqHj
"brought one from #MaHe, but is already handed in with #GottloseType for @RenateBergmann at the entrance"
"I&#39;m also soooo excited, I bought the tickets in the summer, you just have to make provisions"
Bundestag Vice-President Petra Pau (Left) gives a lecture on Nazi terror in Mainz - http://www.allgemeine-zeitung.de/lokales/mainz/nachrichten-mainz/bundestagsvize-petra-pau-linke-haelt-vortrag-ueber-naziterror-in -mainz_17447328.htm… #NSU #GottloseType #Mainz
"No, even #Justiz is part of the # NSU disaster, you can also see the lack of consequence http://dipbt.bundestag.de/dip21/btd/18/093/1809331.pdf…"
High time! &quot;Blood &amp; Honor South Thuringia&quot;: searches for suspected right-wing radicals http://spon.de/aeRCJ via @SPIEGELONLINE #NSU
"11.11.11 BfV-Lingen deliberately shreds files on Nazi V-people, StA Cologne has a statute of limitations on 10.11.16, the Bundestag debates on 11.11.16 #NSU"
And # NSU scandal is always taking new forms http://www.dka-kanzlei.de/news-reader/staatsanwaltschaft-koeln-will-das-verfahren- gegen-mitarbeiter-des-bundesamtes-fuer-verfassungsschutz-nicht- record-anyway-.html ... # unreserved education
"No understanding, as a reminder: L shreds files of central V-people in the # NSU environment on 11.11.11, in 2014 he admits intent, GBA ignores https://twitter.com/AstridGeisler/status/796067673511759872…"
The #NSU and the murder of Peggy K .: &quot;An incredible suspicion&quot; - taz.de http://www.taz.de/!5348711/
These girls and boys are committed to preparing for vocational training and proudly showed me their work
"What is going on in #Freiburg? Carefully said, I&#39;m confused: Freiburg&#39;s synagogue and November 9th http://www.juedische-allgemeine.de/article/view/id/26849… #JuedischeOnline"
And that&#39;s good! @DietmarBartsch @Leftfraktion https://twitter.com/DerRostocker/status/794828688693035008…
The local association organizes this conference from 10.00
"After exciting days in #Mainz &amp; #Trier back to #MaHe, hopefully I can still do &quot;To Church History ...&quot; in Jesuskirche Kaulsdorf"
"After visiting Karl Marx &amp; in the @Volksfreund editorial team, the #GottloseType is making its way to the #Volkshochschule #Trier pic.twitter.com/njVA9iHqbQ"
"Today the #GottloseType is traveling with #Katrin_Werner in #Trier, stations: BBS GuT, OB, Karl Marx Haus ... and VHS http://www.die-linke-trier.de/nc/termine/terminuebersicht/ereignis/ single / 2016/11/04 / appointment / petra-pau-reading-godless-type /…"
Something in the afternoon? #GottloseType reads 16.00 in the Cafe Mahlsdorf http://cafe-m.ceweb.de/?page_id=592 there is http://www.cafe-mahlsdorf.de/index.html #MaHe
"OK then! However, I ask everyone who comes to the #GottloseType reading in Cafe Mahlsdorf to schedule this complication, 4:00 p.m. it starts https://twitter.com/MarioCzaja/status/791987448704278528…"
"Let&#39;s talk in #MaHe! Humiliation, dark cells, abuse etc. were everyday life in Torgau, I met the children from back then"
Bundestag Vice Visited Memorial - Local Affairs - Torgauer Zeitung http://www.torgauerzeitung.com/Default.aspx?t=NewsDetailModus%2887351%29#.WBO0RxdXdsU.twitter…
Thank you for this important book &amp; the debate. The problem in our society has a name. It&#39;s #Racism #Humanity. https://twitter.com/Baharehzade/status/791991239553974272…
The NSU and the murder of Peggy K .: &quot;An incredible suspicion&quot; - taz.de http://www.taz.de/!5348711/
"Hope you are already in # Cologne, there is traffic jam everywhere, I can’t get out after # fault detector use &amp; # NSU debate at university"
"Incidentally, I will be in Mainz on November 3, 2016 and report on the parliamentary clarification in the # NSU complex: https://www.facebook.com/events/1256384857757655/… #LINKE #Mainz"
Today I am in # Cologne: 1. # Use of a fault detector at a school &amp; then to the conference against # racism at the university https://twitter.com/SDSKoeln/status/790938490196389889…
This # 2016 is really enough for me #ManfredKrug
"#GottloseType back in #MaHe from tour with @SuzaKarawanskij &amp; @frank_tempel, brooding helplessly ü Write the @AOK_Nordost to relatives"
News http://www.petrapau.de/aktuell/news.htm… via @PetraPauMaHe
# EuropeanConditions2016 As a reminder: Foreign connections of the # NSU network &amp; # NSU core trios are far from being resolved https://twitter.com/taz_news/status/791278480461705216…
# NSU international relations are still waiting to be cleared up - Hungary: neo-Nazi leader shoots police officers http://spon.de/aeQ6p via @SPIEGELONLINE
#RoteSpitzen in #Altenburg with @frank_tempel u #GottloseType #EulenspiegelVerlag pic.twitter.com/Q10iw9igql
"Whether # Böhnhardt has anything to do with the death of #Peggy has to be clarified, also means that no files and evidence #NSU 1/2"
#Holocaust: Survivors and politicians remember the beginning of the deportations (via @berlinerzeitung) http://www.berliner-zeitung.de/24943324?dmcid=sm_tw… # Gleis17
"On October 25, 2015, 6 p.m. the #GottloseType comes to #Oschatz https://www.facebook.com/events/1787779761500190/… @SuzaKarawanskij"
"The #GottloseType comes on October 26, 2016 for talk and reading in the Altenburg Paul-Gustavus-Haus http://www.abg-net.de/aktuelles/nachrichten/date/2016/10/17/talk-und-lesung- mit-petra-pau-im-altenburger-paul-gustavus-haus /… @frank_tempel"
Committee asks: Did #NSU fund itself from child porn? | WAZ.de http://www.derwesten.de/12285010
"After a stimulating # r2g debate, files and questions about #NSU and this: https://twitter.com/BR_Presse/status/788428204491022336…"
#bindabei #r2g
"every SiWoche, calendar can be found at http://www.bundestag.de # NSU-UA #Bundestag"
Registration in the # NSU committee required: http://www.bundestag.de/blob/475498/4bb16082bf75254a8b1028693739b3a2/to_35-data.pdf… https://twitter.com/nsuwatch_bt/status/788335485026504704…
Note: Registration required #NSU #Bundestag @Linksfraktion https://twitter.com/BlackboxVS/status/788293656121864192…
News http://www.petrapau.de/aktuell/news.htm… via @PetraPauMaHe
"Sure, Bishop Dröge gave a #GottloseType for his birthday, of course the congregation also got a #MaHe"
As the esteemed colleague Wolfgang Thierse said: &quot;Saxon democracy&quot; I&#39;m somehow just angry &amp; recommend: http://www.petrapau.de/18_bundestag/dok/down/2016_zf-rechtsextreme-straftaten.pdf… https: // twitter. com / BuntesDresden / status / 787345723645919234…
"October 15, 2016: The murder of Peggy and the NSU complex (neues-deutschland.de) http://www.neues-deutschland.de/artikel/1028720.der-mord-an-peggy-und-der-nsu- complex.html? pk_campaign = SocialMedia… via @ndaktuell"
"may no longer be destroyed, not in the federal government and not in the federal states, nowhere. #NSU 2/2"
unacceptable &amp; worrying # GermanConditions2016 cry out for democracy defenders in #Police &amp; at all
"Bridges Kaulsdorf Nord, there is the art project"
unacceptable &amp; disturbing # DeutscheZustände2016 cry out for democracy defenders
Just walk and look at both bridges or listen now ...
The Berlin cabaret prize &quot;EDDI&quot; went to Thomas Freitag today. http://edgarkuelow.de/ @Verlag_Eule @ndaktuell #Lachmesse #Lichtenberg pic.twitter.com/vNCviZbONo
# NSU terrorists scouted Berlin Synagogue from (neues-deutschland.de) http://www.neues-deutschland.de/artikel/1027904.nsu-terroristen-kundschafteten-berliner-synagoge-aus.html?pk_campaign=SocialMedia… via @ndaktuell #Piatto #Brandenburg
Equal...
"Read with increasing heart rate in Brandenburg &quot;found&quot; # NSU files, hope chicken No. 7 is the last one for 2016 #Piatto pic.twitter.com/fViMbJrFHH"
"The #GottloseType reads Marchlewskistr in the studio stage in the “Alte Feuerwache” cultural center from 4 pm today. 6, 10243 Berlin"
"The fact is: 1. # Moratorium of extermination was not implemented in Brandenburg, 2. # NSU files &quot;found&quot; now were 1. UA withheld https://twitter.com/rbb24/status/783668785274318848…"
Much wind for an unsuccessful phishing attack on the #Bundestag https://netzpolitik.org/2016/viel-wind-um-einen-erfolglosen-phishing-angriff-auf-den-bundestag/… via @netzpolitik
"# Electoral district day in #MaHe: Visit to primary school, 12.00 hours in the constituency office &amp; 3.00 hours in the STZ at Hultschiner Damm 98, 12623"
Blocked education? The # NSU complex and the current terror from the right: faction DIE LINKE. in the Bundestag https://www.linksfraktion.de/termine/detail/blockierte-aufklaerung-der-nsu-komplex-und-der-aktuelle-terror-von-rechts/…
Petra Pau can be won over by the dancers http://www.nordkurier.de/neustrelitz/petra-pau-laesst-sich-von-den-taenzern-ueberzeugen-0425383910.html… http: //www.deutsche-tanzkompanie. com / #Neustrelitz #GottloseType
#GottloseType is in #Stavenhagen today &amp; looks forward to the concert in the synagogue &amp; the reading from 7:00 p.m. in the Fritz-Reuter-Museum
"I would have liked to have heard and discussed today in Dresden, now runs in #MaHe: City - Am Fenster, 1978 https://youtu.be/se-8CsPBDF8 via @YouTube # TdDE16"
Much remains to be done #peace #democracy #justice video Germany celebrates 26 years of reunification http://mediathek.rbb-online.de/wicket/bookmarkable/de.swr.avp.cae.ard.webapp.page.redirect. ShortUrlRedirectPage? DocumentId = 38091174 &amp; topRessort = tv… via @
"# DeutscheZustände2016 # TdDE2016 we should also talk about it today in the @rbbabendschau, now drive from #Dresden back to #Berlin https://twitter.com/ndaktuell/status/782943295001530368…"
"#SchanaTowa to #RoschHaschana 5777! I wish everyone a sweet and peaceful, happy and successful year 5777."
# DeutscheZustände2016 # Solidarity with @LuiseNeuhaus is announced!
#ShanaTova https://twitter.com/JuedischeOnline/status/782591014309466113…
# NSU Committee reveals: Deliberate document shredding at the Federal Office for the Protection of the Constitution | Telepolis http://www.heise.de/tp/artikel/49/49575/1.html…
"Conclusion # NSU-UA in the #Bundestag - Zschäpe speaks, the #constitutional protection is silent: faction DIE LINKE. in the Bundestag https://www.linksfraktion.de/themen/nachrichten/detail/zschaepe-prechen-der-verfassungsschutz-schweigt/?utm_source=twitterfeed&amp;utm_medium=twitter&amp;utm_campaign=@arminfischer_de…"
May I recommend my booklet to you? Simply order #GottloseType online (neues-deutschland.de) http://www.neues-deutschland.de/shop/article/1457142?pk_campaign=SocialMedia… via @ndaktuell
"Until 6 p.m. there is still a lot of fun, music, culinary delights and gifts in the Jewish community center. # Hanukkah Bazaar pic.twitter.com/jgGh0xxTvU"
Will recommend something to read again: https://www.linksfraktion.de/themen/nachrichten/detail/nur-mit-angezuzer-handbremse-ermittelt/…
We meet today at the # Hanukkah Bazaar in the Jewish Community Center on Fasanenstrasse http://www.berlin.de/events/3895927-2229501-chanukka-basar.html?pk_campaign=shariff…
@ bodoramelow Gut so!
"Too bad, I wanted to get in the mood for Advent with the community association #Mahlsdorf today &amp; then a note on the door, &quot;technical problem&quot; #MaHe https://twitter.com/Bezirksamt_MaHe/status/801082585287790592…"
"We meet from 1 p.m. on the Alt-Kaulsdorfer #Christmas market Dorf-Anger Alt-Kaulsdorf, Dorfstraße 21, 12621 Berlin #MaHe #Advent"
Simply unbearable: Video &quot;Hate wave against pastors and bishops&quot; - Panorama http://www.ardmediathek.de/goto/tv/39290530… via @ARDde # DeutscheZustände2016
"# 2016, it&#39;s enough for me, you make you sad: alone this week, 3 people I loved #PeterHintze #GiselaMay &amp; #LilliNachama #Courage"
Determined only with the handbrake applied: Fraction DIE LINKE. in the Bundestag https://www.linksfraktion.de/themen/nachrichten/detail/nur-mit-angezuzer-handbremse-ermittelt/… # NSU-UA in the #Bundestag
"Invitation to the debate at @EABBerlin and @rbbinforadio on December 6, 2016 http://www.eab-berlin.eu/wp-content/uploads/Programm-und-Einlad-2.pdf… or on December 11, 2016 to listen to #Europa #Democracy"
This case contains innumerable ??????????
"Good evening from #Mahe, was offline, was &amp; lies on # NSU files, BMI, federal states, constitutional protection want to keep everything secret, so read &amp; think"
"But it is really time, welcome! Solidary greetings, PP"
Carl Melchers: in conversation with Petra Pau over five years of parliamentary and legal clarification http://j-ref.com/fxf #NSU
I guess get older &amp; inattentive: Did @tagesschau &amp; @ZDFheute have something to complain about #data storage at the # Federal Constitutional Court?
"Yikes, someone wrote about us @RenateBergmann @RenateKuenast Internet phenomenon: Grandma Renate likes to twitter http://www.stuttgarter-nachrichten.de/inhalt.internet-phaenomen-oma-renate-zwitschert-gern.c06bfc67-1b91- 4e09-a9f4-3e83a5978f0e.html…"
Immediately we will raise the banner against #violence against women in front of the town hall. Our mayor Dagmar Pohle thanks pic.twitter.com/3Gei9NEq6e
