"Bye Baltic Sea and Warnemünde, now it&#39;s off to the weekend, with two party conferences @dielinkeberlin and LINKE McPomm http://www.originalsozial.de/fileadmin/dokumente_2013/LPT_23_24_11_2013_HGW/0.1.%20TO.pdf…"
"@hildwin @RenateBergmann To my knowledge and experience, she is simply @RenateBergmann, which is a good thing, an independent voice"
"Incidentally, I&#39;m looking forward to @cicero_online, so far only saw &quot;Pau instead of peacock&quot;, so heading ..."
#ff for @Halina_Waw @Petra_Sitte_MdB and @RenateBergmann Good night from Warnemünde! Tomorrow it will be exhausting again in Berlin. And #MaHe.
"@JohannesSingham Congratulations, Vice President!"
"@FWSchroft @phoenix_de Well, I&#39;m now speaking to the Chancellor, she shows subtle humor, that&#39;s why it&#39;s worth it, but it&#39;s good afterwards"
"@ FrankBaumann80 Well, I&#39;m now speaking to the Chancellor, she shows subtle humor, that&#39;s why it&#39;s worth it, but it&#39;s good afterwards"
"Now have fun with CSU on @phoenix_de, sometimes shaking my head ..."
"@JosefWinkler Congratulations, would love to have a cup of tea or coffee with you!"
"@halina_waw you already, wish that some MdB would at least use the time for such studies, applies to all factions .."
"@halina_waw @therealdegers z. B., let&#39;s talk tomorrow at party congress, country group is real. completely there?"
"@RainerLoveiam @EvaHoegl Please do not confuse #NSU and #NSA, both cases are not cleared up, see http://www.petrapau.de/linke/dok/down/131124_lpt_linke-mv.pdf…"
ver.di | VS - Association of German Writers - Votes against Right: Berlin http://vs.verdi.de/service/veranstaltungen/++co++e38f7584-51fc-11e3-bf07-52540059119e… #NSU
The # NSU Committee of Inquiry | bpb http://www.bpb.de/politik/extremismus/rechtsextremismus/172857/der-nsu-untersuchungsausschuss…
"@PetraPauMaHe half was of course meant, the rest must last until the weekend, no time for further frost protection measures"
Halves of the #MaHe balcony are winterproof and also the 1st half of the nibbles to be overwintered inside and out pic.twitter.com/oXm9eCvLGT
"@Schmutzbesen @linksfraktion works, wannabe #GroKo denied it, spoken about it yesterday: http://www.petrapau.de/linke/dok/down/131124_lpt_linke-mv.pdf…"
"@SteinkeCDU @Halina_Waw Oh, who is currently working on the 650 final decisions and around 7000 new petitions?"
"@Halina_Waw not only bad, also unsuspecting, look at protocols from the Herren-Chiemsee-Konvent and later on the emergence of the GG ..."
"@Petra_Sitte_MdB Do not fear, already shows the history of the post: first BK office, then Ministry of Transport, now general security, so BMI"
"@ronnypohle @facebook Are unfortunately online again, the misanthropes and keep rushing ..."
"Late, but at least: http://www.rostock-heute.de/gedenkstele-nsu-opfer-mehmet-turgut/42622… #NSU #Gedenken #Rostock"
"@MV_AM @RenateBergmann Go ahead, but have no grain in stock, you have to bring it, dear Angela .."
TiPP: http://geheimerkrieg.de/
#Pressemitteilung http://www.linksfraktion.de/pressemitteilungen/hauptausferenz-waere- Wider-demokratie/… # Bundestag parliamentary work #Demokratie
"@Ypsilonia @oPetition Then we only need one petition committee in parliament, about 1000 others are waiting # Bundestag work"
"Dieter Hildebrandt is missing, what would he have said about this mischief-main committee = parliamentary decay pool? # Bundestagmußarbeiten"
"@RenateBergmann Of course, if she rules, I would have to check her, after all experience she will talk about potato soup and roulades"
"@RenateBergmann Immediately offer asylum in #MaHe, only condition: eat sweets myself, I like it hearty when eating and drinking"
"@Halina_Waw @Petra_Sitte_MdB Art.53aGG, together. Defense Committee, GG sees poss. only for final regulated emergencies"
@ronnypohle @facebook ... site checked and found that it does not violate our community standards ....
"@ronnypohle She does that regularly, receives a Facebook standard answer, so today she has commissioned a lawyer to investigate further procedures"
"Wish everyone involved good nerves and success today, have a sufficiently bad conscience because the Vice MdB office move is not there"
"@MedientanteMT Really nice, with all grief ..."
@Petra_Sitte_MdB parliamentary decay pool # Bundestag work
Thanks Eugen Herman-Friede: http://www.das-parlament.de/2013/47/Kehrseite/47839557.html…
@peer_juergens Mazal Tov! I&#39;m unfortunately prevented ...
"@Halina_Waw This is supposed to be the parliamentary collection and decay pool, right: hands off the main committee! # Bundestagmußarbeiten"
@Halina_Waw Exactly! # Bundestagmußarbeiten
"In office hours #MaHe u elsewhere, on the street, annoyed citizens ask when answer to petition, pension adjustment http://www.tagesspiegel.de/meinung/lammert-und-gysi-mahner-vom-dienst/9093986.html…"
Perpetration of perjury: A federal government that lets all kinds of secret services switch and act reveals # civil rights and # democracy.
Coalition negotiations paralyze Parliament - In a coma - Politics - Süddeutsche.de http://www.sueddeutsche.de/politik/bundestag-lammert-und-gysi-kritisieren-stillstand-im-parlament-1.1820146… via @SZ # Bundestag parliamentary work
THE LEFT. Marzahn-Hellersdorf http://ustre.am/JagC #MaHe #Livestream
"Good morning from #MaHe, today we are discussing the consequences from # btw13 at the @dielinkemarhell Annual General Meeting and are electing the new board"
"@gegisa @Volker_Beck and I could start a joint initiative, an orientation calendar, so that nobody comes too early or too late"
@TeamPetraPau Recommend http://www.pferdchen-naseweis.de/
"@Volker_Beck They made a mistake, was just shopping in #Mahe, also irritated, probably there will be on December 24th. buying colorful easter eggs"
"I&#39;m in my thoughts now at @Linke_Thl @die_linke_th Thank you dear Luc Jochimsen and don&#39;t leave us alone! We need culture, culture, culture ..."
"Today I stay all day in #MaHe: advising projects in the constituency office, post office and then nationwide #reading day in the daycare center Acacia Island"
"The Interview: Petra Pau, DIE LINKE: http://youtu.be/mCOrxpWomm0 via @youtube Long ago, still applies today, before loss of voice and gain in vote"
"@Bezirksamt_MaHe Very good, all the best! #MaHe"
"#Venceremos Victor Jara: http://youtu.be/uGazscDbUkI via @youtube I needed that today, maybe some followers too? Sleep well!"
"@Konstanze_MaHe @peltheas Exactly, let&#39;s talk analogously, that&#39;s not possible! #MaHe"
@ merte01 We will win !!!
"@peltheas please? Hopefully this is not true, I was already dealing with this topic in BVV in 1991 ..."
@tagesspiegel_de Simply unworthy! What does the &quot;frozen&quot; federal government actually say? EU is also committed to human rights!
@Petra_Sitte_MdB I think so too! # Bundestagmußarbeiten
"@PjotrPetka Well this will not succeed, nope. Monday special session, we will also propose committee appointments # Bundestag footwork"
@ Icke12619 @ dynamo1955 Certainly. I was just looking for advice on which model comes close to the qualities that have grown dear to the old ...
"Good morning from #MaHe, start the working week with moving into the new Bundestag office, fear Postberg has also moved"
"@ FrankBaumann80 Sure, e.g. Z. It does laptop, recommend http://www.petrapau.de/linke/dok/down/131124_lpt_linke-mv.pdf…"
"Lookup, my speech today at #LINKE MV: http://www.petrapau.de/linke/dok/down/131124_lpt_linke-mv.pdf… #Demokratie #NSU #NSA"
"@RenateBergmann Thank you, that&#39;s a tip, but how do I get my parents closer to playing golf?"
Great - finally a class position - weapons expert: no suicides - # NSU story continues to crumble http://rotefahne.eu/2013/11/waffenexperte-keine-selbstmorde-nsu-story-broeckelt-weiter/…
@smegworx @CaeVye That&#39;s right! It remains # Bundestag footwork
"Better not comment today in the #Bundestag, I would have to complain about non-parliamentary expression, but retweet what is applicable"
I&#39;m back in Berlin and I&#39;m listening to my working group leader Jan Korte at @rbbinforadio on # NSA-Debate today # bundestag work
"Now make me on the way to Berlin, special session of the Bundestag @Linksfraktion requests the establishment of the committees # Bundestag work"
"@jrg_bergmann nee # Warnemünde, tomorrow first again #Bundestag"
"Oh, did I miss something? Aren&#39;t we voting yes, no or abstention in the Bundestag? @ARD_BaB #Volksentscheid #Kauder"
"@ARD_BaB Then take a look, there is also the #Ostsee"
Time out #Weekend #Ostsee pic.twitter.com/D09MJD90sJ
@Hotel_NEPTUN I have to take a look at it #Weekend #Ostsee
"@joergimd Sure, this air already ..."
"I&#39;m offline for a while, have a nice weekend, everyone! #Baltic Sea"
"@die_linke_bw The CDU u LINKE have already requested this in the Bundestag investigation committee #NSU, which also applies to Hesse, Brandenburg, Bln."
"Column: The Stavenhagen Synagogue | Opinion - Berliner Zeitung http://www.berliner-zeitung.de/meinung/kolumne-die-synagoge-von-stavenhagen,10808020,24989296.html… via @BLZonline"
What is a Schroth cure and how does the naturopathic treatment work ?: http://youtu.be/NK3AgKkx8Rk via @youtube
"I&#39;m also at @ARDde, but the best @T_Entertain preserve, saves me from disappointments"
Forum democracy: http://www.phoenix.de/content/phoenix/die_sendung/diskussionen/771552…
"Great, I&#39;m already looking forward to the Allgäu 2014, without the Olympics, with peace, Schrothkur and nature, greetings from #MaHe"
"@Halina_Waw All the best, my challenges today are a little less demanding, harvesting balconies and plants, making furniture winter-proof"
"@ FredWeston2 @PolitwoopsDE @MedientanteMT Dear Fred, thank you, I understood it that way, politwoopsd = digital bullying and stalking"
"@ FredWeston2 @PolitwoopsDE @MedientanteMT politwoopsde = I have long felt like digital bullying and stalking, so relax"
"@Dande_Lisbeth @Leftfraktion can not be put to sleep, good exam today, Monday wide awake opposition and proposals # Bundestag work"
@ FredWeston2 @PolitwoopsDE @MedientanteMT me too and now I&#39;m being stalked by @PolitwoopsDE
"@ Karlo43 because # NSU-UA promised this survivor d Keupstr., The survivors of the 8 murder victims with Turkish or Kurdish roots"
#Press release to promote social initiatives for # democracy and against # right-wing extremism http://www.linksfraktion.de/pressemitteilungen/gesellschaftliche-initektiven-verlaesslich-foerdern/… #NSU
"New form of commemoration stimulated today, and sometimes disturbed http://www.youtube.com/watch?v=PPznfiB5OJ0…, thanks to Vivian Kanner pic.twitter.com/FpJyPMpq57"
"@braunejauche @Leftfraktion so, well, then we&#39;ll meet again there @Halina_Waw, me and other #LINKE are honorary members"
Thoughtful after the event at the #Reichspogromnacht back in #MaHe
The evaluations of the # NSU investigation committee of the 17th Bundestag are now also available in Turkish.
"Commemoration and reflection on the Poromnacht of November 9, 1938 http://www.jg-berlin.org/kalender/details/75-jahrestag-der-pogrome-vom-november-1938-i5238d-2013-11-09-18- 30.html… 75 years ago"
@SabineLeidig @Leftfraktion exactly # Bundestag footwork
@linksfraktion is now in retreat and I mostly offline # bundestag work
"Good morning from #MaHe! Today it goes to @TheaterParkaue in #Lichtenberg for the Brothers Grimm Award Ceremony, I&#39;m curious."
I do not think that any Union and SPD have chosen to put the Bundestag into deep sleep # bundestag work
"Now leave once again from #MaHe, to the Forum Democracy: November 9th - Destiny Day of the Germans | bpb http://www.bpb.de/veranstaltungen/format/172118/forum-demokratie-9-11-schicksalstag-der-deutschen…"
"Message today to the KV, the Berlin Senate, etc.: Doctors and sickmen were not invented to pay off. pic.twitter.com/dssDVdElV2"
#Press release on the study by the European Union Agency for Fundamental Rights (FRA) on #Antisemitism in the EU http://www.linksfraktion.de/pressemitteilungen/antisemitismus-alarmierend-auch-deutschland/…
"@Petra_Sitte_MdB Well, @Leftfraktion will work anyway, that is well prepared by you # Bundestag work"
http://fra.europa.eu/de/event/2013/fra-prsentiert-ihre-erlassung-zu-erfahrungen-und-wahrnahme-jdischer-brger-bez-auf… FRA presents a survey on experiences and perceptions of Jewish citizens hate crimes Discrimination #Antisemitism
"Forum Democracy: November 9th - Destiny Day of the Germans | bpb http://www.bpb.de/172118 11/9/1938 remains unique, more tomorrow ..."
"@Volker_Beck @stefangmoll @Oklara is currently a major blockade for negotiation, it could also be called refusal to work # Bundestag work"
"@tirsales yes, we should also talk about professional bans, among other things, but today # Bundestag footwork applies, also work up something ..."
"@celfridge Thank you, was there once, 1992-1995 in Hdorf, respect for work, but nothing for BT 2013 # Bundestag work now!"
"Oh dear comrades from SPD and GroKo, you remembered Willy Brandt: Dare more democracy! # Bundestagmußarbeiten"
"@Petra_Sitte_MdB Please help times, I have been in the Bundestag since 1998, what is a main committee there, I only know something like this as a municipal collecting basin"
"@Energisch_ BT can / must work, committees provided for in the GG should begin, at the same time change minority law / PUAG before investigations"
@HolgerLuedtke Congratulations!
"Start of the constituency day in #MaHe, first many discussions, including refugee policy, local politics, later also a consultation hour"
"@Nirthak As I have constituency day today, please in the constituency office #MaHe, 13.00 to 13.45 and 15.00 to 18.00 will be there safely."
@Nirthak make calls tomorrow?
"It will be the end of the day in #MaHe, tomorrow again with pleasure #NSU #NSA and above all #electorate"
"So desk emptied, quickly back to #MaHe in the Peter Weiss library and to Mittendrin e. V., later to @dielinkemarhell"
News http://www.petrapau.de/aktuell/news.htm… via @PetraPauMaHe
11/05/2013: #Saxony makes a mistake (neues-deutschland.de) http://www.neues-deutschland.de/artikel/838022.sachsen-macht-einen-fehler.html… #NSU # Prevention #Right-wing extremism #Rassism
"@celfridge na I thought it was appropriate, apart from the fact that my wheelchair was also more practical than a costume"
"back in #MaHe, now podium debate on the future of housing and housing in the # electoral district"
"The weather is creepy, start from #MaHe in the Bundestag, there are #NSU #NSA and the future of the medical center"
After commenting on #vattenfail http://www.linksfraktion.de/im-wortlaut/knapp-gescheitert-diesmal/… now #harrypotter
Comment on the Berlin #Volksentscheid http://www.linksfraktion.de/im-wortlaut/knapp-gescheitert-diesmal/… # vattenfail311 #energietisch
"@HollsteinM @Tatort will have a lot of time in the next few weeks @Tatort has to win me back first, too much freaking and hectic ..."
 http://www.linksfraktion.de/interview-der-woche/politisch-klar-praesidial-neutral/ …
@MedientanteMT @TeamPetraPau slow ...
17 Yerushalajim shel zahav by amichai via #soundcloud  http://soundcloud.com/amichai/17-yerushalajim-shel-zahav?utm_source=soundcloud&utm_campaign=share&utm_medium=twitter&utm_content= http://soundcloud.com/amichai/17-yerushalajim-shel-zahav …
@Berlin_de_News mhh
"From a great concert in memory of Kurt Schwaen back in #MaHe, after harvesting hot and sour fruits on the balcony, I read Allgäu thrillers"
"@RenateBergmann Nö, only in the @tagesschau"
"@RenateBergmann How many drawers do you have? After 11:00 you should treat yourself to some rest, I will try this after # NSA stress too .."
"@djsde Thank you too, it was fun, now I have to go to the AG Linkspolik of the @linksfraktion #NSA"
"After a lot of internal parliamentary meetings, I&#39;m now looking forward to talking to journalist students from Munich #Bundestag"
Another answer from the federal government: http://www.petrapau.de/17_bundestag/dok/down/2013_zf-rechtsextreme-straftaten.pdf… #Rechtsextremismus #Straftaten #September
Reply of the frozen federal government: http://www.petrapau.de/17_bundestag/dok/down/2013_zf_antisemitische_straftaten.pdf… #Antisemitismus #Straftaten
"@pscljnsn Senate invited Berlin MdB to an information meeting. Among other things, it was about the budget situation, also because of lawsuits against financial equalization ..."
"@PetraPauMaHe That was the regular meeting of the state government with Berlin MdB of all parties, it is about acting together in the BT."
What happened? No Berlin MdB from the Greens in the Red City Hall when advising Berlin MPs with a financial senator
11/12/2013: The sole goer (neue-deutschland.de) http://www.neues-deutschland.de/artikel/914558.der-alleingeher.html…
The federal government replied again: http://www.linksfraktion.de/pressemitteilungen/ablamente/nicht-nsa-sondern-bnd/… #NSA #BND
#Pressemitteilung http://www.linksfraktion.de/pressemitteilungen/ueberfaelliger-stufen-demokratieschatten/…
"@suseclown rather before and with consequences if possible, I&#39;m not only very upset, relatives of the victims are rightly disappointed and impatient ..."
"@ Artus123Merlin @BenjaminHoff ??? I don&#39;t understand that right now, unless @ Artus123Merlin wishes to be blocked ..."
German mothers and activists http://wp.me/ppfm-gEx via @dokmz #MaHe #Nazis #Rechtsextremismus
@schluesselburg @Team_GLoetzsch please communicate with Jan Korte ...
@suseclown @annalist @TeamPetraPau Recommend story about #Piatto http://www.petrapau.de/17_bundestag/dok/130414_im-wortlaut.htm… #NSU
"@annalist @TeamPetraPau That&#39;s why I&#39;ve been asking for over a year why there are no # NSU-UA in BaWü, Hessen, McPomm, Brandenburg, Berlin, HH ..."
"Session marathon at @Linksfraktion ended for today, quickly back to #MaHe"
@blz_thomsen That already amazed at breakfast today and motivated Vattenfall to pull the plug. # vattenfail311 #Berlin
#Press release on #NSA #BND # secret services # federal government http://www.linksfraktion.de/pressemitteilungen/deutsche-dienste-teil-taeter-clique/…
"@Oberharzermaik A warm good morning back and thanks for your wishes, Kurt Schwaen has lived and composed here in the # electoral district #MaHe"
"I am now looking forward to music by Kurt Schwaen #Concert in VISTEL&#39;S CelloMusikSalon, Leipziger Str. 61, 10117 Berlin http://www.kurtschwaen.de/schwaen/"
"Good morning from #MaHe, then go across the street and pull Vattenfall out of the #Volksentscheid #vattenfail"
"Great @spdberlin, after a report in rbb evening show about your decision, my relatives also decided: Yes! to # vattenfail311"
"Great # @ spdberlin, after a report in the rbb evening show about your decision, my relatives also decided: Yes! to # vattenfail311"
@Katina_Schubert http://www.linksfraktion.de/pressemitteilungen/initiativen-gegen-rechtsextremismus-verlaesslich-foerdern/?rss ...
#Press release on # coalition negotiations # NSU # prevention http://www.linksfraktion.de/pressemitteilungen/initektiven- Gegen-rechtsextremismus-verlaesslich-foerdern/…
"@TeamPetraPau nice and full here, good that not only club members are there, have just learned something new about Biesdorf Castle #MaHe"
"Start now in #MaHe: first plant trees in the Marzahn wedding park, then to the home club http://www.heimatverein-marzahn.de/termine/021113tagderregionalundheimatgeschichte.html…"
Delete @akubiz @AmadeuAntonio without replacement
Can someone turn off the rain in #MaHe? 11.00 Planting trees in the Marzahn wedding park
Why is that no longer surprising to me? http://www.ndr.de/regional/niedersachsen/innenausschuss109.html… Abolish #constitutional protection as a #Secret service http://www.linksfraktion.de/abteilunge/petra-pau/downloads/…
"In Saxony, # prevention and # victim counseling is at risk - the Union and the SPD want to implement recommendations on the #NSU case - http://www.tagesspiegel.de/politik/koalitionsverhandlungen-union-und-spd-wollen-empfätze-zum-fall-nsu - implement / 9017220.html…"
@AmadeuAntonio Then you should start asking Saxony to continue funding the cultural office and victim counseling from the RAA
"@wittglobal Who from the LEFT did you contact? Can assess this from a distance, so need more detailed information."
@jrg_bergmann satisfied tenant
"@Petra_Sitte_MdB I&#39;m still excited and irritated, according to my party, I should condemn society, but I&#39;m just delighted #MaHe"
"@gaejawen @ArneFellner not only read, it&#39;s my turn, nothing for Twitter &quot;real life&quot;"
"I&#39;m very enthusiastic about #MaHe: 10 minutes ago call the caretaker, 5 minutes ago the doorbell rang, the heating has been working again for 1 minute"
"@ dynamo1955 sorry, just had a CDU colleague on the ear"
"@MaHe_hilft nice report at @morgenmagazin, congratulations!"
"@Petra_Sitte_MdB Well then all the best, make me on the way in #MaHe."
@morgenmagazin @ZDF Oh yeah! http://linksfraktion.de/im-wortlaut/wer-nicht-souveraen-ist-kann-kein-souveraen-2013-10-28/…
@ wikinews030 take care of me and then report back
Today at @DLF http://www.dradio.de/dlf/sendung/interview_dlf/2301621/… to #nsa #merkelphone @Linksfraktion
@ wikinews030 What can or should I do? # Cold Telephone
"@ FrankBaumann80 Thank you very much! Was really moving while reading, there is not that often in everyday life and it goes on cheerfully ..."
Just reading &quot;Parliament&quot; pleased: http://www.das-parlament.de/2013/44/Themenausgabe/47597517.html… #Demokratie #Bundestag #LINKE # NSU-UA # Vice-President
"#NSA #merkelphone mess again the whole day, just spoke to @ZDF is calling @DLF and later @zeitonline"
"Column: Just a click away from the dirt | Opinion - Berliner Zeitung http://www.berliner-zeitung.de/meinung/kolumne-nur-einen-klick-vom-dreck-entfernt,10808020,24799944.html… via @BLZonline"
"Good morning from # MaHe, week starts with an hour delay, tempting program: post, conversation with GdP, data security in BT, clean up .."
News http://www.petrapau.de/aktuell/news.htm… via @PetraPauMaHe
"@ClZMueller @Linksfraktion Exactly, that&#39;s why the constitutional court already pointed out the danger for everyone back then."
Mazal Tov for the Jewish Student Center in Berlin Mitte pic.twitter.com/wlUHxZiTSb
Current about #merkelphone #NSA #Demokratie #Bundestag #LINKE #Datenschutz #Secret service at @linksfraktion http://www.linksfraktion.de/im-wortlaut/wer-nicht-souveraen-ist-kann-kein-souveraen-2013-10 -28 / ...
@braunejauche @Leftfraktion ???
I am now looking forward to Micha Brumlik&#39;s lecture and drive out of #MaHe to the opening of the Jewish Student Center in #Berlin Mitte
"I support the open letter to the administration and politics of the city of Cologne, because the concern is still current: http://museumsbaukoeln.de/unterschrift/"
Austrians steal a piece of Zugspitze - Bavaria - Süddeutsche.de http://www.sueddeutsche.de/bayern/satire-angriff-auf-die-zugspitze-das-ist-ja-der-gipfel-1.1804225… via @SZ Has BMI Already entrusted to BKA with investigations?
"@Halina_Waw good morning from #MaHe, with me no mirror loading problems"
News http://www.petrapau.de/aktuell/news.htm… via @PetraPauMaHe
"@Halina_Waw determined, stay with Donna Leon anyway .."
What follows from the # NSU debacle: http://www.linksfraktion.de/termine/schlussschlussungen-nsu-untersuchungsausschuss/… #LINKE #SPD #Verfassungsschutz #Bundestag #Untersuchungsausschuss #Rechtsextremismus
"@friedhainerin yes, was very moved during prayers / recitations, could empathize with how the older women suddenly felt they belonged"
"@ dynamo1955 of course, but to the annoyance of the accompanying interns I had to go after prayers and speeches and at the opening of the buffet #MaHe"
"@maxstadler miss you very much these days, nobody cares about your orphaned address? # Civil rights #Democracy are cheated"
"Salam aleikum for the festival of sacrifice in the house Babylon #MaHe, beautiful, despite Nazi demos women and children from the home are there pic.twitter.com/5cfMhoKKrs"
"@manuelbewarder Sometimes I wonder whoever is wondering, assumed that not only because of #Verfassungsschutz http://www.petrapau.de/person/lesbar/131009_an_vs-ramelow.htm…"
"@MGrosseBroemer For me, more crime thrillers and glasses of red wine, tomorrow morning Presidium, thanks for today&#39;s wishes, hope for good cooperation. #Bundestag"
"@MdB_Stroebele just think of 2005/6 u your faction http://www.petrapau.de/aktuell/down/060406_presse_vizekandidatur.pdf… until today no excuse, so let&#39;s down a gear"
"Invitation: http://www.die-linke-berlin.de/nc/politik/termine/detail/?tx_ttnews[tt_news[=35796… experiences, insights and conclusions from the debates of the # NSU committee of inquiry"
@TeamPetraPau Thank you for working together on it and now on ...
"@MdB_Stroebele There was a clear appointment for the time being - in addition, the vote also included a Stasi check, for example, like reaction to no"
"Back in #MaHe after # btkonst13, thanks for all good wishes, go to work as usual, I promise!"
"@hildwin Thank you, good cooperation ..."
"@Linksfraktion Dear ones, at http://www.linksfraktion.de there is the LINK on the start page which misleads http://www.linksfraktion.de/interview-der-woche/politisch-klar-praesidial-neutral/…"
"@Konstanze_MaHe Yes, I also noticed that I reached the church at the last minute and now also the Bundestag."
"@andyneumannbdk yes, from 11.00, thanks for the wishes"
"This is sabotage at the beginning of the legislature, 60 minutes for 5km, I am still in #MaHe and still wanted to go to church with my colleagues"
"Good morning, wish everyone a successful day, start from #MaHe towards Mitte, first to church, then to #Bundestag"
"Oh Lothar, what would you have advised: Remember L. Bisky: &quot;As if this world wasn&#39;t yours at all&quot; http://spon.de/ad15D via @SPIEGELONLINE"
