"Reduction dictates of the ECB does not only whole countries are broken, but also its own employees: 5% suicidal. http://t.co/i9KfV9s7ij"
Merkel's willingness to compromise dishonest: Federal Government blocked repayment of 1.2 billion euros to #griechenland. http://t.co/3nrrWJUHiF
My answer to Angela #Merkel in today's parliamentary debate on the European Council: https://t.co/BFcZNoW2Jx #Griechenland #Ukraine #EU
My yesterday's speech at the rally Blockupy on the Romans in Frankfurt is now available as a video. https://t.co/zRQCS05dUU via @YouTube
# Blockupy Alliance is civil disobedience without violence. We will not spoil the peaceful protest against the EU Totsparpolitik
"Legal, illegal, # ECB: Celebrating behind bars police from the public shows arrogance + Democracy distance. http://t.co/OiZzOwg8FG"
#Draghi godfather of the Troika mafia. Lex Athens (without fulfillment of the reduction dictation no purchase Greek. Bonds) is illegal. http://t.co/CWE3eaYOfs
Bond purchases of #EZB as wealth tax act for the middle class and are a billion gift to the rich. http://t.co/rSubdkH0rY
I addressed today a letter to the deputies of the Left faction. http://t.co/99o6aRnqpu
SPD Steinbrück makes it apparent to everyone. This time the consulting fee comes from the Ukrainian oligarchs. http://t.co/WbPk0UTOoF #Ukraine
Schaeuble's wrong Spendierhose: More money for tanks and war rather than for investment in education and climate protection. http://t.co/ieOWU0pwCc
No agreement to Greece failed policy. My press release on the vote in the Bundestag: http://t.co/UJgl4wxCoh
Federal government needs from sending soldiers of the NATO-# country UK dissociate into #Ukraine. http://t.co/MyuzEtoIBq
Merkel are crazy backups: Transaction blockade destroyed Europe & billion of taxpayers http://t.co/B0eOUZYPm9 #Griechenland
"Merkel, Hollande and Putin are right: Minsk II alternative. will have to continue working on implementation. http://t.co/j3kq6SBDgK #Ukraine"
Troika mafia: Illegal extortion of Athens by ECB & Schäuble gambled with intransigence even more tax money http://t.co/SM0m2iqDin
On Sunday all the votes for the Left: A good result in Hamburg is a clear signal to those in power in Berlin and Brussels!
Schizophrenia: Why Merkel decided directly by appointment from Minsk in Brussels entry into force of new sanctions? http://t.co/LJgiKz9duD
Unlawful actions of #EZB stop: the blackmail of the Greek government is not covered by EU law. http://t.co/OvPPQNuE9E
stop war escalation in Europe now! Federal government must of US arms sales to Kiev distance. http://t.co/4dVfsi1YHb
Overturning is his trademark: Minister #Gabriel met CDU wishes and announces softening of the #Mindestlohns. http://t.co/0f95hShqfy
War madness: EU funded with billions loans bounties for the Ukrainian militia. http://t.co/8aCiE6k5zI #Ukraine
"Cool Rap to my comments on drone attacks and terrorism. Well explained, it is what! Thank Blumio. https://t.co/4Cq3HWXu1c"
"Congratulate Greece! Alexis Tsipras: ""The vicious circle of austerity is over!"" http://t.co/RaZN1LfJvs"
Draghi's grotesque fight deflation: two billion per day for financial markets rather than for dängende future investments. http://t.co/3wa0XZ0H4K
Wrong partner for real #Mindestlohn: Merkel wants to completely erode by less controls holey regulations http://t.co/ofBCTenT9Y
Swiss central bank surrenders to Merkel's ruinous euro crisis policy. http://t.co/Vjav56wRJK #eurokrise #Merkel
"Gorbachev's warning correct: ""damn stupid and extremely dangerous"" Ukraine-Western policy increases the danger of war in Europe http://t.co/y9jssxRc6Q"
Yatsenyuk had liberation from fascism by Soviet Army liked (Min.21: 35-21: 58) prevented https://t.co/ybdje9lkT5 #Ukraine
"""Grexit"" -Gerede is blackmail to SYRIZA victory to verhindern.Merkel & Gabriel want http://t.co/wQLbLR1dqb no end to the reduction dictation"
