&quot;Spotters&quot;? Is that the colleague at the neighboring desk with his gossip or when the journalist looks in the mirror in the morning? https://twitter.com/tagesspiegel/status/814381504377815040…
"Again: what is kept secret is the scandal, search terms from the NSA that should never have entered the BND database. #nsaua"
"At the request of the opposition, #BfV, #BSI and BT-IT will come to @wikileaks in consultation session #NSAUA on origin."
Expert E. King describes ring exchange of GB-USA data in 2007. Safeguards for FiveEyes citizens are bypassed. #NSAUA
the witness will definitely come in January.
Small program change in #NSAUA today: Ex-President Schindler has been unloaded. Reason: consultation session will take longer + 5 votes
That is why the domestic politicians of the Left Party voted against the bill yesterday at the InnA. #BarchG
1/2 Name the problem by name. Racism and neo-Nazism are attitudes and actions. #kaltland #nsu #noafd
For me the economy of the word &quot;hate&quot; reveals an analytical vagueness. It&#39;s not about emotions 1/1
Our solidarity with the imprisoned # HDP colleagues and all persecuted critical opponents in # Turkey @togrularya pic.twitter.com/EK19PsHCPz
"&quot;For Zschäpe, the death of her beloved grandma falls in an already difficult time.&quot; Article stunned me. #NSU http://www.sueddeutsche.de/politik/nsu-prozess-beate-zschaepe-verliert-ihre-oma-und-damit-ihre-einzige-vertraute-1.3292430…"
The #NSAUA starts on Thursday at 9 a.m. with further hearing experts 🇬🇧 and then the well-known witnesses Pauland and Schindler pic.twitter.com/3s9R9Pddmo
Secret services have lost nothing in the asylum procedure. Federal government has learned nothing from criticism of HBW. #NSAUA https://netzpolitik.org/2016/internes-papier-des-innenministeriums-verfassungsschutz-darf-direkt-an-asylanhoerungen-teilnahm/…
sent as DM. It was just too much text.
"Incidentally, as far as the plausibility of the time is concerned: not all MPs and their offices that once had access still have it."
There are umpteen arguments that speak against the conjecture @FAZ_Politik. &quot;BT security officer&quot; did not speak to #NSAUA. http://m.faz.net/aktuell/politik/Finland/wikileaks-sicherheitskreise-geheimakten-des-bundestags-von-russland-gehackt-14568558.html…
"Secret services remain true to themselves. They infiltrate, control, cover and protect the right scene. Switch off state enemies of democracy! https://twitter.com/msulzbacher/status/807513066502062080…"
Who agrees with the #AfD in the Thuringian state parliament? #Facts check instead of demagogy! Right with right and left with left. Very easily
"Perpetrators murdered for right-wing / racist motives, weapons came from a racist. Investigations due to aid necessary."
"Oh! Bavaria of the Oktoberfest assassination, of 5 # NSU murders, the massacre with 9 deaths on July 22nd. or the police murder by &quot;Reichsbürger&quot;? https://twitter.com/arminlaschet/status/814111799280803841…"
Does anyone here actually believe that the NSA no longer has a common cause with the BND because a parliament is doing a job? #nsaua
It continues to burn in #kaltland https://twitter.com/mdr_san/status/812566397716926464…
"The Christmas peace must wait. #kaltland http://www.ndr.de/nachrichten/hamburg/Feuer-in-Bergedorfer-Fluechtlingsunterkunft-ausgebrochen,feuer3290.html…"
Islamist on duty chats with Islamist for the service via attack plans for the service. Strange number right? http://m.spiegel.de/politik/deutschland/a-1123676.html…
Interior Minister announces: Nobody intends to set up a censorship agency. Anything else would worry them too much. #fakenews https://twitter.com/golem/status/812248432526131204…
"There is transparency at the BND after 60 years on the doorbell, but not towards the parliament. Ex. from Eikonal to Warpdrive. #NSAUA"
Ceremonial act 60 years #BND: keynote speaker Prof. Neitzel: &quot;60 years BND are a good moment to step down.&quot; Laughter in the audience. Until one leaves!
Ceremony 60 years #BND. Merkel says #NSAUA and public discussion are important. After all. What does that mean for the implementation of the BGH decision?
This week Thursday in #NSAUA wiretapping and practice in 🇬🇧 and then selectors up and down with BND luxury vice Guido Müller pic.twitter.com/KbNLWEwU2X
#VS watched / helped. Unsuitable to withdraw weapons from neo-Nazis. Deficit in control / enforcement of the WaffenG http://m.tagesspiegel.de/politik/waffenrecht-maas-will-reichsbuergern-zugang-zu-waffen-erschweren/14901966.html?utm_referrer= https% 3A% 2F% 2Fwww.google. % 2F…
"GroKo can disagree 10 times, but must nevertheless act within the meaning of the BGH decision. #State, #power sharing"
a.) GroKo has to agree according to the BGH b.) Complaint (not filed) would not have a suspensive effect c.) If not = violation of the law
"Illegally &amp; arbitrarily, GroKo submits the request for questioning witnesses @snowden from TO. BGH had asked for an immediate vote. #nsaua"
"Look here: http://mobil.fr-online.de/cms/politik/verfassungsschutz-verstrickt-mit-ober-neonazi-michael-kuehn,4232484,34957344,view,asFitMl.html…"
All secret services operate information operations. Parliaments and the press / media should speak openly about it and protect themselves. #NSAUA
"If nothing helps, Ivan the Terrible comes around the corner. Obviously, before the next #NSAUA is reached deep into the moth box. https://twitter.com/spiegelonline/status/801320380153655296…"
This arrogance is simply unbearable. #NSAUA pic.twitter.com/EblcBnyqWm
How grotesque! Bend to the secret services for 2.5 years and then talk about the freedom of the MPs to the BGH decision: http://www.allgemeine-nachrichten.de/politik/sensburg-will-beschwerde- Gegen-snowden-urteil-des-bgh- 101196 /? Utm_source = dlvr.it &amp; utm_medium = twitter…
Neo-Nazis buy another house in the district of Gotha (Thuringia). Buyers belong to the militant right rock scene. http://www.martinarenner.de/index.php?id=38366&amp;no_cache=1&amp;tx_ttnews%5BbackPid%5D=34837&amp;tx_ttnews%5Btt_news%5D=69468&amp;cHash=5986d725a114cbab71f315c8e8103271…
"As early as 2014, the neo-Nazi assassin Ausonius had connections to Germany and a role model for #NSU topic: http://www.neues-deutschland.de/m/artikel/1032893.neonazi-laser-man-vor-ausgabe.html…"
Who talked to the #AfD in Thuringia? http://m.spiegel.de/politik/deutschland/a-1006988.html… refrain from this # Linke = # AfD bullshit.
Pegida bomber from Dresden and what he likes on FB. The &quot;AfD filter bubble&quot; looks like this: #kaltland #noafd #nopegida pic.twitter.com/KtullVNYPO
"&quot;We are not only Nazis, we also go on vacation.&quot; Right-wing terror developed from the normality of right-wing sentiments. http://www.rbb-online.de/politik/beitrag/2016/12/brandenburg-prozess-nauen-angeklagter-einschuechtert.html…"
Tomorrow for process monitoring in Potsdam. Right-wing terror in Nauen is not an isolated case. #kaltland @Aktionsnetzwerk https://www.google.de/amp/www.rbb-online.de/politik/thema/fluechtlinge/brandenburg/2016/11/process-um-brandanschlag-nauen-befangenheitsantrag- continuation- decision- adjourned.htm / alt% 3Damp.html…
"Incidentally, the funniest thing is when secret services warn of disinformation campaigns by other secret services. #NSAUA"
And for the @g_rantelhuber and the @c_vassili https://twitter.com/fozzybear77/status/805459214202245120…
"Hne Without the protection of the constitution you would only be three, without the police it would only be two. http://www.zeit.de/politik/deutschland/2016-12/sachsen-freital-terror-polizei-leck-ermittlung…"
Persecution by Turkish secret service in Germany: expelling the agents and stopping the cooperation would be https://www.tagesschau.de/inland/tuerkischer-geheimdienst-101.html…
"Regarding the @wikileaks publications from the #NSAUA, I mean: https://www.linksfraktion.de/themen/nachrichten/detail/koalition-empoert-sich-im-interesse-der-geheimdienste/…"
"&quot;Great responsibility grows out of great power&quot;, Spiderman would say to @wikileaks: #NSAUA https://netzpolitik.org/2016/nach-wikileaks-veroeffständigungen-sensburg-forder-konsequenzen-fuer-ausschussarbeit/…"
I also have one.
Disarming racists / neo-Nazis is the responsibility of the authorities. Society must oppose right-wing ideas of self-justice / self-defense https://twitter.com/matthiasmeisner/status/804331474744934400…
"Now the brotherhood is proclaimed here in the spirit of the haystack theory. But it&#39;s not about straw, it&#39;s about our data #NSAUA"
"The federal government is afraid of a testimony @Snowden and for this reason alone, the GroKo in #NSAUA had to disregard the BGH decision today."
"Legendary branches of the BND have been exposed, but operations with the NSA (two cable taps) remain secret."
Why am I not surprised? #noafd http://www.neues-deutschland.de/m/artikel/1032176.wohnung-von-afd-stadtratskandidaten-durchsucht.html…
comes as mail.
&quot;The ice age has apparently started for fundamental rights.&quot; #NSAUA #selectors
Intelligence cooperation must not undermine parliamentary control: http://www.golem.de/news/gescheiterte-selektorenklage-gericht-will-geheimdienstkooperation-statt- Control-1611-124468.html… #nsaua #selectors
Who actually bagged this BND-NSA cooperation past Parliament at the time? https://web.archive.org/web/20130810030820/ http://www.tagesschau.de/inland/bndnsa100.html… #nsaua #selectors
Cooperation between the BND and other intelligence services must not undermine parliamentary information and control rights. #nsaua #selectors
We stick to it: Democracy is more important than the interests of the secret services. #nsaua #selectors
"Given the choice of #Trump, it is fatal to leave the secret services with the privacy in Europe. #nsaua #selectors"
Federal Constitutional Court decision #BVerG on NSA selectors comes tomorrow morning. We are excited. #NSAUA @Leftfraktion @GrueneFraktionB
Even after #NSU. The extent to which right / racist homicide is perpetrated is only partially recognized by the authorities: http://m.spiegel.de/politik/deutschland/a-1120081.html#spRedirectedFrom=www&amp;referrrer=…
because the car owner is a man?
"Racism is the morning air of right wing terror. There they are all again! KKK in the USA, Combat18 in Europe. http://www.latimes.com/nation/politics/trailguide/la-na-updates-trail-guide-kkk-trump-north-carolina-1478822255-htmlstory.html…"
"Talk of the overpowering left-liberal mainstream, against which the brave rebel, is staged from JF to AfD."
Is #VS just a knower or even an accomplice? Was source protection again about victim protection? Case for justice and politics. http://www.mdr.de/sachsen/dresden/kontaktmann-verfassungsschutz-freital-100.html…
"The leadership of confidants by the police has so far been beyond parliamentary control, that has to change. http://www.spiegel.de/panorama/justiz/lka-in-muenchen-erneut-durchsuchungen-in-der-v-mann-affaere-a-1120853.html…"
Thuringian specialties for 25 years of the Antifascist Press Archive and Education Center eV @apabiz @KatharinaKoenig pic.twitter.com/Mw8beUa4QU
Together with @jan_vanaken and @CansuOezdemir we hand over a jersey #fcsp with all player signatures to @ deniznaki2 pic.twitter.com/SW1EljXXZd
"The town hall of Diyabakir, placed under forced administration pic.twitter.com/FJWdtngCtG"
"Highly secured governor&#39;s seat in Diyabakir. Armored vehicles everywhere, police officers with machine guns, roadblocks pic.twitter.com/C7KCmsh5Ry"
Countless surveillance cameras in Diyabakir. State surveillance and control of internet and mobile communications. pic.twitter.com/WqDafBzgKo
including MP @CansuOezdemir. Process begins at 11:50 am - we tweet from the court from 11:00 am.
Good morning from Diyabakir: colleague @jan_vanaken on Deutschlandradio for the trial against @ DenizNaki2 and the wave of repression in Turkey
After attacks in Saxony: charges against &quot;Gruppe Freital&quot; | tagesschau.de http://www.tagesschau.de/inland/gruppe-freital-anklage-101.html…
"In the old town Surici of Diyabakir, behind the barrier, the destroyed part begins. Over 2000 houses were razed. pic.twitter.com/i5m9rNCm0e"
On Thursday it goes up and down with the # BND selectors in #NSAUA: pic.twitter.com/d368FXMoqZ
"With @jan_vanaken &amp; @CansuOezdemir tomorrow morning at the process against Deniz Naki, then meetings with HDP members among others. http://www.daserste.de/information/politik-weltgeschehen/europamagazin/videos/tuerkei-gefaengnis-fuer-regierungskritischen-fussballer-100.html…"
#SolidarityWithHDP Stops repression against opposition and press in Turkey. Lead the fight for freedom and democracy together: pic.twitter.com/o2P9IySpSY
Our Hamburg colleague and Member of the Mayor @CansuOezdemir is also there and the greetings from #linkelpt for #SolidarityWithHDP
"Those who set fire to refugee homes do not demonstrate against those up there, but are arsonists, accepting the dead. @SusanneHennig #linkelpt"
"Current right-wing / racist wave of violence is bringing old militant right-wing terror groups like Combat18 to the scene. #NSU http://www.fr-online.de/neonazi-terror/rechter-terror-extremistisch--bewaffnet-und-gewalt willing.1477338,34912254.html…"
Will fly to #Diyabakir with @jan_vanaken on Monday and try to visit our imprisoned fellow MPs of the #HDP.
"I also think it&#39;s good that the press first spoke to LKA about possible trace contamination by Thuringian investigators, Oh wait. https://twitter.com/diana_of_t/status/792381572003561473…"
this here: https://www.compact-online.de/flussplan-compact-europakonferenz-2016/…
"Demo line says 3,500 on the street - wow! #noEfLinz"
That&#39;s a template for 5.11. Berlin: At least 2000 people in protests against ethnic strategy meeting in Linz #noEfLinz #noafd pic.twitter.com/ZqQkPwg7fU
#noEfLinz Block ethnic networking! Today in Linz and on November 5th. in Berlin: https://www.compact-online.de/flussplan-compact-europakonferenz-2016/…
Very interesting idea against the BND law: https://futurezone.at/netzpolitik/oesterreichs-gruene-wollen-bnd-gesetz-kippen/227.802.793… #nsaua
"Press spokesman Thuringian LKA and AfD board member, is that possible? I don&#39;t think so. Office and right-wing agitation incompatible. http://m.otz.de/startseite/detail/-/specific/Sprecher-des-LKA-hat-jetzt-Vorstandsposten-bei-der-AfD-1517691568…"
Please excuse me
Ku Klux Klan in Germany. Marginal but dangerous point of reference for racist organization: #NSU http://www.sueddeutsche.de/politik/organierter-rassismus-viermal-ku-klux-klan-1.3220083…
@Announce (((-;
What is important now: Compare DNA of killed Peggy with traces of WoMo and Frühlingsstr. Review of further unsolved child murders #NSU 1 /
"It will be fun, discuss with @AnnaBiselli @KonstantinNotz and @TSchipanski at the TU Ilmenau about the #nsaua https://kif.fsinf.de/wiki/KIF445:Hauptseite…"
"@MartinKnobbe the store was simply illegal, switched off control and broke Article 10 GG and now Grappa prices?"
Racism can hardly be more horrible. #kaltland https://twitter.com/mdr_th/status/789783865455943680…
"Discuss immediately what democracy, security, citizens lose or win in times of extensive secret services: http://www.geheimdienste-vor-gericht.de/auftaktpodium-politik-und-geheimdienste-in-unsicheren-zeiten/…"
in addition to the no from @Linksfraktion and @GrueneBundestag there were also two no votes from @spdbt
Should we read through well as #NSAUA if the #BfV again claims to have noticed nothing in Bagram of torture. https://www.hrw.org/news/2016/10/03/us-ex-detainees-describe-unreported-cia-torture…
@spdde @ManuelaSchwesig Why is the word RACISTS so hard to say? Think of Lassalle and say out loud what is!
I have another tweet: https://twitter.com/szonline/status/782953628059504640…
 https://twitter.com/libellulafilmde/status/782951792753729536 …
"For a stylish #tatort from Dresden, they have to let the Interior Minister run through the tracks with Entourage this evening."
Anyone have any idea why exactly this law firm in Eisenach legendized the donation? Or all coincidence? @PanamaPapers https://twitter.com/tagesthemen/status/782338776806875136…
"Establishment of a rallying area at Gotha GG station, the Nazi march is underway. Starting point of the Nazi march at 2pm exactly opposite. # 110gotha #nonazis"
Future CIA boss wants to see @Snowden dead and # NSAUA chairman feels snubbed by the BGH. Without words! http://www.deutschlandfunk.de/streit-um-den-zeugen-snowden-ein- intermediate success - for-die.1783.de.html?dram:article_id=371994…
What does BGH judgment mean for @Snowden and #NSAUA now? Questions from the nice moderators from @radioeins http://www.radioeins.de/programm/sendung/modo1619/_/snowden-verlassung--gruene-und-linke-bekommen-unterstuendung-vom.html…
The question is not whether but how BReg @Snowden provides security. What is democracy worth if it is afraid of secret services?
BGH shows opposition right! GroKo must not block @Snowden cargo. Federal government must choose parliament vs. NSA. #nsaua https://twitter.com/zeitonline/status/800705391986229248…
I asked Ausonius about the findings of German authorities about neo-Nazi assassins in 2014: http://m.rp-online.de/panorama/toetete-der-lasermann-auch-in-deutschland-aid-1.6409365…
"what model to take? On the appointment of racists, anti-Semites, Islam haters and secret service apologists in key positions?"
"well, in the case of Piatto, Meyer-Plath was the V-man driver."
News from V-Mann driver Meyer-Plath. Or resolve an argument for #constitutional protection. #NSU https://twitter.com/mdr_sn/status/799230177951682560…
Exit offers from the #VS are often headhunting for new spies. Independent qualified projects are needed here.
So what! @stoerungsblog @Mobile_Beratung @blicknachrechts https://twitter.com/mdr_th/status/798968831234424832…
@HeikeKleffner and who may have deliberately misdirected the police investigation? BfV or an LfV? #nsu
"Authorities give numbers, but have no concept. Protection for refugees / helpers and clarification of the deeds continue to be poor. #kaltland https://twitter.com/ndaktuell/status/798824187368390657…"
"Turkey-Kurdistan: imprisonment of mayors, forced administration, dismissal of employees topic in the @DLF http://www.deutschlandfunk.de/tuerkei-es-geht-eine-grosse-angst-um.694.de.html?dram:article_id = 371491 ..."
"Not only is the Oktoberfest attack a blind spot, there are also many unanswered questions about the murder of Olof Palme in Sweden: http://www.bbc.com/news/world-europe-37996063…"
"Since fundamental rights interventions are carried out via the database or selectors, in my opinion it would have to be documented in any case."
the soft green breaks the shark pic.twitter.com/9yDRap532p
The BND witness RU sits here in #NSAUA - head of the US / German branch in Bad Aibling for five years - and knows little to nothing.
true: pic.twitter.com/nv9NU8K3Wt
Sometimes a look at the well-wishers #Trump pic.twitter.com/VUZarH97Y5 is enough
&quot;Reporter Without Borders&quot; demands unbureaucratic residence permits for persecuted journalists from d. Turkey: https://www.reporter-ohne-grenzen.de/presse/pressemitteilungen/meldung/journalisten-nicht-ins-asylverfahren-tieben/…
"Interview with lawyer Aktar, defender of @hdpdemirtas: International pressure is crucial. Thanks @Leftfraktion for solidarity pic.twitter.com/WxoLFC5dVr"
Long conversation yesterday evening with # HDP and BDP MPs. Repression is expected to continue. Now meet detainee lawyer
Destruction of files in the # NSU complex is not followed. First BfV covers the NSU network and then Justice covers the BfV: http://www.dka-kanzlei.de/news_nsu.html
Combat18 was able to reorganize itself for far too long. Other federal states must also act: http://m.spiegel.de/politik/deutschland/a-1120375.html… #nsu
@tagesschau on hiring procedure @ deniznaki2. Release of all oppositionists &amp; journalists in d. Turkey http://www.tagesschau.de/multimedia/video/video-229249.html…
Now talks to local politicians from the city and district about the state administration and the dismissal of critical officials.
Procedure @ Deniznaki2 is discontinued. Standing up for peace and democracy is not a crime! Thanks to international solidarity pic.twitter.com/yyiNYDTFnS
"Whoever runs after Höcke does not demonstrate against Merkel, but for the AfD. @SusanneHennig #linkelpt"
Handover of the football shirt from #fcsp to @ deniznaki2 in front of the courtroom in Diyabakir pic.twitter.com/2DPhgN5Piv
Great media interest in the trial against @ deniznaki2 pic.twitter.com/Q0I77sJP65
Report on yesterday&#39;s event from #NSAUA at TU Ilmenau as part of # kif445 @KonstantinNotz @annskaja http://ilmenau.thueringer-allgemeine.de/web/lokal/politik/detail/-/specific/Einblick-in-den -NSA-Inquiry Committee-966966646…
Leonard Cohen&#39;s new and perhaps last album &quot;you want it darker&quot; is really one of the best: http://www.juedische-allgemeine.de/mobile/article-view?id=26828…
it’s about to start. pic.twitter.com/aPstVCuLiB
Where am I? pic.twitter.com/5T5WH20nV8
Can&#39;t say the days often enough: Thanks @lotta_magazin for research for the C18 meeting in Dortmund. #NSU https://www.lotta-magazin.de/ausgabe/online/combat-18-reloaded…
"When VS investigates Snowden Docs as intensely as surveillance allegations, I know what comes out: Nüscht! https://www.welt.de/politik/deutschland/article159223327/Aufklaerung-von-NSA-Cyberspionage-unwahr likely.html… #NSAUA"
"It&#39;s time to ask if BND had a liaison office in Thuringia, who was the official in charge. #NSU @mdr_th @die_linke_th https://twitter.com/kendzia_ludwig/status/794061994076868608…"
@dieLinke in Mecklenburg-West Pomerania calls for a # NSU committee of inquiry. Very well! MV was the scene of the crime and the retreat of the core trio. https://twitter.com/rettirp/status/793870306737844224…
The spies in the area of the #NSU were not only protected by the VS authorities: http://m.taz.de/!5350062;m/
In the new edition of @pragerfruehling I write why the AfD gives an ideological gold answer to unsecured pension provision. https://twitter.com/pragerfruehling/status/792006137499492352…
"Today I am discussing with author @MB_Journalist &amp; Marco Kormann (Gotha Police) about the consumption of crystal meth, causes, consequences and others. Prevention pic.twitter.com/Jro0HXCH1Q"
"Five years after the #NSU&#39;s exposure, racist mobilization and right-wing terrorism need to be considered together. https://www.linksfraktion.de/presse/pressemitteilungen/detail/gemeinsame-erklaerung-im-vorfeld-des-5-jahrestags-der-selbstenttarnung-des-nationalsozialistisch/…"
#NSU - blocked reconnaissance? And new terror from the right. Hearing the @Linksfraktion tomorrow in Berlin: https://www.linksfraktion.de/termine/detail/blockierte-aufklaerung-der-nsu-komplex-und-der-aktuelle-terror-von-rechts/…
I was referring to specific journalists who accepted the BKA or PP Upper Franconia claim without doing any research.
good luck for the rally against the #BND law from the #NSAUA @linksfraktion
BND gets a license for data vacuum cleaners wherever. Method: service emerges strengthened from every scandal. https://netzpolitik.org/2016/ueberwachungspraktiken-des-bnd-selbst-legalisiert-verstossen-sie- Gegen-die-verlassung/…
"the only question is, servants whose lords?"
"can happen, after four years of LT MPs (-;"
How poor. Groko tries to present BfDI&#39;s complaint about data collection in Bad Aibling as a legal minimum opinion. #nsaua
I am happy to read such clear words from @die_linke_th @icultureonline about the new regulation of the Federal Archives Act. #nsaua https://twitter.com/die_linke_th/status/788785835806232576…
Do you also hear it like Dr. Measurements in Cologne according to: &quot;Everywhere INSIDER and DECOMPOSITION PRESS&quot; screams (-; #NSAUA https://twitter.com/annskaja/status/788802394905862144…
"Indictment against 2 neo-Nazis, who had partially injured three punks in Saalfeld on 1.5.15. Too little consequence from police disaster that day. https://twitter.com/mdr_th/status/788972682943627264…"
Need for action for regulatory agencies and the interior ministry. Reliability according to weapons law not given. # Reichsbürger https://twitter.com/katharinakoenig/status/788820844059435008…
the answer to the written question can be found here: http://www.martinarenner.de/uploads/media/2016.10.18_Schriftliche_Fragen_263_264_To__tungsdelikte.pdf…
come directly to Linz.
So brutal and Violent neo-Nazis / racists no longer acted for a long time. The number of attempted murders is also increasing drastically: http://m.tagesspiegel.de/politik/rechtsextremismus-zahl-der-versuchten-toetungsdelikte-durch-neonazis-stieg-stark/14703844.html…
"yes, I saw. By the way, I&#39;m in Linz on October 29th. as a speaker at the #noEFLinz protests"
Sorrrrry. Here is the link again: http://dipbt.bundestag.de/doc/btd/18/099/1809969.pdf…
Maybe interesting about Henkel&#39;s personnel policy in the LfV: http: //dserver.bundestag.btg/btd/18/099/1809969.pdf @klauslederer @UdoWolfMdA
Selfie with Wonja from &quot;Bandwidth&quot; - taz titled as &quot;right greasy journalism&quot;. Friend-enemy determination in parts of @dieLinke obscure
Why were traces in the right-wing scene ignored and people with Turkish names suspected? #nsu #fallpeggy http://mobil.n-tv.de/politik/Bericht-Neonazis-schrieben-Peggys-Mutter-article18868696.html…
"Incidentally, #Albakr is not the only suspect who has hanged himself in detention. http://m.faz.net/aktuell/politik/inland/brandanschlaege-in-berlin-rechtsextremist-tot-in-haft-auflieben-13700287.html…"
