"who doesn&#39;t care about the takeover of Le Pen and FN is no longer a partner for me, they are opponents."
. @ CorneliaSeibeld @cdu calls for an anti-Semitism officer at the Yom Haschoa memorial event of the Jewish Community in Berlin pic.twitter.com/pbyIYgH51F
No more &quot;state of organized irresponsibility&quot;. Expert report on anti-Semitism http://www.taz.de/!5404120/
Expert group on hatred of Jews: &quot;Anti-Semitism without anti-Semites&quot; is spreading https://www.welt.de/politik/deutschland/article163957692/Antisemitismus-ohne-Antisemiten-griff-um-sich.html&amp;wtmc=socialmedia.twitter.shared.web… via @welt
Chechnya: Greens force Bundestag to refer http://www.blu.fm/aktuell/tschetschenien-gruene-zwingen-bundestag-zur-beflassung/#.WP4aSsLTEaU.twitter…
What can @AuswaertigesAmt say about this report: Terrorist accused of killing a British student will be paid £ 800? http://dailym.ai/2p8e7rf
"Germany pays too little attention to current anti-Semitism, report says  http://www.dw.com/en/germany-pays-too-little-attention-to-current-anti-semitism-report-says/a-38561473 …"
Unsure straight men love homophobic jokes http://www.queer.de/detail.php?article_id=28703… via @queer_de
Anti-Semitism report must not be routinely filed - quick implementation! http://www.faz.net/-gpf-8x6zc#GEPC;s3… via @faznet
The demands of the Independent Expert Group #Antisemitism must now be implemented! https://www.facebook.com/VolkerBeckMdB/photos/a.88914877697.81047.46819172697/10155297728607698/?type=3&amp;theater… pic.twitter.com/xLlSZD1xpL
I&#39;ve done it before.
Here is the regulation: https://dejure.org/gesetze/TierSchG/4a.html…
So you don&#39;t care if Le Pen takes over? That reminds me of ....
#AfD continues to drift to the right: Eldorado for right-wing extremists and anti-Semites http://www.neues-deutschland.de/artikel/1048898.afd-driftet-weiter-an-rechte-rand.html?pk_campaign=SocialMedia… via @ndaktuell
Such leftists are not fit for me: Mélenchon made no election recommendation and said that he would accept the end result.
Disgusting: AfD party conference: The queen is kissed with a hand - a drama in five acts https://www.welt.de/politik/deutschland/article163934830/Die-Koenigin-wird-mit-Handkuss-abserviert-ein-Drama- in-five-files.html &amp; wtmc = socialmedia.twitter.shared.web… via @welt
Tonight the &quot;Day of Holocaust and Heroism Remembrance&quot; Yom haScho&#39;a in France is Le Pen 2. יום הזיכרון לשואה ולגבורה https://twitter.com/EliyahHavemann/status/856218268381700096…
"Macron !!! Now we must proceed to the &quot;gathering of all progressives&quot;, the democrats, the Europeans for @EmmanuelMacron https://twitter.com/TimesofIsraelFR/status/856217160145924099…"
"Gauland wants to keep Höcke against the federal executive in the party. Consistent, #Gedeon is still there despite its anti-Semitic tracts"
"What a macho this Gauland. Petry, of course, controlled by her husband. Women cannot think for themselves. #berlindirekt"
I hope for France and for Europe - for all of us! https://twitter.com/rtbfinfo/status/856180430348877825…
from which legal &quot;concepts&quot; do you swagger?
"Sorry - if the arguments are refuted, people say different opinions. Marriage is protected for its own sake."
I didn&#39;t say anything about atheists. Atheists don&#39;t have to be intolerant and anti-democratic. Most just don&#39;t believe it.
Greens put wave of homosexual persecution in Chechnya on the agenda of the Bundestag https://www.facebook.com/VolkerBeckMdB/posts/10155294450417698…
doesn&#39;t make it better.
The anti-church agitation has a long tradition in the German national right
Greet your spiritual ancestors in Walhalla https://de.m.wikipedia.org/wiki/Tierschutz_im_Nationalsozialismus…
Factory farming is cruelty to animals. Point.
"have you ever heard of practical concordance? Fundamental rights don&#39;t surrender, they have to be developed."
That pleases me. Somehow I thought he had (deserved) it long ago. Compass needle 2017 goes to Manfred Bruns @lsvd http://www.queer.de/detail.php?article_id=28680…
and where do you see 2 right &quot;concepts&quot; at work? I rather have the feeling that you do not understand freedom of belief with human rights.
Central Council of Jews: With visits to concentration camps against anti-Semitism among refugees http://spon.de/aeXSz via @SPIEGELONLINE
"http://www.duden.de/rechtschreibung/nur_blosz_aber_ausnahmslos… nur = restricts the statement of the previous main clause; however, however, but"
§ 4 a TierschG is applicable German law. The #AfD wants to delete the paragraph.
"Animals and humans are 2 categories, only under National Socialism were some people treated worse than animals."
You made a mistake on the subject
There was an extra request. But the Animal Protection Act of 1933 comes back in the program.
# AfD demand for the animal protection law means: Jews &amp; Muslims out! This legal situation already applied from 1933 https://www.welt.de/politik/deutschland/article163918819/Frauke-Petry-sitzt-wie-versteinert-da.html&amp;wtmc=socialmedia.twitter.shared.web… via @welt
"The marriages of Mrs. Merkel, Mr. Kauder &amp; Mrs. Steinbach do exactly what?"
And why?
The answer is in the electoral program https://gruene-nrw.de/daten/wahlprogramm2017.pdf ... Reading is worthwhile.
"when it comes to sexual identity, everyone has their own non plus ultra for themselves. It is to be respected by others."
Israel 🇮🇱 as a state of rule of law is self evidently prosecuting it. https://twitter.com/volker_beck/status/856153031850807296 …
"Disgusting: Jewish gang attacked Arabs in order to end their romantic ties with Jewish women, state says http://www.haaretz.com/israel-news/1.785047 …"
that&#39;s why I was kind enough to speak of &quot;inappropriate &amp; uncomfortable&quot;. He is a man of the word. It should be pointed out to him.
. @ catholic_de the concentration camp comparison of @Pontifex_de for the refugee camps is inappropriate and unpleasant @radiovaticana
What do you think of the AfD&#39;s requirement to delete Section 4 a (2) TierSchG without substitution because of the Muslims?
Chechnya is part of the Russian Federation.
Four wounded as Palestinian man allegedly attacks passersby on Tel Aviv waterfront  http://www.haaretz.com/israel-news/1.785128 …
"Any demarcation from anti-Semitism (Petry application) was rejected, but a shaft ban à la animal protection law in 1933 was requested."
You can do more than Berlin: http://www.queer.de/detail.php?article_id=28695…
Cologne was not only Waterloo for Petry decisive AfD is now &quot;Eldorado for right-wing extremists &amp; anti-Semites&quot; https://www.facebook.com/VolkerBeckMdB/posts/10155294572167698…
the AfD wants to delete this regulation: § 4 a (2) TierSchG https://dejure.org/gesetze/TierSchG/4a.html…
"Calls by Kadyrov against the &quot;enemies of our faith and our fatherland&quot; must alarm, @AuswaertigesAmt https://twitter.com/Volker_Beck/status/856101249074311168…"
&quot;Standing together at the right moment&quot; - Political voices on the AfD party conference https://www.domradio.de/node/243124
Courage to truth: AfD on Höcke course: a real alternative for Nazis http://spon.de/aeXRO # koeln2204
"Our cross has no hooks. # Koeln2204 Together against #Antisemitismus, #Homophobie &amp; #Rassismus pic.twitter.com/HhC2lCr1Ty"
"Nonsense, it is called municipal tax for Jewish communities."
the AfD party congress rejected @fraukepetry&#39;s application to differentiate it from anti-Semitism. Left has clear decisions against it
"for the AfD, the church is said to consist of Easter eggs and Christmas stollen. But that is folklore and not Christianity."
AfDlers want to punish churches for withholding church tax because they follow the charity principle towards refugees.
"the anti-Semitism of AfD delegates such as #Gedeon, MdL contradicts church doctrine, eg Nostra Aetate"
On the move France! For the future of Europe @enmarchefr with @EmmanuelMacron https://twitter.com/emmanuelmacron/status/855538744442724352…
Police officer killed in Paris terrorist attack was out and proud  https://www.lgbtqnation.com/2017/04/police-officer-killed-paris-terrorist-attack-proud/?utm_source=twitter&utm_medium=Sendible&utm_campaign=RSS#.WPxQxrOMSLE.twitter …
?
AfD has a problem with the Christian West: Sharp church criticism at the AfD party conference - kathisch.de http://www.katholisch.de/aktuelles/aktuelle-artikel/scharfe-kirchenkritik-auf-dem-afd-parteitag…
Just an example of how to fix it: #Gedeon and Nostra Aetate. The church has to stand up because of the teaching against the AfD. #antisemitismus
The directions of your compass have been mixed up. Otherwise everything is chic.
Do not avoid a dispute - but I cannot do this revaluation of your person to our coalition partner @CDUFraktionK.
It is a bot
A fitting summary of the # AfD party conference is the sentence by # NPD leader Frank Franz in @DerSPIEGEL: https://twitter.com/volker_beck/status/855832280543244288…
"&quot;If the AfD becomes NPD in terms of content, you have to ask yourself whether the NPD still has a livelihood correction.&quot;"
#AfD gets rid of &amp; after the useful bourgeois idiots from the start-up phase https://twitter.com/twittschler/status/854361695506108417…
Peaceful for respect and human rights ~ against misanthropy of right-wing populists pic.twitter.com/057gXN60z6
Diversity and respect instead of simplicity and hate! This is Cologne. # 2204 pic.twitter.com/AXHgrxlhJn
"You fantasize. Incidentally, green-red links never ruled in the federal government &amp; no norm of the Residence Act without a CDU passed."
Then that&#39;s the security you mean: Afghanistan: At least 50 people die in Taliban attack http://spon.de/aeXRu
What do you say to the federal delegate #Gedeon - doesn&#39;t that contradict Nostra Aetate? So a church position #antisemitism
"Iran, 30 young gay men arrested and tortured by the police http://www.gay.it/?p=139569 #gayit via @gayit"
Who does that
Is #Gedeon the @Maritim_Hotels Cologne welcome? The world of maritime hotels with hospitality for anti-Semites? https://www.ruhrbarone.de/weiter-prominenz-auf-dem-afd-bundeaparteitag-in-koeln-hoecke-und-gedeon/141367…
Have a good appetite
"«Diversity and respect instead of simplicity and hate - that is Cologne» https://www.nwzonline.de/politik/voll-auf-aerger-eingestell_a_31,2,3687184932.html…"
I hope he doesn&#39;t think you could watch him like that
"There were also reasons why black-green didn&#39;t come in 2013, including # ehefüralle"
Me too 😂
My impression is that it is a horde of semi-bot accounts of the Munster with sham legends. @balleryna is flagship https://twitter.com/Volker_Beck/status/855412791888445441…
Paris shooting: Two police officers killed in likely 'terror attack' near Champs-Elysees  http://www.haaretz.com/world-news/europe/1.784755 …
"I oppose anti-Semitism wherever I meet him: left, right, in the middle, Christian, Muslim, atheistic -"
Will the party leadership @AfD_Bund behave towards its delegate #Gedeon or is every anti-Semite warmly welcome in the #AfD? #Cologne
You don&#39;t get an answer in the matter. In 1989 I enforced a refusal to decriminalize pedosexuality (§§ 174/176 StGB).
#derailing as the only way out of the # Gedeon- # anti-Semitism bang? Is #AfD a biotope for anti-Semites or does Gedeon exclude them?
. @ AfD_Bund Can you buy the &quot;Protocols of the Wise Men of Zion&quot; in your party shop or only from the party delegate #Gedeon personally?
Thank you. You can&#39;t believe it. Whether there are readings from the minutes at the # AfD party conference or Rosenberg&#39;s myth?
Mr. @Joerg_Meuthen @FraukePetry where is the exclusion against the anti-Semite #Gedeon? https://twitter.com/Volker_Beck/status/855136062053777418…
Exclude humps and make #Gedeon a delegate? http://www.belltower.news/artikel/stehen-wolfgang-gedeon-vorm-comback-11711… @FraukePetry @AfD_Bund Make Antisemitism great again?
Iran's Ahmadinejad disqualified from running in presidential election http://www.haaretz.com/middle-east-news/iran/1.784748 …
is he actually a delegate? I thought he was excluded.
Iran's Human Rights record excludes the country from being a partner of democratic countries. https://twitter.com/jerusalem_post/status/855015982103879680 …
Iran arrests more than 30 alleged homosexuals - federal government should react. http://www.queer.de/detail.php?article_id=28677… via @queer_de
Federal Government @AuswaertigesAmt @RegSprecher should campaign for the release of the supposedly homosexuals #iran https://twitter.com/irqrlgbt/status/854890127558160385…
Citizens decide about future politics. New positions have opportunities from new parties such as @Die_Gruenen or Piraten.
No it is not. You would get an appointment with me.
AfD account @Balleryna is a bogus giant The gentleman from Münster is said to have been very busy at the university. http://www.tagesspiegel.de/medien/datenjournalismus/twitter-datenanalyse-groesster-afd-twitter-account-ist-ein-scheinriese/19691492.html…
. @ AfD_bund has to comment on #Gedeon. Ms. Petry wants to clarify Realo or Fundi. It would have to be clarified: how much Nazi is in the AfD?
It didn&#39;t come because it was JF &amp; I didn&#39;t know it. I only knew that there were changes and in which direction.
"Now to the point: does an anti-Semite like Gedeon, who considers the protocols of the Zionist sages a document of Judaism, has space in #AfD?"
🌈No coalition without #everyone with @Die_Gruenen says @cem_oezdemir That&#39;s a word. 👍🏻 🌈 http://www.stuttgarter-nachrichten.de/inhalt.gruene-mit-union-spd-oder-linken-oezdemir-stell-bedingungen-fuer-koalition.70790f3b-8d17-464f-8f32-29e314cfb36e.html ...
"No, and you could read this here if truth was a category for you: https://books.google.de/books?q=editions:ISBN3658075805&amp;id=a2LbrQEACAAJ&amp;hl=de…"
"For de Maizière&#39;s proposal, he needs @RT_Erdogan for the generation cut. @Cducsubt didn&#39;t think that through again #doppelpass"
"What was in Germany after 1945? Partially successful, only partially."
At Gedeon you can see that things can go wrong.
Is that a joke?
"You ended up wrong, only that your description is more racially distorted. http://www.tagesspiegel.de/berlin/nach-uebergriff-an-friedenauer-schule-volker-beck-sennt-antisemitismus-in-elternbrief/19635496.html…"
The logs of the wise men of Zion are considered a historical source by #Gedeon and Islamic anti-Semites.
"Modern Islamic anti-Semitism is a reception of German anti-Semitism in the early 20th century, including imagery."
"Anti-Semitism in Islam, which you mean, is a modern phenomenon and a product of the 20th century."
"In real terms, it is an ideological reimport."
It&#39;s not a fate. I think that should be an issue from the beginning of the integration.
Netanyahu cancels meeting after German FM refuses to snub Israeli leftist NGOs  http://www.haaretz.com/israel-news/1.785594 …
"Germany, the country of immigration, has yet to learn about democratic disputes: (Discrimination) victims are no excuses for the right."
"Netanyahu asked to speak with Gabriel on Tuesday afternoon, but the German foreign minister refused to take his call. Sagt @haaretzcom"
pathetic but career-enhancing - self-defamation: @JensSpahn demands &quot;more family instead of gender mainstreaming&quot; http://www.queer.de/detail.php?article_id=28669…
So Petry is defeated - How long was it from the Lucke defeat to the Petry surrender?
"Dictatorship? «Don&#39;t we have ballot boxes? We have that, »said Erdogan. And didn&#39;t she also have Hitler? Stalin? Ulbricht?"
"Today 7:00 p.m. in #Hannover: # Naturalize Islam, but how? https://twitter.com/BelitOnay/status/854244200283549697…"
Now at @mdrde Israel 🇮🇱-Germany
"this is the new stitch. AfD troll accounts &amp; bots are all supposedly social, green, and Jewish"
Topics at @tagesthemen: Right-wing populism only: #AfD &amp; #AKP
Make Ivanka great (again)... https://twitter.com/thehill/status/854299372791750656 …
! https://twitter.com/APosener/status/854369886986014720 …
Those?
then all AfD students are there too? And where to put it?
"No, human rights cannot be overturned by majority vote. That would be tyranny of the majority."
just not.
Turks out! - AfD slogans are not an answer to a referendum - we need courage to face political disputes in the immigration society.
Reasons for the differences in German election results should be analyzed: Nowhere closer than in Berlin http://www.morgenpost.de/210273823?__pwh=9zJsJslvpSUmF8XoXO252Q==…
 https://de.m.wikipedia.org/wiki/Bund_(Soziologie) …
That is why it continues with the referendum for the death penalty and the fight against ever new invented &quot;enemies of Turkey&quot; https://twitter.com/volker_beck/status/853902301249101824…
The Erdogan system is as federal as it is with fascist movements; it always has to fight to avoid falling apart. https://twitter.com/tagesschau/status/853891769704083456…
"My appeal went to @HeikoMaas &amp; @BMJV_bund because they are responsible, not to @spdbt, because otherwise too cheap - like your tweets."
This cheap party policy bores me.
"as a minister, I will do that to you in a year. As MdB you don&#39;t do anything."
Then you have to wipe out the actors with legislation &amp; JuMiKo. Prevent &amp; seize all income. But you also have to want it.
"If you don&#39;t have anyone, I would have some ideas. But would need the skills."
A @BMJV_Bund that does not develop a law enforcement strategy with its ministerial bureaucracy can be dissolved.
where is it safe?
Do we care @AuswaertigesAmt ? @BaerbelKofler protect human rights defenders!  https://www.washingtonpost.com/news/worldviews/wp/2017/04/15/she-broke-the-story-of-chechnyas-anti-gay-purge-now-she-says-she-has-to-flee-russia/?utm_term=.28c09536e6fb …
Would it have been enough to win the majority without the fraudulent election? https://twitter.com/tuncayoezdamar/status/853675047176765440…
the BKA took it seriously
Not even true. I criticize it myself. It depends on how and not on whether.
Last week&#39;s death threat with reference to my address was from a German. Then it should not stay.
"Nationalists &amp; racists, homophobes &amp; anti-Semites out? Then everyone. But where?"
And you want to imitate Hitler the Germans?
All of this is already forbidden - you may have to stop all economic activities.
"If @HeikoMaas doesn&#39;t get blocked &amp; deleted, he can close @BMJV_Bund &amp; Kaffeekränzchen with @TwitterDE. pic.twitter.com/19K8dp0Zb5"
"Well, if he doesn&#39;t want to know, he unfortunately writes differently"
convince me with your summer vacation there. What parts do you have in view?
"No, I am rather surprised at the theology of detachment, which the churches disagree with. Contradicting Nostra aetate."
Frohe await! Rose spring! pic.twitter.com/j7aGt6iFKO
I am certain that W. Kretschmann rejects a boycott of Israel & comparisons of Israel with the apartheid regime. http://www.jpost.com/Diaspora/German-state-head-gives-BDS-Bethlehem-hate-preacher-nearly-32000-488053 …
"No alcohol, no tobacco - or don&#39;t you think that&#39;s drugs?"
&quot;Medicines are intended for healing&quot; - Beck warns the federal government after the execution stop https://www.domradio.de/node/242585
So I&#39;m arguing with Israeli politicians without any problems
"the Russian Federation, part of which is Czech Republic, is not a majority Muslim. This is the Putin-Kadyrov system."
 http://www.tagesspiegel.de/berlin/nach-uebergriff-an-friedenauer-schule-volker-beck-sieht-antisemitismus-in-elternbrief/19635496.html …  http://www.sueddeutsche.de/politik/kriminalitaet-antisemitismus-waechst-1.3392872 … etc.
"Yes, Google helps: http://www.spiegel.de/panorama/gesellschaft/tschetschenien-gewalt- Gegen-schwule-jetzt-hilft-nur-noch-die-ausreise-a-1141666.html… http: // m -maenner.de/2017/04/56946/"
After #Friedenau: #Antisemitism: How safe is Jewish life in Germany? at @boell_stiftung https://www.facebook.com/events/1880278418855013/…
there has been a (not really necessary) debate for a long time http://www.institut-fuer-menschenrechte.de/fileadmin/user_upload/Publikationen/Policy_Paper/policy_paper_16_ein_grundgesetz_ohne_rasse.pdf…
that&#39;s rather funny.
"you could have inserted a &quot;supposed&quot; one so that you, too, cannot misunderstand it, although you want to?"
"Not true, for example &quot;but also among Christians. So the anti-Israeli terrorist George Habasch was a Christian.&quot;"
Has @AuswaertigesAmt already invited Elena Milaschina to Germany? Protection seems necessary here. http://www.queer.de/detail.php?article_id=28643…
Federal Government @Regrecher @AuswaertigesAmt @peteraltmaier should support @Fresenius with amicus curiae letter. http://spon.de/aeXB1
What should &quot;declare a country as a safe country of origin&quot; mean?
"If Afghanistan were a safe country of origin, there would be no more insecure."
Whoever scourges racial hatred does not believe in the existence of human races.
"On the contrary: &quot;And giving up,&quot; says the mother of the Jewish student, &quot;is also racism.&quot;"
to what extent reduction? I don&#39;t see the equation either. And where are human races adopted?
Starts in the middle of the word criticism of Israel. Ever heard of criticism of Germany? Not me.
You can charter a helicopter and get people out. Chatterbox.
What has to be said: Anti-Zionism is the fire accelerator of current anti-Semitism. http://www.zeit.de/kultur/2016-04/israelkritik-antisemitismus-medien-sueddeutsche-zeitung-10nach8… @Mirjam_Fischer #zeit
# Chechnya: Gay rights are not a luxury problem - Against the complicity of #whataboutism http://www.zeit.de/politik/ausland/2017-04/tschetschenien-homosexuelle-folter-toetungen-russland-5vor8…
I didn&#39;t know that everyone had to be circumcised now.
accuses authorities of inaction against Ditib spies &amp; shakes his head over the voices from the government http://www.tagesspiegel.de/politik/spione-der-tuerkei-volker-beck-wirft-behoerden-untaetigkeit- gegen-ditib- spies-before / 19660360.html…
"No 🌈 # LGBT, different religions, languages, origins belong to it. You have a racial tick."
Cologne has to blow kölsch: bont un with respect for d&#39;andere Jeck. https://twitter.com/SEVN_Agentur/status/852132933330763776…
With @MarcBartra and the injured police officer and everyone who is still in horror. https://twitter.com/Die_Gruenen/status/851882367803428867…
what is @APosener s article openly racist?
One seriously wounded in suspected stabbing attack in Jerusalem  http://www.haaretz.com/israel-news/1.783493 …
Chechnya &quot;gay free&quot; sounds like the &quot;Jews free&quot; of the Nazis. The language of obliteration and annihilation. http://spon.de/aeXBF
Hello @focusonline send interns to the library &amp; have it clarified: &quot;This investor wisdom is said to be found in the Talmud.&quot;
"Something is going wrong in #Friedenau &amp; probably not just there. Tolerance is inappropriate for anti-Semitism. Face it, fight it! https://twitter.com/aposener/status/852530743972687872…"
@FraukePetry will need a lot of staying power for # Höcke exclusion because arbitration boards may decide for Höcke. Does she have it?
Asking a question does not mean having a sure answer. Otherwise it would not be a question.
What kind of stuff do you stammer? We don&#39;t rule at all. What is this galactic nonsense?
The question must be asked: Who is interested in insecurity in Germany due to Islamist terrorism and professionalism for bombs? https://twitter.com/alsharq/status/852187918122799104…
And the security situation in Afghanistan can be found here: https://www.nds-fluerat.org/wp-content/uploads/2016/10/sicherheit-afghanistan-170314.pdf…
You should know what a &quot;safe country of origin&quot; is. Afghanistan is of course not one of them: https://www.gesetze-im-internet.de/asylvfg_1992/anlage_ii.html…
And how do you close them? In the health food store?
Mazel tov: Wedding in custody: Deniz Yücel married his girlfriend in prison #freedeniz https://www.welt.de/politik/ausland/article163658054/Deniz-Yuecel-hat-im-Gefaengnis-seine-Freundin-gehe Ehe.html&amp;wtmc = socialmedia.twitter.shared.web… via @welt
Freedom (self-determination) &amp; equality (prohibition of discrimination) are central human rights. What do you mean
&quot;The recognition of self-determined gender identity is a human right&quot; https://twitter.com/volker_beck/status/852228115535470592…
OLG Hamm: No legal gender adjustment without expert opinion http://www.queer.de/detail.php?article_id=28630… via @queer_de
Which country do you mean?
a deportation stop depends on the security situation in the destination country of the deportations.
This is a nonsensical shortening &amp; mixing of two questions
Since @fraukepetry s Waterloo at @phoenix_de http://www.stern.de/politik/andreas-petzold/afd--wie-frauke-petry-von-volker-beck-entzaubert-wurde-6713998.html ... she has me blocked @BerndLucke Spread the word.
"Because you don&#39;t recognize the poison of right-wing populism, here is an example from your retweet list @BerndLucke How it starts, then it slips off pic.twitter.com/Xnt628CX4y"
Is this verified?  https://twitter.com/mediaforeign/status/851489459216556032 …
Patriotic Europeans for the de-Christianization of the West: AfD politicians want churches to take away rights
The whole world is constantly changing. You have to do that. But those who dream of the good old days often forget what got better.
Who says you can&#39;t say an opinion?
Still not found anything? Then ripe for an apology.
Jews of his country were not his own people? What is he saying? This is pure #Antisemitism. https://twitter.com/volker_beck/status/851932383653879808 …
