Why didn&#39;t the SPD have the courage to make a political demand?
if the application had meant anything operationally yes
"If the SPD had applied for @RegierungBW organ complaint, ok. But so, nope."
Sorry the decision is made in the Bundestag - in Stuttgart it was nothing.
Our @GrueneBundestag
"You should discuss this: Israel, Jews and the SPD: From kneeling to many oversights http://www.faz.net/-gqz-8y8c7#GEPC;s3… via @faznet"
Thank you for this award and surprise at the reception of @IsraelinGermany. Toda Raba! #israel pic.twitter.com/y6nc4UTwiE
The end is near pic.twitter.com/kXwQ8QKv4x
"No, the Turks are not an autochthonous minority like Kurds in Turkey or Arabs in Israel."
Compare my party congress proposal.
Clearly
That is the position of the Bundestag - across parliamentary groups.
"To smoke out you need smoke, something has to burn. Can you call someone who &quot;smokes&quot; arsonists? # fragefürFreund"
Anti-Semitism is always the anti-Semitism of others. No. Is not he. Work against any shape.
Visit the school today in #Friedenau http://www.bz-berlin.de/berlin/tempelhof-schoeneberg/jetzt-prechen-ferdinand-14-ich-fuerchtete-um-mein-leben…
I&#39;m curious whether Schulz&#39;s loyalty to the Nibelungs is the last word or whether the SPD still has the guts here. https://twitter.com/kahrs/status/867109842435092481…
referred to Palestinian Bishop Munib A. Younan at the German Evangelical Kirchentag
40 years #HuK #homosexual &amp; #kirche I congratulate #dekt pic.twitter.com/JInd14MPPI
He who is patient is wise; but whoever is impatient reveals his foolishness. (Claims)
Whoever has influence and does not use it loses it. Applies to both parties in different places.
"@Kirchentag_de newspaper celebrates him as a peace visionary - in view of his statements about Israel, I ask: did you really look? pic.twitter.com/33zIuqmmmR"
Ramadan Kareem!
How does the Federal Minister of the Interior judge Al Tayyeb&#39;s assassinations of Israel against Israel? https://www.memri.org/reports/president-mubarak-appoints-dr-ahmad-al-tayyeb-new-al-azhar-sheikh-2002-interview-memri#_edn3…
No only as registrated partnership.
What do @BMI_Bund &amp; @kirchentag_de say about this video compilation? Fake or opinion? https://twitter.com/nayakowz/status/868151645422723072…
100% equality - maybe with us or not @Spdde http://www.queer.de/detail.php?article_id=28910… via @queer_de
"No, I had made it available and my group had given it to me."
Now at the @Die_Gruenen stand at @kirchentag_de #dekt H1.2 Stand H21 pic.twitter.com/Qx4Bzdx6FO
The fact that @Kirchentag_de has not asked its guest for a clear statement here is politically not responsible &amp; honest. #israel https://twitter.com/volker_beck/status/868042206392852481…
You don&#39;t know anything about al-Tayyeb&#39;s positions and your minister keeps on featured him? Don&#39;t you find out? http://www.kairo.diplo.de/Vertretung/kairo/de/2016/bildergalerie__demaiziere.html…
"Bundestag must decide consequences in June, Schuster is right: #Anti-Semitism fight more targeted http://www.juedische-allgemeine.de/article/view/id/28693…"
23 dead in attack on bus with Christians in Egypt
Or #groko postpones the decision for another 4 years.
"No matter where I go - whether PLO, Fatah or bishops: No answer as the end of the occupation as a demand, nothing about the security order."
"This is how a candidate for vice chancellor acts and speaks, not a candidate for chancellor. https://twitter.com/volker_beck/status/868467467030581248…"
Now the #Schulzzug has its axles broken - I can no longer believe that it is fighting for anything. # ehefüralle http://www.queer.de/detail.php?article_id=28923…
"you don&#39;t want to or can&#39;t understand: it&#39;s not about de Maizière&#39;s stance on Israel &amp; Terror, but his stance on al-Tayyeb."
Where did the federal government act on al-Tayyeb&#39;s stance? Please with source.
Are you at the event?
But you have to explain that if you meet al-Tayyeb in public. Let&#39;s clarify in the plenary on Wednesday.
Bishop Younan forgets 2 small details: in 1948 and 1967 Israel successfully resisted Arab aggression twice - only detail #dekt
What did German Protestantism learn from Luther&#39;s anti-Judaism? https://twitter.com/volker_beck/status/868455664275816449…
Dear @kirchentag_de the Kairos-Palestine document with its detachment theology should not be referred to unconditionally.
I think you can also talk to problematic figures. But then you have to talk about the problems and not ignore them.
Will write @kirchentag_de next week. Dialogue has to see and perceive the other and needs attitude.
must one face disrespect with disrespect? This is actually not our culture.
Blessed Ramadan to all Muslims. Peace be with everyone! #RamadanMubarak pic.twitter.com/vGUvzmUvuG
your article does not answer the questions about his problematic statements - you make him a beacon of hope.
And the justification for suicide bombings in 2002 and attacks on Zionism &amp; Jews? Is there a repositioning?
"So please, that is not serious!"
 https://twitter.com/volker_beck/status/868042206392852481 …
 https://twitter.com/volker_beck/status/868042206392852481 …
And how do you interpret it? Israel&#39;s right given or not? What does your guest think?
The event should clarify. That is the meaning of dialogue. The lecture has not yet clarified it.
 https://www.welt.de/regionales/berlin/article164906799/Jens-Spahn-will-Fokus-der-Kirchen-auf-Kernthemen.html …
"When a politician from a party that has Christianity in its name tells the churches to stay out of politics, it is"
I would like to welcome you to the reception of @GrueneBundestag for #DEKT with Katrin @GoeringEckardt pic.twitter.com/YuYPHXhwow
"You see me, the sky says over Berlin. #dekt #Kirchentag pic.twitter.com/mDVhMS7F9W"
Appeal to the federal government - Greens call for &quot;clear edge&quot; against Ditib http://www.dnn.de/Nachrichten/Politik/Gruene-forder-klare-Kante- Gegen-Ditib… via @dnn_online
The television council forwarded my complaint to the intendant for comment.
"Say hello to @goproudout as a 74,000th follower. Welcome #fb"
Discrimination is not a Jewish value. &quot;You see me&quot; is the opposite message.
Submitted a question @kirchentag_de: Does al-Tayyeb&#39;s message of peace include condemning terror against Israel? https://twitter.com/volker_beck/status/868032315397636096…
How nice! The # MarriageForEverything is now coming to Taiwan. http://www.volkerbeck.de/2017/05/24/eheoeffnung-in-taiwan-ehe-fuer-alle-jetzt-auch-in-asien/… pic.twitter.com/fclzSStBP7
"As of today, there is # MarriageForEveryone in Taiwan. Meanwhile in Germany: The SPD is looking for its backbone &amp; the CDU continues to have a stomachache. https://twitter.com/haleyelaine9/status/867293351216910336…"
"No group application is required, there are 3 bills to choose from."
"Now or never - realize the majority for # ehefüralle in June 2017! Mouth not only pointy, whistle! https://twitter.com/kahrs/status/867109842435092481…"
because in Germany politics still looks after the pharmaceutical industry.
I say thanks! https://twitter.com/queer_de/status/866909533515292672…
Humboldt-Forum: I think the castle has fallen out of time. Wilhelminism or cosmopolitanism? - http://www.tagesspiegel.de/kultur/humboldt-forum-stimmen-zum-kuppelkreuzstreit-wilhelminismus-oder-weltoffenheit/19840254.html…
Racial Profiling in Germany: Looking for “North Africans” - taz.de http://www.taz.de/!5408197/
Islamic scholar al Tayyeb: &quot;what justification would Israel have in this region?&quot; Do you see that too @kirchentag_de? https://www.welt.de/politik/ausland/article145244559/Waren-ueberrascht-von-dieser-satanischen-Pflanze.html&amp;wtmc=socialmedia.twitter.shared.web…
Does #dekt Sheikh Ahmed el-Tayeb also question his positions on Judaism &amp; Israel? https://en.wikipedia.org/wiki/Ahmed_el-Tayeb#Jews… https://de.wikipedia.org/wiki/Ahmad_Mohammad_al-Tayyeb#Stellung_zum_Terrorismus…
Berlin: SPD calls for free PrEP. I think it&#39;s right. http://www.queer.de/detail.php?article_id=28884… via @queer_de
"Election campaign 2017: some call it chancellor duel, the other coalition committee - democracy goes between government and opposition."
A Läblebäbbel denounces the fight for human rights. http://www.tagesspiegel.de/politik/nach-der-wahlniederlage-in-nordrhein-westfalen-die-gruenen-streiten-um-ihren-kurs/19839718.html…
Please send understandable documents to my office volker.beck (at) bundestag.de
The senior teacher - from @EstherSchapira &amp; @g_michael_h unfortunately so true over 82 million Middle East experts http://www.juedische-allgemeine.de/article/view/id/28640… #JuedischeOnline
whose heartbeat is it?
"Confrontation necessary, however. that it wants to be Christians does not change anything I German Christians were not better Nazis, but Nazis."
the children are still not unnatural - their language lacks respect - I personally do not advocate surrogacy.
What are unnatural children?
What is the difference between my marriage and that of Mrs. Merkel?
"Children &amp; families need special protection, but all communities of responsibility reproductive capacity is not a prerequisite for marriage"
Does the CDU want to delete the C from its party name? - Christianity is more than Easter bunny and Christmas stollen. #Nightlove #God trust https://twitter.com/katholisch_de/status/867662115557044225…
Marriage bans based on gender and sexual orientation are discrimination. Marriage is a worldly thing.
Twitter is not enough for ecclesiology
The voters shouldn&#39;t be so joked
Any bet? Do you also bet on your mandate if # ehefüralle is not in the next coalition agreement? Don&#39;t you dare!
every millionaire who is in need. Only then is he not - but my husband &amp; I are no different from Mr. Sauer &amp; Mrs. Merkel.
"Legitimate (!) Goals may only be achieved with suitable, necessary &amp; appropriate means. We are a constitutional state."
"No, the state has no right to discriminate."
We should just give final advice to the Federal Council draft in plenary. We now have a majority. Act instead of tweeting!
Arrived # Reformation anniversary - #Wittenberg # 95thesen #Luther pic.twitter.com/RN3qneIR2Q
The anti-democratic impetus of #BDS shows itself again: One wants anti-Israel field service without contradiction instead of debate https://twitter.com/jerusalem_post/status/865641642203660289…
Especially when they deny themselves.
&quot;All people are born free and equal in dignity and rights.&quot;
The Universal Declaration of Human Rights and the History of Marriage Bans.
problem solved - Shabbat Shalom! https://twitter.com/Volker_Beck/status/865603058167894017 …
"one hour of trouble with border control, interior ministry, American Embassy #OMG #weekendcanwait"
"When does it dawn on @CDU that it is wrong? Meck-Pomm: SPD, CDU &amp; AfD vote against proposal to open marriage http://www.queer.de/detail.php?article_id=28867…"
Anyone who thinks they can reduce green to eco is working as a funeral director. A Läblebäbbel denounces the fight for human rights.
Bundestag: Self-determination for transsexuals required http://www.queer.de/detail.php?article_id=28864… via @queer_de
"Yes, that was misleading. However, this is irrelevant to the process."
"The first bill dates from October 2013. Naturally, a reasonable period of time cannot be longer than one parliamentary term."
@Katjadoerner &amp; I have written down a feasible concept here: http://katja-doerner.de/2016/09/05/wahlrechte-und-gleichrechteigung/…
I already know the concept. It scratches the boundaries of unconstitutionality &amp; does not resolve collisions.
Read the application. There is a deep misunderstanding about the BGB.
All people are born free and equal in dignity and rights.
I wish there were two rule-of-law liberal parties in Germany. Fight for us to keep at least one.
What do you mean by liberal? Liberalism defends fundamental and human rights as freedoms against the state.
Where is there something about love in the BGB? https://twitter.com/dpa/status/866573242210897925…
Truly: &quot;a very exciting process.&quot; says the @Verfassungsblog https://twitter.com/riffreporter/status/866329466708123648…
@BVerfG has long regulated the tax.
Liberal Islamic Covenant: &quot;The Koran allows gay marriage&quot; https://www.welt.de/politik/deutschland/article164652401/Der-Koran-erlaubt-die-Homo-Ehe.html&amp;wtmc=socialmedia.twitter.shared. web… via @welt
I am happy to answer any questions ;-)
@HeikoMaas conclusively expects another grand coalition. Do you like @MartinSchulz?
Another two homophobic raids in Berlin http://www.queer.de/detail.php?article_id=28879… via @queer_de
"#factscheck: Kauder, Steinbach, Merkel, all married - no children."
There is nothing in the brief of 2 years: https://www.gruene-bundestag.de/fileadmin/media/gruenebundestag_de/themen_az/lesben_schwule/pdf/Antragschrift_BVerfG_Ehe_f%C3%BCr_alle.pdf…
Just read the brief.
"Unfortunately, the specialist did not take note of the facts or the application. It&#39;s all very different."
maybe one should base a legal assessment on the legal reasoning and not on the general situation?
Postponed to 8.00 - the technology https://twitter.com/volker_beck/status/865441932721364992…
7.30 am @ntvde on the coalition law of the #fb pic.twitter.com/EaNj01xHmf
New allegations against Islamverband - @DITIBkoeln should systematically exclude cosmopolitan forces. https://www.rbb-online.de/politik/beitrag/2017/05/ditib-islamverband-vorwuerfe-weltoffene-kraefte-ausgegrenzt.html…
We couldn&#39;t have done that in 2013.
"I can&#39;t answer your question. But there is a Federal Council initiative on the subject in the Bundestag. According to Art. 76 GG, a vote must be taken."
"This is not supervised reading: Now take a look at the logs yourself, including Baden-Württemberg"
 https://www.bundesrat.de/SharedDocs/drucksachen/2015/0201-0300/273-15(B).pdf?__blob=publicationFile&v=1 …
"of course, every child can get married when they are 18 years old."
But she also has to provide a birth certificate and a marriage certificate.
I thought you read the irony
"@Sigmargabriel has courage or chutzpah alone in Jerusalem, not in Ramallah, Ankara, Moscow or Tehran. https://twitter.com/allgemeinenachr/status/865174159134937088…"
EP demands that EU funding cannot be diverted directly or indirectly to terrorist organizations. Consequence for @nadplo?
You haven&#39;t even understood the subject of the lawsuit. Reading helps.
We will not give up! Union politicians defend daytime discrimination against homophobia http://www.queer.de/detail.php?article_id=28850… via @queer_de #Ehefueralle
Program complaint to @zdf is underway. This violates the principles of balanced reporting. https://twitter.com/mena_watch/status/864431544517230592…
"At most, there can be no undemocratic vote on the different positions in the Bundestag."
Whoever wants to marry should be allowed to marry! @Gruene_jugend&#39;s campaign on # EheFürAlle. 🏳️‍🌈 #JaIchWill #idahot pic.twitter.com/KXWKRRLoNe
", @cducsubt takes majority of the Bundestag hostage in parliamentary. That is unworthy of parliamentary democracy. #Ehefueralle"
The civil partnership is not recognized abroad &amp; forces everyone to exit.
"Today we @GrueneBundestag force the marriage advocates in the coalition to take an oath. Hic Rhodus, hic salta."
I?
@GoeringEckardt is about to talk to # Ehefüralle - we @GrueneBundestag fight &amp; don&#39;t let up. The majority of the Bundestag must act now!
Schuster: Protection of the constitution should watch parts of the AfD - he is right there.
Discussion at @ADS_Bund: We have to do more for the protection and reception of persecuted homosexuals! #idahot # idahot2017 pic.twitter.com/Alz8bTePeZ
"So now back to Berlin, then 3 speeches: on human rights for so-called illegals, home-ab-law of the coalition &amp; human rights for # Trans *"
"Yes, we are getting closer to the chance of a positive decision by the Bundestag. Only that counts, not the person."
Why the behavior of the coalition violates the principle of democracy and violates the rights of all MPs: # ehefüralle https://twitter.com/volker_beck/status/865143557308526594…
The staunch gentleman @Joerg_Meuthen reminds more and more of &quot;Biedermann and the arsonists&quot;: The incendiary has been set. http://www.stuttgarter-zeitung.de/inhalt.aufregung-im-landtag-ein-afd-berater-vom-rechte-rand.f9f16cc4-da85-4912-8e32-81484461b83a.html…
"#Freedeniz Turkey allows second consular visit to Deniz Yücel. Finally, review absurd allegations under the rule of law!"
"Postponement of #Ehefueralle: a total of 64 adjournments: Bill @GrueneBundestag 27, bill @Leftfraktion 27, @bundesrat 10."
"We set an example: equal dignity and equal rights, against hatred and intolerance! #idahot #idahobit #loveislove pic.twitter.com/FD2xGgcn06"
Case for Human Rights Council: Homophobia in Indonesia: Court sentences homosexual couple to flogging #IDAHOT https://www.nzz.ch/international/homophobie-in-indonesien-gericht-verurierter-homosexlicheses-paar-zu-auspeitschung-ld.1293989…
For the #IDAHOT we let a rainbow rise over the Reichstag: Against homophobia &amp; transphobia! #idahobit #LoveIsLove pic.twitter.com/BuNh4upimf
Dear @spdde Sharepics do not replace political action. You have adjourned # ehefüralle for the 27th time today at the request of @spdbt! https://twitter.com/spdde/status/864756844639772672…
Brunner applies for a contract and votes against it himself. That has to be that with the high art of statehood. https://twitter.com/volker_beck/status/864742999523250176…
Unbelievable @spdbt again submits an application to # ehefüralle. Majority follows. That is already abusive. 29 adjournments.
Whether the legal committee has been adjourned again today or does @spdbt remember its promise to # ehefüralle? pic.twitter.com/ziX7Pz2j9m
We Greens go to the Federal Constitutional Court because of the # EheFürAlle. Details on the background can be found here: http://www.volkerbeck.de/2017/05/18/ehe-fuer-alle-gruene-zie-vor-das-bundesverfassungsgericht/… pic.twitter.com/Q7UatgYOso
Today in the Bundestag http://www.mannschaft.com/2017/05/staatlich-sanktionierte-homophobie-in-den-da-ch-laendern/…
"Maas: No coalition agreement with the SPD without “marriage for all”, ie he is not fighting for it to happen beforehand. #word break # ehefüralle"
It is no longer a marriage. Read the BGB.
I&#39;m there. @BVerfG # ehefüralle For the democratic rights of members of the Bundestag to vote on the draft laws. pic.twitter.com/0cInHlMPmd
"Trump’s leak of Israeli secrets threatens an intimate intelligence relationship 
 http://www.haaretz.com/israel-news/.premium-1.789674 …"
Equality: Daniel Günther puts pressure on the federal CDU http://www.queer.de/detail.php?article_id=28842… via @queer_de
Tomorrow the SPD has the last chance for &quot;100% equality - only with us!&quot; With the @SH_CDU in the back it is important: show more courage now # ehefüralle
"To @SH_CDU &amp; # ehefüralle: Hic Rhodus, hic salta !, Mr. Günther, Mr. Spahn. https://www.facebook.com/VolkerBeckMdB/posts/10155368227937698…"
Liberal Muslims call for marriage to be open to gays and lesbians http://www.queer.de/detail.php?article_id=28839… via @queer_de
here she is blonde.
"The EU is turning its back on admission, is the EU&#39;s help when it comes to deportation? Interesting position. @world"
Marriage for everyone: Volker Beck is suing in Karlsruhe http://www.queer.de/detail.php?article_id=28854… via @queer_de
This cannot justify elimination of the rights and obligations under Article 76 of the Basic Law: https://twitter.com/volker_beck/status/865107149432729600…
Abuse of the GO majority: @LambrechtMdB: &quot;They wanted to drive a wedge into the coalition. That would have meant the end of the coalition.&quot;
The constitution has a different perspective than the Karnikelstall: equal dignity and equal rights for all people.
The coalition misuses its majority to maintain the coalition and thus deprives the Bundestag of its rights. @LambrechtMdB admitted to @ardmoma
"With an interim order, @GrueneBundestag wants the Bundestag to be able to vote on #ehrfueralle in this legislative period."
Article 76 GG: &quot;The Bundestag has to deliberate on the proposals within a reasonable period of time and take a decision.&quot; https://www.gesetze-im-internet.de/gg/art_76.html
At 10:00 I submit the @gruenebundestag organ complaint to @BVerfG. # Ehefürall pic.twitter.com/BIp4SZdxcV
"i24NEWS - Despite political tension, Berliners take to the streets to celebrate Israel  https://www.i24news.tv/en/news/international/145186-170514-despite-political-tension-berliners-take-to-the-streets-to-celebrate-israel …"
&quot;Günther @SH_CDU should ask his country group in qcducsubt to decide tomorrow to implement the marriage for all. http://www.volkerbeck.de/2017/05/16/cdueheoeffnungdaniel-guenther-handeln-statt-rauszoegern/…
"By the way, a clear edge is not a question. Querulanz is Querulanz - #justsaying"
Federal government does not want to answer the questions about Gabrielin Israel from the last federal government survey. What should be hidden?
"&quot;Because if two men or two women want to live together, they basically do that ..., a long-term partnership for two&quot;"
"Praise all nations, praise the Lord #cantate #Wittenberg pic.twitter.com/nMd7WEn9G3"
"Yes, we have to fight crime. No, are not allowed to adopt # GroKo-Agenda. We are a civil law corrective."
You are not talking about the case that you are not commenting on. strangely
What alliances do we need against right? the @lsvd discusses alliance policy for democracy http://www.queer.de/detail.php?article_id=28828… via @queer_de
Did you read the description of the perpetrator in the article? Homophobia &amp; not the origin of homophobes is the problem.
Brutal assault on gays in Munich One must not take homophobia lightly. http://www.queer.de/detail.php?article_id=28823…
"Ultra-Orthodox lawmakers stall bill defining Israel as 'national home of Jewish people'
 http://www.haaretz.com/israel-news/.premium-1.789196 …"
#OSZE #Guide to Understand Anti-Semitic #Hate Crimes &amp; Address Security Needs # Jewish Communities pic.twitter.com/2SxxJO7SKs
Bundeswehr scandal - Von der Leyen wants to rename barracks - Union has always prevented that in the past. http://www.deutschlandfunk.de/dlf24-nachrichten-detail.1939.de.html?drn:news_id=744636…
the BaWü model does not work outside of BW.
"Attitude, e.g. with safe countries of origin?"
In there is. But it is also a clear warning shot: Mene mene tekel u-parsin. Lessons have to be learned from this.
"I think the attitude is wrong. That it is based on eliminatory anti-Semitism, however, must first be proven &amp; not just claimed."
Maybe wrong. But that&#39;s not what you wrote.
Where do you get this unspeakable claim?
"Dear people, vote, vote democratically &amp; against hate, preferably a second vote for @gruenenrw &amp; @sylvialoehrmann pic.twitter.com/J8ItqeWOQI"
"right, there are enough other photos of him."
"if you want to know what the Leyen problem is, read Niebel and his thread: https://www.facebook.com/niebelbw/photos/a.679520925395376.1073741827.620605831286886/1667711903242935/?type=3&amp;theater…"
Wehrmacht posting on Facebook: ex-minister Niebel complains and pinches | Latest news from politics NRZ.de https://www.nrz.de/politik/wehrmachtsposting-auf-facebook-niebel-klagt-und-kneift-id210563275.html…
Ex-Minister and the Wehrmacht - FDP distances itself from Niebel-Post on Facebook http://www.dnn.de/Nachrichten/Politik/FDP-distanziert-sich-von-Niebel-Post-auf-Facebook… via @dnn_online
Niebel probably posted this in response to current incidents of right-wing terrorists in the Bundeswehr. Absolute failure! #fail
"If you don&#39;t take wrong historical bonds, you don&#39;t forbid anything."
What does the Reformation mean for you today? #followerpower https://twitter.com/Volker_Beck/status/862956616194437120…
SPD urges #Ehefueralle in this parliamentary term - who knows what will come then. http://www.zeit.de/news/2017-05/12/deutschland-gruenen-politiker-beck-draengt-spd-zu-homoehe-noch-in-dieser-wahliode-12112804…
On Sunday I speak to &quot;Who cares? The Reformation in today&#39;s secular consciousness.&quot; http://www.predigerseminar.de/index.php/de/2-uncategorised/31-text-1-gross… #Wittenberg
Friedenau is everywhere - taz.de @SLagodinsky demands recognition of anti-Semitism where others look away. http://www.taz.de/!5406125/
Hello Mr. Becker https://netzpolitik.org/2017/twitter-datenanalyse-bei-der-afd-die-falsche-balleryna/…
"Either shame for National Socialism and pride in other chapters of German history, or neither. Everything else is cleavage https://twitter.com/TiloJung/status/862721267958460416…"
"Today&#39;s people are no more to blame for Hitler than for Bismarck, Staufer or Goethe. What a bullshit, Mr. #Gauland. https://twitter.com/TiloJung/status/862721267958460416…"
The disrespect category is not a civil status feature - go to the ball pit.
"In win for Israel, FIFA kills vote on Palestinian bid to exclude Israel Team http://www.haaretz.com/israel-news/.premium-1.788664 …"
There are no people without dignity and human rights. Only barbarism sees it differently
Four days in the Middle East http://www.juedische-allgemeine.de/article/view/id/28537…
You shouldn&#39;t be burqa! http://www.juedische-allgemeine.de/article/view/id/28524… #JuedischeOnline
Double pass among friends 🇩🇪 🇮🇱 http://www.juedische-allgemeine.de/article/view/id/28522… #JuedischeOnline
