"I was in Cologne very often, for example. Against proköln"
"Höcke likes the imitatio Hitleri. Exceptionally, the AfD leadership recognized this correctly."
And therefore surrender immediately? Weird logic.
Volker Beck a namesake?
now it&#39;s getting trivial at #maischberger You can&#39;t believe it.
?
Read Klecha 2016 and you will see that I was not deceiving.
Which argument do you use to make that claim?
Good night - tomorrow will be - I think - an exciting day.
"MORE THAN 30 MEN ARRESTED IN ESFAHAN, #IRAN FOR socalled SODOMY  http://irqr.ca/2016/?p=561 "
Human rights are universal and not cardinal values.
Progress in content matters - you have not yet recognized that.
Deportations to Afghanistan are suspended = Merkel stops de Maizière &amp; our pressure has an effect.
From 2. German everyday life is so obvious that the relationship is clear
I keep my speeches free on something like that
"We are not fair weather democrats: whether it is stormy or snowing, the anti-Semites are not a meter wide."
7.15 at @NDRinfo on the diplomatic crisis between Germany and Israel
anything that pleases and violates nobody&#39;s integrity and freedom is allowed.
Mr. Strobl thinks the legislation in the last week of the session will take place &quot;in the sale of the German Bundestag&quot;. Interesting.
Merkel is open to &quot;marriage for all&quot;. Let us now let the Federal Council draft decide for free http://www.faz.net/-gpf-8z70q?GEPC=s3…
"a gender entry is always a gender entry. Therefore, the same or different gender is generally always given in my opinion"
The Alevis have arrived in the prayer room of the German Bundestag. Alevism belongs to Germany. pic.twitter.com/qxqKsCoqhx
"There can be no breach of trust in a question of conscience, purely logical, right?"
The # Ehefüralle with the blessing of @EKD https://www.ekd.de/Stellungnahme-des-Rates-der-EKD-zur-Debatte-um-die-Ehe-fuer-alle-24373.htm… #thanks
@spdbt &amp; @Left faction
"I would be happy if the Chancellor, like Cameron, said on Friday: I support the marriage opening because I am a Conservative."
Marx is wrong: Marriage is a worldly thing https://www.facebook.com/VolkerBeckMdB/posts/10155528107307698… @katholisch_de # ehefüralle
"What do you want to threaten who with it, Mr. @HPFriedrichCSU? https://twitter.com/HPFriedrichCSU/status/879982766334636032…"
"we start at 8.30, if anyone wants to be there. #Andacht https://twitter.com/Volker_Beck/status/879996453845946368…"
Why can&#39;t a Minister of State say: I accidentally misinformed you? @antjeschippmann
"I doubt that, I was probably not there in 1981."
Cologne Thanks back! pic.twitter.com/59upIxFrQ9
&quot;It is not a good thing that people are alone.&quot; # ehefüralle https://twitter.com/volker_beck/status/880001059422437376…
I received many questions today regarding the concrete implementation of # EheFürAlle. So here&#39;s a quick FAQ. http://beckstage.volkerbeck.de/2017/06/30/faq-fuer-alle-heiratswilligen/…
Now at Deutschlandradio Kultur on # ehefüralle https://twitter.com/dlf/status/880770212412477440…
#SPD
"That was it, my last speech in the Bundestag. And now finally applies: equal dignity, equal rights. # EheFürAlle https://www.youtube.com/watch?v=NJmRmZDfXfY…"
Thanks @monikalazar for the nice souvenir: The # ehefüralle-opener. pic.twitter.com/sp6V9jpc3o
Thanks to @lsvd and all civil rights activists who fought for it when we were pretty alone. https://twitter.com/gruene_jugend/status/880707392136245253…
"Simone Veil RIP A great liberal has left us. We were not always in agreement, but an icon in the fight for women&#39;s rights https://twitter.com/Volker_Beck/status/880727672380379136…"
"SimoneVeil Life has taught me that over time, progress always wins. It&#39;s long, it&#39;s slow, but in the end, I trust."
Germany: Parliament opens marriage to homosexuals - via @lemondefr http://www.lemonde.fr/europe/article/2017/06/30/allemagne-le-parlement-autorise-le-mariage-homosexuel_5153475_3214.html…
Rocket fired from Gaza strikes southern Israel near border  http://www.haaretz.com/israel-news/1.797978 …
"Thank you @Bundestag @lsvd @Die_Gruenen for this day, for our success, for recognition &amp; equal rights. Also to supporters from @cducsubt"
# Marriage for all celebration in front of the Chancellor&#39;s Office. We celebrate this day &amp; bring our rainbows with you! 🌂🏳️‍🌈 pic.twitter.com/T3GIaDxrBs
🏳️‍🌈🏳️‍🌈🏳️‍🌈🏳️‍🌈🏳️‍🌈🏳️‍🌈dpa reports: &quot;Merkel releases vote on marriage for everyone in the Union faction.&quot; 🌈
"I hope that conservatives will also recognize the worth preserving from the marriage to be preserved: responsibility, not discrimination. # Marriage for All pic.twitter.com/aAv3KCsP3L"
"#EheFuerAlle fits the # Reformation anniversary &amp; thinks Luther&#39;s sentence to the end: &quot;Marriage is an external, worldly thing.&quot;"
Then she has a Darknet account with which she goes on a screenshot tour.
True https://twitter.com/arndhenze/status/880674028998021122…
# rainbow breakfast # chewy # ehefürall pic.twitter.com/paRuq7X5bv
"Tomorrow, on Thursday at 8.40 am, I will hold the last prayer of a member of parliament in this period in the prayer room of the German Bundestag."
DUDEN: SYNONYMS OF ACCEPTANCE: Recognition.
The stork
Today it is about ending the phase of tolerance and opening a new chapter: the era of acceptance. pic.twitter.com/rQ92apqAeB
It can&#39;t be that you have to force answers through organ charges at @AuswaertigesAmt. #iran #torabi https://twitter.com/volker_beck/status/879663406948769792…
Right at @radioeins # ehefüralle
?
"Good Morning! Today, the Bundestag decides whether to recognize lesbians and gays as people with equal dignity and rights."
@CDUCSUbt should take a stand against this disrespect @petertauber #ressentiment pur https://twitter.com/kudlaleipzig/status/879701985506676737…
She cheerfully spreads her tweet - because it is poisoned with resentment.
"@GrueneBundestag have submitted an application, but @cducsubt has not yet decided the consequences: http://dip21.bundestag.de/dip21/btd/18/127/1812784.pdf…"
"Playing minority concerns against each other is not a value orientation, but Trixi is happy."
"With the #Ehefueralle coming into force, life partnerships can no longer be concluded."
Thanks to @lsvd - the association that has carried out the same-sex marriage campaign since its inception. #EheFuerAlle
What do the two topics have to do with each other?
Interview on “Marriage for All”: “We have been waiting for this for so long” http://www.faz.net/-gum-8z9fn?GEPC=s3… via @faznet
Proponents have made a conscience decision: they are in favor.
You may keep your opinion. But don&#39;t impose discrimination on us.
Marriage for all: the fight for equality http://www.blaetter.de/lr97
#EhefuerAlle has cleared the first parliamentary hurdle - I&#39;m happy! https://www.facebook.com/VolkerBeckMdB/posts/10155527062382698…
Press statement after the legal committee: The first hurdle has been overcome. Ehe # EheFürAlle pic.twitter.com/GGzwHlNTZT
The majority of the legal committee recommended to the Bundestag to adopt the Federal Council&#39;s draft law on # ehefüralle.
# WhatsApp group: #Leaked # AfD chat becomes #topic in the #Bundestag http://www.handelsblatt.com/19988034.html?share=twitter…
The Federal Government is obliged to provide truthful and complete information. @AuswaertigesAmt where&#39;s the answer? #torabi #iran pic.twitter.com/KGl1EU9VH2
The legal committee meeting for #EHEFUERALLE begins and no adjournment is made. pic.twitter.com/JzQyQHsXwO
"There&#39;s a little #Candystorm 🍭🍬🍡 #Ehefueralle 🌈🌈🌈🌈Thank you very much ’in my timeline, but we still have to win."
&quot;Marriage bans are a history of exclusion&quot; http://www.wz.de/mobile/home/politik/inland/volker-beck-eheverbote-sind-eine-geschichte-der-auslimung-1.2463307… @wznewsline
The &quot;centuries-old understanding of marriage&quot; that Bishop Koch speaks of included the oppression of women. #justsaying # ehefüralle
Colleagues to what extent?
"Dear colleagues, now all supporters must be on board at # Ehefüralle on Friday. This historic opportunity must be seized."
@Kahrs relaxation! It is crucial that the majority also stands for # ehefüralle on Friday.
Think small
What says @AuswaertigesAmt : @UNIFIL_  UN Interim Force in Lebanon is turning a blind eye to Hezbollah’s actions. http://www.haaretz.com/israel-news/.premium-1.797469 …
Errant fire from Syrian war hits Israeli Golan Heights; none hurt   http://www.haaretz.com/israel-news/1.797568 …
If # BDS-whine about boycott #genaumeinHumor https://twitter.com/pbahners/status/878556832175935488…
On my Facebook page
"Congratulations, but what&#39;s that?"
"With a slight @Volker_Beck obsession @PBahners tries to emancipate the hatred of Israel, the Jewish &amp; democratic state. https://twitter.com/pbahners/status/878522166962266113…"
With our decision &quot;No coalition without # Ehefüralle&quot; we put the other parties under pressure. Nice legacy!
And who invented it? Christian Lindner: No coalition for everyone without marriage http://www.queer.de/detail.php?article_id=29125… via @queer_de
"I&#39;m not gone, but not in the Bundestag from October."
You seem to have missed the fact that there is a Jewish faith and a Jewish people.
»Anti-Semitism in Germany« https://detektor.fm/gesellschaft/antisemitismus-bericht-deutschland… via @detektorfm
Are you the better Jew than the Israeli Jews? And what does Zionism have to do with killing?
There is at least one &quot;supposed&quot; missing from race. But of course the Nazis also used anti-Jewish motifs in their propaganda.
Noisy for Israel #Antizionismus is #Antisemitismus 2.0 http://www.juedische-allgemeine.de/article/view/id/28919… #JuedischeOnline
"I like it when school classes visit church, synagogue &amp; mosque"
Can anyone identify the Ayatollahs?
"Yes, and yet these invented breeds of race biology do not exist."
Whether visiting a mosque or swimming lessons - parents have to respect the educational mission! #rendsburg
Can the @AfD_Bund say what he wants to say with it? I can see no non-anti-Semitic sense in it. https://twitter.com/juedischeonline/status/878235017427558400…
Al Kuds Day: Protests against anti-Israel demo in Berlin (via @berlinerzeitung) http://www.berliner-zeitung.de/27849644?dmcid=sm_tw…
Mimimi
#amisraelchai speech on #noalquds. Against anti-Zionist agitation on Berlin&#39;s streets! pic.twitter.com/aIjqWChHl6
"Experts warn of hatred of Jews and agitation at the &quot;Al Kuds Day&quot; With the @ARD you ask, does it always have to be projective? https://www.morgenpost.de/211006093?__pwh=yRtHrH2DfjwtncXE9CFvbg==…"
You were wrongly convicted?
"I would like to thank @gruenenrw for the trust and the opportunity to serve as a member of parliament for 23 years. From October, it will be free to go to new banks. https://twitter.com/gruenenrw/status/878177328282644481…"
"If you still have doubts about the character of #BDS, hopefully this will teach you: http://www.bz-berlin.de/berlin/mitte/holocaust-ueberlebende-an-humboldt-uni-niedergebruellt… #respektlos #antisemitismus"
Today my lecture on the 70th anniversary of the AKR Berlin &quot;Religious Peace in the Multicultural City&quot; http://site.akr-berlin.de/index.php/component/dpcalendar/event/14…
"Pörzgen and Blüm are, of course, also party as non-Jewish Germans on the subject"
. @ BMI_Bund @Telekom_hilft can you perhaps turn this practice off? https://twitter.com/ercankarakoyun/status/877894557123448833…
Speech from yesterday Volker Beck: Anti-Semitism in a cultural baggage http://www.wz.de/home/kultur/volker-beck-antisemitismus-im-kulturellen-gepaeck-1.2460189… @wznewsline
Against hatred of Israel on Berlin&#39;s streets! https://mobile.twitter.com/home?status=Berlins%20Nahostkonflikt%20 https://www.zitty.de/berlins-nahostkonflikt/…
"After 7:00 p.m. I give a speech on rehabilitation 175s. If @spdbt doesn&#39;t speak to # Ehefüralle, it will be my farewell speech."
This was asked in the @maischberger show. #antisemitism is not project-like either.
"Are there # Sweden criticism, # Russia criticism or # USA criticism? Or do you criticize #Trump or #Putin?"
We expect clear statements from @sigmargabriel &amp; @AuswaertigesAmt. Dialogue needs a point of view. https://twitter.com/jufodig/status/879254705637138433…
"&quot;Mr. Seehofer, treat the question as a question of conscience and release the vote.&quot; Http://szo.de/_arid,10690833"
Seehofer&#39;s statements on marriage for all are the screamer: Keep marriage out of everyone for party politics http://www.queer.de/detail.php?article_id=29138… via @queer_de
The religious policy spokesman leaves - last Bundestag week for Green politician Volker Beck https://www.domradio.de/node/248906
That is very nice. But: I&#39;m not that big of a footballer.
What invitation?
Jewish Agency cancels dinner with Netanyahu in protest of Western Wall egalitarian prayer space freeze http://www.haaretz.com/israel-news/1.797828 …
The ban is a clear breach of the ECHR - unlawful
"Israeli army readies for flare-ups ahead of works on Lebanon border wall
 http://www.haaretz.com/israel-news/.premium-1.797786 …"
Now be careful that the enemies of democracy like you don&#39;t feel here too
Wish you a blessed festival at the end of Ramadan. Eid Mubarak. Ramazan Bayramı Mübarek Olsun. 🌙 pic.twitter.com/C8RyarekjK
Rubber bullets on demonstrators: police stop gay parade in Istanbul http://www.n-tv.de/19905863 via @ntvde
And my questions about it were still not answered truthfully and completely https://twitter.com/ajcberlin/status/878295254369042432…
"Danke, Toda, Thanks. https://twitter.com/queer_de/status/878960913151164416…"
Democratic organizations of German Turks should use #Istanbulpride for the right to demonstrate http://www.queer.de/detail.php?article_id=29128…
"Dear @zeitonline, how about a new comment? #theweekafter https://twitter.com/zeitonline/status/876453921195216896…"
Turkey is increasingly developing into a clerical-authoritarian republic. This is a violation of the ECHR. https://twitter.com/queer_de/status/878622431778414592…
"In the end, every Muslim believer decides for himself what he thinks is Islamic or un-Islamic. #religiousness https://twitter.com/Volker_Beck/status/877824431216893952…"
Ibn Rushd Goethe Mosque: Turkish authorities criticize church as &quot;un-Islamic&quot; (via @berlinerzeitung) http://www.berliner-zeitung.de/27838060?dmcid=sm_tw…
It was a festival of self-righteousness and it wasn&#39;t about #antisemitism. Is there anything else coming? Would be a topic @maischberger @wdr https://twitter.com/christian_buss/status/877781379412447232…
Anti-Semitism debate: Germany still underestimates hatred of Jews https://www.welt.de/politik/deutschland/article165807742/Deutschland-unterschaetzt-den-islamisten-Judenhass-noch-immer.html?wtmc=socialmedia.twitter.shared. web… via @welt
"UN was driven out, 1,000 tanks &amp; 100,000 soldiers rolled towards Israel. It couldn&#39;t have defended itself in the sea."
are you going to Al Quds Day with these people?
Did you criticize Ayatollah? Can&#39;t remember
I was able to observe their relationship to human rights in the Blue Mosque. Silence in hymns of praise for the Iranian death penalty.
I even spoke on one yesterday. Probably doesn&#39;t fit your worldview.
"The Shoa a purely German narrative? What is the Grand Mufti doing with Hitler, Frau # Pörzgen? pic.twitter.com/aDP0KBjZ8g"
"#Auschwitz was not in Germany, Ms. # Pörzgen. In Poland, the German murder of the European! Jews organized #maischberger"
"Anyone who talks about 50 years of occupation, but remains silent for more than 50 years of the 6-day war and attack on Israel, is making history. #maischberger https://twitter.com/Volker_Beck/status/877661380538765312…"
"At an infinite number of events spanning 50 years of occupation, Ms. Pörzgen, as the grande lady of the counterfactual, claims that she doesn&#39;t exist."
#Maischberger Friday is the next anti-Israel Al-Quds Day in Berlin https://www.facebook.com/events/213390062499687/…
Why was nobody invited to @maiscbberger by the Independent Commission of Experts #Antisemitism? Too close to the topic?
Is @maischberger still about #Antisemitism?
"At the #Tutzing academy, Ms # Pörzgen simply didn&#39;t tell the truth, but does she blame others for an agenda? #maischberger"
"# EheFürAlle blocked 30 times: If the SPD does not take the last chance, it should catch up with its rainbow flags. http://www.volkerbeck.de/2017/06/21/ehe-fuer-alle-zum-30-mal-blockiert… pic.twitter.com/EsWekZf8ZO"
# Ehefüralle was adjourned for the 30th time. Dear @spdbt 1 chance you still have. Otherwise @cducsubt &amp; @Spdde can take the #CSD free.
"I do not wish her death, only the death of hatred in her ❤️ May she find peace."
"What&#39;s going on there, dear @ARD? @ARDpresse I would appreciate an explanation. https://twitter.com/joergmgehrke/status/877212837529210881…"
"In a non-criminal sense, that&#39;s incitement - this wicked old, hateful woman. @steinbacherika https://twitter.com/queer_de/status/877137404880203776…"
The compensation is also insufficient - §175: Federal government restricts rehabilitation in the last second http://www.queer.de/detail.php?article_id=29093…
Does @NZZ want to contribute to Pro &amp; Contra anti-Semitism? Result Open? https://twitter.com/nzz/status/877075960868286464…
?
the party political blockade must be broken. So there are also specific addressees
"After all, &quot;the project of same-sex marriage&quot; simply goes over the lips of the judges: change of meaning? https://twitter.com/BVerfG/status/877066482626199553…"
soon on the page of @BVerfG
Marriage for everyone will come. Because anything but equality is discrimination. https://twitter.com/Volker_Beck/status/877061544395276288…
Application by @BVerfG rejected: @spdbt must act now! Ms. Merkel release the vote! https://www.facebook.com/VolkerBeckMdB/posts/10155492897112698… #Ehefueralle
😕
Curious; excited.
The SPD should also consider this: &quot;The CDU would never let a coalition fail because of &#39;marriage for all&#39;&quot; https://detektor.fm/politik/die-gruenen-verabschieden-wahlprogramm…
"Appropriate would be, for example, representatives of the Wuppertal synagogue, the parents of the Friedenau school boy https://twitter.com/volker_beck/status/876912384929038336…"
"Broder spins or @WDR? It can&#39;t be serious, can it? http://www.achgut.com/artikel/wdr_der_auflauf_der_kandidaten…"
Has not been so confirmed in the processing - well
From &quot;basic Christian belief&quot; for marriage for everyone http://www.queer.de/detail.php?article_id=29076… via @queer_de
LSVD calls for a demonstration against Quds March on http://www.queer.de/detail.php?article_id=29082… via @queer_de
After three years there is now a rapporteur discussion on the subject of antigypsyism: http://dip21.bundestag.de/dip21/btd/18/019/1801967.pdf…
". @ Die_Gruenen must be part of the next federal government, says @queer_de Programs are written with courage. http://www.queer.de/detail.php?article_id=29079…"
I really don&#39;t want the @spdbt to secure the majority for @cducsubt&#39;s stance against # Ehefüralle next week. https://twitter.com/queer_de/status/876702868207566848…
"Talk yes, but with a view @AuswaertigesAmt @sigmargabriel: no normalization with the enemies of Israel! https://twitter.com/ajcberlin/status/879583795443372033…"
"Everything that is not marriage, is less binding or is in competition with marriage must be put in a worse position."
That would again be clearly unconstitutional
# Ehefüralle - Why Merkel suddenly no longer walls &amp; @The_Green have won. http://sz.de/1.3562532
The Federal Constitutional Court has already said otherwise. A change is possible and it has occurred.
Now at the event for Tim Pröse # centennial witnesses #neuss pic.twitter.com/kKxU56Wew3
"If @CDU does not want to screw up its constituency candidates&#39; chances in wobbly direct constituencies, it will #emove all this week"
@BVerfG asks whether &quot;gender differences ... formative meaning&quot; or whether there has been a fundamental change in understanding
"sad if a conservative party cannot recognize the value of marriage as such. Marriage is for the spouses, not for the state. https://twitter.com/queer_de/status/876430893778223109…"
"If you want, you can: Schulz wants quick voting on marriage for everyone http://www.mdr.de/nachrichten/politik/inland/reaktionen-auf-merkels-kurswechsel-bei-ehe-fuer-alle-100.html…"
Tonight 7:00 p.m. in Neuss at @ErzbistumKoeln https://www.facebook.com/tim.prose.90/posts/10209743700536879…
After Merkel&#39;s repositioning: there is enough conscience for everyone. Already in the 18th parliamentary term. # ehefüralle
Why Wolfgang #Bosbach is wrong with the # germ cell theory &amp; no to #Ehefueralle: https://www.facebook.com/VolkerBeckMdB/posts/10155486977542698… #grundgesetz
would be grateful for information about the outcome
"Mr. Ramsauer, this is not a legitimate wish in a parliamentary democracy: &quot;I don&#39;t want the issue at all in the Bundestag&quot;."
We already had a hearing.
"A new bill would need two readings, so it would be nothing in the 18th parliamentary term."
We have a Federal Council bill. That is in the legal committee &amp; only has to be decided now http://dip21.bundestag.de/dip21/btd/18/104/1810485.pdf…
End discrimination against Jews on retirement! Also an equality question: what is German? https://www.taz.de/Archiv-Search/!5421152&amp;s=nora+belghaus&amp;SuchRahmen=Print/…
Marriage for all: Green politician demands immediate vote from Merkel http://www.faz.net/-gpf-8z770?GEPC=s3… via @faznet
"Then let&#39;s just do it, dear @spdbt @cducsubt, or where should you look for permission? #Ehefueralle https://twitter.com/stefankaufmann/status/879434811961741313…"
Do you think Muslim parents should take their girls out of swimming lessons? I think wrong.
"# MarriageForAll this week: Ms. Merkel, release the vote! #LoveisLove http://www.volkerbeck.de/2017/06/27/merkel-will-machenensentscheidung-zur-ehefueralle-dann-noch-diese-woche-abstimmen/… pic.twitter.com/ZROWfc7KRu"
"I am with you in spirit. Wish success, peace, strength &amp; fun."
Then only @Die_Gruenen remains for #LGBT ... https://twitter.com/queer_de/status/875786572544843778…
Nobody has asked me yet
Super - It was worth it: &quot;Chosen and excluded - The hatred of Jews in Europe&quot;: The first shows AR ... http://ots.de/37e0b1
WarI was there for the first unsuccessful attempt under the old regime. I&#39;m happy about democratic progress 🌈🌈🌈🌈 # Kyivpride https://twitter.com/rebharms/status/876380369355931649…
🌈🌈🌈🌈🌈Greetings and Congratulation to everybody at #Kievpride 🌈🌈🌈🌈🌈
the gender difference in marriage no longer has any formative significance.
but after the election the media wouldn&#39;t care. Only the attack on @Die_Gruenen in the election campaign makes it interesting.
"@polizeiberlin Is this authentic or fake? What was the background, if any? https://twitter.com/cesurmilusoy/status/876119790296981504…"
"Complicated: As Qatar crisis rages, Egypt gets closer to Hamas
 http://www.haaretz.com/middle-east-news/egypt/.premium-1.796155 …"
Palmer as a victim? Really?
"Chapeau, that has style. On our own account - front page: That went wrong - taz.de http://www.taz.de/!5421768/"
"# ehefüralle ⚣⚢ SPD with backtrack, Greens with promise - blu hinnerk gave rik Leo http://www.blu.fm/aktuell/ehe-fuer-alle-gruene-spd-wahlkampf/…"
that&#39;s why we didn&#39;t graduate.
# Ehefüralle - you can rely on @Die_Gruenen # Politikfür83% http://spon.de/aeZ06 via @SPIEGELONLINE
Wow - so many! Great! https://twitter.com/Nicht_Mit_Uns_/status/876048556179771392…
Does @spdde get the majority for a no? Bernd Fabritius: I vote for marriage for everyone http://www.queer.de/detail.php?article_id=29047… via @queer_de
Helmut Kohl has died. His commitment to Europe remains unforgettable. RIP
Ramadan Peace March in Cologne: Not in the Name of Islam - taz.de http://www.taz.de/!5417959/
Which hafner? Which colleagues?
Planned demo in Cologne: parties criticize Ditib for canceled participation (via @berlinerzeitung) http://www.berliner-zeitung.de/27801062?dmcid=sm_tw…
Attack: Intercultural center thrown with raw eggs &amp; who thinks this is an argument for what? (via @mzwebde) http://www.mz-web.de/27802226?dmcid=sm_tw…
"PFLP, Hamas or IS? - Jerusalem: IS and Hamas claim attack on Israeli police officer for themselves http://spon.de/aeZ0C"
"Federal government continues against marriage for all. Regardless, the only thing that counts is http://www.queer.de/detail.php?article_id=29067… via @queer_de"
ARD shows anti-Semitism documentary on Wednesday - good thing! https://www.facebook.com/VolkerBeckMdB/posts/10155483732222698…
For social cohesion! https://twitter.com/lamyakaddor/status/875972463645118464…
In Wittenberg to the #Reformation https://twitter.com/r2017org/status/875328450671910912…
"Yes, a website that made a career in the legal commentary."
Despite @Ditib criticism: Central Council calls Muslims to anti-terror demonstration on http://spon.de/aeZUI via @SPIEGELONLINE
Interview with Volker Beck: &quot;I don&#39;t see the FPD as a civil rights party&quot; (via @ksta_news) http://www.ksta.de/27796960?dmcid=sm_tw…
Turkish association: Ditib sees in Cologne march against terror &quot;capture&quot; - politics - Tagesspiegel Mobil - http://www.tagesspiegel.de/politik/tuerkischer-verband-ditib-sennt-in-koelner-marsch- Gegen-terror-vereinnahmung /19935910.html…
