90 minutes to choose. Let&#39;s go #Brandenburg and # Thuringia! #ltwbb #ltwth
@anked All questions about # fk14 please to @GrueneBundestag
All documents on the voting behavior of the green-governed countries in the Federal Council can be found at http://www.gruene.de/ueber-uns/asylrechtsreform-abstimmung-im-bundesrat.html…
The green federal women&#39;s conference (# bfk14) meets in #Berlin on Saturday. We cordially invite all women to participate: http://www.gruene.de/ueber-uns/zeit-aus-der-rolle-zu-fallen.html…
Tomorrow in over 2000 mosques: &quot;Muslims stand up against hatred and injustice&quot;. We are in the Mevlana Mosque in Berlin.
@Werder_LE We are against TTIP in its current form. Here is our article on rejecting the European citizens&#39; initiative.
.@Schmidtlepp  https://www.gruene.de/ueber-uns/hier-kannst-du-direkt-mitglied-werden.html …
Quickly save the world on Sunday? Demo in #Berlin and on five continents: https://greenpeace-berlin.de/termin/mal-schnell-die-welt-retten/… #PeoplesClimate
In preparation for # fk14 we read &#39;Freedom is Green&#39; and other contributions to the program debate: https://www.gruene.de/debatte/rechte.html…
We are at the @GrueneBundestag Freedom Congress # fk14 tomorrow. Info and #Livestream: http://www.gruene-bundestag.de/fraktion/der-gruene- Freiheitkongress_ID_4392628.html…
"Trust is good, # animal protection is better! Against #Massierhaltung RT! http://www.br.de/nachrichten/tierschutz-landwirtschaftsminister-schmidt-100.html… pic.twitter.com/QhdL9I0agc"
Congratulations to @GrueneBBG and @Gruene_TH for the successful election: https://www.gruene.de/ueber-uns/ein-gutes-wahljahr.html… @peter_simone #ltwbb #ltwth pic.twitter.com/EklFnWVgft
Stand up against anti-Semitism! In an hour at the Brandenburg Gate. http://www.gruene-bundestag.de/themen/innenpolitik/aufstehen- Gegen-antisemitismus_ID_4392876.html… #stehauf
Choose green against right! Today in #Brandenburg and # Thuringia. #ltwbb #ltwth
Green blog on the hearings. @Gruene_Europa put new EU Commission to the test: http://gruenlink.de/tiz # ephearings2014
Stand up against anti-Semitism! Today at 3 p.m. at the Brandenburg Gate in #Berlin. http://www.gruene-bundestag.de/themen/innenpolitik/aufstehen- Gegen-antisemitismus_ID_4392876.html… #stehauf
#CETA? #TTIP? Not like that! #Free trade must not undermine the rule of law. http://www.gruene-bundestag.de/themen/freihandel/keine-klageprivilegien-fuer-konzern_ID_4393005.html… pic.twitter.com/MWGJz9Azkt
On October 2nd to 5th in #Berlin? Then come to the # WirHabenEsSatt congress: http://www.wir-haben-es-satt.de/start/2-5-okt-kongress-berlin/…
We congratulate Edward #Snowden on the Alternative Nobel Prize! A good and pioneering choice. pic.twitter.com/p5gWYQg2IS
Now it&#39;s up to you: Choose Brandenburg and Thuringia. Get out of bed and into the polling station! #ltwbb #ltwth
We wish everyone who celebrates #RoshHashanah a happy new year 5775! pic.twitter.com/iAC63gbpEP
"Instead of fighting #climate change at the climate summit, #Merkel meets with the industrial lobby today. # Climate2014 pic.twitter.com/O2ZlKfmVLS"
State election in Austria # vbg14: Congratulations @GrueneVlbg on the historically best election result! http://gruenlink.de/tg3
Solidary greetings from # bfk14 to the alliance http://www.sexuelle-selbst determination.de/ &amp; the demonstrators at the Brandenburg Gate. pic.twitter.com/FyFzCkTyHP
"Get up against #hate hatred! 14.9. at 3 p.m. rally at the Brandenburg Gate, Berlin. Go there! http://gruenlink.de/t8p"
"Today in #Bundestag we commemorate the victims of World War II, which began with the attack on Poland 75 years ago. pic.twitter.com/6s2JgLAIEh"
"Expose TTIP! Since the espionage affair, the hope for transparent and fair negotiations has finally vanished. pic.twitter.com/bLxRFALl0C"
Germany is world champion! A fantastic performance by the team! Congratulation!! #gerarg # WM2014 pic.twitter.com/FfGKnMUmkz
"The CSU- # toll is a bureaucratic monster, unfair, economically nonsensical and harmful to Europe. http://www.gruene-bundestag.de/themen/verkehr/dobrindts-kleinstaatlicher-wegezoll_ID_4392425.html… pic.twitter.com/z5vdiMraaC"
What is @JunckerEU planning? @gruene_europa discussed with him on Wednesday. Be part of the LIVESTREAM: http://gruenlink.de/s8o #junckertest
The #GroKo in the Bundestag rejected an exit from coal power. Climate protection goals cannot be achieved in this way. pic.twitter.com/U3LW7Pavp7
State elections are coming soon. @GrueneBBG presented their campaign. http://gruene-brandenburg.de/startseite/single-news/article/gutes_morgen_brandenburg/…
TV tip: Now @IreneMihalic as a guest at @AnneWillTalk at @DasErste. Livestream: http://www.ardmediathek.de/tv/live?kanal=208…
These are the losers of the #GroKo pension reform: http://www.gruene-bundestag.de/themen/rente/die-verliererinnen-und-verlierer-des-rentenpakets_ID_4392284.html… pic.twitter.com/GRn3opyFKm
It&#39;s about our freedom! On to the demo next weekend # FSA14 pic.twitter.com/bZ1nGtzK8A
Movement in Lusatia. Thousands signal the coal phase-out. #humanchain http://www.gruene.de/themen/energiewende/bewegung-in-der-lausitz-tausende-machen-zeichen-fuer-den-kohleausstieg.html…
Green final spurt in the state elections. # ltwth14 #ltwbb #ltwsn http://www.gruene.de/ueber-uns/endspurt-bei-den-landtagswahlen.html…
The green campaign against coal is on. A first overview just before the human chain. http://www.gruene.de/themen/energiewende/gruene- Actions- Gegen-die-kohle.html…
Merkel&#39;s chaos in the energy transition. Violent criticism from the Federal Audit Office. http://www.sueddeutsche.de/wirtschaft/bundesrechnungshof-miese- Noten-fuer-merkels-energiewende-1.2095086… via @SZ
Against #Homophobia in football and everywhere! Strong video from @GHvC_News: http://youtu.be/-qOg8E4Tzto #dertagwilldommen
The #CSU wants to close the borders to lock out # refugees. Help instead of limits! http://www.spiegel.de/politik/deutschland/asyl-csu-macht-vorschlaege-zur-fluechtlingspolitik-und- Grenzkontrollen-a-990500.html… pic.twitter.com/MHW75rBltq
CDU board #Laschet: I consider the #toll extremely harmful &amp; legally impossible. http://www.rp-online.de/politik/deutschland/armin-laschet-nennt-die-maut-schaedlich-und-rechtlich-unmoeglich-aid-1.4404399… pic.twitter.com/tBFMWRSc49
"On the day of humanitarian aid, we ask for your help for people in need. http://www.drk.de/spenden/spendenmoeglichkeit.html…"
Together against #coal! Come to the #Lausitz on August 23: http://www.gruene.de/menschenkette- Gegen-kohle… Now RT! pic.twitter.com/0kZil7V9CA
In any case follow: @GrueneBBG @gruene_sachsen and @gruene_th! #ff #followfriday # sltw14 # ltwbb14 #ltwth
Sows would choose @GrueneBBG! Against # factory farming in #Brandenburg and everywhere. # ltwbb14 pic.twitter.com/RbOHgOmch9
# Thuringia votes on 14.9. and can do much more: http://youtu.be/5YrvBCQu6ng # MachEsM Possible #ltwth
Greens stay in! Congratulations to @gruene_sachsen for re-entering the state parliament. Bitter is the strong result of the right-wing parties.
Another hour to vote! #Saxony! Here we go! # sltw14 pic.twitter.com/l7pJuUr86Q
"Previously low turnout in #Saxony. Democrats, go vote and throw the Nazis out of the state parliament! Best @gruene_sachsen. # sltw14"
"For real energy transition &amp; climate protection, against right &amp; factory farming: choose green today in #Saxony! # sltw14 RT! pic.twitter.com/84IExri0Yt"
"Dear #Saxony, tomorrow it applies: Throw Nazis out of the state parliament and choose strong @gruene_sachsen! # because it is possible # sltw14"
"While the federal government is sleeping, we continue to fight for freedom online. #timefree # fsa14 pic.twitter.com/ZGOVYoxVLB"
At 2pm: We demonstrate against surveillance in #Berlin. Information here: http://www.gruene.de/ueber-uns/demo- Freiheit-statt-angst.html… # fsa14 #zeitfuer Freiheit # Freiheitstattangst
Follow the top candidates @AntjeHermenau &amp; @VZschocke today and vote in #Sachsen @gruene_sachsen on Sunday! # sltw14 #ff #followfriday
Who will come to the # FreiheitStattAngst demo in #Berlin tomorrow? http://www.gruene.de/ueber-uns/demo- Freiheit-statt-angst.html… # fsa14 #ZeitfuerFreiheit pic.twitter.com/2JDJGmmlOK
"For us, freedom is part of a liberal drug policy. Therefore: decriminalize #Cannabis! #LegalizeIt pic.twitter.com/5Tn42rdVaQ"
Our freedom is untappable! On Saturday for the demo after #Berlin: http://www.gruene.de/ueber-uns/demo- Freiheit-statt-angst.html… # zeitfür Freiheit pic.twitter.com/YLwQslIUvW
. @ MatthiasMeisner One thing is certain: the sows in #Brandenburg need @Die_Gruenen. Keyword # mass animal husbandry: http://gruene-brandenburg.de/startseite/single-news/article/vorschlag_fuer_tierschutzgesetz_tieren_unnoetiges_leid_und_qualen_ersparen/…
"On August 31st, elections will be held in #Saxony. Try the @wahlomat now! https://www.wahl-o-mat.de # sltw14 #Wahlomat"
On August 23 to the #human chain against #coal in the Lausitz! All information: http://www.gruene.de/themen/energiewende/menschenkette- Gegen-kohle.html…
We wish everyone a blessed # Ramadan festival! pic.twitter.com/IjFvEANpA3
A step towards decriminalization: court allows seriously ill people to grow cannabis. http://spon.de/aehGO pic.twitter.com/C8NdlPJu9m
After the espionage affair: Malte Spitz analyzes the German-American relationship. http://www.gruene.de/themen/justigkeit/massenueberüberwachung-ist-keine-freundschaft.html…
@FEchelmeyer Hello Franziska. Here is the statement by the Berlin Greens from yesterday afternoon: https://www.facebook.com/Buendnis90DieGruenenBerlin/posts/690289941006500…
Register now: 4th network policy soirée on the surveillance and secret service affair on 3.7. in #Berlin: http://gruen-digital.de/2014/06/save-the-date-vierte-netzpolitische-soire-zur-ueberwachungs-geheimdienstaffaere-am-3-juli-2014-in-berlin/… # nps14
