Some whites are so racist that they don&#39;t even consider non-whites capable of racism. What does that actually mean when you only allow “whites” to have certain (also negative) social behaviors? https://twitter.com/zeitonline/status/1197199142273064963…
I find that really progressive only when same-sex but cross-religious marriages take place there; with Muslim participation.
"In any case, cause for further research. Thank you!"
You will find it here. https://www.welt.de/geschichte/article113867642/RAF-Terror-wucherte-aus-dem-Geist-des-Judenhasses.html…
"Doesn&#39;t bother me either. I feel totally numb. I just don&#39;t have to accompany the nonsense therapeutically, a psychologist should do that."
"If you ask me, I think it is a welcome measure. It works in my direction."
"From me, you should let transgender people play along. Honestly, I am amused. I also suspect how such absurdities have a social impact. 1 Transgender in women&#39;s football easily makes 100 angry new opponents of this idiotic gender ideology."
Klein-Zoe doesn&#39;t know the difference.
"Why Apocalypse? Honestly, I would even watch women&#39;s football just to have fun. But I don&#39;t count that under sport."
But they were “only” doped.
 https://www.tz.de/sport/fussball/frauen-maenner-fussball-gross-unterschied-wirklich-zr-1296331.html …
"Honestly, they smoke completely normal, freely tradable plastics in the n-tv editorial office. https://twitter.com/ntvde/status/1196896437923020800…"
"Honestly, after 14 years of existing Merkel Chancellorship (without an accent from the CDU party program), I would have given up any debate within the party. So hats off, Sisyphus! https://twitter.com/BILD_Politik/status/1196725907597250562…"
Almost too much praise.
It is actually inconceivable that he does not get the template into the goal with a funny counterattack.
"Well, @saschalobo would now say that &quot;there are attitudes that have no place in the discourse of liberal democracy&quot;. https://twitter.com/DLFNachrichten/status/1196889985930203136…"
@DLFNews denounces Stalinist methods here. 👍 https://twitter.com/DLFNachrichten/status/1196521217362210821…
Bullshit rhetorical question. 😜
"Ok, then the AfD is at the intra-party level of discussion from the beginning of 2016."
"It is interesting in this context that de Maizière, as a close confidant of Merkel, suddenly did not become a minister in 2017. https://twitter.com/manuelbewarder/status/1196876587586801665…"
Is it appropriate for the species?
"You could now say: let it be, it&#39;s just &quot;women&#39;s football&quot; that is broken. Understand the left."
"Do you realize that differences in performance in football, between men and women, easily make up 5 leagues?"
"Unfortunately, absolutely conceivable in Berlin."
The question alone should be enough for a medium-sized shit storm. Are you lucky that everyone is currently busy with Don Alphonso.
Probably a measurement error. Typical skills shortage that needs to be remedied.
&quot;A team of researchers has now examined it using Denmark as an example and observed surprising things.&quot; Who is not surprised like the FAZ? https://m.faz.net/aktuell/wirtschaft/arm-und-reich/princeton-studie-sozialleistungen-locken-zuwanderer-16492033.html?fbclid=IwAR1Zr7QGytDMUGiCE7qJsizfvFj4q1uc20gz9Mw-7YX4lhZ5LeEgrlSMt
I also like this pluralism. &quot;What Parliament advocates&quot;! Incredible but completely common.
"Thank you, if only I could be earlier ... Oh, what the hell."
Exactly
"This is totally hammered. If a 120 kg boxer came up with the idea of fighting in featherweight, he would get into the slap and into no ring."
"Sorry, many times."
"Biologically male transgendered women are now allowed to play football in Berlin. It seems completely unknown that the separation of women and men in sport is about performance, i.e. it has the same reason as boxing weight classes."
Critically asked by the South German
They always hang out in these shabby dives. 🤷🏼♀️
"With your tweets today, you would like to know who ran into you."
I also ask myself questions. But they affect the OB. https://twitter.com/buerger18/status/1194628869774438401…
"He likes to do that. He did it for me in 2016, which was theoretically remarkable at the time."
crass
"Socialism is the result of people&#39;s lack of learning ability! Here please, causalities! https://twitter.com/die_gennburg/status/1194254234746806272…"
"Yes, he shows his attitude. But if he took a stand, he would be better off."
Image and text; considerable scissors in the statements. 😂 https://twitter.com/faznet/status/1194260068147040256…
"Cool, so only 4 month after everybody else has got their delegation leader, the libdems chose one as well?
And still you are head of delegation, not group leader."
"Yes, &quot;suffer&quot;."
"Otherwise my comparison would be stupid, wouldn&#39;t it. 😉"
"Incidentally, the labeling of Israeli goods from Judea and Samaria will suffer the same fate as the label &quot;Made in Germany&quot;. The range of goods is small and good. The friends of Israel are far more than the offer suggests."
Might cause more trouble than good. That should have been done before the Sinai was returned.
"Palestinian criticism of Israel! Finally, you have to consider that (fill in what suits best). https://twitter.com/DLF/status/1194145291290722304…"
"You can say thank you. Now don&#39;t question it critically. After all, anyone can do journalism, but only very few are allowed to report to the government! https://twitter.com/BeckerRainald/status/1193643949665247238…"
Emma is also becoming a conspiracy leaflet. 😉👍 https://www.emma.de/artikel/epstein-wurde-ermordet-337297…
Maybe one of my dutch friends can help.
I know that location. 😉
"The deputy federal chairman of the AfD. Entangled up to the neck in NPD networks, sponsored by Gauland. https://twitter.com/SabineamOrde/status/1192796445759430656…"
They wrote &quot;clever&quot;.
Quite right in a way and at the same time the best argument for Mr Gorus&#39; proposal.
Dumbledore is there too.
"But they were certainly not stupid enough to make him a member of the party executive, group leader and country leader."
"Yes, bad story. It won&#39;t work with me anymore."
"That‘s interesting, and i am not talking about grammar. pic.twitter.com/ljej7HFSQq"
Can&#39;t get any worse? I had thought that years ago. So wait and see!
The person has completely different problems if you ask me.
Pray? Isn&#39;t there something from Ratiopharm?
"Yes, we left! 😂😂😂"
I extreme left? I think that&#39;s kind of funny. https://twitter.com/GerdTomate/status/1192863011016511489…
"Sorry, if you are not a &quot;care and therapy case&quot;, maybe even have your own (different) opinion, you will still want to be deported very quickly. But is not meant racist. 🤷🏼♀️"
Upright walking in Europe? When was that supposed to be? It seems to me that he was buried here first.
"I&#39;m thinking about what it could be, but I can&#39;t figure it out."
"Yes, even in large numbers in the AfD."
Right
"There would have been good reasons not to vote for him, good reasons to vote him out later, but declaring “Judaslohn” anti-Semitic is already a heavy tobacco."
 pic.twitter.com/KA3xgGjlPl
He forgot me.
"We live in a crazy time in which I have to defend Lucke, Brandner and Springer journalists within a very short time. Can that stop please? I really don&#39;t want that!"
"Such a little auxiliary Erdogan. The real one locks them away right away, the Springer journalists. What&#39;s broken there? https://twitter.com/sixtus/status/1192209375412281345…"
"Tactics, it was all tactics. And it even opens! A stroke of genius."
I imagine he would have said that the beginning of mankind and the transition from ape to person did not take place in Africa but in the Allgäu.
"Let&#39;s be realistic, they are healed."
Hmmm ... So how am I supposed to explain it to you? BUT!
What would you like to have? All neighbors except Luxembourg are possible and realistic.
Insane https://twitter.com/AF_Will/status/1192411466311380992…
Difficult
Unfortunately limited to four? Holland?
France? Does anyone choose France here? Is that the new &quot;never again Germany&quot; in particularly nasty?
My thoughts
In view of the overall situation: which neighboring country should occupy us?
"From a legal point of view, this can certainly be true. Therefore, there is also paragraph 212 II of the Criminal Code, which provides for life imprisonment even for homicide."
They should be so stupid. You don&#39;t have that in your hand.
"Merkel has humps, Johnson has Corbyn. You don&#39;t have to be brilliant, it&#39;s enough to have an even worse-performing competitor to be elected. https://www.electoralcalculus.co.uk/homepage.html pic.twitter.com/4EI0uqrRBX"
"Höcke became state president against Wohlfahrth, supported by Lucke. No sow knew him then."
That is why his party friends are discussing cooperation with Höcke of all places. I would not have dared to predict it and would not have believed it myself.
As soon as it is liberal again.
Nobody was interested in 2016 and certainly not today.
But not you
"No, others in the AfD did that. Hardly anyone knows the real knockers. The reality today is worse than the image."
"Until the middle of 16 everything went like a train, then Meuthen was bought."
Frauke in particular played a lot with them.
The press is the best ally of the AfD !!! They are a gift!
"Long story, but to accuse Frauke of all people is pretty stupid."
"No, less. The illegal donations have massively destroyed. People were bought with it."
"D&#39;accord, what have you done to position the AfD well?"
Kärchern! Right in the spring!
"In the end, it has to be baptized for changes, so moving into a parliament is not enough."
It is entirely sufficient to process the asylum application extraterritorially and only to provide benefits in kind. Someone suggested that quite clearly in 2015.
Note: The BfV will certainly also receive information on left-wing extremism under this number. You will definitely be connected to the responsible department immediately. Right-wing extremism hotline +49 (0) 221/792 - 3344 #Servicetweet https://twitter.com/BfV_Bund/status/1188796974092427266…
Individual case pic.twitter.com/YffPDfDbFy
Chess matt!
"The Irish are Catholic, by the way."
"Yes, Irish US migrants! ☝️"
So you can eat
Looks like a pumpkin.
Glad if I can help.
And me! ☝️
People
Then Shmuel and you did not work the shadows cleanly while shopping.
The menace remains.
One must be almost grateful to Mr Miri for the debate after his asylum application. This is a more valuable contribution to solving the underlying problem than all political debates in recent years.
I think she understands that.
"Halloween is a pagan custom with names based on Christianity. The origin is the British Isles, especially Ireland. Of course, that has nothing to do with Islam."
Shhh! It&#39;s going right now and now you&#39;re going to ruin everything with your advice. 😉
I wasn&#39;t there. And YouTube doesn&#39;t offer videos from that time. But if you say that ...
"Ok, but what is the pumpkin mischief? The number of pumpkin farmers has not increased massively."
But that&#39;s the bottom end of &quot;clever&quot;. Something like that was taken for granted.
I&#39;ve documented umpteen times. The best thing to do is read his crazy book. There he writes down the crap himself.
"Almost, I don&#39;t dare to make a forecast."
"The stronger the result of the AfD in Thuringia, the more Höcke. You had to choose something."
If Polenz is overtaken on the left ... https://twitter.com/polenz_r/status/1188788049737633793…
I wouldn&#39;t choose Höcke anyway.
"Well, the truth is in the middle. Höcke is a national socialist and clearly totalitarian."
Höcke is a socialist. He writes it in his book; Overcome capitalism.
"For a deputy MP? Honestly? You can&#39;t be serious, @MikeMohring? Everyone has a price, sure, but so cheap?"
"Of course not, the star helped diligently, completely ignoring the effects."
"It is now said again that East Germany is special. If you look around Europe, West Germany is rather very special."
"That is still the decision of the acting person. You have no idea what was going on internally. And as an AfD supporter, you also don&#39;t want us to talk about it."
The FDP has 6%?
People could only make a difference if they could lead the party. But that doesn&#39;t work with the AfD.
Because it has nothing to do with people. The party has had a huge problem since the mid-16s. I&#39;ve been saying this since mid-16.
It&#39;s not about malice. It is about correct classification.
Why not: Why are you doing worse in October 19 than André Poggenburg in May 2016?
So it wasn&#39;t up to us.
"Lucke said of himself that he was not liberal. If he is not, he believes in the state."
You obviously don&#39;t know the party. There are two main currents: one profoundly socialist and one free market economy much more free than the FDP. The rest in between is a marginal.
Then just faster into the abyss; and of course also deeper.
Brave and right https://twitter.com/Gegen_die_AfD/status/1187449231373529088…
Nothing is good there.
Rhetorical question. 😉
Didn&#39;t they have so far?
"Yes, probably a leftist like Höcke. Socialists among themselves."
"No pity for Roth, zero. 😉"
"His remark is nonsense, but legally quasi unassailable thanks to Maier in the parliamentary group. Happens constantly in political discourse."
"Well, quark in this case. Höcker has advertised umpteen times on social media with the AfD mandates. And the &quot;letterhead&quot; can be found in great detail on the Internet. Incidentally, Höcker himself made such publications of letters. In that case, they were journalists."
"Yes, the trigger is loose."
Exactly wrong!
Very well. The same should apply to the left. https://twitter.com/georgloewisch/status/1187319688902172672…
"Augstein has bright moments, Restle does not."
So there are still brave students at the University of Hamburg. https://twitter.com/h0tnh0ly/status/1186939535999094784…
Others have known that for years. https://twitter.com/drumheadberlin/status/1186761076572147712…
I don&#39;t know how to use the positive term “guardrails” in this context.
Ideologists are surprised. https://twitter.com/SabineMenkens/status/1186505348976463872…
"Mr. Kuhle discovered freedom of expression, but at least late. https://twitter.com/KonstantinKuhle/status/1186370243167424519…"
"If you think Peter Handke received the Nobel Peace Prize, the article and survey make sense. Yours sincerely, your former quality newspaper. pic.twitter.com/XCpuYEzxaD"
"If you survive the first two days, it will happen."
😱😳🙈 Mad about what the media gibberish does with synapses. https://twitter.com/BILDamSONNTAG/status/1185802325513781248…
Today Lucke in the WamS. 😂👍 https://twitter.com/MarcusPretzell/status/1184420862159708160…
"First of all, I am concerned with the rape of the term market. A &quot;liberal&quot; party shouldn&#39;t do that."
"I like to explain it. Any form of political debate, whether within a party or externally, is anti-bourgeois in nature. With bourgeois behavior, you become a maximum of luggage carriers in politics and even that is difficult."
"Funnily enough, all parties in Germany want to be civil. Citizenship in politics is similar to prudishness in the porn industry; a disability!"
"I would not legally put too much emphasis on the AfD group. Politically, the statement remains silly anyway."
Then forget about the AfD and the FDP. There are still last twitches in the Union.
Got it!
Doesn&#39;t matter here either.
"Unfortunately, it is not the socialist AfD either."
Every now and then something slips through.
You have to praise the @Junge_Union. They seem to be developing something like profile under @ TKuban96. https://twitter.com/BenWeinthal/status/1184468831823159297…
"Yes, really bad. Escalation on all sides. What does the Lucke bring a gun to the lecture? https://twitter.com/Iron_Alf/status/1184475964505505792…"
One can be excited. https://twitter.com/tconnellyRTE/status/1184444300706353152…
Anyone who is a student at Hamburg University and has not got up for Lucke today should remain silent on the subject of fascism forever. https://twitter.com/AF_Will/status/1184434832224538624…
"I do not think so. Nazis are national socialists, and they remain extremely dangerous."
Just have it done. Germany is broken.
What Antifa wanted at Hamburg University today: Lucke really show where the hammer is. What Antifa has achieved today: put Lucke in the shop window of the Hamburg University and make him an interesting media contact again. 😂😂😂
University of Germany 2019 That&#39;s it! https://twitter.com/PhilippWoldin/status/1184418095764520960…
The sentence is the same nonsense as the Nszi charge against Lucke.
"No, they are students !!!"
"In fact, what I find remarkable is the always the same ugly sweater by Lucke. Quote from one of my sons (then 9) 2015: &quot;Did his mother knit his grandpa sweater for him?&quot;"
One hundred against a &quot;highly dangerous Nazi&quot;. You don&#39;t see that much civil courage very often. 😳
Mass deaths in Europe! Who does not know that? We really have problems ... https://twitter.com/SZ/status/1184411971921285121…
Patriotism! https://twitter.com/hatice_akyun/status/1183296508801748993…
"I just notice that Germany will therefore get its energy. It seems to me to be very stupid, no matter how you feel about nuclear energy."
Prantl wishes the coalition between CDU and SED Pfui Teufel! https://www.sz.de/1.4638874
"When police try to use physical force and maybe even tear gas to prevent border crossings and are dangerously attacked. By the way, that was the question I answered."
"I am satisfied with the current legal situation. I just want them to be applied. Firearm use is essentially theoretical. For 99% + of all illegal border crossings, you can easily deal with it."
Let run.
Victory is not my cup of tea. This is Höcke.
And without a weapon!
Of course not. A single policeman holds them up with one hand.
"No, I live from the spread. But it would be nice if you mentioned me by name."
Technical term is: ultima ratio
"No, I didn&#39;t write either. I spoke of violence, of massive violence. Everything else is solved differently."
I don&#39;t slide around there either because I have said the same thing a dozen times. Is my copyright from 2015 anyway. 😉
"He obviously doesn&#39;t know much either, otherwise he would know better."
Only where it is inevitable. What would you do if a woman tried to shoot Jews in front of her eyes in a synagogue in Halle? Wait? No shoot!
"No, I don&#39;t want anything. I don&#39;t want to shoot neo-Nazis in Halle either. But those who use violence get the right answer."
His book says worse than any journalist has ever written about him.
You will still be frightened by Höcke.
"No, he is elected for the same reason that the SPD is going down the drain. CDU and FDP no longer address their own clientele and shift the political coordinate system. That is the fatal thing."
Not bad https://twitter.com/faznet/status/1181650220523888640…
The police should only shoot at violent offenders. Just like yesterday in Halle. But of course also on violent offenders at the border. It is not for nothing that this means state &quot;violence&quot;!
At most to the limit.
"Exactly, without deaths and much more gently than Erdogan&#39;s invasion."
"Like at the Hungarian border? No, the determination alone to prevent crossing the border is enough."
"Instead of the German car industry, you should smash this monster! https://www.bild.de/digital/internet/internet/medien-bericht-hat-amazon-heimlich-kunden-beim-sex-gefilmt-65280636.bild.html…"
"Incidentally, the Kurds in northern Syria are dying because the EU as a whole and Germany in particular are unable to protect their borders. Erdogan&#39;s trump card is the “refugee deal” and 3.5 million refugees. Foreign policy by and for dummies."
This is no longer necessary since Obsma.
"It is significant that the Central Council of Jews, as a primary target of the attack, gives the victims a face in front of almost all German politicians. Thank you! https://twitter.com/ZentralratJuden/status/1182583669669670913…"
"For comparison: If someone tells me that he is a Christian and wishes me a Merry Christmas on December 6th, then I get a strange feeling."
Not my competence. But I know with certainty that some of the simplest basic cultural concepts of Judaism are not familiar.
Perfect! 65 years of silence is the end of the world. He can now demonstrate in space. https://twitter.com/welt/status/1182598994377265152…
"Exactly, some people thought that. ;-)"
Including people who the wing introduced there as &quot;Jews&quot;.
Who says voters are to blame?
There is also something there.
"As someone who has experienced this very directly, I tell you that you are as wrong as Lauterbach. Both currents wrestle with each other."
That too.
"With reference to the life performance of the Cubans, some Germans still wear the portrait of a former minister, mass murderer and war criminal on their T-shirts."
Astray on all sides. https://twitter.com/drumheadberlin/status/1181430297977589760…
"You forgive my missing subscription, even if it would be worthwhile for some of your articles."
👍👍👍
And why are Europeans unable to act? That is the even bigger hammer! Turkey deal is the magic word.
I suspect very strongly.
"What do you say to the Berliners, whose MPs have just given the Left Party an additional € 2,500? Running in Berlin? Or rather sick system?"
"Nothing really works in Berlin, but the MPs in the House of Representatives treat themselves to an additional € 2,500. The Left Party was of course there. The Berlin system is totally sick. https://twitter.com/DietmarBartsch/status/1181548205697359872…"
"Everything speaks against a primary election, usually! But the CDU has never been so difficult AKKrankt. https://www.n-tv.de/politik/AKK-Gab-immer-gute-Gruende- Gegen-Urwahl-article21317821.html…"
"Three dead men, two dead women. If you are lucky twice and not three times when thinking, is that intelligence?"
"Man shoots three men, two women: Clear case of feminicide. https://twitter.com/KathaSchulze/status/1180917363711074305…"
XR de-escalating crimes? Really? Do you also write about comparable #IB campaigns?
"The problem in the AfD and its supporters is that it is believed that everyone has to do every nonsense for a mandate. Some have to, or want to, others will eventually."
Yes and?
"So when I left, I was the country chairman and group leader. Not much more."
"&quot;Investigators classify the truck incident in Limburg as a terrorist act.&quot; Motive of the truck assassin puzzles Yes, completely unclear! Maybe stress with the woman? https://www.n-tv.de/politik/Motiv-des-Lkw-Attentaeters-gibt-Raetsel-auf-article21317427.html…"
Now you are naive. 😉 natural laws? We are here in politics! ☝️
It was the CDU! And I thought we should all thank Olaf. Good thing the Antje makes that clear. https://twitter.com/cducsubt/status/1181152128351510528…
The 5-year rental plan is already showing its first successes! Venceremos! https://twitter.com/Tagesspiegel/status/1181149125510909953…
Noteworthy https://twitter.com/OekoLinX_ARL/status/1180935422597324803…
&quot;Connected to Nazi rule&quot; In this article I mentally replaced &quot;GDR&quot; with &quot;NS regime&quot; and &quot;SED&quot; with &quot;NSDAP&quot; in order to check whether it made sense. Result: complete bullshit! https://www.welt.de/politik/deutschland/article201496230/Schwesig-und-Ramelow-Begriff-Unrechtsstaat-fuer-DDR-problematik.html?wtmc=socialmedia.twitter.shared.web… via @welt
"The delegate systems for the state and federal government are different. In this respect, this is not true with the dress rehearsal. BPT is more advantageous for the wing, LPT for its opponents."
I believe that we are now making good progress in Germany! Thanks Olaf! https://twitter.com/ZDFheute/status/1180160966530666496…
"Also my No. 1, with equally weak percentages."
"One is wealth, the other only claims against one&#39;s own children."
How surprising ... Or not? https://twitter.com/thinkBTO/status/1179331031603826692…
And they are surprised that others are more successful online. https://twitter.com/drumheadberlin/status/1179437844621905920…
They don&#39;t even want the coat.
"That is perfectly clear, but it does not change anything about his stay here. Incidentally, this applies to around 600,000 people in Germany at the moment!"
Ok I understand.
I&#39;m not saying that Switzerland would be smart. Not at all 😉
"A pretty reasonable result, I think. https://twitter.com/MarcusPretzell/status/1192405696068931584…"
Few have lied about me in public like this.
She won&#39;t worry.
That&#39;s the point. As if children knew better if you didn&#39;t tell them that the GDR was an injustice state.
"You can be happy about everything, but “history of democracy”? These stupid phrases! https://twitter.com/zeitonline/status/1192557314831765506…"
"Yeah, right. That&#39;s why we learn almost nothing about the 3rd Reich at school. 🙈 https://twitter.com/DLFNachrichten/status/1192552116184920069…"
"Strictly speaking, the prosecutor would have to do the job of defense. Officially this is his job too!"
There is no such thing in all of German television. Have fun.
"The topic is freedom of expression, right? 🙈🙈🙈"
There comes menstrual envy. #TaxationIsTheft https://twitter.com/sternde/status/1192537424292982784…
"Today he would not get 3 but 3,000 likes for the tweet. Social media in all its glory. 😉"
Just it.
