We didn&#39;t even campaign.
Since 2005 the Union has even provided the minister responsible. 😉
That too.
who can can
These are far fewer problems than non-old-white-men-and-proud-of.
"It is also conceivable that there was no intention to kill. It is conceivable that he acted in self-defense. It is conceivable ... I would suggest an explanation in such a case, which cries for treachery as rarely a case, and especially in such a disgusting case of a child murder."
A Minister de Maizière would be an enormous burden for Merkel today. So it&#39;s politically cold coffee.
"They carry owls to Athens. The AfD is unsuitable. Already because of their left-wing twist in economic policy, but also because of massive personnel problems."
"Quite right, that&#39;s how many voters seem to see it. The same applies to the rest of the opposition."
I would like to admit that it is possible to think otherwise; as almost always. But dealing with the case is negligent! It would be completely unthinkable that the StA would act at this level in the case of Halle&#39;s gunman; cope.
Anyone who talks about expropriation has never been interested in discourse.
"You could think about that with opposition parties. Great dissatisfaction, but no mood of change. Translated: The government is big crap! The opposition probably can&#39;t do it better! A democracy, by the way, cannot stand this mood forever. https://twitter.com/fuecks/status/1202723258707120128…"
"At least that&#39;s the German legal situation, although the TFEU contains a very similar regulation on cash. Unfortunately, this is watched over by European jurisprudence, which strongly politicizes it."
"At most prepayment would be a way. However, that would most likely be anti-competitive and therefore reminderable."
"If you push a defenseless child from behind in front of an incoming train; that&#39;s not insidious. Says a German prosecutor. For the protocol, file in the folder &quot;Rule of Law and its Decline&quot;, there under the tab &quot;Federal Republic of Germany 1949-_&quot;"
"The determination to protect the climate increases significantly with every private jet owned. (See Hollywood, English royal family or now this gentleman) This leads to a simple and rational demand. Private jets for everyone! https://twitter.com/welt/status/1202554240071348224…"
"Yes, probably"
"No, this is not what the inability to do is about."
Was that so? May have not followed the details.
Which term do you use?
Respectively. is therefore not punished.
Nor can she be a blackjack.
I cannot and do not want to rate guiltiness. That&#39;s not what I&#39;m talking about here.
Incapacity concerns the act as a whole and not its classification according to murder / homicide. Or do you have another opinion?
A common misconception that StAe do not have to look for anything exonerating. They have to! Only case law and literature come to a predominant conclusion here: treachery -&gt; murder
I only read the accusation of &quot;being close to the state&quot;.
What conclusion do you get when you consult relevant BGH judgments on the insidious?
"I am actually concerned with the rule of law, its laws and the associated case law."
"Not Stalinism but satire. Not a bad one, by the way."
"That alone would not be a problem, he even has to. The StA has to look for and evaluate relief. The problem is deeper here. Someone doesn&#39;t know the legal situation and case law."
"In this case, both relevant views come to the same result: treachery"
"Yes, we had canceled the project in Saxony."
"If the MDR had justified it, yes then ... But it has expressly not done so. There they were only insulted by the accusation of being close to the state. The existence of “real” reasons, which have apparently been ignored, makes it rather worse for the MDR."
"A good article, but: The reasons that the article names for Steimle&#39;s expulsion were not mentioned by the MDR without exception. There they explicitly retreated to the fact that Steimle is subordinate to public broadcasting. https://twitter.com/berlinreportage/status/1202549923570425856…"
Unnecessary comment https://twitter.com/welt/status/1202518199293661185…
Soon here in this cinema.
Does anyone know how much methane a donkey emits per kilometer? https://twitter.com/ntvde/status/1202346097655500801…
"This is exactly how you should handle it. For some reason, this does not apply to politicians on the right of a border defined by journalists."
A serious suspicion.
I am unsure which of the two rejects first.
She modeled.
I think it&#39;s almost done! 🤷🏼‍♀️ https://twitter.com/zeitonline/status/1202299968893128704…
 https://www.tagesspiegel.de/gesellschaft/medien/urteil-zum-zdf-staatsvertrag-verfassungsgericht-politik-hat-zu-viel-einfluss-auf-oeffentlich-rechtlichen-rundfunk/9663170.html …
"If Corbyn wins, the number of social benefit recipients in Germany drops to zero. They are all in the UK, so that stays in the EU. Go Corbyn 😂😂😂👍 https://twitter.com/jeremycorbyn/status/1202288269964263424…"
What can you say about the expulsion of the satirist Steimle at @mdrde? Maybe what the BVerfG 2014 said: Politics has too much influence on public service broadcasting https://www.tagesspiegel.de/gesellschaft/medien/urteil-zum-zdf-staatsvertrag-verfassungsgericht-politik-hat-zu-viel- influence-on-public-legal-broadcasting / 9663170.html…
But someone is angry. https://twitter.com/hartaberfair/status/1201635153535283200…
Not even then. The legal tender is not contractually required.
"I make fun of someone who is obviously doing the opposite of what he is promoting. As a lawyer for the climate, the man is &quot;lousy&quot;."
I&#39;m just afraid of the damage on the way there.
You are not a good person. 😉
"Ah sorry, then I misunderstood you. The offer is of course permissible."
"The host can only avoid this if he demands advance payment. Then he can kick out cash payers. If you can prove a system in this regard, it is legally enforceable under competition law."
"So I let myself be served in full knowledge, wait for the waiter and offer cash. The problem now is the restaurant, not me."
The exclusion of the cash payment option is ineffective.
"And if you do go there: Up to 50 coins must be accepted, regardless of the denomination."
"I&#39;m afraid that he will change his business model for the third guest. Don&#39;t go there. After all, we are talking about a lawbreaker! 😉"
"No, he is in default of acceptance if he does not take the cash."
The agreement of a different payment obligation opens the possibility to pay differently. The option to pay with the legal tender does not exclude them. You can&#39;t rule that out.
Socialism is only sexy when every conceivable group of society is presented with its own disadvantage in the most dazzling colors. It benefits the backroom communists or the want-to-be future profiteers of real existing socialism.
"No, there are insidious things. If there is a different situation in exceptional cases, a few sentences would be appropriate. StAen do this in other proceedings where it also appears politically opportune."
"In Berlin there are also well-attended drug stands, assigned by the regulatory office. But it is against German law."
"Incidentally, this refusal is simply illegal. Paragraph 14 I S.2 BbankG &quot;Banknotes denominated in euros are the only unlimited legal tender.&quot; For more environmental protection: In Hamburg restaurants, customers can no longer pay in cash https://www.focus.de/11420245"
I leave it open whether your question is serious. But do you see the gap between climate protection demands and personal behavior?
From 2014 Constitutional Court: Politics has too much influence on public service broadcasting https://www.tagesspiegel.de/gesellschaft/medien/urteil-zum-zdf-staatsvertrag-verfassungsgericht-politik-hat-zu-viel-einfluss-auf- public-legal-broadcasting / 9663170.html…
I currently know of no party that I would not wish to have a Saarlander on the neck.
"No, actually normal. It is not normal what you do with Trump."
"Because Steimle says that ÖR Rundfunk is close to the state, the state-close broadcasting separates from it. https://twitter.com/BILD/status/1202218761673199619…"
There is no polarization! https://twitter.com/eskensaskia/status/1202134537167425536…
It would also be silent. It&#39;s not a pig&#39;s business.
Could we please get a story about the Merkel / Sauer couple in this &quot;quality&quot;? No? https://twitter.com/welt/status/1202103259172950016…
"Clearly, what citizens want now is a good explanation that deported, insolent goodies, like this one, come back in and collect money. You just have to explain it. 😂 https://twitter.com/bild/status/1201936912468054017…"
I can not imagine that. 🤷🏼‍♀️ Düsseldorf: deportations illegally suspended? https://m.bild.de/regional/duesseldorf/duesseldorf-aktuell/duesseldorf-abschiebungen-unrechtmaessig-ausnahm-66437270.bildMobile.html…
"Always to Bismarck, actually"
"Now you have to defend the human dignity of Franz von Papen. Not because you feel like it, but because completely unscrupulous spinners don&#39;t know the limits of decency and law."
The Spiderman file Finally something funny and not always the old well poisoner story. https://twitter.com/ritterlaszlo/status/1201829293724028929…
Inordinate https://twitter.com/tspcheckpoint/status/1201822963416391680…
Sounds like Jens Maier after the &quot;Halbneger&quot; tweet. https://twitter.com/politicalbeauty/status/1201604182928773121…
"&quot;Controversial&quot; Even if it turns out that there are no real Auschwitz dead, it remains tasteless at best, otherwise I honestly lack a term for it. https://twitter.com/tspcheckpoint/status/1201767671903268864…"
"Replacement for the SPD, of course"
"Not only that, the Union has also been providing the responsible minister continuously for 14 years ... https://twitter.com/CDU/status/1199343854807179265…"
I am at a loss. Can anyone explain that to me? Knife stabbing in the no-weapons zone! https://m.bild.de/regional/leipzig/leipzig-news/eisenbahnstrasse-messerstecherei-auf-eisenbahnstrasse-66284756.bildMobile.html…
The BKA pic.twitter.com/7RAOJ6zOiM is a bit more precise
"Anyone who has children knows that: Klaus, there&#39;s something behind the spoon! Klaus: &quot;Yes, but Susi started, and besides, she always pulls my hair.&quot; Susi: &quot;That&#39;s not true, you bit me. It hurt a lot more. ”🥊 Unfair ... mean ... he was ... you idiot ... https://twitter.com/rezomusik/status/1199255986625818624…"
I actually feel like crying.
"Spoiler: Incidentally, this has to do with politics, dear Minister of Agriculture. https://twitter.com/drumheadberlin/status/1199234515992010754…"
"The series of successful and forward-looking arrangements! Fortunately, the Saxon cultural assets in the Green Vault were only observed by unarmed security guards (I refrain from the term &quot;guarded&quot;), so any personal injury could be prevented in the beginning."
"In any case, only those whose culture is about to die come to mind. Either because she dies or she dies because such thinking spreads."
BDS activist has to leave Israel. https://twitter.com/zeitonline/status/1198985239596589056…
What does “family” mean here? We are all one company!
After the rental cover we need 1. state-owned apartments 2. housing entitlement certificates 3. Gulag At the latest then there is peace! https://twitter.com/rbbabendschau/status/1198704524145446913…
"Incidentally, remarkably uncritical of Kubitschek."
"It is not that easy. The two differ significantly, which does not mean that they do not complement each other."
"Pretty weak, actually. Gottschalk is disappointed with Weidel. 😱🤧"
"If the development had not been stopped in 2016, 2017 would have been different. But!! But over, there&#39;s nothing more. In spite of all templates, downtime for 3 1/2 years."
Then you can follow the application at the party conference very relaxed.
Then you can stop politics.
"The own party friends ... Wouldn&#39;t be any different at Höcke. If he does not chair the parliamentary group, things will get tight."
"Yes and if it were not for him, the AfD would not have been a kink in his mid-16s."
"Sorry, that is not possible. You can&#39;t get slaughtered for AfD blinking in the media and then let Höcke fool you. Then you are politically exhausted. In the CDU, the pack waits a long time for something from Mohring. Excluded and Höcke knows that too."
Read a book; he needs total chaos and knows it.
"And I won&#39;t take that away from him, otherwise he would have sacrificed the group chairmanship."
"The fact that he doesn&#39;t offer anything specific has two aspects. The voter can imagine something; then he does that too. The CDU and FDP would have to demand something that they would put in Höcke&#39;s hands. Then he can play. Nevertheless, he would not have to do without."
"Specifically, how?"
What exactly does he give up with? What is he missing?
That&#39;s the problem.
"And something else. Höcke is not a spinner. He has a very understandable plan, in contrast to Meuthen, Weidel, Gauland ..."
"Everything ok, only he didn&#39;t give up. If Mitsch renounces the candidate for chancellor from the Union of Values, it is not selfless, but a tactical maneuver."
I recommend reading his book. He knows he has to and can wait.
"Some things are a little cheap then. First, what is he doing without? Secondly, since it was foreseeably rejected and certain decisions are pending in the party ... That is really cheap now."
"If you think that&#39;s innovative in 2019, that&#39;s part of the problem."
"Some people see the economic catastrophe coming in the event of Brexit. Anyone who chooses Corbyn is definitely certain in this regard. If anyone breaks it, it&#39;s Corbyn. https://twitter.com/zeitonline/status/1197539111390846977…"
"If 1% of Germans take to the streets because they are afraid to die, it is still a sect."
"Roger Hallam is only one of the co-founders of Extinction Rebellion, it is now said. In fact, together with Compassionate Revolution Ltd. #ExtinctionRebellion significantly designed. Does anyone know who owns the trademark rights? Compassionate revolution?"
I learned everything from you. 😉 pic.twitter.com/eaE0nqiRuy
Because annihilating people is the next logical step towards climate rescue after the birth strike has not been successful.
"Yes, everything is said with that. Anyone whose opinion would be important?"
"The result was that, surprisingly, this topic hardly interested young people. The topic is irrelevant for a whopping 81 percent of 12 to 22 year olds. Yes, completely surprising that they just turn blue. https://www.express.de/duesseldorf/schock-umfrage-in-duesseldorf-jugendliche-werden-weihnachten-zu-anti-gretas-33494166…"
Nobody needs them anymore anyway.
"No reasoned person understands that, so I prefer to write it in an understandable way."
"Pretty blatant, to be exact. https://twitter.com/Burpeelover/status/1197037270001422336…"
A world without natural sciences can also deal with facts differently. 😳 https://twitter.com/CKemfert/status/1197110536732848129…
"When left-wing extremists propagated the march through &quot;fascist&quot; institutions in 1968, the Holocaust was initially omnipresent. Anti-Semitism still existed at RAF &amp; Co. back then. After the success, the Holocaust naturally disturbs. #ExtinctionRebellion"
 pic.twitter.com/knml8BwFc9
"Yes, at least certain trends were probably from the beginning. Some &quot;donors&quot; probably too."
Maybe because it was never about climate protection?
“Biologically masculine” makes every gender ideologist spontaneously empty his stomach.
I don&#39;t disagree. 😉 Except for the emergence of the AfD! That was a major failure of the FDP.
"In tough demand, by journalists, by journalists, for journalists. https://twitter.com/SZ/status/1196512417150320646…"
Stasi spies collect data from innocent citizens. The man returns to his core competence. https://twitter.com/Tagesspiegel/status/1196491545878417408…
"Kobold-Baerbock therefore takes care of technical questions from the Greens. Phew, but everything dramatically worse than expected. 😳 https://twitter.com/MarcusCJung/status/1196340366837997569…"
The EU Commission is close.
Satire! Expropriate billionaires in the fight against the law. 😂😂😂 https://twitter.com/zeitonline/status/1196350112659890176…
"No, everything is different this time. Completely different! Honestly! No gulag, no quibbling, no dictatorship. This time: peace, joy and of course success! And if you don&#39;t want to believe that, comrade, we can do it differently!"
"Around 90% of all voters think politicians are incapable, corrupt and lying. However, the majority of the same voters in Germany now want to transfer responsibility for the economy to precisely these politicians; it&#39;s called socialism! Is it still dumber?"
"&quot;We want to dictate to industry ...&quot; So this success story called GDR started, right? https://twitter.com/DLF/status/1196316643791646720…"
Anyone who rejects freedom of expression is therefore uncompromisingly left. I&#39;ve been suspicious for a while. https://twitter.com/sibelschick/status/1195402574226247687…
Now imagine this tweet from a left in 2016 to the AfD.
"I have to disagree. Those who call themselves &quot;Quattromilf&quot; are constantly waving their motherhood. Unusual, but at least wagged."
Many prohibitions are illiberal. Big bans are liberal. Lots of taxes ... Lots of taxes ... Lots of authorities ... Lots of authorities ... #Liberalism pic.twitter.com/oEgcrQAUMs
She probably also stood and applauded. https://twitter.com/TinaHassel/status/1195391368572669954…
For free!
"@ArminLaschet really wants to become chancellor. Cleverly stalked, with a withdrawal option. The North Rhine-Westphalian Prime Minister Armin Laschet described the abrupt exit from nuclear energy by Chancellor Merkel as an error https://rp-online.de/wirtschaft/der-nordrhein-westfaelische-ministerpraesident-armin-laschet-hat-die-abrupten- exit-from-the-nuclear-energy-by-chancellor-merkel-described-as-error_aid-47163869? utm_source = twitter &amp; utm_medium = referral &amp; utm_campaign = share… via @rponline"
"Ah, that would be nice ..."
Hence the overpopulation in Africa. It is obvious! All climate!
"Actually, stagnation at 15% for 3 1/2 years."
"I know that very well. You can replace it at any time. Strong party leaders are not wanted, in hardly any party."
"Did you know that pregnancy in Italy only lasts 8 months? As is well known, the bouquet lives in Africa, so it is not pregnant at all, but only breeds! ☝️ https://twitter.com/BILD/status/1201536143549964288…"
Politically correct shitstorm: NOW! https://twitter.com/BILD/status/1201544195044970496…
And? They are now in opposition?
I am currently considering who could have campaigned for the Saxon Union. https://twitter.com/HGMaassen/status/1201226836849647616…
Koll&#39;s questions are a gift. But Chrupalla messed it up.
"With Chrupalla, the AfD will soon experience a few “goat moments”. https://twitter.com/berlindirekt/status/1201200679244750849…"
Perhaps that has something to do with the fact that those who claim to define the intellectual elite themselves ... How do I best express this now without becoming abusive?
The AfD&#39;s answer to Ms. Baerbock&#39;s intellectual level.
"Alexander Wolf (Danubia) is considered moderate? Sorry, everyone (!) In connecting circles is just getting a laugh."
But in which party should something go? Not with the DU without C itself.
He applies for the federal board. 1. Something with Hitler always works in German politics. 2. It&#39;s Christmas problem soon: How do you get that into a speech? I would say perfectly solved.
"Same game, same shit."
I laugh at Ms. Passmann for the first time. Chapeau! https://twitter.com/sophiepassmann/status/1200831456228134913…
"The majority is not a category in science, apart from that it is wrong. A minority of around 30% see it that way."
"After the PGF of the Bundestag faction, the GSin of the FDP is now also offering a replacement for the FDP. https://twitter.com/lindateuteberg/status/1200839116222607362…"
Consistently from Kuhle. https://twitter.com/konstantinkuhle/status/1200831446916763650…
Hmmmm... https://twitter.com/drumheadberlin/status/1200827931267936257 …
The first replacement is the obvious choice. https://twitter.com/MarcoBuschmann/status/1200827184711159809…
"5, but that has nothing to do with his anti-Semitism. He has other problems."
I predict an ice age from which only a lot of CO2 can save us. Now play poker!
"That&#39;s ... yes, what actually? pic.twitter.com/73MJeb2y6s"
The same scientists who have so far &quot;massively misjudged&quot; now explain everything exactly. https://twitter.com/juttapaulusrlp/status/1200176214255820808…
"The entire video gives the impression that @dieteruhr compared Thunberg with Hitler and Stalin. At the end, half a resolution. You have a tit, of course! 😂"
So that is clear: a guy with blue hair can neither be sexist nor Nazi. The maximum is suitable as an AfD mascot. # dieZerstörungdesRezo
"What we need now are emergency laws, right? #klimanotstand"
"&quot;We are very deliberately at a distance from Mr. Bachmann,&quot; clarifies Meuthen. pic.twitter.com/X9W7eFNItR"
"A moderate association without wings ... I laughed very loudly, but with journalists it was impossible to ignore how moderate things are now in NRW. 😂😂😂"
CO2?
The SPD&#39;s top candidate for the 2017 Bundestag election is quoted as follows: &quot;People find me embarrassing.&quot; Https://twitter.com/katarinabarley/status/1199723387662356487…
But @Kachelmann will be happy to be associated with such bluffing.
Not a word about the violations of honor by women against men before they are murdered? These Islamist accounts are also becoming more and more whimsical. https://twitter.com/lawyerberlin/status/1198942662570774540…
"Alexander Wallasch explained it at @TichysEinblick. Nothing really new. First Hartwig was in Schnellroda, then Weidel. https://www.tichyseinblick.de/kolumnen/alexander-wallasch-heute/alice-weidel-und-goetz-kubitschek- comes-hier-zusammen-was-zusammen-gehoert/…"
The Junge Alternative does not want to be seen as @ KayGottschalk1 on the federal board because he is a little thoughtless. (He said that everything was very different.) You should definitely rethink that. Already from amusemang! pic.twitter.com/US7LC3cF5T
"Mohammed would go on. The compulsion not to have sex at the age of 9 is just as compulsive as having to have sex. In the meantime, we are discussing “children&#39;s rights” in the GG ... They spin the Romans and therefore their culture is also going under. Oh wait ..."
Arguments for social democracy; strong as a bear. https://twitter.com/Ralf_Stegner/status/1198161031790571525…
The
"Marketing can be without content, content cannot be without marketing. Just saying."
What to do if you are the problem yourself? https://twitter.com/PaulZiemiak/status/1197937688592162817…
"A prime example of how politically caused market failure, further political interventions, further market failure, ... https://twitter.com/ThomasSigmundHB/status/1197533144334901250…"
Trailerpark-Kevin https://twitter.com/KuehniKev/status/1197645881257930753 …
You have to praise @kuehnikev. His proposal to give voting rights only to those who work and pay taxes is brave. 😜 pic.twitter.com/EOQFYIZWM1
Newspaper publisher is lying ... Tell me more. https://twitter.com/hubertus_knabe/status/1197617288519864320…
"Could you briefly post the critical image articles from the first 12 years in office? If possible, all three."
I think they have him now. https://twitter.com/CNN/status/1197623247271088128…
We 😂
"No, it stabilizes because the way out seems blocked for many."
Just
"For this reason, unity in the sense of the Union is now so important that some people don&#39;t like it. The Chancellor is having a hard time."
#Greenpeace removes the C from the CDU. Cheap copy. #Merkel came up with the idea 14 years ago.
The officials don&#39;t fall on their faces. They are now praised everywhere.
"I translate: The law is big crap that we have introduced. If you have a few hours, you may be freed from the worst excesses by friendly officials. We cannot guarantee that, but we would like your vote. https://twitter.com/cducsubt/status/1197526158960742400…"
@spdbt What exactly does a hijab (far right) have to do with the &quot;Good Day Care Law&quot;? pic.twitter.com/YQOEOR6shT
World Philosophy Day at ZDF with Marx. Kant would be too controversial. https://twitter.com/ZDFheute/status/1197422180549742592…
How can you tell that Salvini is no longer in the government? https://twitter.com/welt/status/1197413346716336129…
"&quot;Regardless of the assessment of the quality of the German media, however, four out of ten respondents believe that journalists would be given by the state and government what to report about.&quot; Https://www.heise.de/newsticker/meldung/Studie-Weniger- People-consider-German-media-credible-4592813.html…"
"Would you like to see this? Pretty weird, right?"
"Fulfilled the plan, dear comrades! https://twitter.com/DLFNachrichten/status/1197257383241760771…"
"The Tagesschau now also on the Chinese state platform TikTok. Given the events in Hong Kong, you really have a good feeling for timing here. In any case, the state radio does not have to make any further changes journalistically. https://twitter.com/tagesschau/status/1197107541869809664…"
