"Ten years ago there was no security lock container, no fences or even ditches in front of the Bundestag. Even police officers were rare. Now the Bundestag is to be made a high-security wing. But has nothing to do with anything ... #AfD https://www.spiegel.de/politik/deutschland/reichstag-graben-fuer-mehr-schutz-geplant-a-1277938-amp.html…"
"#Electricity is more expensive than ever - consequence of the fatal #EEG. Eco-socialist politics means exactly one thing: costs, costs and even more costs. It doesn&#39;t work and harms everyone. #NeinZumEEG #FreiheitStattKlimaIrrsinn #Klimakabinett https://www.welt.de/wirtschaft/article197024717/Strompreise-machen-auf-neuen-Rekordwert.html?wtrid=newsletter.wdwb..topnews..%26pm_cat%5B%5D%3Dtopnews&amp;promo = 81491.1177618.5822841 &amp; r = 3716817676371818 &amp; lid = 1177618 &amp; pm_ln = 5822841…"
The # climate-totalitarian madness is turning more and more hollow. Choosing #SPD &amp; old parties means: Restricting the mobility and freedom of citizens from the political and governmental side at the expense of the middle class and ordinary people. # CO2is not a pollutant https://www.welt.de/politik/deutschland/article197036655/Luftverkehrabgabe-Umweltminister-beharrt-darauf-dass-Fiegen-teurer-wird.html?wtrid=newsletter.politik..politik..%26pm_cat%5B % 5D% 3Dpolitik &amp; promio = 81501.1177718.5822961 &amp; r = 3716817677371818 &amp; lid = 1177718 &amp; pm_ln = 5822961…
&quot;That would be absolutely fatal&quot;. Speech - u did exactly the absolutely fatal thing just seven months later. Without turning red. And completely freed from any suitability or competence. The Bundeswehr has deteriorated to a station: Merkel&#39;s party-tactical relocation station. #Trauerspiel https://twitter.com/andikynast/status/1151489519859970048…
"A sad day for Europe. #VdL is chosen by Macron&#39;s grace. It stands for a massive left-wing course and against everything we fight for: a Europe of the fatherland and democracy, because it only works nationally. #AfD pic.twitter.com/RN9Chgkkxa"
"The “refugees” “saved” on the Mediterranean are not. &quot;Proven&quot;. They are migrant poor. Thank you for this official clarification u therefore we have to prevent 100,000s from abusing our asylum procedures #FestungEuropa #AfD https://twitter.com/auswaertigesamt/status/1150068802585026561?s=12… pic.twitter.com/1YPbLFHzlL"
"Mr. colleague, is that your application as press spokesman for Nicolás Maduro or Kim Jong-un? https://twitter.com/VolkerUllrich/status/1149969433269604352…"
12:00 noon. Mid-July. Anno 2019. Dramatic heat wave has Germany firmly under control. It&#39;s good that we are destroying our industry. That definitely helps against these insane temperatures. #Panik #Hysteria #Klimagaga #FridaysForFuture #AfD pic.twitter.com/eqNAPi3723
What would be gained if we deported Bulgarian rapists to Bulgaria - this professor at a German university wonders. And I wonder why we have such ideologues taught at our universities with German tax money. https://twitter.com/sabinedoering/status/1149406186137149440…
"Application? The better term is tug rendezvous zone. Or, because everything always takes place in the same small sea area, one could also speak of an artificial Bermuda Triangle off the Libyan coast. #noway #Komplizen https://www.zeit.de/politik/ausland/2019-07/sea-eye-alan-kurdi-mehrere-migranten-an-bord… pic.twitter.com/Ak9dT0PDPe"
When will #Leyen finally resign? It is an absolute bad habit to keep the ministerial position warm until you have surely stumbled up the career ladder &amp; already postponed ministerial appointments just to campaign in Brussels ... https://twitter.com/vonderleyen/status/ 1148226466729123841…
Suction. #Sea rescuers say they can&#39;t take shipwrecked people back to Libya because of the civil war. But this affects ALL 7 million Libyans. So should all 7 million be allowed to come into the #EU? That&#39;s absurd.
Short vs. Seehofer ports to vs. Ports on rescuers vs. Tug Correct vs. wrong conservative vs. CDU / CSU #AfD #niewiederCDU #niewiederCSU pic.twitter.com/AB0pPl8ik6
The newspaper titles say: Four German vacationers accused of group rape. It is kept secret that the perpetrators are of Turkish origin. What does not fit into the picture is simply left out. # Gap press https://jungefreiheit.de/debatte/kommentar/2019/was-nicht-passt-wird-passend-machen/…
"If #Altmaier is the biggest &quot;misstaff&quot; in the government, shouldn&#39;t he have been nominated instead of #vonderLeyen as President of the Commission? # Worst selection https://www.welt.de/wirtschaft/article196388285/Fehlbesoke-Gesamtmetall-Praesident-forder-Altmaiers-Ruecktret.html…"
The left does not distance itself from left-wing violence and shows its sympathy for left-wing extremists. For the democratic balance and the consensus that democracy must be defended against all extremism =&gt; http://www.blicknachlinks.org https://www.youtube.com/watch?v=T787I_BTbhk…
Absurd times: I agree with Martin Schulz. #VonderLeyen is a grotesque misstaff as the # EU Commission President. The #SPD (or S&amp;D) can stop this in the EU Parliament. Opportunity for the SPD to show the backbone. We will measure them by that. https://twitter.com/MartinSchulz/status/1146075889916096513…
You can&#39;t invent all of that !!! But in itself it is also conclusive: the most incompetent of all German ministers is dumped into kurz just before you MUST fire them. #EU #AfD https://twitter.com/ntv_EIL/status/1146103301718577152…
"#vonderLeyen as the # EU Commission President? # Consultant affair, # GorchFock scandal, planes that don&#39;t start, submarines that don&#39;t dive, and a demoralized force. This personnel decision would be the greatest possible oath of disclosure for the EU. https://www.spiegel.de/politik/ausland/eu-kommission-ursula-von-der-leyen-als-praesidentin-im-gespraech-a-1275412.html…"
Now is the time for European solidarity. Let us declare our solidarity with #Italy and Interior Minister #Salvini - against the machinations of the smugglers and their accomplices like Carola #Rackete and for a Europe with secure borders. pic.twitter.com/QMn7EUifhP
"11 men, most of the refugees, rape an 18-year-old. The lawyer claims that the &quot;woman had massively demanded sex.&quot; Disgusting. What do the #net feminists say about this? Don&#39;t they care? https://www.welt.de/vermischtes/article196206287/Freiburg-Verteidiger-sagen-es-gebe-keine-Bewesse-fuer-Vergewaltigungen.html…"
"OK. Understand. That was not coordinated with the &quot;editors of @hartaberfair&quot;. But it was coordinated with all other @ARDde Talk editors, i.e. with @AnneWillTalk, @maischberger NDR-Talkshow, Saartalk, Kölner Treff, etc. Right? https://twitter.com/DasErste/status/1145764261983076354…"
"Thank you for these frank words. It is finally officially documented that state radio is not impartial, but operates opinion manipulation and suppresses diversity of opinion. #GEZabschaffen https://twitter.com/DasErste/status/1145656954079076352…"
"#Rackete is not a hero. She is just criminal and should be detained. If one is a hero, then #Salvini. It protects the border and therefore also us. And # Böhmermann&#39;s donations should go to the Italian coast guard. 🇮🇹 https://www.youtube.com/watch?v=J_TYI9kNxM8…"
