"(2/2) BMU paper: speed limit. EU: monitoring of fuel consumption. The crazy climate plans of #EU and BReg are not only anti-social and against the middle class, they end our freedom. # totalitarian https://www.focus.de/auto/ratgeber/kosten/vorfertigung-fuer-weiter-co2-steuer-neue-eu-vorschrift-ab-2020-wird-der-spritkonto-jedes-autofahrers-ueberwacht_id_11422288. html…"
"(1/2) BMU paper: Abolish commuter allowance, fuel prices 50-70 cents higher through taxes, truck tolls more expensive. EU: &quot;climate toll&quot;. Mobility only for high earners. #unsozial #wirtschaftsfeindlich #nurnochAfD https://www.sueddeutsche.de/wirtschaft/umweltbundesamt-klima-verkehr-sprit-preise-1.4709948…"
"Dear #Left # Greens #Antifa and other advocates against violence, look at this! Small plants that you want to crush become trees✌️. Every attack on us only makes us stronger 💪🏼. #AfD https://twitter.com/lsteinwandter/status/1202149756807634944…"
"Dear climate believers, without your prophetess and without the essential &quot;climate sinners&quot; China, India, Russia and the USA you can really put your # COP25 fair in #Madrid. This also saves a lot of CO2. And one more thing: no candles at Christmas! They bring the CO2 death subito! #AfD"
"Only “democratic elections” and not the “storm on the Bastille” will be successful. The Office for the Protection of the Constitution works against us, but we will “do everything possible to make it as difficult as possible for them.” Thanks to Alexander #Gauland #AfDparteitag # opens pic.twitter.com/XNJSu85p4x"
"Russia: # Putin = bad, USA: @realDonaldTrump = bad, UK: #Brexit = bad, Eastern Europe: #Refugeesnotwelcome = bad, @EmmanuelMacron: Against #NATO with Putin. Germany is isolated thanks to #Merkel. Ethical ethics leads to a dead end. Dare more realism. https://www.welt.de/politik/ausland/plus203900986/Frankreich-und-Russland-Macrons-neue-Nato-Politik-duerfte-dramatik-Folgen-haben.html…"
"I call on President Sebastian Piñera to take all necessary measures to stop violence in Chile and protect citizens. It is up to you, Mr. President Piñera, that violence does not win millions of Chileans. Mr President, act! pic.twitter.com/48UBaEG8C2"
"In the future, you can be informed directly and immediately about my work via my new # Telegram channel. You can join my official Telegram channel using the following invitation link: 👉 https://t.me/BeatrixvStorch #Min Freedom of Expression #AfD #NetzDG pic.twitter.com/FtoG2IMXYC"
June 2019: #AfD requests # Hezbollah ban. #CDUCSUSPD are closed against it. &quot;It does not work! Because of #Lebanon and #EU etc. “Half a year later: it works! We learn: Today&#39;s AfD program is tomorrow&#39;s government policy. #AfDwirkt! https://www.spiegel.de/politik/ausland/bundesregierung-plant-hisbollah-verbot-a-1298692.html…
". @ OrganizeStrike I registered with @FFF_FU_Berlin for the #Climate Change and #Gender event. Just to listen! Result: panic, hysteria, #Antifa marches cancel their own event. How pathetic! Universities dominated by political sects. # Freedom of expression https://twitter.com/OrganizeStrike/status/1199693241374924806…"
"@OrganizeStrike I registered with @FFF_FU_Berlin for the event #Climate Change and #Gender. Just to listen! Result: panic, hysteria, #Antifa marches cancel their own event. How pathetic! Universities dominated by political sects. # Freedom of expression https://twitter.com/OrganizeStrike/status/1199693241374924806…"
". @ kahrs made a head-down gesture in our direction. With the gesture, I asked #Roth to give Kahrs a call to order. Roth lets Kahrs go through this insult. That is the scandal. @spdbt https://twitter.com/spdbt/status/1199666779053838336…"
No problem. I can also listen to climate change scientistswissenschaft if they are no longer part of #PublicClimateSchool. I just want to see what you&#39;re doing to understand yourself better. 🧠 @FFF_FU_Berlin https://twitter.com/FFF_FU_Berlin/status/1199642334197100544…
I&#39;m not looking for the conflict. I try to get an idea. What do the public schools do? Are universities and science still free? I&#39;m curious. # Fridays4Future @FFF_FU_Berlin #PublicClimateSchool #AfD https://m.tagesspiegel.de/berlin/klimaveranstaltung-an-der-fu-berlin-beatrix-von-storch-sucht-den-konflikt/25272950.html…
Dear @PaulZiemiak - the #Miri will not come back☝️. The borders are now protected sooo much ❌. Has promised #Seehofer firmly! Don&#39;t you speak to each other in the #CDUCSU? in-den-kna-66254842.bild.html…
It&#39;s called &quot;Public&quot; Climate School. So it&#39;s public and an invitation to everyone. Looking forward to Wednesday! We&#39;ll see you there. 👋
"#Hisbollah #AfD&#39;s motion to boycott: Boycotted by all old parties today. Anti-Semitism is widely regretted and the determined struggle against it is propagated daily. Only where you could really trade, #NIX happens. pic.twitter.com/aXXIZe5PrE"
"Dear @FFF_FU_Berlin, I am happy to accept your invitation to visit #publicclimateschool. I am extremely interested in what climate change has to do with gender relations and whether women and men are affected differently by the consequences. #irre https://pcs.fridaysforfuture.berlin/events/klimawandel-und-gender/… https://twitter.com/FFF_FU_Berlin/status/1197168081786822658…"
"# Söder says &quot;AfD is enemy&quot; and does not promise black and green. Apparently Söder can do everything, just no math. Without #AfD, there is only a coalition with the Greens for the CDU / CSU that are “tough” on the left. Söder = denial of reality. https://www.welt.de/politik/deutschland/article203759768/CDU-Parteitag-Soeder-geisselt-die-AfD-Die-wollen-zurueck-in-die-30er-Jahre.html…"
No?! But!!! Ohhhh !!! And the great thing is: we can “deport” #Miri 1000 times. Because he can enter again 1000 times without hindrance. # EinLandMachtSichZumLöffel https://twitter.com/ntv_EIL/status/1197875038202056704…
"14% of #VW belong to the Emirate #Katar, which supports the #IS and the # Muslim Brotherhood. Instead of bashing the #AfD, VW should rather prevent the VW profits from being used for terrorist financing. https://www.welt.de/vermischtes/article203693600/Auf-Wunsch-des-Sponsors-Schriftzug-Volkswagen-Halle-wird-bei-AfD-Parteitag-abgedckt.html…"
"The climate Nazis of #ExtinctionRebellion drop the mask: they want to abolish democracy and relativize the Holocaust. Where is the #constitutional protection, &quot;live democracy&quot; and the incompatibility decision of the #green? https://www.zeit.de/wirtschaft/2019-11/roger-hallam-extinction-rebellion-mitgruender-klimawandel-holocaust…"
&quot;Refugees&quot; prefer to flee where there is the most money ?! Is scientifically proven? !! No! But!! Oooooh. #AfD https://m.faz.net/aktuell/wirtschaft/arm-und-reich/princeton-studie-sozialleistungen-locken-zuwanderer-16492033.html?GEPC=s13…
. @ petertauber wants black green. There is of course no place for the @WerteUnion. That is consistent. And good for the #AfD. Just keep going. https://www.welt.de/debatte/kommentare/plus203638542/Peter-Tauber-Fuer-die-Werteunion-ist-kein-Platz-in-der-CDU.html…
God protect us from the fact that these economazis will ever rule. 🙏 They are enemies of our liberal-democratic order. They are fanatical and they hate our country. #Gruene # bdk19 https://www.welt.de/politik/deutschland/article203624286/Gruenen-Parteitag-Die-Frauen-entscheid-ob-debattiert-wird.html…
#Germany #Development country #nurnochpeinlich https://twitter.com/tagesschau/status/1196389874917691393…
"The West surrenders to #Islamization. We have to stand up to the Islam lobby: they are displacing our culture and not because they are so strong, but because we are kinking! #SchlussDamit #StMartin #ChristlichesAbendland #defenden https://jungefreiheit.de/kultur/gesellschaft/2019/moslemin-empoerte-sich-sankt-martin-darf-nicht-mehr-aufstufen/…"
Claudia #Roth heart Holocaust denier u is defended by established parties. # SPD health spokesman Lauterbach says &quot;Judaslohn&quot;: No criticism. #Brandner says the same u is voted out as committee chairman #AnschlagAufDieDemokratie #Doppelmoral #LexAfD #LexBrandner
This news makes me SOO angry. &quot;Young men commit adolescents&quot; also sounds better than &quot;group rape of a girl by 5 asylum seekers.&quot; (Still) a destroyed life and hardly anyone gets upset. What madness. https://www.presseportal.de/blaulicht/pm/110979/4438124…
"# Mass migration, no new construction, # rent covers and living space for everyone - that doesn&#39;t work? 1 + 1 = 2? Not for the # left green communistic Berlin Senate. With reddish-green on the way to #North Korea #Venezuela #Simbabwe # ForwardwardReversibleNever ✊ https://www.tagesspiegel.de/berlin/wegen-des-mietendeckels-in-berlin-genossenschaften-iegen-aus-bauprojekt-in-neukoelln-aus /25217290.html…"
"Dear @SZ, there has already been an application to ban #Hisbollah. From the #AfD. Just like the application to ban the #BDS. #FDP (and everyone else) declined #. At least make yourself honest. If that happens, it is because WE are driving it forward. https://www.sueddeutsche.de/politik/nahost-politik-fdp-will-verbot-der-hisbollah-1.4674457…"
I&#39;m really sooo excited: #Seehofer is announcing extensive border controls at the German borders. So that the #Miri s of this world do not re-enter. This time he is serious. Now he takes action. Uiuiuiuiuiiiiii. #AfD #Border protection #Fortress
"The #AfD does not &quot;provoke&quot; session termination! We make sure that rules are observed! It can&#39;t be true that rules only apply to the opposition, if you don&#39;t want to abide by the rules, abolish them, at least be honest! https://m.spiegel.de/politik/deutschland/afd-fraktion-provoziert-abbruch-der-bundestags-sitzung-a-1295457.html…"
". @ PaulZiemiak is the @KuehniKev of the #CDU: no profession learned, without a degree, but great political career. And so one attacks the #AfD. @Tino_Chrupalla and I have a message for this CDU general secretary: 👇 pic.twitter.com/AkyO4eeeF5"
Thanks for the support @Tino_Chrupalla Yes. Good decision. You can&#39;t get more unanimity. https://twitter.com/Tino_Chrupalla/status/1191997344402878466…
"The first step has been taken: the rejection is followed by consideration, then approval. Left-wing majorities can soon be history with us. And the #CDU will not be able to remain closed to a middle-class majority forever. #AfD # come to stay # and govern # for Germany 💪🏼 https://twitter.com/CDU/status/1191760223440113664…"
I won. Infrastructure in India is very important. One * of the * problems that a German government is elected to solve. And why are we doing this? &quot;Because we can do it&quot; would say @OlafScholz. 🤦♀️Nein! We cannot! And we don&#39;t want it either! #Alternative # for🇩🇪 pic.twitter.com/O7vPM9d77O
"This Nazi writes at the mirror. He wants to outlaw people because of their opinion, exclude them, &quot;keep them small&quot; (?) ... let their imagination run wild. The inclined left-wing fascist can think of something. You just can&#39;t believe it. What a pitiful figure. https://twitter.com/HasnainKazim/status/1190158792975106048…"
That&#39;s really a thing: Russia is following suit. Government websites that are critical of the government can now be switched off. #NetzDG #Hatespeech #Shadowban #Zensurgesetz That is yes - as with us! The outrage is justified. #noironie https://www.tagesschau.de/ausland/russland-internet-überwachung-101.html…
"#Trittin is right: “If you add up the results of #CDU, #FDP and #AfD, you get majorities almost everywhere in the middle. Left-wing coalitions are discontinued, thanks to AfD. The country needs new majorities. https://www.spiegel.de/politik/deutschland/juergen-tretin-das-konzept-volkspartei-ist-tot-a-1293841.html…"
But there is also a glimmer of hope for the #SPD in the east: it will no longer lose double digits there in the future. Not even with a Stegner as a top candidate. 😂
"In # Thuringia there is now a majority from #AfD, #CDU and #FDP for a different policy on deportation, energy and education. If the CDU agrees with #LINKEN in these fields, it has exposed itself as a block party. # lwth19"
I fully agree with the second sentence. 😂 # ltwth19 #AfD https://twitter.com/tilsteff/status/1188724252356370432…
" https://m.bild.de/politik/inland/politik-inland/thueringen-landtagswahl-2019-ergebnisse-fuer-jeden-wahlkreis-in-thueringen-65633932,view=amp.bildMobile.html …"
"Dear @BILD, we are SECOND strongest force. 23.6 is greater than 22.1. I know that hurts you. But that&#39;s actually too stupid for you now, isn&#39;t it? #Image # stupid # ltwth19 #AfD pic.twitter.com/x3pZsAs8Yh"
Congratulations to Thuringia: #AfD brings its 3rd big election success in 2019. #Osten is a stronghold with a loyal electorate of well over 20%. Without AfD there are no stable majorities in the East. Now coalition: #Linke and #CDU? Go for it! 😂 #Thuringia election # ltwth19
"Almost 23% of the #SPD are behind the so-called Vice Chancellor @OlafScholz as the #insolvency administrator of a formerly proud party. Congratulations! And hey, #Scholz only has twice as many votes as @Ralf_Stegner as last place. How broken is the store? 😂 pic.twitter.com/3mPhfe1ecY"
"All the misery of the government in the headlines one day. If you don&#39;t want that anymore, choose #AfD # ltwth19 💪🏼 pic.twitter.com/GEMKhEox9t on Sunday in # Thuringia"
Somehow it seems embarrassing to these Social Democrats * ^ _ Inn&#39;qs ** that it was YOU who introduced &quot;the&quot; 3rd gender. WE were against it. #der #die #das https://twitter.com/Z ZwischenrufMdB/status/1187355308730933249…
"The shoulder to shoulder of the left-wing establishment with Jew-hating Islamism explains, &quot;What drives Jews to the AfD.&quot; That is the title of the new book of the #Juden in the #AfD (@inJAfD), which I would like to recommend to you: https: //www.amazon .de / What-drives-Jews-Conservatism / dp / 3873366568? fbclid = IwAR0XW9ywDXbiaFv8UDo6b0J_UMmMGp4IlIibAHhdY19ujAV6h5BCuf0JnFA… pic.twitter.com/crvgBJJ4Ej"
"After #Halle verbally complain about #Antisemitism and then one of the largest bloodthirsty anti-Semites in the world happily cheers and embraces. The left-wing Greens are profound anti-Semitism friends #Roth #ekelhaft https://m.bild.de/politik/kolumnen/kolumne/kommentar-schande-fuer-den-bundestag-65477172,view=amp.bildMobile.html…"
I could not believe it. But it&#39;s true: #NoHundistillegal #AfD pic.twitter.com/jNFWuyP3Ve
"#Limburg: A police-known Syrian without a valid residence permit, who came to 2015 in 2015, wants to murder people with a truck like #Amri. #LINKE has very important questions about this attack on the interior committee.👇 See video. 🤦‍♀️ pic.twitter.com/BqdJL8XCBZ"
Quite right: BILD rightly thinks that #CDUCSU #SPD #FDP # GRÜNE u #LINKE should agree to the #AfD application to ban Hezbollah. We have the motion this Wednesday at 10 a.m. on the interior committee. Learn from #hall! #AnIhrenTatenSolltIhrSieDericht https://www.bild.de/politik/inland/politik-inland/anschlag-in-halle-5-dinge-die-sofort-geschehen-muessen-frau-merkel-65295292.bild.html…
It leaves you speechless. Saubermann @ArminLaschet chooses the language of violence. What would be going on if we spoke like this ?! IT IS ENOUGH! Put the ax out of your hand! #Hate # baiting # incitement #AfD pic.twitter.com/OG2X9QraSw
"Let us not use anti-Semitism politically - but fight politically together. Not just with words! For example, this week on the agenda of the Interior Committee: #AfD&#39;s proposal to ban Hezbollah. Otherwise, those who refuse DAS may remain silent! https://twitter.com/AJCBerlin/status/1183358686519087105…"
What a poor instrumentalization of a terrible double murder. It is really pathetic how democratic parties are to be destroyed in Germany in 2019. #Armleuchter! #AfD #CSU https://amp.welt.de/politik/deutschland/article201772810/CSU-Landesgruppenchef-Dobrindt-fuer-Beobachtung-der-AfD-durch-Verfassungsschutz.html…
The attack on a Jewish synagogue on Yom Kippur is a disgusting act of violence. Such an attack is an attack on the entire nation. Solidarity with our Jewish citizens. #Hall
The #Endzeitsekt #ExtinctionRebellion is officially a #Dreckschaufen. #ExtinctionRebellionBerlin 👇 pic.twitter.com/n76V2pwo3M
"Migrant distribution minister #Seehofer fails due to the EU countries. Unlike the minister, they are still in their senses. 110,000 asylum applications in Germany and he wants to take even more. Dear #CSU, finally send him into retirement. 🙏 #AfD https://www.welt.de/politik/ausland/article201614310/Verteilung-von-Migranten-Seehofers-Mission-in-Luxemburg-gescheitert.html…"
On site under left ... I wanted to take a closer look at these doomsday sect ... They openly fight democracy and industrialization. #ExtinctionRebellion #End time sect #Anti-constitutional enemies #Democracy enemies #Climate protection law #Berlin pic.twitter.com/xcBhyYsviG
An Islamist in the Heart of Security Authorities in the Fight Against Islamists? French government covers him? u then he kills 4 police officers? Now #Macron wants to cover it up? There is blood on your hands! You kill with me! Impossible in 🇩🇪? I&#39;m afraid not. https://www.faz.net/aktuell/politik/ausland/messerattacke-in-paris-vertuschung-auf-hoechsten-befehl-16418097.html…
"That is coercion, dangerous interference in road traffic. This affects the normal citizen who has to work. #Extinction rebellion is waging war against the working population. This is an attack on the #state. https://www.tagesspiegel.de/berlin/extinction-rebellion-in-berlin-am-montag-geht-die-blockaden-los/25083372.html…"
What&#39;s up - at @DIEZEIT! Do you still not understand? I do not know how many people I know personally who have lost their job / income / circle of friends because of their # AfD proximity or because they accommodate / serve / do not boycott us / me. pic.twitter.com/j39uPdKR8Y
"MdB #Jelpke, Die #LINKE, is concerned that the fight against # clan crime will &quot;discriminate&quot; against the Arab clans. The LINKE is not an East German party, not a party of ordinary people, but a criminal protection party. https://www.welt.de/politik/deutschland/article201272534/Linke-diskutieren-ueber-Clans-Wir-sollten-ueber-deutsche-Familienclans-prechen.html…"
"Really very funny @polizeiberlin. These are not funny “wedding parties”, but conquerors who #show with demonstrations of power! conquer public space. You and our culture don&#39;t take them seriously. Albert not around! #AfD https://www.berliner-zeitung.de/berlin/polizei/polizeibericht-hochzeitskorso-aus-der-spur---polizei-beschlagnahmt-autos-32206520… https://twitter.com/polizeiberlin/status/ 1178976804922675200…"
