Government celebrated. Why she gets out of coal even though it does not bring CO2 in terms of CO2. Hear and see for yourself. Otherwise you won&#39;t believe it ... pic.twitter.com/NOhwPViHqT
"Freedom or socialism. The question has only one answer. Like 30 years ago, it still brings tears to my eyes. #NiewiederSozialismus https://twitter.com/krk979/status/1178563239753535488…"
"It is said to be illegal to describe an illegal as illegal. That stirs up hatred. I honestly believe that it is this totalitarian, anti-freedom policy that fuels hatred. Or do we already officially live in a madhouse? #AfD # 1984 https://jungefreiheit.de/politik/ausland/2019/new-york-stell-bezeichenung-illegale-einwanderer-unter-strafe/…"
#not pass? Hey boy! You! #nopasaran and we will win! 💪🏼😝 https://twitter.com/michel_brandt_/status/1176805885320015872 ...
"Socialist logic of the Berlin # r2g Senate: he sells 6,000 state-owned apartments for 180 million u and later buys back for 920 million. Question: How many additional apartments did this create? And how many apartments could the Senate have built for around 920 million?"
That speaks for itself. The #left is firmly on the side of the violent and anti-democratic #Antifa. The rule of law and socialism are incompatible. https://twitter.com/MartinaRenner/status/1177175950808813568…
#Seehofer has just joined the committee on his 25% quota commitment from Malta: simply NOT to believe what he said. More in the video 👇 #AfD pic.twitter.com/GD1Rpli0fH
"Carola #Rackete is said to have brought 3 rapists, torturers and murderers to the SeaWatch in 🇮🇹. The GutmenschIn * brings the horror to Europe and is proud of it. Typically green # prosperity: she&#39;s fine. Daddy pays, others die, they don&#39;t care #pfui https://www.welt.de/politik/ausland/article200997712/Seenotrettung-fuer-Folterer-Wir-koennen-nicht-scannen-wer-die-Leute-sind -The-come-without-pass.html ..."
"Now it counts: all democratic parties now elect the # AfD Vice President of the Bundestag, Paul Podolay. pic.twitter.com/QYSGAWcFYE"
Green prosperity children want to kill millions of their jobs. Industrial workers and their families have to fear for their existence u #Greta scoffs: &quot;I assume they just feel quite threatened by us.&quot; Greta-unfortunate # prosperity brat https: //www.welt .de / politik / article200968338 / Greta-Thunberg-about-critics-you-just-feel-pretty-threatened-by-us.html…
The government wants to spend 100 billion euros to reduce CO2. So that the temperatures do not continue to rise. My question to the Vice Chancellor was: how many degrees do the 100 billion bring? Listen to the answer. It&#39;s worth it. #Offenbarungseid #Staatsversagen #NurnochAfD https://www.youtube.com/watch?v=y1yObjHwuP4&amp;feature=youtu.be…
"#Climate policy always says: Germany has a role model function. What a joke! Under #Merkel, Germany is not a role model, but the mockery of the world. China completes mega-airport in 4 years and laughs at #BER. https://www.welt.de/wirtschaft/article200904854/Von-Stararchitektin-Hadid-In-Peking-eroeffnet-futuristic-Super-Flughafen.html…"
"#Steinmeier congratulates the Mullah regime on the Islamic revolution, praises left-wing extremist bands and buys gift baskets from Lebanese arms dealers. A do-gooder standing with his feet in the mud. # civil is only the #AfD #NotMyPresident"
"Der Spiegel about the #Klimapaket: #SPD and #CSU combined the fear that the # commuters and low-income earners &quot;could possibly migrate to the AfD.&quot; Without the fear of us, it would have become much more expensive for the citizens. It is worth choosing #AfD. https://www.spiegel.de/plus/rekonstruction-der-klimaverhandlung-ab-sechs-uhr-frueh-waren-alle-wie-auf-speed-a-71931c54-02b0-48d9-8a32-c1575efff1bb…"
"The disturbing thing about this photo is that Angela Merkel has probably requested an audience with #Greta. It should be noted that if 🇩🇪 were a healthy country, neither of the two people in the picture would have more than local attention here. https://twitter.com/RegSprecher/status/1176155528189362179…"
"The sky laughed over Berlin. About 8000 participants, of course also the Christians in the #AfD. MdB @Ulrich_Oehme and MEP @Joachim_Kuhs. # WillkommenskulturFürUngeborene. #itsachildnotachoice #kulturdeslebens pic.twitter.com/aDr8iWrnI9"
"The purest climate mockery: Merkel flies to the climate summit in the USA - and AKK is not allowed to fly in the same Airbus, but takes off 30 minutes later with its own government aircraft: adds 335 tons of CO2. For comparison: Every German produces 11 tons of CO2 a year."
"I am considering wanting a car again after a long time. I walk my heels in the city 🚶‍♀️, ride 🚲, e-bike and train 🚇. I think it&#39;s time for a # SUV diesel. Does anyone have a recommendation? #Marking #solidarity #current of opposites"
EU Parliament takes decision on the importance of the past for Europe&#39;s future. And forgets (?!) The explicit naming of the millions of Jewish victims. @AfDimEUParl&#39;s application to name the Jewish victims of the Nazis was rejected by everyone from left to black left. #Shame https://twitter.com/AfDimEUParl/status/1175128138340347904…
"30 years after the fall of the Berlin Wall, the old party system is history. Non-left majorities are ONLY with the #AfD. Beyond her there are only weak motley alliances. That is the reality, the AfD is the playmaker. #ltwbb #ltwsn #Saxony #brandenburg"
"#No one needs such a church. Ringing the bell for # Fridays4Future. And #morning for the #march for life then the bells are silent. The protection of unborn life, THAT really matters to the church. https://jungefreiheit.de/kultur/gesellschaft/2019/erzbistum-bamberg-laeutet-glocken-fuer-fridays-for-future/…"
The #AfD wanted to ban the terrorist organization #Hisbollah in Germany. But all other parties voted against. So stop lamenting the &quot;serious dangers&quot; caused by Hezbollah! #Hypocrite! @AuswaertigesAmt http://dip21.bundestag.de/dip21/btd/19/106/1910624.pdf… https://twitter.com/AuswaertigesAmt/status/1174324929879302144…
"After Luisa #Neubauer traveled the world by plane, she now considers the blockade of airports and bridges to be legitimate. With #FridaysforFuture, it is obviously only one step from double standards to ecological crime /25028660.html…"
Good thing we pay for something like #GEZ: Gender has not yet arrived in the animal world. Only the females give milk. What a knowledge. But the males are also useful. Really now? Stop the #Volksverdummug Just #AfD #noGez https://twitter.com/ZDFheute/status/1173976156628037635…
"&quot;If fascism returns, it will not say: &#39;I am fascism&#39;. It will say: &#39;I am anti-fascism.&quot; Who burns down half of the city and cars, beat his opponents, boycotted democratic parties, systematically destroys the existence of dissenters ? https://twitter.com/AnjaReschke1/status/1173874327894335488…"
"# Grölemeyer confessed in the mirror to his left-wing extremist roots: &quot;We had the K groups, the peace movement, we played in Wackersdorf, that&#39;s where we come from.&quot; K groups were the friends of Stalin, Mao and Pol Pot ... https://www.spiegel.de/plus/herbert-groenemeyer-aufgeschuchter-und-nervoes-sind-wir-deutschen- Leichtes-futter-a-00000000-0002-0001-0000-000160489460…"
"No film fits our time better than #DieWelle. Dear #Antifa #Climate fanatic #Gender totalitarian # Grölemeyers u #Gutmenschen, look at that. You are! A totalitarian idea, everyone participates, violence becomes legitimate ... #dictatorship #imstep march https://youtu.be/qkztDM5ukbw pic.twitter.com/hMgLqNX7LF"
"First @groenemeyer, now the # Greens. Both want to dictate with their fists - # everything. Greetings from #Antifa. #Totalitarianism #DieWelle pic.twitter.com/a7QqvkVdAe"
"The Foreign Minister wants the #Dictatorship as explicitly #Groenemeyer. It&#39;s the scariest, nastiest, most totalitarian hate speech I&#39;ve ever heard. That is the tone and furor of the new terror from the left. Who supports this is - like @HeikoMaas - a case for the protection of the constitution https://twitter.com/HeikoMaas/status/1173139512576360448…"
"Papperlapapp @c_lindner wants to rule with the # Greens. He will do everything for a ministerial post, including millions of illegal mass migration, with one condition: #Merkelmussweg. It&#39;s all just a matter of time and then it falls again #FDP # FähnchenImWind #AfD #DeutscheEiche https://twitter.com/georgrestle/status/1172826483720695808…"
"The upper left district mayor #Herrmann, who protects and promotes drug dealers, left-wing extremists and criminal migrants, no longer dares to enter the park in the dark. #can not think https://www.tagesspiegel.de/berlin/ist-mir-als-frau-zu-gefaehrlich-gruenen-politikerin-herrmann-loest-debatte-ueber-park-sicherheit-aus/25008912.html…"
"Dortmund awards #NellySachsPreis to Kamila #Shamsie, a follower of #BDS, who doesn&#39;t want her books translated into Hebrew. No literary prize for enemies of Israel and haters of Jews. https://www.welt.de/kultur/literarischewelt/article200162028/Kamila-Shamsie-darf-den-Nelly-Sachs-Preis-nicht-bekommen.html…"
The # Greens want quotas for fat people. And I ask myself: why not for small people or people with bad breath and strong myopia? #dumb # dumber # green. https://gruene.berlin/nachrichten/diskritierungsmerkmal-wachs-ins-landesantidisisierungsgesetz…
#Kretschmann starts again. The #CDU must decide whether it wants to be a permanent junior partner of the party that wants to run the auto industry in the Auto-Land. There is no conservative policy with the # Greens. https://www.sueddeutsche.de/politik/kretschmann-gruene-baden-wuerttemberg-1.4597796…
 https://twitter.com/Beatrix_vStorch/status/1172053921021485057 … pic.twitter.com/5zCgc62mVT
"Yes, I also believe: #Habeck can chancellor: the destruction of the German key industry qualifies him in the eyes of many leftists. If you choose # green, you want to destroy Germany. https://www.welt.de/wirtschaft/article200151870/Verbot-von-Benzinern-Gruenen-Chef-forder-jaehrliche-Zulassungsquoten-fuer-E-Autos.html…"
"The #CSU wants to save the #world climate by promoting energy-efficient household appliances. In the competition for the most stupid climate proposals, Bavaria&#39;s ex-conservatives are pulling past the Greens. Congratulations! https://www.spiegel.de/politik/deutschland/alexander-dobrindt-csu-sgeht-chance-auf-wirtschaftswunder-durch-klimaschutz-politik-a-1286289.html…"
"Now documented: The public service offers TV for left-wing academics in advanced age. That&#39;s OK. But why should conservatives, young people and non-academics pay for it? #GEZabschaffen #Reuters https://www.welt.de/kultur/medien/plus200021362/ARD-und-ZDF-Wie-die-Oefflich-Rechtlichen-ihre-eigene-Relevanz-riskieren.html#cs-lazy-picture- placeholder-01c4eedaca.png…"
". @ BorisJohnson did the right thing: Proposed new elections. If the government does not have a majority and the UK parliament blocks itself, the citizen has to decide. The buck is with those who deny this right to citizens. https://www.spiegel.de/politik/ausland/brexit-boris-johnson-scheitert-im-parlament-mit-antrag-auf-neuwahlen-a-1286000.html…"
"@BorisJohnson did the right thing: Proposed new elections. If the government does not have a majority and the UK parliament blocks itself, the citizen has to decide. The buck is with those who deny this right to citizens. https://www.spiegel.de/politik/ausland/brexit-boris-johnson-scheitert-im-parlament-mit-antrag-auf-neuwahlen-a-1286000.html…"
"Great moment: @OlafScholz when asked, #why should we get out of coal in Germany when 1000 new power plants are being built in the world and our single-handedly is CO2-relevant IRRELEVANT. Answer: It does nothing. But: we can! That&#39;s why we do it. 🤦♀️"
"The attacks against the #IAA show the left&#39;s hatred of the #automotive industry, which provides work and income to hundreds of thousands of people. We say: Yes to Germany as a business location and to the preservation of industrial jobs. https://www.welt.de/wirtschaft/article199968204/IAA-Aktivisten-forder-Verbot-von-SUVs.html…"
This is how they are: #SPD #CDU #FDP elect a # NPD man into office. Congratulations 🤦‍♀️. But the main thing is to fight resolutely against the #AfD. You are so poor! https://www.welt.de/newsticker/dpa_nt/afxline/topthemen/article199895626/Entsetzen-nach-Wahl-von-NPD-Politiker-zum-Ortsvorsteher.html…
The green-twisted environment minister of the former People&#39;s Party SPD wants to ban oil heating within the next 10 years: I promise that the #AfD will undo it if we get the chance to the federal government beforehand. @AfDimBundestag https://www.faz.net/aktuell/wirtschaft/umweltministerin-schulze-will-oelheizungen-verbieten-16373022.html…
"My replica in @Young_Freedom on @maxotte_says. He wants higher taxes and expropriations. And I think that he can handle his money better than Merkel, Maas &amp; Co. We have no revenue problem. It&#39;s a spending problem. https://jungefreiheit.de/debatte/kommentar/2019/bitte-senkt-meine-steuern/…"
"This is how the Greens are better people: 🇩🇪 should set a good example with #Climate protection of the world, but the plastic suppliers cannot even do without the coffee in the disposable cup with a plastic lid. Nice # AfD selfi 😝 mendacity, your color is green! @JTrittin pic.twitter.com/0HLNGV612t"
&quot;Dear people present&quot;. And &quot;blah blah ... coordinators with a capital i&quot;. Yesterday in the 29th opening session of the # BVV center. Here it is demonstrated what the destruction of our culture through mutilation of our language will look like
&quot;Most people have no problem that their church will be Islamized&quot;. @Ralf_Stegner speaks the Sharia and the degradation of women to people &#39;2nd class. #NONE topic is more important for the survival of our civilization than that: #IslamisierungStoppen #AfD
The #CDU in #SchleswigHolstein wants to introduce Turkish lessons in schools. So that the children learn German better. I believe that Zedeuh-minister da ham selpst already shouted to Kehöa and then niks mea. https://m.ln-online.de/amp/news/Nachrichten/Norddeutschland/Prien-will-Unterricht-auf-Tuerkisch-an-Schulen-in-Kiel-und-Luebeck…
"A year ago I predicted the #LINKEN in the Bundestag: With &quot;ferry instead of Frontex&quot; you are our best campaign helpers in the east. You were! Therefore, many thanks, especially to Ms. @katjakipping. Keep it up! Go under! https://www.youtube.com/watch?v=Fffst2WwzbA…"
"#Lindner refuses to change course. Don&#39;t you have to have a course to change it? Sometimes the #FDP wants to copy the #AfD, then it wants to coalition with the Greens. With such a &quot;course&quot; you land below 5%. https://www.sueddeutsche.de/politik/fdp-landtagswahlen-waehler-absturz-1.4585814…"
💪🏼✌️😁🙋‍♀️
"In the past, such a naive-socialist comment would only have appeared in a bad school newspaper or the party organ of the MLPD. Today he gets prime time from the state radio. #GEZabschaffen #Rietendeckel #Berlin # R2G @AfDBerlin @AfDFraktionAGH https://twitter.com/tagesthemen/status/1166451184934240259…"
"ör-Rundfunk u Government in a desperate act 4 days before the election in the coal region of Saxony: &quot;Dear Saxony, you get a lot of money. Don&#39;t choose the #AfD just because the government is destroying your jobs.&quot; Yes, you actually think really that they are stupid in the east? https://twitter.com/ZDFheute/status/1166659339035262977…"
Posture journalist @NikolausBlome at work. How many was May elected by then? And Cameron? And what was the content of the referendum? #BREXIT or # ONLY with1000pagesDealundBACKSTOPundPARLAMEMTSZIMMIMMBREXIT? https://twitter.com/NikolausBlome/status/1166643709632495623…
"The # FridaysForFuture generation flies the most and also produces the most plastic waste. The Ü60, &quot;old white men&quot;, are much more economical. If #Greta | s disciples adapt their lifestyle to their rhetoric, we can continue talking. https://www.welt.de/wirtschaft/article199266806/Verpackungsmuell-Junge-Leute-verbrauchen-besonders-viel-Einwegverpackungen.html…"
Are they colorfully uniformed or colorfully uninformed? #unteilbar #unheilbar #DieWelle https://twitter.com/Hartes_Geld/status/1165938311862587392…
"It is wrong that the wall is still standing: it would never have been built without the left. The ducking away is symptomatic, because it is always leftists who cannot stand other opinions and are actually not tolerant, cf. leftist violence against dissenters. https://twitter.com/tilsteff/status/1165858112080941061…"
"This will have really shaken #Trump: he doesn&#39;t get an appointment with #Greta. Since he can inquire a hundred times. Tell me, @SPIEGELONLINE, nothing really is too stupid for you, is it? pic.twitter.com/JKIHQIDL6S"
Warning from the Libyan Prime Minister: the #IS smuggles terrorists to Europe as &quot;refugees&quot;. Thanks to @Steinhoefel for successfully combating Facebook&#39;s censorship of this report. The truth needs a top lawyer today. # ZensorenSchreckNr1 https://www.focus.de/politik/videos/auf-dem-weg-zu-euren-kuesten-libyscher-ministerpraesident-warnt-vor-is-kaempfern-auf-fluechtlingsbooten_id_5812602.html…
Now the top Green politicians are already campaigning for the #AfD. Thanks @ABaerbock! #ganzgrosseskino pic.twitter.com/mr9ZlbhsBC
Now &quot;Pornstudies&quot; are also offered at the university in #Berlin. The Chinese train hundreds of millions of engineers and programmers and you watch porn at German universities. This is deliberate damage to the taxpayer and targeted doping of the &quot;academics&quot;. #AfD https://twitter.com/MsOeming/status/1164424529269207041…
Hopefully new elections in Italy soon. Then the citizens can decide on #Salvini&#39;s course and whether they want #Rackete &amp; Co to keep dancing on their noses. https://www.welt.de/politik/ausland/article198838357/Conte-tret-in-Italien-zurueck-Die-Regierung-endet-hier.html…
Thank you politely for the campaign help😌. Hopefully quite a few voters in the East will see this before the election: Whoever chooses #CDU chooses left-green mainstream blah or left-wing extremist culture annihilators. But a measure and its values will soon be thrown out in the Union. #AfD https://twitter.com/MGrosseBroemer/status/1163010395151503360…
"The @spdde fights fiercely for the 3rd sex and then wants a team of a man and a woman as chairperson. 3 questions: aren&#39;t they all just social constructs, where is the quota for the / the various * _ and - do you think the effort is still worthwhile?"
 https://www.welt.de/wirtschaft/article198622037/Greta-Thunberg-Jetzt-ist-ihr-Segeltrip-nicht-mehr-sauber.html …
Dozens of helpers are carting tons of material to 🏴󠁧󠁢󠁥󠁮󠁧󠁿masses of media people fly in and praise the super rich luxury toys as #Greta&#39;s CO2-neutral means of transport. Captain #Casiraghi otherwise offers 🚁 sightseeing flights over Monaco. #Climate neutral # LargestPropaganda broadcastEver pic.twitter.com/6H39cjG0wT
The #DalaiLama says there are too many refugees in Europe and Germany cannot become an Arab country. I agree with a little correction: we can already become an Arab country. BUT HOW DO NOT WANT! And only the #AfD wants to prevent this! https://twitter.com/christianlueth/status/1161659539541889024…
"So these are the dynamic, new sympathizers who want to breathe new life into a dying person. The #SPD has finished. But something like that. 👏 # oath of disclosure https://www.spiegel.de/politik/deutschland/spd-vorsitz-gesine-schwan-und-ralf-stegner-tret-als-team-an-a-1281876.html…"
"Preaching doomsday u then take off: the Greens save the world by frequent flying? Because then their &quot;parliamentary initiatives&quot; through &quot;dialogues with experts&quot; are &quot;based on valid knowledge&quot;? Yes, do you want to celebrate us? #Klimaterroristen https://www.bild.de/bild-plus/politik/inland/politik-inland/bundestag-das-sind-die-vielflieger-des-parlaments-63863732.bild.html…"
Willy Brand would fly out of the #SPD today for such a statement as a xenophobic racist nationalist. &quot;... think of our own countrymen first.&quot; #Gottseibeiuns https://twitter.com/torben_braga/status/1159462474690826240…
"ör-Zwangsfunk in almost complete cultural submission to the #Islam: beating women is &quot;controversial&quot;. NO! It is absolutely incompatible with our culture and our values. We will fight this Islam rigorously! #Fate question #AfD https://www.br.de/nachrichten/bayern/frauen-schlag-umstrittene-empfendung-von-islam-gemeinde,RXtiDia…"
#CDUCSU and #SPD are undiminishingly undermining the German auto industry in order to meet the emission targets of the #EU and to build with the green castles in the air. That cannot go without serious consequences. Something is rolling towards us! #futschi #GroKo #AfD https://www.wiwo.de/unternehmen/auto/auch-zf-kappt-jahresziel-domino-effekt-erfasst-die-autozulieferer/24865208.html…
"Why are we so upset? Because, unlike this professor (?), We want NO ONE to be slaughtered by us: neither Germans, foreigners or migrants, no legal and no illegal. Just nobody. When will these agitators finally start to think ?! #AfD https://twitter.com/andreasmoring/status/1157036330083409923…"
"#Greta wants to sail to America - like Columbus once did. What comes next? Via the Brenner Pass on foot to Italy, carriage instead of car, carrier pigeon instead of emails? Is this the vision of the Greta disciples, back in the 16th century? #FridaysForFuture https://www.zeit.de/video/2019-07/6065694238001/fridays-for-future-greta-thunberg-will-klimaneutral-in-die-usa-segeln…"
How do we make train stations safer? 1. deport all illegals 2. no longer allow illegal immigrants to enter the country 3. deprive foreigners who have committed criminal offenses and expel them. We have enough German criminals and no need for imported violence. https://www.welt.de/wirtschaft/article197723423/Nach-Bluttat-in-Frankfurt-So-koennten-Bahnsteige-icherer-werden.html…
The &quot;incident&quot; at #FrankfurtHbf - another &quot;individual case&quot; u the reactions show: trust in the state as we knew it and which guarantees the security of its citizens is dwindling under #Merkel and #Seehofer - in a dramatic manner # AfD https://www.welt.de/debatte/henryk-m-broder/plus197723387/Getoeteter-Junge-in-Frankfurt-Die-sozialen-Folgen-sind-katastrophal.html…
I&#39;m also very excited ... The #AfD brings a minimum of 10% when # black-green begins to rule and totalitarian eco-socialism visibly ruins our country even for the last one. With Gendergaga u climate protection instead of auto industry u environmental protection on the abyss https://twitter.com/KonstantinNotz/status/1156171986328064000…
Here you can follow me on Instagram 👉🏻 https://www.instagram.com/beatrix.von.storch/… pic.twitter.com/wXd2ia7NSr
So now #KlimaschutzInsGrundgesetz: So we can be taxed to death. The # Greens will become openly totalitarian and #CSU and then #CDU will support all this madness. Sooner rather than later. Anyone who wants to stop this has exactly one alternative: #AfD https://twitter.com/GruenSprecher/status/1155848382402957312…
Question to the # BDS and “FreePalestine-make-Love-fck-Israel” activists at # CSDBerlin2019: why don&#39;t you even do a gay parade in Gaza? N / A? 👊🏿 https://twitter.com/ronnie_barkan/status/1155171607930966017…
M
# Diesel driving bans in the capital! Berlin Senate provides the ultimate proof that # r2g politics is environmentally harmful and insane. Linksgrün stands for #car hatred and the fight against individual # mobility and freedom of citizens. #NoDriving prohibited pic.twitter.com/tbAC1bjV8n
Submitted later: my conversation with Steve #Bannon about the great tasks of the western world in the 21st century and the greatest danger for Europe. To see here: 👉 https://www.youtube.com/watch?v=h1wtfcX-GHM…
 pic.twitter.com/OYM06DQJAO
"As predictable as pathetic: Barely a week in summer is summer, then the #climate screeching starts again. Hot # climate crisis. But with 17 degrees and rain in July, we are taught that this is &quot;weather&quot;. Has nothing to do with climate. Decide times, you # scareers! https://twitter.com/GrueneBundestag/status/1154050225717166080…"
The provisional # SPD parliamentary group leader Rolf Mützenich describes US President @realDonaldTrump as &quot;racists&quot;. An incredible derailment. This shows once again who splits foreign policy instead of acting constructively with our allies.
&quot;Marauding youth gangs - police surrender&quot;. That was foreseeable. Whoever lets 1.8 million predominantly young migrants from archaic cultures into the country should stop wondering - and start deporting them. And to close the borders. https://www.bild.de/politik/inland/politik-inland/ob-schlaegt-alarm-wir-kapitulate-vor-marodierenden-jugendbanden-63467712.bild.html…
"What a certificate of poverty. Equating Hitler&#39;s industrial mass murder with criticism of illegal #mass migration, #Islamization, #Gendergaga and #Klimareligion comes very close to relativizing the Holocaust. https://twitter.com/akk/status/1152553602868797447…"
90% are for the abolition of the #GEZ. 85% do not believe the public service #fakenews. That shows the # AfD mood barometer. And now? 🤷‍♀️ https://twitter.com/ZDFheute/status/1152200162678333440…
