"RT @AfD: ++ Finally, President Steinmeier is also switching to # AfD course! ++ It must be the wisdom of the office: So he matured the di…"
RT @AfDimBundestag: ++ Israeli intelligence legend Rafi Eitan supports #AfD ++ video message &amp; greeting from the Minister a. D. Rafi ...
Congratulations! https://t.co/SAXU6EeDCa
Congratulations! https://t.co/Z5BTtRI5oT
https://t.co/Z0vfGxeoTp
"As the strongest opposition party, the #AfD will openly address these abuses and continue to campaign vehemently for secured borders and against the import of crime and the hollowing out of our welfare state!"
"#Sondungspapier: &quot;Strengthen the EU financially &amp; also ready for higher contributions.&quot; Macron will be tipped from his chair at the Élysée Palace with laughter. With the money of the German Michels, France&#39;s EU plans will be all the easier to implement ! https://t.co/xsEtxGfjXu"
"RT @AfDimBundestag: Honestly: Have you ever heard of Catholic, Evangelical, Jewish, Buddhist or from ..."
"RT @AfD: Hear, Hear! »A media lawyer from Hamburg assesses the matter in a much more differentiated manner. In his opinion ..."
RT @AfDimBundestag: Look forward today to speeches in the German #Bundestag of the following # AfD MPs (see graphic): Everyone promptly on our…
"RT @AfDimBundestag: # AfD Group requests today in the #Bundestag a ban on the #full veil! In our opinion, this expression is ..."
#Individual case ... »The police-known suspect of Afghan citizenship could no longer be found at the crime scene.« Https://t.co/EM6F116zlF
"RT @AfDimBundestag: After the session is before the session! On Friday, February 2nd, the German #Bundestag will continue from 9:00 a.m. A ..."
#AfD and SPD in the same country. Running. https://t.co/eEcJpU73tl
RT @AfDimBundestag: # AfD MP @StBrandner: The concept of a study assumes scientificness and this is apparently missing here…
RT @AfDimBundestag: There have been press reports that the # AfD parliamentary group is committed to the abolition of §130 StGB. This is fa ...
RT @AfDimBundestag: The # AfD Group in the German #Bundestag wishes you happy #Easter and relaxing holidays! # Easter2018 https: //t.co…
RT @AfDimBundestag: The Greens once again demonstrated their strange understanding of democracy in the #Bundestag. Intermediate questions from #AfD rejects ...
The future prospects for our country are bleak if even the smallest immigrants create a climate of fear in our schools - here it is imperative to take countermeasures to protect our children and teachers! #AfD # Easter2018 #Easter https://t.co/L3arjGcs7F https://t.co/GKNhIVcBiW
RT @WMuhsal: The Easter days offer a good opportunity to relax with the family. Since my husband and I in summer our fourth ...
#Good Friday walk at the castle #Salem. #Easter # Easter2018 https://t.co/WaWSRihWVg
"#Seehofer s #Home Ministry is increasingly turning out to be the campaign center of the CSU, which is operated at the expense of taxpayers. Voters in Bavaria will not let sand in the eyes of #LtwBy in October! #AfD https://t.co/oUasP2z1C2 https://t.co/BPg9WzUyPd"
This terrible act of blood has to shake the whole of Europe! We must not wait until the imported Muslim #antisemitism claims deaths in Germany as well. #AfD https://t.co/73zPaQ2hoi https://t.co/Wj2QU6zuy7
"The most important question is not asked: How many of the 15,000 return afterwards how often across the open borders? #AfD https://t.co/GWkuO1rnVx"
The program is a misconstruction and an imposition for the German taxpayer. Because it rewards migrants with tax money for their illegal entry. #AfD #Bundestag #Deportations https://t.co/SkROLT3jTv https://t.co/DsqvMctSbi
RT @AfD: +++ End EU accession negotiations with immediately! +++ The #AfD already rejects Turkey&#39;s accession in its basic program…
RT @AfD: The incomprehensible statement of a headmaster: »Your daughter does not have to say that she is. You can also give her a ...
RT @AfDimBundestag: 1⃣5⃣.0⃣0⃣0⃣ followers - thank you very much for your keen interest in our work as opposition leader in the #Bundestag! F ...
I call on the federal government and in particular the &quot;home minister&quot; host #Seehofer (CSU) to address this Islam phenomenon and to create opportunities to immediately take the perpetrators into custody and remove them from the country. #AfD https://t.co/eY4gO2sXz2 https://t.co/GD0JxPjpio
"My reply to the Chancellor&#39;s # government statement: It is simply not enough, Ms. Merkel! #Bundestag #AfD https://t.co/jsex20tYfl"
"€ 343 million #child benefit went abroad in 2017 - a tenfold increase since 2010! A small request from @AfDimBundestag uncovered this, but the EU Commission sees no need for action: has nothing more to say in its own country! #AfD https://t.co/2JWKpltjCe https://t.co/VtZK2GK0KA"
"RT @AfDimBundestag: The best speech excerpts of the # AfD deputies from the 20th and 21st session of the #Bundestag s - with @MdB_Lucassen, @…"
#GroKo declined today to discuss the #AfD&#39;s urgency proposal to set car emissions standards. Employees in the automotive industry &amp; their families are entitled to have the #Bundestag deal with their fears! https://t.co/ZmbqzQXO6W https://t.co/s0y0pkJeZG
"Instead of an EU policy based on interests, finance minister #Scholz once again swaggered over the greater contribution that Germany had to make. #Bundestag # Government statement Subscribe to the #AfD YouTube channel now https://t.co/0AA5Arcg5y https://t.co/Q3Rgz0FZhp #Dexit"
"RT @MalteKaufmann: one-day discussion with Dr. @Alice_Weidel #AfD on March 21, 2018 shortly before the # government declaration #Merkel: # coalition agreement give…"
RT @AfDimBundestag: Response from the # AfD Group Chairman Dr. @Alice_Weidel on the # Chancellor&#39;s government statement: That&#39;s enough…
RT @AfDimBundestag: Alexander #Gauland replies as # opposition leader to the # Angela Merkel government declaration #Merkel: You have the 1st…
It was &quot;slit&quot; again. #AfD #Bundestag #Kretschmann #GroKo #Regierungserklaerung https://t.co/1XlbhbB5zw
Knife attack from second grader to teacher should not be &quot;overrated&quot; according to the Greens. In a &quot;scramble&quot; she was stabbed. So so. #AfD #Bundestag #Kretschmann #GroKo #Regierungserklaerung https://t.co/ChwwRS7d2H
"This week, the # Federal Chancellor, who &quot;presents&quot; us with her chancellorship for the fourth time, will make her government statement - that was also our topic during today&#39;s conversation with the press, which I used to take a look at Bavaria &amp; the CSU. #AfD #Bundestag #GroKo https://t.co/j1labIIdV4"
Prepare for my speech on #Merkel s #Government Declaration on Wednesday! #AfD #Bundestag #GroKo #AfDimBundestag ℹ https://t.co/d03aTLSjqv https://t.co/rt3l6tbpiV
So much for the topic &quot;#Link extremism is an exaggerated problem&quot; (Manuela #Schwesig). Building bombs against the right is not a problem or what? #Ramelow #AfD #Bundestag https://t.co/HbRVihKFjJ
"We do not have to learn to deal with Islam, we do not have to bring Islam to the bottom of the Basic Law, but Islam has to adapt fully to us. And this can be enforced with the full harshness of the law! #AfD https://t.co/k2mUzIxxnR https://t.co/3w6Bvr0Y2C"
Finance Minister Scholz for more to the EU: I call for an EU referendum! Citizens should now be able to vote on the #Dexit instead of transferring more and more of the money they have generated to Brussels. #AfD #Brexit #Bundestag https://t.co/gr5CwMpd2n https://t.co/EPDHk3hxFC
"It was nice at the @AlternativeBW&#39;s busy # AfD statute party conference in #Heidenheim. Many thanks to the regional board, the regional office, the Junge Alternative and the many members and helpers. https://t.co/0iftVamJ1J"
Wild things. Why is that? #AfD https://t.co/eA9M4ceUPj
That was the oath of revelation. #AfD #Bundestag https://t.co/HPDM3z04rj
+++ We stick to it - border controls are essential! +++ Our request to check the borders again has just been rejected by all other parties represented in the #Bundestag with arguments drawn to the hair! #AfD #Bundestag https://t.co/uxovo8JNe7 https://t.co/ApoPadl8js
RT @AfDimBundestag: +++ tone to: Dr. @GottfriedCurio on the proposal by the # AfD Group for &quot;introduction of comprehensive border controls&quot;. +++ woman # M…
Sunday reading. #AfD #AnneWill #GroKo https://t.co/NrJY0ZufjJ
What does home mean for us and me? I was asked that yesterday in the #Tagesthemen - the answer is in the video! You can find the entire interview here: https://t.co/DDPd2D7Btn #AfD #Bundestag https://t.co/oIZNAi0QNp
RT @AfDimBundestag: TODAY in the #Bundestag: Request by the # AfD Group for &quot;Introduction of comprehensive border controls&quot; - with n͟a͟m͟e͟n͟t͟l͟i͟c͟h͟e͟…
Every week we learn of girls stabbed by asylum seekers or cruelly murdered with knives. And the #chancellor remains icy cold &amp; untouched about this unprecedented series of violence against young women! #Kandel #Mia #Mireille #Maria #AfD #Bundestag https://t.co/aQjjOhOoBM
"+++ Watch BILD interview &amp; switch on the #Tagesthemen at 10.30 p.m. +++ I often met the question why we congratulated Angela #Merkel. But we did not congratulate her, but rather expressed our respect for the office. #AfD #GroKo https://t.co/TmKVF4LUj0 https://t.co/mVd0ulBNUl"
RT @AfDimBundestag: # AfD parliamentary group leader Dr. @Alice_Weidel on the murder in #Flensburg: it can&#39;t go on like this - the asylum policy into ...
&quot;Case of acute # Merkel allergy? The two # AfD faction leaders Alice Weidel (39) &amp; Alexander Gauland (77) had to sneeze after the # defense of the Chancellor. Weidel jokingly:&quot; There is no sheet of paper between us - not even a handkerchief! &quot; https://t.co/ltOVFQ8bTm
"Relief of the middle class and the worker, limitation of immigration - k͟e͟i͟n word in the # coalition agreement! #Kanzlerwahl #AfD #GroKo https://t.co/7RHNHFs7cE NOW subscribe to the @AfDimBundestag YouTube channel &amp; never miss a speech: https://t.co/0AA5Arcg5y https://t.co/iCdwc4P8nX"
"RT @AfDimBundestag:. @ Leif_Erik_Holm, Deputy # AfD parliamentary group leader, yesterday unequivocally replied to what he said about the 4th K…"
"RT @AfDimBundestag: Yesterday, the # AfD MP Dr. @GtzFrmming on the #chancellor election: What is happening here in the #Bundestag is ..."
What is great about the #GroKo is the loss of trust among the citizens ... #Coalition agreement #AfD https://t.co/dnpr6sQbXs
Remedial action could be taken quickly: only benefits in kind for asylum seekers! The boards would not be so overloaded and Jens #Spahn could continue to indulge his ignorance of the realities of life. #AfD ℹ https://t.co/sJPbG57urw https://t.co/SK6wUpn21U
+++ just imagination? -Attacks only increase &quot;felt&quot;! +++ Fact is: Not a week goes by now in which at least 1 bad knife attack does not happen - apart from such tragic cases as that of 15-year-old Mia from #Kandel! #AfD https://t.co/Qi3Cp7fuKD https://t.co/Gm2cwTX2u9
"RT @AfDimBundestag: ++ Scandal at the #ITBBerlin: radical Muslims are pushing exhibitors! ++ MdB @S_Muenzenmaier, # Tourismus-Kommissionvo…"
"+++ No # visa exemption for the! +++ Granting Turkey complete visa exemption for the EU is a high-risk insanity. In this way, a gigantic number of people could simply enter Europe &amp; especially to. #AfD https://t.co/lb8wdE6HpD https://t.co/Kyyqfbx8XN"
"+++ embarrassing for! +++ Now, of all people, censorship minister #Maas is supposed to represent our country as # foreign minister. It doesn&#39;t seem to understand why the #SPD hits new historical lows with every survey - or it simply doesn&#39;t care. https://t.co/V8EvCT2Tmr https://t.co/gp000e1mqe"
The city council made a proposal to set up mobile dwellings on the # playground to meet the short-term need for connecting accommodation for recognized # refugees. The direct residents think little of the proposal. #AfD https://t.co/JIWcG99h3M https://t.co/nplalrTIqP
"»Female lecturers are not accepted by every refugee, interfere with teaching, do not respect the teacher, ignore work instructions or do not even appear in the classroom.« The integration experiment fails at school! https://t.co/QdjnfyASep"
"»I no longer feel comfortable and safe in this city. Something got out of joint here. «(A 48-year-old Berliner). Due to the unregulated immigration, (not only) the big cities have become hotspots of violence &amp; crime. https://t.co/tRewvERt1H"
"“Deutsche Umwelthilfe” (# DUH), an organization the size of an allotment garden association, successfully targets the automotive industry - #Toyota | s lobbying has more than paid off. We stand up for #Diesel - and against #Driving bans! #AfD https://t.co/Z3xEzWVkJX https://t.co/t4l5aBdDgL"
"RT @AfDimBundestag: The # AfD parliamentary group&#39;s proposal to fix the language in the Basic Law met with violent pressure, particularly at the Union ..."
I wish Alexander Gauland all the best for his birthday today - of course he was given as well! https://t.co/DZLBqyacLG
(4) It represents the interests of the citizens of its home country. #Salvini is therefore rightly one of yesterday&#39;s winners. # elezioni2018 https://t.co/pok1AnenJD
"(3) Ü͟b͟e͟r͟s͟e͟t͟z͟u͟n͟g: I congratulate @matteosalvinimi very warmly on yesterday&#39;s great election success in. #Salvini advocates border security, a restrictive immigration policy and a loss of sovereignty at home. # elezioni2018"
"(2) Salvini is committed to border security, for a restrictive migration and against the loss of national sovereignty. He represents the interests of his own citizens of his native country. Matteo Salvini is rightly one of the winners of yesterday&#39;s elections."
++ Gratulation an die @LegaSalvini &amp; Matteo Salvini zum Wahlerfolg in! ++ (1) Many and cordial wishes from me to @matteosalvinimi for the great success in the national elections yesterday in Italy. #LegaNord #oggivotoLega # election2018 #AfD https://t.co/0SUgdW4fM5
"We are opposition leaders - and as such are not only interested in watching #Groko closely, but in particular in the interests of the citizens. That is hardly to be expected from the old parties! #AfD Complete interview: https://t.co/KPtJejn6VV https://t.co/Rh13vnzR3A"
RT @AfDimBundestag: Here is a brief summary of our proposals and positions during the 17th and 18th session of the German…
Visiting @ardmoma. #AfD #GroKo https://t.co/JthjFnfUG9
RT @AfDimBundestag: Press conference from the #Bundestag on the #SPDmember decision pro #Groko with the group leader Alexander # Gaul…
"RT @AfDimBundestag: (1) This weekend, our board met for a closed conference near Berlin. At sc ..."
"(3) as Roland Baader in his pamphlet &quot;Totgedacht. Why intellectuals destroy our world ”, the socialist dictatorship is just around the corner."
"(2) If every opponent of unlimited welfare state &amp; unrestricted immigration &amp; multiculturalism, in short: every non-left can be defamed indiscriminately as potentially right-wing right-wing extremist, equal to &quot;fascist&quot;, &quot;racist&quot; &amp; &quot;inhuman&quot;,"
Reading Tip! (1) It is a dangerous brew that has been touched on and has gained influence far beyond the ideological core of the socialist left under labels such as “struggle against the right”. #AfD https://t.co/BQBMlP3z4D
"Makes you think: German environmental aid (#DUH) has been working with Toyota for many years. Why? According to Toyota, diesel vehicles only have a registration share of 20%; German manufacturer, however, sometimes three times. #AfD https://t.co/ocrs8Nu34b"
+++ Sound to +++ The #AfD is rightly the second strongest force - I explained why this is so this morning in an interview with n-tv. Watch - and retweet. Thank you! Here is the whole show: https://t.co/hpMhPVKIex https://t.co/ehpotErZG5
"RT @AfDimBundestag: ++ # vacation tax? Paint without replacement! ++ MdB @S_Muenzenmaier, Chairman of the Committee for #Tourism, on the planned ..."
"»A social attitude that your own countrymen do not forget: In Merkel&#39;s year 2018, this already qualifies you as a &#39;Nazi&#39;. Is it even more absurd? «#TafelEssen #AfD You can find my full guest post in @Junge_Freiheit here: https://t.co/BQBMlP3z4D https://t.co/AePxKXoktH"
RT @AfDimBundestag: Eloquent silence after a short intervention by the deputy # AfD parliamentary group leader @Beatrix_vStorch: All that…
"RT @AfDimBundestag: # AfD parliamentary group leader @Alice_Weidel on the classification of Algeria, Morocco &amp; Tunisia as safe countries of origin:…"
"Even the attack on the #Breitscheidplatz could have been prevented, would finally deal with danger as it was appropriate. These should be locked up &amp; deported immediately if possible! #AfD #Bundestag https://t.co/0AA5Arcg5y https://t.co/23zrSnSj8C"
RT @AfDimBundestag: MdB Roman #Reusch presents two proposals from the #AfD: Responsibility of the federal government for the prevention of dangers S…
Finally a punching bag - or kick bag. #AfD https://t.co/wv2p7VaSUZ
RT @AfDimBundestag: Alexander #Gauland &amp; @Alice_Weidel on the #corporation ban of @cducsubt with #AfD: The Union is proving that a…
"Who would have thought that: parts of the majority society with anti-Jewish &amp; anti-Zionist extremists from Arabia identified, especially leftists. Everyone in the Jewish circle of friends says: Violence vs. Jews only come from Muslims. «#AfD https://t.co/5wMqr6CkT5"
"RT @AfDimBundestag: ++ #Diesel judgment: expropriation of millions of citizens! ++ Dr. @DirkSpaniel, traffic pol. Spokesman for the # AfD Group, on the # BVerw…"
"+++ # TafelEssen: Shame on you, Ms. Merkel! +++ Volunteers in all of Germany bathe your politics of open borders. And you even have the cheek to criticize the board in #Essen for your completely understandable actions! #AfD https://t.co/BHF5Bb8Xf7 https://t.co/zUHvRl5mCl"
"++ Unsuspecting Minister of Education #Karliczek! ++ Merkel&#39;s cabinet of curiosities shouldn&#39;t shock anyone anymore, but you manage to go a step further. It is already clear what can be expected from this #Groko: nothing. #AfD https://t.co/IyrQChNRi1 https://t.co/MJZ8nSoo6B"
RT @AfDimBundestag: Today&#39;s decision by the Federal Administrative Court is eagerly awaited: Allow the municipalities to # Dieselfah…
"The left wants the # rent brake on the planned economy. Extend bureaucracy monsters. Typical socialists: If the consequences of pol. Wrong decisions become unmistakable, if you want to paste them with even more dirigism and governmental restrictions. #AfD https://t.co/a6nOQhLVri https://t.co/DmvfniVdjQ"
"Refugees should only receive benefits in kind, financial support is inappropriate, also in view of the events at #TafelEssen. And must finally deport the asylum seekers whose applications have been rejected. #AfD https://t.co/icIjfkVaaR https://t.co/WuiZWmVHNX"
"+++ Graffiti attack on the #TafelEssen +++ We live in a country in which the social division is being pushed ever further, without the established politicians being interested in changing this. #AfD https://t.co/JRZQSeDlKK https://t.co/JESwxd0qIb"
"The @AfDimBundestag represents more than 6 million Germans - including people from all walks of life. The rabble in the plenum is therefore not a &quot;recipe&quot; against us, but rather embarrassing and completely unworthy of our democracy! #AfD #Bundestag https://t.co/bw8JqJwKl3 https://t.co/q5vw9bSvBn"
"Numbers don&#39;t lie: If you look at the demographic development and how many children a Muslim. Family compared to a family, then no questions remain unanswered. &amp; show us the future! #AfD Source: &quot;Talk in the hangar&quot; https://t.co/hliOfoIkWc https://t.co/5dnRJLFbGl"
"The new federal government consisting of ÖVP &amp; FPÖ reforms asylum law. And takes action, a role model for. I am therefore pleased to be a guest at https://t.co/2bGi4nAcna on this topic this evening. Turn on at 11:35 p.m .: https://t.co/hliOfoIkWc #AfD https://t.co/0v8Do9NcmL"
"Here you can see my speech today in the German #Bundestag on Angela #Merkel&#39;s government declaration on European policy: The free exchange of goods with the United Kingdom must be put on a new, reliable basis. YouTube version: https://t.co/o6RJJQmGN6 https://t.co/cSqvmBURPi"
"++ We are People&#39;s Party! +++ For the first time in its history, the #AfD (16%) has overtaken the SPD (15.5%) at federal level - we are the second strongest force in Germany! I would like to thank you in particular for supporting us every day! Source: https://t.co/4xqTau7qYB https://t.co/VfgNjclDM4"
"RT @AfDimBundestag: -Tip: MdB Roman #Reusch as guest at #hartaberfair! &quot;Overworked, overwhelmed, too lax - what goes wrong with the Geri ..."
"Many marriages are forbidden &amp; are punished with imprisonment or fines. In our country only one wife is accepted and no harem. In addition, social benefits for asylum seekers must finally be canceled and converted into benefits in kind. #AfD https://t.co/lVPMiByjza https://t.co/GvjxAodeuJ"
"Environmental protection &amp; sustainability are without question sensible concerns. But manipulation instead of facts, endangering 1.8 million jobs &amp; neglecting internal security is of no use to the environment or our country! #AfD https://t.co/b08ZUO226D https://t.co/HBpSRe6LKj"
Here again the position of the @AfDimBundestag on the #Doppelpass - which we of course reject. It cannot be that there are two loyalties. #AfD https://t.co/NMs9pTizKU
"@dr_dlf @Alexanderwtk @ulfposh Thanks for the tip, was added to our post. Best regards, Team Weidel"
"If the #Media reports today that the &quot;German journalist&quot; # Yücel has been released, that is two #Fakenews in one sentence. I explain why this is so here: https://t.co/v3WVlI1PG1. #AfD #FreeDeniz #FreeDenizIsFree https://t.co/RcQ6tGW79E"
A journalist slipped into the role of a Syrian refugee for a documentary - and applied for asylum. What he describes is the decomposition of Germany from the inside. The right to asylum may only be temporary protection for those actually persecuted! #AfD https://t.co/fKQh7Uf3Ho https://t.co/wo50WIIo2d
Only 1 percentage point separate #AfD (15%) and SPD (16%) - and that makes it finally clear: We are replacing the SPD as the voice of the employees! Here you can find the current survey values of all parties: https://t.co/bcNlxGSmr6 #GroKo https://t.co/YydzJPiK1R
RT @AfD: Again the German taxpayer should pay for misconduct! That the #Brexit is caused by the presumptuous dictation of its ...
Suddenly you hear a loud &quot;Allahu Akbar&quot; !? Is this interactive learning book from the Ravensburger publishing house suitable for children from the age of 4? Or is Islam now conquering our children&#39;s rooms? What is your opinion! #AfD https://t.co/VukYVW6FGR https://t.co/P571euvNUX
RT @AfDimBundestag: Event of the # AfD Group vs. #Antisemitismus - Alexander #Gauland is looking forward to support: The early…
People&#39;s Party #AfD https://t.co/5VdohthCrD
"The Minister of Defense had all the time in the world to structurally renew and equip the #Bundeswehr. Instead, multicultural &amp; gender justice was important to her. To the #GroKo: Eliminate Ursula #vonderLeyen! #AfD https://t.co/WiInUhxKxj https://t.co/XrFxEoPKz5"
"To the point! »The boyish childish way of #Nahles repels many voters. With &quot;Bätschi&quot;, &quot;auf der Fresse&quot; &amp; &quot;Widdewiddewitt&quot; she does get into the &quot;heute show&quot;, but she doesn&#39;t gain political charisma or charisma. «# PAM2018 #GroKo #AfD https://t.co/ajGGbHxTxi"
"Poor Mr. Yücel, who said about Thilo Sarrazin that &quot;one can only wish that the next stroke will do his job more thoroughly&quot;. All of this remains unforgettable. https://t.co/bMCelAoFsT"
Welcome to Absurdistan. https://t.co/hjpQfPbi1p
Viktor Orbán continues to secure the Hungarian border and finds allies with his (southeast) neighbors. What is the Chancellor doing when it comes to border protection? https://t.co/G3vx1RVbCh
Criminal immigrants with 20 (!) Identities fool the asylum authorities. What else has to be done for this madness to finally end? #AfD https://t.co/1rvgH8ylB2
A big compliment to the Olympians from @TeamD in Pyeongchang! Congratulations on the great accomplishments! # pyeongchang2018 #Olympic winter games
There is asylum anarchy in Germany - and neither the #Groko nor the CSU in Bavaria want to change that! #AfD https://t.co/RjLlhU2m4Z https://t.co/sCxuiO2FCY
"While the outside is given the impression that they are also in favor of such measures, the Union votes against all #AfD applications that aim at an age check. We will continue to work for correct age determination! https://t.co/h61uYXRnDE https://t.co/3skVReG1yo"
"RT @AfDimBundestag: Dr. @Alice_Weidel and Dr. Alexander #Gauland, chairman of the parliamentary group of the alternative for: #AfD will…"
This is NOTHING compared to the price that now has to pay for 4 years! Angela Merkel in the # berlindirekt interview: »The CDU also&quot; paid a high price &quot;for the goal of forming a stable government.« #AfD #GroKo #Koalitionsvertrag https://t.co/YFUPwDDeWO
"In a country in which we like to live well ... »Right before the station entrance 15 to 20 black Africans suddenly attacked each other. Clashes between drug dealers are suspected. When rescue workers arrived, Messer was still in the head. «Https://t.co/lDgQJOe13e"
"&quot;While women fight for freedom in Iran, it is given up without a fight in their own country.&quot; Graphic: @Junge_Freiheit found at: @ MaryKhan77 https://t.co/odbj4uyOl1 https://t.co/kcUTstffc3"
"Ms. #Merkel, please do the same to Mr. #Schulz, refrain from the new chancellorship and finally do a real service! #AfD #GroKo # Foreign Minister #Coalition Agreement https://t.co/5XvRoYafwk https://t.co/gKIFyIjwTK"
Without words. https://t.co/263PQuVZ6X
