"Uprising against #Merkel in the #CDU? A little late, right? Where was the uprising in autumn 2015 or in the eternal &quot;Euro rescue&quot;? #AfD #GroKo #Coal contract https://t.co/wYjCkRLcvM"
In the name of the people...? &quot;Anyone who has refused to do military service in Syria and is now seeking protection can be granted refugee status.&quot; #Family reunification #GroKo #AfD https://t.co/YAz5ZsSoHg
RT @AfDimBundestag: Guest commentary by the # AfD group leader Dr. @Alice_Weidel on the # GroKo agreement in @Junge_Freiheit: Even the ...
Very worth reading! »Is a good example of how reeducation works. That explains the fatal refugee policy of the open borders. «#AfD #GroKo #Koalitionsvertrag #Heimatministerium #Ober Grenze https://t.co/ev9eYXgdZV
RT @AfDimBundestag: # AfD parliamentary group leader Dr. @Alice_Weidel on the # GroKo agreement: the gap between the ruling parties has never been ...
RT @AfDimBundestag: Video of the press conference of the # AfD group on the # GroKo agreement with the group leader Dr. Alexander #Gauland and…
The suspected staff of the # GroKo departments alone take your breath away - and the unworthy job post is just beginning! Schulz Foreign Minister Maas Minister of Justice Seehofer Interior Minister Altmaier Minister of Economics #Coalition Agreement #AfD #Coalition
When will it finally stop!? “She said that the Afghan asylum seeker had sexual intercourse with her against her will. He had already been sentenced to 1 year in prison for parole for attempted rape. «Https://t.co/iDYZKEYMaD
Blank # GroKo madness: Word # upper limit does not appear in the # coalition agreement! It is said succinctly that 180-220k immigrants pa - 880k in the legislative period &amp; 2.2 million in 10 years - will come. needs the #AfD more than ever! https://t.co/fysnVjXwfC https://t.co/nAUec1rcR6
"Reading tip: # Gender madness in: »If the Duden editorial team has to deal with the phrase&quot; Dear members &quot;, this says less about justice than about the mode of action of permanent brain vaccination.« #AfD https: // t. co / GciMR8CwTg"
“The #Cottbus example clearly shows how withdrawn the established parties are. They have completely removed themselves from the problems of the people and simply let the citizens down. &quot;#AfD #GroKo https://t.co/oElQw1keIo https://t.co/23pekrLJ9Y
"I thank you and you for the many congratulations on my birthday, which reach me in various ways. By the way, you can also congratulate the #AfD today - because today our party was founded 5 years ago in Oberursel! https://t.co/jaYnOzMdqZ"
# INSA survey: 15 percent would currently vote for the #AfD - only 2 percentage points on the SPD! #GroKo https://t.co/lfGj56y5tq https://t.co/CjIbn8JusJ
"While the # Groko negotiating partners open up a secondary location, the real problems of the people fall behind! #AfD #AnneWill #Cottbus https://t.co/BjIDkITtOd"
Without words ... »The student body has become much more heterogeneous - German as a second language has become a qualification in many places that primary school teachers should have.« #AfD #GroKo https://t.co/2LaPmAMXAO
No to the #family reunification! Overwhelming the #BAMF makes a mad sum possible for a family of 10! We reject further burdens on those who do their daily work and often make ends meet with difficulty! #AfD #GroKO https://t.co/mxXidfwZ9p https://t.co/S1i3rGuHAr
"Lord, throw brains from heaven! #Woelki expressly denied that his receptivity had reached the limit: &quot;We have not reached our limit and are not getting there.&quot; #AfD #Family reunification # Upper limit #AnneWill #GroKo https://t.co/NXsHeSSryn"
"&quot;You should actually laugh about it, but it is fatally proof of the intellectual bankruptcy of our society due to the compulsive political over-correctness.&quot; Become a fan of my # AfD state association Baden-Württemberg: https://t.co/ey2V9bg2e3 https: / /t.co/CbBzGh7sdw"
urgently needs to protect itself against such developments as in! Conditions similar to civil war in #Calais: Illegal immigrants engage in violent clashes with the police and with one another. #AfD https://t.co/quBPe9xGc4 https://t.co/pWECuYt6wE
"Pious appeals do not help against anti-Christian attacks, but an end to the unregulated immigration that Christians haters bring into the country! #AfD #Bundestag #AfDimBundestag https://t.co/QnpYXnpFnj https://t.co/gIE2rA6Yn3"
#Doppelpass? Rejects the @AfDimBundestag! #AfD #Bundestag #AfDimBundestag https://t.co/8pkvykfPBZ
"Aha ... &quot;At the point where the painting hung, museum visitors should now pin their contributions to the discussion on small pieces of paper on the wall.&quot; Https://t.co/nJ3C4RcAJS"
++ # AfD faction against family reunification! ++ How fragile the #Groko will be can already be seen today with the topic &quot;#Family reunification&quot;. Union &amp; SPD still disagree on this. The @AfDimBundestag did not agree to the CDU application - we keep our election promises! https://t.co/UJ0jDdwIZT
+++ chosen! +++ Congratulations to the # AfD parliamentary group colleague Roman #Reusch on the election to the parliamentary control body of the #Bundestag | es. https://t.co/iuZ5XZql1X
The #Bundestag is currently debating the #family reunification. The @AfDimBundestag clearly rejects this! You can find other important topics of the day on the agenda of today&#39;s meeting - tune in &amp; follow the debate live: https://t.co/lxa8wgIsnN https://t.co/VJn1DwkVf5
RT @AfDimBundestag: Today&#39;s 11th session of the German #Bundestag | it starts at 9:00 am and marks some interesting and important days…
"In the #tagesthemes I was interviewed to our three committee chairmen in the #Bundestag. I congratulate my # AfD parliamentary group colleagues @PeterBoehringer, @StBrandner &amp; @S_Muenzenmaier on their new tasks. All the best! Video of the interview: https://t.co/Y9HNbBtDKB"
RT @AfDimBundestag: +++ # AfD parliamentary group receives all 3⃣ desired committee chairs +++ @stbrandner: Committee on Legal Affairs and Consumer ...
"»Is that journalism? Some are booed, others cheered: First, they know how to create a mood. «#AfD #Rundfunkbeitrag https://t.co/X2dYh7DgRH"
RT @AfDimBundestag: # AfD parliamentary group leader Dr. Alexander #Gauland on #Family reunification: These people should not be here for imm…
"The police officer whom the Islamists visited at his private address was able to save himself in his apartment. must now finally act and identify the danger immediately, it does not want to run the risk of completely losing control! #AfD https://t.co/lF2iHQTt7z https://t.co/6FUUetQVKI"
@AfDFraktion_BW met with the Baden-Württemberg state group in Stuttgart. MdL Emil Sänze: &quot;We exchanged ideas on how we can work together efficiently and actively in the future in order to advance the goals of the #AfD even better.&quot; Https://t.co/YYESDdDWwv https://t.co/TIIQugHPu9
RT @AfDimBundestag: Volker Münz as church political spokesman for the # AfD parliamentary group takes part in the national prayer breakfast on February 8 -…
"Germany&#39;s security is upside down, and actually #GroKo&#39;s first big task would be to restore it. However, this is not to be expected: on the contrary, it will import even more potential for violence. #AfD https://t.co/09DIW7SobG https://t.co/xP8orgd6Ba"
"Citizens have not forgotten that 1 year ago a former SPD state minister, after only 13 months as VW ethics board member, received a severance payment of&gt; € 12 million together with a generous pension - with the approval of other comrades on the supervisory board. #AfD https://t.co/Nu8sqJ4uCE https://t.co/TzDZOaptOU"
It was nice! Last Friday I was a guest at the #Neujahrsempfang @AfD_FraktionNRW. You can find a review of this very successful event here: https://t.co/DncpYqE4pW and further impressions: https://t.co/MWyf5pyz2D #AfD #LtNRW https://t.co/dPh1VwjNoy
"»In addition to their incredible loss and pain, Leon&#39;s parents had to experience that the headmaster expressed his sympathy in the same breath as the family of the perpetrator. This terrible educator remains in office. «#Luenen #AfD https://t.co/IVSRvm66RD"
Incredible! A number of cases against Islamists suspected of terrorism are simply dropped in Germany. How careless are our law enforcement agencies? #AfD #GroKo https://t.co/NBHvD9DdGv
That has to be this restricted #family reunification that the CDU and CSU always talk about ... Or? #AfD https://t.co/n5ynp6ojT9
"&quot;Since the anti-# AfD initiative by Frankfurt club president Peter Fischer, some people from the party have deliberately entered at the end of December and&quot; have all received a confirmation of admission and their membership card &quot;. Https://t.co/9pDSV6oNG9"
RT @AfDimBundestag: Merkel wants to get the so-called &#39;right-wing populism&#39; under control - # AfD parliamentary group leader Alexander #Gauland: »Si…
"Insults, violence, agitation - these are the committee chairs of the #AfD https://t.co/BG19HpyNZe"
"The #AfD takes the place that Union &amp; SPD have long since vacated. It is developing into the new People&#39;s Party. We look at people&#39;s mouths, but we don&#39;t speak to everyone by mouth. We address the problems clearly and offer solutions. https://t.co/8eFh8NPIg6"
"RT @AfDimBundestag: # AfD MP @PeterBoehringer, designated # Budget Committee Chairman of the #Bundestag | es, in the phoenix day…"
"«I&#39;m looking forward to the next statistics on the migration balance for highly qualified people. I suspect that many of them are leaving due to social development. In my personal environment, at least, I often hear about people who want to emigrate. «"
President of the Federal Association of German Economists &amp; Business Economists: »Chancellor has the economic expertise of a primary school student &amp; overwhelmed with refugee policy. Social peace is therefore at risk. And that is an important location factor. «Https://t.co/U3bPqFM9sq
RT @GtzFrmming: CDU and EU reach for the savings of the Germans in order to &quot;save&quot; foreign banks in the event of a crisis. And if this K ...
This so-called #children channel belongs to the protection of our children and is immediately removed from the network and restructured so that it can be used to convey basic social values instead of cheap state propaganda. #AfD #KiKa https://t.co/c87owRVohp https://t.co/2kzEw9RrYO
https://t.co/yvQf2MBM3Y
https://t.co/Dtz80y076h
https://t.co/iDxWPUGRPC
https://t.co/wZVjtVSVIy
https://t.co/BIBY9PSZSG
"Why does every young man suddenly feel, regardless of nationality, that he has to carry one with him? Has this always existed? Some terrifying examples of the past few days: https://t.co/wbk2Rizffq"
"Do you remember the media outrage when I googled the words &quot;Men&quot; &amp; &quot;Knife&quot; several times at # AfD election events and read the rich results to the audience? Unfortunately, I was right - the number of these incidents is increasing rapidly! # Lünen #Candel"
Group meeting of the @AfDimBundestag: Since yesterday we have been in a good mood selecting all positions of the committees and committees. #AfD #AfDimBundestag #GroKo https://t.co/qCfwvFluxD
RT @AfDimBundestag: On the agenda of the next 3 #Bundestag | s meetings are bills by the # AfD parliamentary group regarding: stay ...
We need a central deportation center where all migrants who are required to leave the country are detained and deported. The most important thing would be that the illegals could not even cross the German borders. #AfD https://t.co/NAnzl5guDT https://t.co/tFjj0mvZhj
RT @AfDimBundestag: # AfD parliamentary group leader Alexander #Gauland on the debate about the # upper limit: »Embarrassing to see how the # GroKo part…
My current comment in @Junge_Freiheit: Culture needs freedom from instrumentalization. But the left has an eternal problem with freedom. #AfD #Kultur https://t.co/N4YogekN1i
"is structurally not strong enough for the euro and will therefore never come out of the crisis in the euro. If this house of cards then inevitably collapses, the uncovered checks come to light &amp; it only gets really expensive. #AfD https://t.co/wk8Dd87KCE https://t.co/atW2lcyIQS"
The self-determined person who takes responsibility in his own hands and claims his freedom vis-à-vis the state is increasingly being put on the defensive. My speech on the #Elyse contract in the #Bundestag: https://t.co/AF91QqCOXd #Elysee # Élysée #AfD
I would also have been happy to answer your questions at #AnneWill about #groko - unfortunately the #AfD was not invited. A disrespect for the future strongest opposition in the #Bundestag and its voters! https://t.co/twCS4fydPS
Relax on Sunday afternoon with a good cup of tea and watch the #SPD #party conference. Will Schulz create the party or will the party create Schulz? # spdbpt18 https://t.co/EL4LHAnGJN
The #AfD replaces the #SPD as a people&#39;s party because we have the people and the country in view instead of subordinating our actions to any ideology. Election or #Groko? We welcome both. # spdbpt18 # Special Party Conference https://t.co/M08RqgHa0t https://t.co/yegqJZ8fLW
"The largest &quot;bad bank&quot; - worth reading: »If the #EZB were a commercial bank or a savings bank, the bank supervisory agency it would run itself would immediately close it &amp; deprive the board of management of the license to ever be allowed to run a bank again.&quot; #AfD https : //t.co/Dyemo4yWLq"
"Dear Markus, get well soon and get on your feet. We miss you in the faction! @Frohnmaier_AfD @AfDimBundestag #AfD #AfDimBundestag #Bundestag https://t.co/7XxmLbxebv"
"... in the previous legislative period no #AfD who asked annoying questions. Issues that particularly hurt the refugee policy of the Union. After all, the idea of suspending the #Familiennachzug | s comes from the CDU and CSU. #AfDimBundestag #Bundestag #AfD effective"
"The rows (in the #Bundestag) are regularly very well filled, including the two # AfD parliamentary group leaders #Gauland &amp; #Weidel. There is not so much discipline in the other groups, especially not in the previous legislative period. https://t.co/0Ge5kLA5av"
"The fact that it is difficult to keep calm with the Union&#39;s excuses is self-explanatory - and can be recognized from the numerous notes by the secretaries, in which &quot;Interjections &amp; Questions&quot; are mentioned. #AfD #Bundestag #Age determination https://t.co/azdF6UNXwd https://t.co/Px0kp5herY"
"RT @Alice_Weidel: The @AfDimBundestag ensures more democracy! At the request of our group, the quorum of the Bundestag ..."
"The @AfDimBundestag ensures more democracy! At the request of our group, the quorum of the Bundestag was checked - and it was found that fewer than half of the members were present. The result: termination of the session in the #Bundestag! #AfD works! https://t.co/hiA88koiAD"
Reports that uncontrolled immigration to Germany will bring economic benefits will not be true even if you keep repeating it. This is where the cheapest kind of propaganda is spread openly. #AfD https://t.co/oBykXCYlvZ https://t.co/HsnUTcxPBp
RT @AfDimBundestag: Today the 6⃣ will take place from 1 p.m. Meeting of the 19th German #Bundestag | es. An agenda item is the upcoming ...
I had just thought it was a joke. But it is not. Burka sample at the expense of taxpayers. Everything is great in Afghanistan! #AfD #AfDimBundestag https://t.co/isHdahsmg7
Martin Schulz in Dortmund was called on by neo-Nazis from the &quot;The Rights&quot; party. I regret my tweet yesterday!
Here the disastrous survey value of the SPD mentioned above: https://t.co/YRAh2D01UP
"RT @AfDimBundestag: +++ Young group founded in the # AfD parliamentary group +++ Founding members (from left to right): Markus @Frohnmaier_AfD, @…"
Those who have not lived here for so long lack any respect for the state. They would therefore have to be taken into custody on the spot and immediately deported. #AfD #Regensburg https://t.co/5sN2L1zS56 https://t.co/GOz4UXNIMB
Whoever believes it will be saved! &quot;We will not increase the tax burden.&quot; How the # GroKo projects are to be financed remains largely open. Union &amp; SPD start the upcoming legislature completely without plan. #AfD # sounding paper https://t.co/YrrSro2nxm https://t.co/i0tRLrDwzY
"No matter what nationality the perpetrator may be, this brutality is just shocking and incredible. Hopefully the one who is responsible for this terrible robbery will be caught soon. All the best &amp; soon recovery of the old lady! https://t.co/mlERF2gH3g"
"If even our &quot;government&quot; has fears ... »In fact, the mere assertion of a family connection is sufficient. Member State responsible for extensive family organizations in which there are already numerous people. «#AfD https://t.co/hFqPc8BoDe"
"How could she refuse to do that? »3 young people from Syria (14, 15 &amp; 17) had asked the woman to show them&quot; respect &quot;. When she refused, the teenagers attacked the husband. One pulled a knife. «#AfD https://t.co/Ftgy9HVfGi"
"++ TON AN and hear this outrageousness with your own ears! ++ Schulz on ZDF is as bold as it is succinct about a supposed # upper limit: If more come now, for example 260,000, then more will come! Absolutely scandalous! #AfD https://t.co/abXlS2Ui9s https://t.co/KJBxlQheqE"
"&quot;Be one of 220,000 future beneficiaries of social assistance!&quot; The rush to will probably increase significantly. We therefore do not need an upper limit, but a negative immigration - combined with a closure of the borders! #AfD https://t.co/HqWDTSic8A https://t.co/HEZpOa2dBT"
"Would you like to know how I spend tonight? I have been reading the #GroKo #sounding paper for some time - amused, shaking my head, amazed, incredulous, angry and above all shuddering! God help us! #AfD ℹ https://t.co/YqXQ4vPPfQ https://t.co/GHbuuOXtlo"
RT @AfDimBundestag: # AfD parliamentary group leaders @Alice_Weidel &amp; Alexander #Gauland on the result of the #GrokoSondierungen: Grotesk: Eine &quot;sta…
"Running ... &quot;According to the federal states and the Federal Criminal Police Office, more than 200 suspected terrorists have already returned to Germany - but only a fraction of them are in custody.&quot; #AfD https://t.co/fF4qvZU1M1"
"Incredible: A value of 220,000 in the #GrokoSondungen is a single farce! How does the #GroKo WITHOUT border security want to implement a # upper limit after our application in the #Bundestag was categorically rejected? #AfD https://t.co/XonHRkCfKc https://t.co/AHtWBW63JW"
"RT @AfDimBundestag: On the agenda of the #Bundestag for sessions 6-8 are the following proposals from the # AfD parliamentary group: Thu, Jan 18, 14…"
"In the first 8 days of the controversial #NetzDG, there have already been 52 complaints about social networks at the responsible Federal Office of Justice, because they would not have deleted or blocked illegal content in time. #AfD # Freedom of Expression https://t.co/fO1ct2Nt3R https://t.co/s5DkGmntQQ"
"@Steinhoefel But what possibilities do &quot;normal&quot; users have against the #NetzDG, who have neither great solidarity nor competent legal advice? It was about this tweet from New Year&#39;s Day - feel free to retweet! #AfD # Freedom of Expression https://t.co/57xpDdvnPT"
"++ Thank you! ++ Thanks to the involvement of numerous users and my legal advisor Joachim @Steinhoefel, an already wrongly removed post (below) was restored from Twitter for the second time in 2018. The #NetzDG should be abolished! #AfD # Freedom of expression https://t.co/uAdSPvgj8q"
Terrifying survey results: 36.6%: other religions are worth less than Islam 29.9%: I can imagine fighting for Islam myself &amp; risking my life. 27.4%: Islamic Sharia law much better than German #AfD https://t.co/KIAjnGFB2j https://t.co/n0aiqo9v7x
"Without words! &quot;With prohibitions you can&#39;t get a millimeter further,&quot; said Klaus Harter, who worked for years in the care of the most difficult to educate young people. He therefore proposed a system of positive incentives, which was received positively. «#AfD https://t.co/nYrKPPwm3M"
Do felix! Which is possible in a very short time if the ruling parties agree that the country&#39;s security and well-being are at the center of their pol. Have to act! A BLUE break for - what do you think? #AfD #AfD acts https://t.co/Dl0B96tZGZ
"Instead of supporting Viktor Orbán and in securing the EU&#39;s external border, Merkel desperately insulted Hungary for its deliberate and responsible action at the height of the 2015 asylum crisis. Now Orbán rightly reads the Levites to the Chancellor! #AfD https://t.co/k3gccZ48ah"
"# Stuttgart21 remains an endless story: An exact time for the completion of the station is still unknown. And parallel to the progress of the construction period, fewer and fewer commitments on the part of DB have been kept. https://t.co/2PoYKzhhXT https://t.co/uHuwLIn97t"
&quot;Minor&quot; asylum seeker (quickly aging &amp; bearded) about his 16-year-old girlfriend: »I don&#39;t like other guys talking to her. It belongs to me. «Does #KiKa prepare our girls for marriages with Islamic immigrants? #Malvina #KIKAGate https://t.co/Wc7HmXAWmT
Surprise? The #GroKo is the coalition of the losers. Germany is threatened by a policy of &quot;keep it up&quot; - just as announced by #Merkel on election evening - of course the voters also know that ... https://t.co/z4mplzkgpD
"This insanity of liability is hardly noticed in the reporting and thus in public perception. Although the problem has been known for years, the established political class continues to stand idly by. # Target2 #AfD https://t.co/3QSaNy3yAp https://t.co/vIGXyYZYSL"
"You have to let that melt in your mouth: Chancellor Angela Merkel, who is said to be overpowering, meets with her old and probably new coalition partner for # exploratory talks 15 weeks (!) After the Bundestag election. #GrokoSondierungen #GroKo #AfD https://t.co/IaMNL20pDd"
An insightful report: »They have the experience that they can take the public space undisturbed. Those who can make themselves younger - everyone knows that umA in is excellently cared for and guaranteed not to be deported. «#AfD https://t.co/ZEBUadvulf
"Dear #FDP, does that mean that there is also &quot;an&quot; Islam that is NOT in line with the GG? &quot;On the basis of Our G͟r͟u͟n͟d͟g͟e͟s͟e͟t͟z͟ standing in line Islam&quot; #AfDwirkt #AfD https://t.co/JV1hHzSzga"
RT @AfDimBundestag: # AfD parliamentary group leader @Alice_Weidel in the @ phoenix_de daily discussion on #GrokoSondierungen: As the strongest opposition party…
Anyone digging a pit for others ... #NetzDG #mind freedom #AfD https://t.co/xXH5qftSC2
A remarkable #New Year&#39;s address by the head of government by Lars Løkke Rasmussen: You can&#39;t change the past - but you can learn for the future! &quot;We have to take care of Denmark.&quot; Https://t.co/qJdMWuD6sB
"Here again the speech of my group colleague @JoanaCotar, which contains everything you need to know about the unspeakable #NetzDG: https://t.co/jFAsC6HyJB"
"Lord, throw brains from heaven! &quot;FDP and Greens have called for the abolition of the #NetzDG, which was only valid for a few days.&quot; For the record of who requested this from the start: ℹ https://t.co/iwZjtu3mUO https://t.co/sxDOfwdDt5"
"In this context, my big thanks to Mr. Joachim @Steinhoefel, who, as our legal counsel, succeeded in having the scandalous blocking of the @AfDimBundestag tweet lifted by the Twitter managers in no time! #AfD #NetzDG # freedom of expression #censorship https://t.co/hIlUksZ9Va"
Please read absolutely! Magnificent guest contribution from @NorbertBolz in the #taz! from 2010 - more current than ever! The 3 dogmatic myths of the German left in terms of # immigration and # integration. #AfD #Family reunification https://t.co/J5sLY89HUp
"Publicist Henryk M. Broder on the progressive #Islamization in: »Radical Muslims do not differentiate between Islam and Islamism, but do&quot; what they feel obliged to do in the service of the &#39;only true religion&#39; &quot;.&quot; #AfD worth reading: https: // t.co/NejBenrLx4 https://t.co/d6mLL9E45Q"
Overwhelming majority of 7⃣8⃣ percent for age verification of supposedly underage refugees! &quot;Followers of the Greens show the highest rejection with 41% - X-ray examination allowed by federal law since October 2015.&quot; https://t.co/XZ6nWH7Gp6
RT @Rene_Springer: German diplomat in Uganda about the @AfDimBundestag: &quot;We have now Nazis in the German Bundestag&quot; The Federal Government ...
RT @AfD: Dear supporters of #AfD! It is said that the 1st million is the heaviest - on Twitter this is certainly the number 1⃣0⃣0⃣…
PS: The number of our fans and followers has been growing rapidly since the beginning of the year; this is probably called the #StreisandEffect. A big thank you for that too! Here is the tweet to spread: https://t.co/YR8Dt2nwZM #freeafd instead of #freedeniz Attached is the succinct email from Twitter: https://t.co/Q1SEGHqB56
++ @ AfDimBundestag-Tweet visible again after a new check ++ The previous steps were legal interventions and numerous complaints from users on Twitter. Thank you for your commitment! The #NetzDG now belongs immediately in the! ℹ https://t.co/IwR5ylkDkS https://t.co/GiB6WFcTzS
RT @AfD: Let yourself be carried away by the incomparable @SawsanChebli &amp; immerse yourself in the unfathomable vastness of # Basic Law ...
"Yes, look there! The brave &quot;anti-fascist&quot; must now admit sheepishly that an honorary president of his club was a member of the Waffen SS! The &quot;processing in the Gramlich case was inhibited out of respect for relatives who were still alive&quot;. ℹ https://t.co/BX9WUdSQNo https://t.co/ARIELyVOiB"
RT @AfDimBundestag: +++ Thank you for more than 1⃣0⃣.0⃣0⃣0⃣ followers! +++ #AfD #AfDimBundestag https://t.co/PrQLwcUwPG
