"&quot;The euro bailout system has deteriorated to sheer cynicism&quot; Gauland, Deputy Spokesman #AfD on #anglotapes http://ow.ly/i/2sNw8"
Now! Lucky Lucke at &quot;Hart aber fair&quot; !!! Have a look. #AfD
Beatrix von Storch: Statement on the introduction of a European banking supervision #AfD #video http://ow.ly/mcguQ
"Help for the population, not for banks. &quot;State of crisis: Cyprus again pleads for help for the banks&quot; #AfD http://ow.ly/maV4X"
&quot;Cyprus is asking the EU for help again&quot; Is it better to end with terror than to end without terror? #euro #AfD http://ow.ly/maSN7
Young alternative for Germany started this weekend! #AfD http://ow.ly/maYTw
"Today we commemorate the victims of June 17, 1953 #Germany #AfD http://ow.ly/m5In8"
"Bundestag votes in serene session to hand over sovereignty. &quot;The earth keeps turning&quot;, the 22.9. is coming! http://ow.ly/m1S69 #AfD"
"Interview with Bernd Lucke on BBC (Newsnight), 06/12/13 #AfD http://ow.ly/m0goP"
"&quot;Si&quot; to help the population! &quot;No, lo siento&quot; to &quot;Spain calls for unlimited euro bailout fund&quot; #AfD http://ow.ly/lZzLI"
#AfD: &quot;... Freedom &amp; democracy in the western world .. higher than control and total surveillance&quot; #prism http://ow.ly/lZucs
"#EZB &quot;considerable stability-political problems&quot;, Weidmanns Heil, his shots are sitting, wiwo, #Europa #Politik http://ow.ly/lZtqU"
Trillion risks from bond purchases are not the responsibility of #AfD #EZB http://ow.ly/lX20I
The consequenceless admission of a gigantic fraud Geolitico #Greece #euro # AfD + http://ow.ly/lSFTh
"Information about Dr. Konrad Adam, spokesman for the federal executive board and top candidate of the #AfD in Hessen: http://ow.ly/lPScp"
Just elected: Hessian top candidate of the #AfD for the Bundestag: Mr. Adam (210/274 votes)
Future of Monetary Union: Economists get into trouble over the crisis - Europe&#39;s debt crisis - FAZ - #AfD http://ow.ly/lNUl6
Appointment discussion &quot;The euro saved - Germany ruined?&quot; Berlin 18.06. with @BerndLucke @AfD http://ow.ly/lMQTQ
... in other places the money is missing: Warning from Brussels: EU lacks money for flood relief -SPIEGEL ONLINE- #AfD http://ow.ly/lLmE7
Without Bundestag: Schäuble grants Spain new billion dollar loan | GERMAN ECONOMIC NEWS - #AfD http://ow.ly/lLmd2
Aha!! Internal report: IMF admits mistakes in Greece bailout - International - Politics - Handelsblatt - #AfD http://ow.ly/lLm68
"Lucke Interview @RT_com:""Alternative for Germany? Eurosceptic party ready to make waves in elections"" #AfD #video http://ow.ly/mw4Zl "
RT @afd_bayern: Andre Wächter with an overwhelming majority as a top candidate for Bayer. List confirmed #afd
PHOENIX asks &quot;What makes Germany tick?&quot; Online voting on topics related to the Bundestag election. # BTW2013 #AfD http://ow.ly/mvDXj
"Public event at Eurogress Aachen with Mr. Lucke #AfD 9.7., 7.30pm, http://ow.ly/mpvih http://ow.ly/i/2svBa"
"Dr. Frauke Petry speaks in Erfurt on June 28, 2013 from 3 p.m. #AfD http://ow.ly/i/2svtG"
"Alternative for Germany: Speech by Prof. Bernd Lucke on June 25, 2013 in Frankfurt - YouTube #AfD http://ow.ly/mrBkf"
#AfD criticizes the approach to the Federal Constitutional Court ruling on the European elections - http://TeleTrader.com http://ow.ly/lLlZf
@ Tjosull93 Please ask Mr. Trittin - we have had no inquiries so far; )
Federal government lets its citizens and companies down! #Tempora #Prism #AfD http://ow.ly/mpQql
#AfD INVITATION: Bernd Lucke is coming to a public event in Eurogress Aachen on July 9th. Beginning 7:30 p.m. Admission free
Worth seeing: State secret bank rescue | ARTE (+7) #AfD #Banken #Euro #video http://ow.ly/moJ3A
"Dr. Frauke Petry speaks in Erfurt on June 28, 2013 from 3:00 p.m. on the Anger on the #AfD election campaign stage http://ow.ly/mfyUY"
Bernd Luckes Lüneburg speech for reading (transcript) #AfD http://ow.ly/ml8b1
"&quot;A new star in the democratic party sky&quot; Mr. Lucke, lecture evening 7:30 p.m., June 25, Frankfurt aM #AfD http://ow.ly/mjHUK"
Sign of direct democracy #AfD spokesman Adam welcomes success of citizens&#39; initiative &quot;Water is a human right&quot; http://ow.ly/miF8o
"@maxprivat if 140 characters are not enough, just reply to FB. We also like to read longer comments! :-) #AfD http://ow.ly/miBIO"
&quot;Why does Germany need an alternative?&quot; #AfD http://ow.ly/miyY6
"Dr. Frauke Petry speaks in Erfurt on June 28, 2013 from 3 p.m. on the Anger on the #AfD election campaign stage http://ow.ly/mfyR5"
Online: Studio Friedman: &quot;Germany doesn&#39;t need the euro.&quot; with Mr. Lucke #AfD http://ow.ly/meVji
Lucke: The current path of the federal government is wrong! #AfD&#39;s own answers are a better alternative for Germany. #AfD # n24
Lucke: It is wrong that there is no debt relief for Greece at the expense of the banks. #AfD # N24
"Lucke: Südlanders should get out of the euro, introduction of the DM just another option #AfD # n24"
Lucke: We don&#39;t actively advertise with NPD voters !! #AfD # N24
Lucke: The appreciation of a currency also means cheaper imports. #AfD
"Lucke: We take citizens&#39; interests seriously. In the past, the Social Democrats had campaigned for debt relief. #AfD # N24"
"Lucke: only the banks, capital providers instead of people in the countries have so far been saved. # n24 #AfD"
"Trickery at Euro Hawk: Court of Auditors delivers live ammunition against de Maizière, traded past Parliament. http://www.handelsblatt.com/8297986.html # AfD +"
#AfD sees no end to the demands from Cyprus http://ow.ly/meI5y
Bettina Röhl directly: The self-destructive hypocrisy of the parties. Think political correctness stifled. http://www.wiwo.de/8295250.html # AfD +
School price: Chancellor in the service of community schools. What happened to the statement about the educational republic? http://www.wiwo.de/8291868.html #AfD
"@Patrick_Kunkel Nö: it is rather that we are compliant, while other countries represent their national interests. # AFD +"
Euro crisis: Euro zone before the big bang. Truth by the federal government only in homeopathic doses. http://www.wiwo.de/7793856.html # AfD +
"Merkel travels to the flood: the people there have a hard enough time. http://www.ksta.de/panorama/newsticker-minister-droht-mit-zwangsraeumungen,15189504,23100028.html… # AfD +"
France: Bad words towards Brussels: Hollande does not want to be talked into by the EU. We do. http://www.faz.net/-gq4-79n3k # AfD +
Bernd Lucke #AfD and Michael Roth visit Michel Friedman / N24-Talk today 11:10 p.m. http://ow.ly/meIZL
Debt crisis - UN warns of unemployment riots in Europe - And we have the Nobel Peace Prize. http://www.welt.de/wirtschaft/article116766817/UN-warnt-vor-Arbeitslosen-Krawallen-in-Europa.html… # AfD +
@KlausSchaper But yes: #CDU even had an expert opinion made about us. (#SPD by the way :)). http://deutsche-wirtschafts-nachrichten.de/2013/04/26/spd-geheimpapier-die-afd-ist-sehr-ernst-zu-ehmen/… # AfD +
"@Vilstal We are currently working internally on topics such as health policy, energy, infrastructure, home affairs, education, taxes etc. # AfD +"
@ fritzim10 @AronLindermeir Right. We honestly say what we stand for beforehand and (hopefully) can only avoid worse! # AFD +
ARD does not disclose survey results on hard-but-fair broadcast with Bernd Lucke. http://homment.com/ard-zensiert-euro… # AfD +
Merkel&#39;s problem week: eyes closed and through. So everything as usual. http://spon.de/adW9J #CDU #AfD
Approval at the gay and lesbian Motzstrasse festival in Berlin: #AfD cosmopolitan in the middle of society. http://ow.ly/mcado
Beyond the key interest rate: The ECB can do it very differently if it wants - with negative interest rates! Expropriation continues. http://www.focus.de/finanzen/news/gastkolumnen/schickentanz/lahme-konjkonom-in-europa-die-ezb-kann-noch-ganz-anders-wenn-sie-will_aid_1001499.html… #AfD
Freedom: The nurse state plays people&#39;s bliss - When politicians call their wrong decisions without alternative. http://www.welt.de/debatte/article116744896/Der-Ammenstaat-spielt-weiter-Volksbeglueckung.html… # AfD +
#AfD: Die Besserwisser ... It seems as if you can only make yourself credible in Germany with 30 billion election promises. http://www.handelsblatt.com/8272964.html
"Former constitutional judge Di Fabio: &quot;If necessary, Germany is obliged to exit the euro&quot; http://www.faz.net/-gqu-79lw8 # AfD +"
Lucke: &quot;The government is populist&quot; Drohhetoric comes from #CDU #CSU and #FDP. http://www.abendblatt.de/116716118 via @abendblatt_hh # AfD +
Open letter from Starbatty to Schmidt&#39;s economics for criticizing AfD. http://afdmg.wordpress.com/2013/05/31/offener-brief-von-prof-starbatty-zum-rp-interview-mit-christoph-schmidt-der-anti-euro-partei-fehlt-sachverstand/ … # AfD +
Commitment to the euro: five top economists against the AfD! What will it cost to stay in the euro? http://www.faz.net/-gqu-79l09 # AfD +
"Competitiveness: Europe loses the connection -The crisis is moving north, NL also affected. http://www.wiwo.de/8267992.html # AfD +"
"Thanks for #ff, #rt and #fav. Happy weekend to you! http://www.alternativefuer.de/de/ # AfD +"
Cyprus: German tax billions seep into the money laundering swamp - Even Brussels saviors of the euro are horrified. http://tinyurl.com/mtdkxnl #AfD
Bundestag election - Merkel promises benefits for 30 billion euros http://www.welt.de/politik/deutschland/article116710710/Merkel-verspricht-Wohltaten-fuer-30-Millillion-Euro.html… # CDU- # AfD +
Athens is making progress? Because of !: Recovery lie and anger retirees: This is how it really goes in Greece to http://www.focus.de/finanzen/news/staatsverschuldung/tid-31561/von-wegen-athen-macht-forschritte-aufschwung -lying-sick-angry-pensioners-how-it-goes-in-greece-really-to_aid_1002529.html… # AfD +
"Coalition wants to see Draghi in Karlsruhe - can&#39;t come, has to print money:) http://www.faz.net/-gqu-79jr5 #EZB # AfD +"
"Infratest / Dimap, unfortunately, the numbers have shifted somewhat. Sorry! But what is not can still be! #AfD"
Sunday question infratest / dimap: #AfD in the east at 7% (!!!) but no value in the west? http://ow.ly/lzKJ3
Interview with Bernd Lucke: Federal government has no grip on the euro crisis. http://de.euronews.com/2013/05/24/interview-bonus-bernd-lucke/… #CDU #FDP #AfD
AfD - Speech by Prof. Dr. Starbatty in Berlin: Merkel caught in her own rhetoric! http://www.youtube.com/watch?v=UXK3MC86hTo… #AfD
KfW loan program: Schäuble plan for Spain scares housekeepers - guess who will vouch for it? http://www.handelsblatt.com/8261936.html #AfD
The government is risking 50-year-olds&#39; pensions! - And the prosperity of our whole country. http://www.geolitico.de/2013/05/26/die-regierung-setzt-die-renten-der-50-jahrigen-aufs-spiel/… #Euro #AfD
Bernd Lucke cleans up. Starbatty top candidate for Berlin state association. http://www.tagesspiegel.de/politik/alternative-fuer-deutschland-bernd-lucke-raeumt-auf/8254688.html… #AfD
With the left out of the euro. Euro skepticism among SPD supporters is great. http://www.faz.net/-gqg-79dok #SPD #Euro #AfD
Euro zone: OECD pushes ECB for even more lax monetary policy - is that even possible? http://www.wiwo.de/8256822.html #EU #Euro #AfD
Federal government plans aid program for crisis countries Portugal + Spain Is there also an aid program for our day care centers? http://www.handelsblatt.com/8256724.html
# AfD boss Lucke: &quot;We are only delaying the collapse&quot; Merkel + Schäuble will present the bill after the #BTW. http://www.welt.de/politik/deutschland/article116526090/Wir-zoegern-den-Zusammenbruch-nur-hinaus.html…
Attack on the savings book - the price of the euro rescue. Brazen cupping of savers. http://www.faz.net/-gvt-79dh0 #Euro #AfD
Euro politics is the business of people&#39;s fear - criticism is not welcome. http://www.geolitico.de/2013/05/24/euro-politik-ist-das-geschaft-mit-der-angst-der-menschen/… http://www.geolitico.de/2013/05 / 24 / euro-politics-is-the-business-with-the-fear-of-the-people /… #AfD
Thanks for #rt and #ff and #fav and finally our new homepage! Have a nice Weekend. http://www.alternativefuer.de/de/ #AfD
"@heluecht @blackjoschka @OnlyPlayin We ask about the party proposal. In the event of incorrect information, there is party exclusion. We cannot do more."
ZDF rejects allegation: No money paid to the SPD. http://ots.de/25d3dc/st #SPD #ZDF #AfD
Slovenia - Euro zone worries about next crisis candidate. http://www.welt.de/wirtschaft/article116155289/Euro-Zone-sorgt-sich-um-naechsten-Krisenkandidaten.html… #AfD #Euro
Debt haircut again for Greece: Euro group boss causes new trouble ... but not BEFORE the elections. http://www.handelsblatt.com/8250080.html #AfD
@blackjoschka And in terms of content? Read program? We can live with the fact that not everyone likes us.
@blackjoschka The press writes everything about us - Lafontaine agrees. Are we also extreme left?
@blackjoschka We are not right. Our program: https://www.alternativefuer.de/pdf/2013_Wahlprogramm.pdf…
@blackjoschka Why are we on the right? Please give details. Or is it because there are also ex-pirates with us?
@blackjoschka We are looking forward to a discussion of the content: throwing dirt is boring. See: http://www.wiwo.de/politik/deutschland/bettina-roehl-direkt-wie-umgeht-mit-der-afd/8231178.html… #AfD
@Arnd_Schumacher Objective discussion with us is exactly what we miss. Humor is the umbrella of the wise. Must also sometimes.
The CDU people did it themselves ..:): https://fbcdn-sphotos-da.akamaihd.net/hphotos-ak-frc3/970724_4176530910662_2093950256_n.jpg… #CDU #AfD
EU Commission - Olive Oil - Symptom of the bloating of the EU apparatus. Moderation is a foreign word for the EU. http://www.welt.de/debatte/kommentare/article116396405/Olivenoel-Symptom-der-Aufblaehung-des-EU-Apparats.html… #AfD
"Bettina Röhl directly: How to deal with the AfD? - As always, to the point. Great, Ms. # Röhl! http://www.wiwo.de/8231178.html #AfD"
Emnid &quot;Sunday trend&quot;: AfD in survey for the first time at three percent - politicians increasingly nervous. http://www.handelsblatt.com/8229822.html #CDU #SPD #AfD
Despite austerity measures: Spain is in debt more than ever - unemployment rate at 22.8% http://www.handelsblatt.com/8230594.html #AfD #Euro #EU
The alternative in pictures: http://www.youtube.com/watch?v=mvjsA5fV0N8&amp;NR=1&amp;feature=fvwp… #AfD
Euro bailout - Hollande&#39;s idea inspires German managers - Southerners prefer Eurobonds. http://www.welt.de/wirtschaft/article116356575/Eine-Idee-Hollandes-begeistert-deutsche-Manager.html… #AfD
"Europe&#39;s strong north breaks away - IMF gives alarm to the Netherlands. Finland, Belgium, F + DE also weaken. http://www.geolitico.de/2013/05/20/der-starke-norden-europas-bricht-weg/… #AfD"
Inflated EU Commission: Europe&#39;s heads of government want to undermine the Lisbon Treaty. http://spon.de/adWvj
The Chancellor&#39;s speechlessness makes her speechless. The consequences of her policies would have to rob her of sleep. http://www.spreezeitung.de/6496/die-sprachlos-der-kanzlerin-macht-sprachlos/… #AfD
Savings course softened: Weidmann criticizes leniency with France - rules + laws are simply disregarded. http://www.handelsblatt.com/8227776.html #AfD
@ Lincoln_1980 @wragermany Please read the content of the newspaper article - then the question makes sense.
"Euro crisis - where does the chancellor get her legitimation from? ..to save the euro, whatever the cost. http://www.welt.de/debatte/kommentare/article116178573/Woher-ngeht-die-Kanzlerin-ihre-Legitimation.html… #AfD"
Sinn: Germany doesn&#39;t need the euro! http://www.wiwo.de/6658906.html #CDU #FDP #SPD # Green #AfD
"@ BxlackJesus96 @BerndLucke @handelsblatt @Volker_Beck Lucke said: &quot;Basically, it is good if someone chooses us and not the NPD&quot;."
@Bkill_Pirat Dear pirate: we do not want to deprive anyone of the right to vote. Reading and understanding are different things ...
"@Bkill_Pirat Ooooch, even the SPD has recognized that right-wing populism is not an issue. Laaaangweilig. #AfD"
AfD course: Merkel and Seehofer criticize critics - do you shy away from dealing with us? http://www.faz.net/-gpg-793mu #CDU #AfD #Euro
"Portugal, Greece, Cyprus: Eurogroup approves new aid - infrastructure in DE needs 2 billion. http://www.faz.net/-gqu-793oj #AfD"
@ JoeWild1965 Can we have a say in this?
Reforms work: Troika gives Greece more leash - and another 7.5 billion. http://www.handelsblatt.com/8200346.html #AfD
Dealing with anti-euro party AfD: Merkel loses its critics - the euro will be saved further. http://spon.de/adWaZ #CDU #AfD
"ECB purchase of corporate loans: Schäuble warns of government funding: The one he called, the ghosts ... http://www.faz.net/-gqe-792lr #Euro #AfD"
Traffic routes - The incredible German infrastructure disaster - Where are the gushing tax revenues going? http://www.welt.de/wirtschaft/article116088153/Das-unfassbare-deutsche-Infrastructure-Desaster.html… #AfD
Central banks lose control: Schäuble fears global financial crisis http://tinyurl.com/d97cqk8 #AfD
"@Arnd_Schumacher We are working on &quot;more content&quot;, but we want to do it well - also on the topic of the job market."
“Indignados” on the street: Spaniards demonstrate against crisis and austerity policies. http://www.handelsblatt.com/8195092.html
#AfD - The Chancellor should put the anti-euro party - With factual arguments? We are excited. http://www.welt.de/politik/deutschland/article116106909/Die-Kanzlerin-soll-die-Anti-Euro-Partei-stellen.html…
Euro - The uprising against Germany&#39;s austerity dictate. F + Italy want to spend money again. And that in the election year. http://www.welt.de/wirtschaft/article116084126/Der-Aufstand- Gegen-Deutschlands-Spardiktat.html… #AfD
@ RedSock77 Please contact the appropriate federal state: https://www.alternativefuer.de/landesverband/ Most have already started collecting.
@ pgk1966 Such nonsense! Of course not. Would like to know who spreads such nonsense.
EU gives banks new ways to access their accounts - 58 million EU citizens without an account? There is still something. http://tinyurl.com/cjr7axk
@ rh195418 Goldman Sachs ... of course. GS visited the Chancellery about 90 times in 2012. #AfD
Youth unemployment at record high: especially in Greece and Portugal. http://www.wiwo.de/8185180.html
Germany is in danger: in the wake of the crisis - Draghi&#39;s &quot;politics&quot; fails. http://www.handelsblatt.com/8173162.html #AfD #EU #Euro
"Savings program - Slovenia, the next problem child in the euro zone! Betting, Slovenia is system relevant? http://www.welt.de/wirtschaft/article116043555/Slowenien-das-naechst-Sorgenkind-in-der-Euro-Zone.html… #Euro #AfD"
@crossmediareitz Thank you!
FOCUS online users discuss: &quot;The greatest devaluation of money in the post-war period - and we accept it&quot; http://www.focus.de/finanzen/news/tid-31096/undankbare-euro-nachbarn-focus-online-nutzer- discuss-about-and-thank-these_aid_984177.html… #AfD
ECB is considering a new security purchase: Risky game with &quot;weapons of mass destruction&quot; - the next taboo break. http://www.handelsblatt.com/8180136.html #AfD
"For Germany, the D-Mark is worth gold! - An analysis against the frighteners. http://www.geolitico.de/2013/05/08/fur-deutschland-war-die-d-mark-gold-wert/… http://www.geolitico.de/2013/05/08/fur -germany-was-the-mark-gold-value /… #AfD"
Germany transfers 599 million euros to Athens http://www.welt.de/wirtschaft/article116020606/Deutschland-ueberweisung-Athen-599-Millionen-Euro.html… #AfD
Schäuble: Germany does not find it difficult to surrender sovereignty: even more rights to Brussels. http://tinyurl.com/d4kfzh8 #EU #CDU #AfD
Controversial plan of the European Union: Attack on your account: savers should be liable in the event of bank failures http://www.focus.de/finanzen/banken/tid-31064/brisanter-plan-der-europaeischen-union-angriff-auf-ihr- account-at-bank-bankrupt-should-save-liability_aid_982756.html… #AfD
@crossmediareitz how does it work?
@ jolicoeur11 @TwittingThom Eben!
"@FreiBastiHeit @Julikator ... well, primarily expertise. The others tend to provide the representation ... # AfD"
@DasSpeedy Please contact the NRW / AfD website: http://www.nrw-alternativefuer.de/
"@AronLindermeir And after September 22nd, full throttle towards Eurobonds / debt haircut GR etc. will be given! # AFD +"
@DasSpeedy We are currently working on such program items: Basic democratic from bottom to top: So please bring in yourself! #AfD
EU Parliament has power like never before - European citizens don&#39;t care. They have other worries. http://www.zeit.de/2013/22/europa-parlament-machtzuwachs… # AfD +
European policy - Merkel no longer wants to give the EU powers - but recently sounded very different. http://www.welt.de/politik/deutschland/article116736487/Merkel-will-der-EU-keine-Kompetenzen-mehr-machen.html… # AfD +
&quot;Euro-Hawk&quot; exemplifies the decline of parliamentarism: infarction of democracy. | Geolitico http://www.geolitico.de/2013/06/02/euro-hawk-klart-uber-den-verfall-des-parlamentarismus-auf/… # AfD +
Bernd Lucke contradicts Reuters report: we have not made any coalition offers + will not! https://www.alternativefuer.de/de/aktuelles.html… # AfD +
Is the #AfD an alternative for Christians? - Pro by @FraukePetry and Kontra (CDU) http://ow.ly/lx3Ii
Bundeswehr sets up 30 security and support companies. http: //www.bundestag. de / presse / hib / 2013_05 / 2013_287 / 02.html # AfD +
Daniel Gros warns savers: &quot;Consume before the money is gone&quot; http://www.t-online.de/wirtschaft/schuldenkonto/id_63604686/daniel-gros-warnt-sparer-konsumieren-bevor-das-geld-weg- is-.html… #Euro # AfD +
The game is over - no longer makes sense - year 2013 officially ended! New Year&#39;s speech by the Chancellor. http://www.welt.de/satire/article116556962/Hat-keinen-Sinn-mehr-Jahr-2013-offiziell-beendet.html… # AfD +
Where are the economists in the ministries? Only lawyers decide in the crisis. http://www.zeit.de/2013/23/europa-wirtschaftsreform-oekonomen… #CDU #FDP # AfD +
Euro rescue at the expense of the return: Investors in the interest rate trauma: When will the savers burst the collar? http://www.focus.de/finanzen/banken/tid-31450/sparer-diagnose-schizophrenie_aid_999410.html… #Euro # AfD +
@ BTW_13 Did not want to offend anyone - Gr + Spain save very hard. What about France? Italy? The EU Parliament?
Martin Schulz - &quot;Oettinger has gone through the horse&quot; - just tell the truth! http://www.welt.de/politik/ausland/article116618996/Oettinger-ist-der-Gaul-durchggeht.html… # AfD +
Brussels leaves crisis countries on the short leash: stop saving (if someone should have started). http://www.handelsblatt.com/8272872.html #AfD
EU Parliament plans punishment for critics - Attack on dissenters. http://www.geolitico.de/2013/05/29/eu-parlament-plant-gesinnungsstrafe-fur-kritiker/… http://www.geolitico.de/2013/05/29/eu-parlament-plant -sign-penalty-for-critics /… #AfD #EU
"Negative real interest rates: If you save, you lose more than you think - massive loss of value! http://www.wiwo.de/8261930.html #AfD"
@CanMarkus ... who could resist there:)
&quot;The euro will break&quot;: Euro rebel: politics jeopardize German pensions http://www.focus.de/politik/deutschland/der-euro-wird-zerbrechen-euro-rebell-politik-setzt-deutsche-renten -on-game_aid_999232.html… #Euro #AfD
EU debt crisis plan: Germany insists on austerity - wasn&#39;t the crisis over yet? http://spon.de/adWRK #Euro #AfD
Don&#39;t get the euro at any price - rethinking begins. Alternatives can be thought of again. http://www.zeit.de/2013/21/europaeische-waehrungsunion-eurokrise… #AfD
@vdHeyde We! The German taxpayer.
"Seehofer rejects cooperation with AfD - Öhm, we didn&#39;t ask Mr. Seehofer either. http://www.zeit.de/politik/deutschland/2013-05/seehofer-csu-afd… #CSU #AfD"
"@MarcusSpicker You asked that before, didn&#39;t you? We don&#39;t have an answer to cuckoo fathers yet. Take part and design."
@elshamyamir also happens in other parties. There are only 2 out of 16 regional associations - the rest works well. And the press puffs up.
"@ 10_yusif The return to the DM is ONE possibility - a smaller € currency area (NL, DE etc) too. Has always been in the electoral program."
@Killikus thanks :)
"Aid to crisis-hit countries: Risky business simulations by the ECB are causing outrage - So far, Merkel has approved the ECB&#39;s policy. http://www.handelsblatt.com/8222040.html"
@FW_Bund Stand never different in the election program - end with THIS euro. Return to the DM remains an option. https://www.alternativefuer.de/pdf/2013_Wahlprogramm.pdf…
"AfD doesn&#39;t want to go back to D-Mark? As always said, it remains an option. DE does not need the euro. http://www.faz.net/-gqe-797w1 #AfD"
"It&#39;s Saturday but anyway: Thank you for #ff and #rt and #fav, for discussion and argument. Nice Pentecost. https://www.alternativefuer.de/ #AfD"
@crossmediareitz I am admin - happy. What do I have to do?
@ UltraGh0st You could devalue and become more competitive.
"@panewippchen Then google #ESM and # Target2:), whoever is informed has a clear advantage. And there are Eurobonds after the BTW, right?"
Hollande demands economic government for euro zone -Time # hardly comes up with the removal of the comments. http://www.zeit.de/politik/ausland/2013-05/frankreich-hollande-rise… #AfD
@RegSpeaker And? Is Europe doing well at the moment? 60% youth unemployment in GR! 30 million unemployed in the euro area. #AfD #CDU #Euro
José Manuel Barroso - &quot;The existential crisis of the euro is over&quot; - without comment. http://www.welt.de/politik/deutschland/article116276916/Die-existentielle-Krise-des-Euro-ist-vorbei.html… #AfD
