"On the train to Bremen interesting conversation with neighbors about health policy, diesel led many other questions."
Do not worry. It&#39;s not because of coffee or spring. It is simply a convincing speech 😉
And of course paid
Good Trip. I&#39;m looking forward to the feedback. https://twitter.com/stefankaufmann/status/977829417056600064…
I am happy to join in there. Congratulations to the whole team https://twitter.com/cdu_thueringen/status/977423235892555776…
This is why we developed &quot;La strategié Françe&quot; on Saarland.
Congratulations . Great reinforcement in group leadership and another strong voice for work and social issues.
I am pleased that a piece by Wolfgang Schäuble is returning to the BMF with STS Werner Gatzer. Good signal for a stable budget with no new debt.
My week in Berlin starts with ... bright sunshine ☀️ Wish everyone a good start!
"Long-standing members were honored at the traditional spring reception of the CDU in Heusweiler, when the temperatures were not spring-like. Many thanks for 60 years of loyalty and cooperation in the CDU. pic.twitter.com/CgbNwgiSUn"
Not quite. But we have the same boss😉 https://twitter.com/doktorpatrick/status/969611865079853056…
Just hung a piece of Saarland in the new office in the Konrad Adenauer Haus. pic.twitter.com/W1NLqHZEwE
Many thanks dear @larsklingbeil. Good democratic struggle for the best solution for the country and its people. https://twitter.com/larsklingbeil/status/968150310505140224…
Many thanks. Looking forward to the new task. https://twitter.com/heikomaas/status/968148222081359872…
This is guaranteed to change positively soon 😉 https://twitter.com/pottbloglive/status/968089778704052225…
"When it comes to the CDU, we stick together through country teams. https://twitter.com/fneuhann/status/967795867615944708…"
Looking forward to you. Have a good trip https://twitter.com/cdu_saar/status/967740048580972550…
Was it. And a particularly nice one😉 https://twitter.com/nifberlin/status/965815724206903296…
# Secretary General @CDU @cdu_saar @saarland_de pic.twitter.com/9rjwQph6oe
Even by Stephan Kolling not https://twitter.com/kolling09918435/status/963501370375622656…
Nope. 2nd class open plan without network. Therefore good opportunity to talk.
"I&#39;m not fundamentalist, I&#39;m not evangelical, and I don&#39;t live in the United States. I am committed to life with the CDU on the floor of the GG, born and unborn. We therefore stand by the applicable protection concept and this includes the advertising ban."
Germany offers religious freedom on the basis of the Basic Law. Anyone who moves away from this ground and abuses this freedom does not want to belong and is not allowed to.
I can highly recommend it. Maybe we&#39;ll see each other😉 https://twitter.com/cdu/status/974226583983714304…
"It is absolutely essential that you have deleted the tweet and withdrawn the related statement. There are statements that no emotion justifies. Protecting life is not &quot;disgusting&quot; but must be the primary goal of all Democrats, including in the SPD. https://twitter.com/evahoegl/status/974220112906645506…"
"&quot;The Saarland is our home, Germany our fatherland and Europe our future&quot;, this triad connects us Saarlanders and makes it possible to connect close rural ties with a committed commitment to national interests and an open view of the world."
Would say both countries are well represented in the new B&#39;Reg. 😉 https://twitter.com/andreas__rinke/status/973902113318297600…
2 Saarlanders in the 1st row of cabinets! Congratulations to the new Economics Minister @peteraltmaier and the new Foreign Minister @HeikoMaas pic.twitter.com/rZBS4Lad3R
Just before the swearing in. MP @tobiashans in conversation with BK&#39;in Angeka Merkel. pic.twitter.com/MZvJwpBARK
"Clear choice, smooth start. Now with all my strength for Germany!"
Nice to see @tobiashans as MP represent Saarland so well represented in the Chancellor election on the Bundesratsbank. pic.twitter.com/Ofw3bpjosj
Nice @tobiashans as MP pic.twitter.com/vdgwHaZw4S
Thanks for the hint.
😊
"# IWD2018 I thank all women who stand up for women and their interests here. I am thinking especially of all women, some of whom fight for their most basic rights under the greatest personal danger. You need our solidarity all year round"
Of course.
I am pleased about the broad agreement of the SPD members to the coalition agreement. It&#39;s a good decision for Germany
After an exciting week of relaxation in the exciting ice hockey match of the Mannheimer Adler with some Olympic heroes.
Caught😉 https://twitter.com/joachim_sucker/status/961260754002378752…
And we hadn&#39;t even discussed it yet https://twitter.com/turmbewohner/status/959846631473631232…
@morgenmagazin # coalition negotiations https://www.zdf.de/nachrichten/zdf-morgenmagazin/annegret-kramp-karrenbauer-im-topthema-100.html…
Was also in the Saarland state representation. That&#39;s part of the good tone😉
The exploratory paper is the basis on which we negotiate. Turning the previous agreement upside down is not a realistic idea. http://www.sr.de/sr/sr2/themen/politik/20180122_kramp_karrenbauer_zur_spd_groko_entscheidung_interview100.html…
You haven&#39;t really got to know our JU yet. https://twitter.com/rosidaggi/status/955064913373859845…
Start today after a compulsory break with committee meetings of the CDU Saar and the federal CDU. Thanks for all the warm wishes to my colleagues and me. Have helped a lot.
"According to the circumstances, everything is ok with colleagues and me. Hope to be able to leave the hospital tomorrow, stay one night for observation. Thank you all very much for your recovery wishes!"
"It&#39;s a shame that for the first time I can&#39;t do traditional fool reception in the State Chancellery SB. Therefore, the Berlin explorations made a triple “Alleh Hopp” to Saarbrücken to the foolish sovereigns and representatives."
Thank you! I&#39;m also glad that I have you euch https://twitter.com/jusaar/status/949346988365148161…
