just got vaccinated against flu. Next month then gg &quot;swine flu&quot;. Protect yourself and others!
is on the way to the Reichstag building and is in talks with colleagues from other parliamentary groups before being constituted
Great: Then 22.5% of a year do military service / community service :-( # CDU- # CSU- # FDP-
RT @juergennimptsch: Proud to be a volunteer! The UN City of Bonn congratulates on the 10th anniversary of the International Year of UN Volunteers.
RT @juergennimptsch: A good day for Bonn. Work is resumed on the construction site of our congress center.
"is on his way to Berlin, parliamentary group elects the executive board today"
RT @atomausstieg: RT @ broadcast: # CSU MdB Josef Göppel against extension of term http://is.gd/4sAGX | So is the Josef: Straightforward
@YoungSocialist mistake: EU draft for life-tagging wants to ban national regulations !!!
@YoungSocialist ... but a partner who refused. You know that you can&#39;t force partners to do everything!
Are REs supposed to make electricity more expensive? This graphic http://yfrog.com/0yzyvqj with data from the major energy companies proves the opposite!
Red-green had put an end to black-and-yellow shadow households. Now they start again! Hello @ iFlow18! http://j.mp/1LkGw9
&quot;Africa&#39;s farmers suffer from EU milk subsidies&quot; http://j.mp/3MSN3O | I experienced this myself in Zambia when I was with small farmers
@pkanzow But Black Yellow has the exact opposite of your proposal ...
My Bonn SPD member of parliament covers abuses undercover on http://j.mp/1feRJ3
Why is the July so silent about Black Yellow Debt Plans? In the election campaign they made demos on the subject. One-sided!
"@pantachorei I am also for a special nuclear tax, but up and not for nuclear power plants :-)"
"@YoungSocialist Pardon, that&#39;s Schmarrn: You need a majority in the Bundestag, Bundesrat and Europ. Houses of Parliament. The SPD stance was clear!"
@pkanzow You exaggerate (again) immeasurably :-) We were the first outside and the first inside with posters. Few outliers ...
"@tsghessen The traffic jams in Hesse have gotten worse with black and yellow :-) STOP in politics, society and on the streets"
@FrankWallitzek Congratulations!
"At least one promise will have to break black and yellow: debt brake, no cuts in social matters, no increase in taxes! What?"
Autumn day in Bonn http://yfrog.com/0jw29hj
@alexbonde as long as you don&#39;t have to intervene militarily :-)
@katjadoerner Had Green Youth Saar also made ...
When rummaging noticed: Hubert Ulrich in Saarbrücker newspaper &quot;We want as Greens here in the country Heiko Maas as Prime Minister&quot;
RT @greenpeace_de: Internal strategy papers document #EnBW cheated old reactor about the federal election http://bit.ly/1e0aFb
RT @KESS_: Tax revenues from #solar industry higher than funding: In 2008 D generated solar tax revenues of € 3 billion http://is.gd/4gZ4s
"@distant_voice No, of course not. But you have to be way above that if you don&#39;t even have it checked, right?"
Bundeskartellamt warns of prolongation of nuclear life! Otherwise the anti-consumer monopoly will be extended. That&#39;s the point ...
Interesting: Only 0.5% of the Hartz IV applications were received. existing assets rejected. Some media / politicians have suggested otherwise
"The most important point when printing on black and yellow: receive feed-in priority EE, then atom and coal will get done faster than expected!"
"RT @atomausstieg: Is there something wrong? According to the FTD, black and yellow wants to smash energy companies, http://tr.im/Bw28 | Headline, every bet!"
@pottblog Even then it would have been fun
So three green Saar MdLs now represent two ministers? And the third controls the government? Do the other two abstain?
"@alexbonde Nana, if you like to hand out, you have to be able to take it. Read today&#39;s taz!"
For the NRW election it is now clear: only one vote for the SPD is a vote to replace Rüttgers!
"makes his way to Berlin: Advisory board of the Federal Network Agency, decision on the award procedure for new mobile communications licenses"
Saar-Greens &quot;CDU and FDP in Saarland stand for nuclear phase-out&quot;. I&#39;m curious about the Saar-CDU-MdB voting ...
@netzfeuilleton see last tweet for the difference
"@rpreuss Pardon, in Thuringia a) SPD discussion has not ended and b) Althaus (!) should be replaced"
"@your helper If unemployed people have to do any work for cities, previously paid jobs will be eliminated ..."
@ndroste Gäääähn!
Saar-Greens had stated in the election program the goal &quot;to replace the CDU&quot;. This is called electoral fraud!
Greens voters will be disappointed after a clear Jamaica rejection in the federal election campaign. Clear complicity in Fundi-Lafontaine!
@pkanzow We should introduce referenda on European treaties along with the right to referenda
congratulates @tsghessen on his birthday
RWE-Innogy boss goes for pseudo-climate protectors: per wind power but against PV. Coincidence that he makes money with wind and PV costs him customers?
@alexandersempf Now some are at the helm who were already against it internally
Green general assembly decides on coalition with the CDU - rather emergency solution than &quot;project&quot; / via @katjadoerner There was an alternative!
"@fukami Which German city is better developed? In parts of Cologne there is at least FTTH, unlike in Bonn and Berlin"
Very good: Socialists in the European Parliament request that the EU should continue to enable &quot;food traffic lights&quot;. Corporations and CDU before failure
"held keynote at Green IT conference by TÜV, Bitkom and Medienakademie. Necessary: innovations, market incentives and (!) Regulatory law"
Interview with the city&#39;s staff council on the future ARGE. Staff council and unions support SPD position
@frederics Yes and Steinbrück made &quot;only&quot; € 37.5 billion despite the 2009 crisis
"Schwarzgelb maintains top position in debt formation: previously Waigel 1997 with 40 billion, now Schäuble with 100 billion. Always there: Westerwelle"
Interview with Bonn tenant association about anti-social tenancy law plans from Schwarzgelb. Black-green relocation for Bonn unemployed also an issue
"@schumi_bonn I shouldn&#39;t be too cynical, because I had already suggested setting up a water taxi"
"will continue to deal with black green in beautiful Bonn, but above all will focus on black and yellow!"
@FrankWallitzek gladly
"@Querdenkerin There was talk with the SPD, intensive negotiations with the CDU. You have demonstrably not wanted to negotiate with the SPD / FDP"
@Query thinkers GREEN have every right to make black green! Just don&#39;t fool the base and say there is no alternative ...
"@Query thinker Angelica, that&#39;s brazen! You haven&#39;t started traffic light negotiations at all, how can you talk about content / offers?"
Bonn Greens warns of basic deception. Green top officials wanted black-green from the start and actively prevented traffic light coalition
@ journalist1958 There is nothing worse than doing yourself :-)
New black-green coalition in Bonn wants to save rental costs for the unemployed and force them to move more -&gt; anti-family
Dino exhibition and Rüttgers cabinet at the Bonn Museum König! Chance or fence post?
