"Anyone interested in &quot;Hip Hop against Violence in Schools&quot;, winner of the SPD Dröscher Prize, can be found at: http://bit.ly/1rN82x"
RT @vorwaerts_de: &quot;With you it&#39;s Genossinen and comrades - for us it&#39;s Homies I want my homie @ulrichkelber.&quot; Thank ;-)
&quot;Hip hop against violence&quot; from Bonn wins the federal SPD&#39;s Dröscher Prize and makes the hall shake http://yfrog.com/7f4bdxj
Eppler: taxes you pay for what the majority can not be bought privately # BPT09
"Eppler: Competition in business is necessary, but absolutely harmful in kindergarten. You don&#39;t have to incite natural selfishness"
"@katjadoerner what is a &quot;political Ton&quot;? Pale, green in the face, red with anger? :-)"
"Quietly, factually, Erhard Eppler breaks down the black and yellow ideology and shows its misanthropy. Read ..."
"@SchaeferAndreas It&#39;s not the savings book that counts, but election promises. FDP: &quot;We will not raise taxes&quot; # electoral fraud"
now has &quot;stand service&quot; at the booth of the parliamentary group at the federal party conference # BPT09
@SchaeferAndreas nonsense! 90% of all letters are exempt from VAT. Anyone who now increases the price of all by 19% is a tax raiser. breach of promise
Sigmar Gabriel has just given a commemorative plaque for the Godesberg town hall: 50 years of the Godesberg program
is pleased to have been elected to the federal executive board of the SPD in the first ballot
Olaf Scholz: SPD is the oldest liberal party in Germany. Now we need new answers for the struggle for freedom # BPT09
"So yes: black-black-yellow begins with tax increases. First, half a billion euros higher VAT on postal services"
The Dresden Party Congress is about to continue. Currently NRW preliminary meeting # BPT09
@JuliaKloeckner as CDU top candidate? God save Rhineland-Palatinate :-)
"@schumi_bonn I like to hear that, but I see it differently. But we wanted to discuss this more closely on occasion, right?"
Sigmar Gabriel received 94.2% yes votes
"@ Wechsel2014: Sorry, but change is in 2010 necessary in NRW and 2013 federal :-)"
"A journalist noticed: This time no slogan on the wall of # BPT09, just the words &quot;Social Democratic Party of Germany&quot;"
SG: There has to be a more open and conciliatory way of dealing with each other in the party than today - that used to be a hallmark
"SG: How many more would be unemployed without Steinmeier&#39;s stimulus package and Scholz short-time allowance, how many more banks would go bankrupt without Steinbrück"
Sigmar Gabriel: Most of the citizens will soon wish Ulla Schmidt back ...
SG: Only pride in what has been achieved also gives strength to correct mistakes # BPT09
Sigmar Gabriel: Who such election result as we get more than a communication problem ... # BPT09
Sigmar Gabriel: Voters want the SPD to think about their own political profile and not about possible coalitions
Sigmar Gabriel: Schwarzgelg is a clientele coalition
"congratulates @katjadoerner! Four Bonn MPs, all with important tasks. What a city :-)"
has just handed citizen letters on climate protection collected by Greenpeace to the Bundestag with an invitation to respond
"And another broken campaign promise: Westerwelle does not reduce the number of its secretaries of state, although explicitly promised"
You have to say it so hard: Volker Kauder is a fraudster
CDU / CSU parliamentary group leader Kauder had promised &quot;no head bonus&quot; before the election and is now enthusiastically clapping for it and calls it the &quot;best system&quot;
"@RastaRhymes I don&#39;t know, I&#39;m over 600 km away ..."
RT @greenpeace_de: Brazil demonstrates industrialized nations has ambitious goals for climate conference + goes into intermediate http://bit.ly/1pYeCu
"Bundestag debates on economy, energy and the environment"
"@alicantist 100-day grace period only applies to the assessment of a minister&#39;s overall balance, not to criticism of individual decisions"
"@webwuff No, the constitution and election of the chancellor were already. PS MdB are not sworn in"
"Steinmeier: It wasn&#39;t a government declaration, it was a government puzzle!"
"Merkel&#39;s new excuse for black yellow commissionitis: &quot;We have to analyze the situation before we act&quot;. Where was Merkel before September 27, 2009?"
Merkel claims black and yellow does not want protection against dismissal to deteriorate. Untrue! Chain time limits are made easier. Effective direct!
Merkel fires smoke grenades: Sion Adverse wages are already forbidden Germany needs minimum wage
Black and yellow childcare allowance will serve as a government subsidy to isolate children from extremists of all kinds. Irresponsible!
Group meeting to prepare the government declaration debate. I&#39;m going to talk to the new Environment Minister Norbert Röttgen tomorrow in a duel
"@schumi_bonn contradiction, monsignor. In BB, former GDR professional officials are in charge at the Left Party and (!) CDU. Plague and cholera"
Merkel wants to present black and yellow goals? Do they have common goals?
@schumi_bonn And what about the friends of the Wall who stayed or joined the CDU and FDP?
was also at the Memorial to the Annunciation of the Republic and the Holocaust Memorial before the fall of the Berlin Wall. That also belongs to November 9th!
"is preparing for a long week: Monday-Thursday session week Berlin, Friday-Sunday federal party conference in Dresden Hope my candidacy for PV works"
"@pkanzow What should you learn from Holzmann? Not a penny of tax money was lost, right?"
RT @gruenenrw: Hooked on Greens in Saarland around and speaks of democracy korrumpierbarer | The only point where OL is right ...
RT @DerWesten: Caricature of the day: black and yellow works! http://www.derwesten.de/9b7bj6 # plaßmann | Very fitting
RT @tsghessen: #Gescher against wide tax cuts. Interesting message.
On the national party council of the NRW-SPD Sigmar Gabriel and Andrea Nahles in Bochum. Pronunciation begins after speeches ...
Back to Bonn. Funeral of Karin Hempel-Soos. It leaves a huge gap in Bonn&#39;s culture and in social democracy
"RT @juergennimptsch: After my talks with Sparkasse, fewer branches will close in Bonn than originally planned"
@ IFlow18 Hope has deceived the competitors three times in a row :-)
Information on party donations by an FDP politician to Saar-Greens. Greens chief refuses to provide information. Now the Green Party convention must stop Jamaica
Very good: City Day rejects black and yellow tax cut on pumps across the party. What is left of black and yellow election promises?
On the way to Berlin. Tomorrow morning a joint exam between the Bonner and Berlin team.
@pantachorei Of course there has been this discussion at the EMA high school for 40 years ...
"@frankheuss Income car toll, especially from countries with a dense motorway network. The BM Verkehr would then spend revenue in Bavaria"
@le_bloc_vert Timely laser treatment?
@FriedrichB Because the sovereign state is abolished. He blames me and then has to endure the answer
"Typical &quot;von Arnim&quot;: First he hands out (against me), then too cowardly for a personal conversation. Requires written &quot;input&quot;. Embarrassing!"
@fukami war profiteer :-)
"According to Merkeberg, black and yellow has &quot;a common feeling for the task&quot;, according to Merkel. Do they want to rule or do couple therapy?"
Now faction meeting
"Before questions come: MdB Marco Bülow stays in the AG Environment, but wanted to focus more on energy policy"
Matthias Miersch from Hanover is the new environmental spokesman for the SPD parliamentary group in the Bundestag. Unanimous proposal by working group!
constituted this morning working group environment and the AG agriculture / consumer protection of the SPD parliamentary group
@Tuenalgan The counterpart to the bird of happiness :-)
@awiemers Mpumalanga is more beautiful than certain regions in NRW :-)
am behind you :-) RT @Sabine_Baetzing: stand at the airport waiting in line of security ... it&#39;s berlin
has this morning heard with regret that the CDU friends have scared away at Bonner Greens FDP to traffic light coalition to prevent in Bonn :-(
has just seen the first exhibits of the upcoming dinosaur exhibition in Museum König. Gigantic!
SG: In Rhineland-Palatinate you can see which educational policy the SPD wants to pursue # BPT09
sitting with @katjadoerner in the staff meeting of the Standing Conference. Interesting debates ...
@schumi_bonn Is electricity from the &quot;boss&quot; himself :-)
@gruenenrw I would be a bit more self-critical given the many black-green alliances in cities where red-green would also have gone!
now meets North Korean delegation in Berlin to discuss energy policy
@frederics Zitter :-(
@JuliaKloeckner you but do realize that you are working in the federal Department of Agriculture and not in the state-Wirtschaftsmin. ?
had climate protection discussion with housing industry. They think climate protection goals are too ambitious. I don&#39;t think WW is ambitious enough
FDP tax system would be priceless and unfair. The inventor of progressive taxation already knew that: a liberal
"FDP does not only incur public debt, in contrast to the SPD, the FDP party also has debts"
A great speech by Sigmar Gabriel. Hall is raging # BPT09
SG: More Badis democracy means more work for the base # BPT09
SG: can do something from his life. Not tied to the origin and parental income. This is the social democratic idea # BPT09
SG: Since September 27 over 5000 new SPD members # BPT09
"SG: People strengthen, clarify things # BPT09"
Not to look good tradition of the SPD only after emergency at home: SG. International solidarity # BPT09
"SG: Who a collective security system under UN leadership, wants to call may not refuse on principle to the UN troops # BPT09"
SG: People need solid ground under their feet. And for that you need strong communities! # BPT09
"SG: Not all, but many integration problems are social problems # BPT09"
"SG: Good education not only for jobs, but also for successful democracy # BPT09"
SG: Education free of charge from kindergarten to university # BPT09
"Now Sigmar Gabriel: With a human start, he immediately wins the sympathies ..."
"SG: Joint Mutbestimmung should already be in companies with 2,000 employees # BPT09"
"the power went out at the laptop, so continue by mobile phone # BPT09"
@DrHartmutFuchter My salary flows without tweets :-)
SG: &quot;This is social patriotism!&quot; # BPT09
"SG: &quot;If this country has made you rich, you have to do more to help others come out of poverty&quot; # BPT09"
"@DrHartmutFeucht Only until the end of this brilliant speech, then there will be less again. OK?"
SG: 10% of people in Germany live in solidified poverty # BPT09
@ Wechsel2014 I know :-)
Now I&#39;m offended: SG says that only the allegrößten Kelber their butchers will choose :-) BPT09
SG: Who (such as black yellow) are not talking about financial capitalism to social market economy remain silent # BPT09
"SG: Directional questions do not have to be solved communicatively, but real # BPT09"
SG: The word common good emerges in black and yellow coalition agreement not to # BPT09
"My God, Sigmar Gabriel takes apart black and yellow # BPT09"
"SG: Innovation and justice are not two wings of the SPD, but must be implemented at the same time politically # BPT09"
"SG: Unity is a (socially) democratic virtue, but openness is also # BPT09"
SG designs a really big line for social democratic politics in the 21st century # BPT09
@JU_Hoffmeister You contradict yourself in your tweet :-(
"SG: The social democratic milieu there are not more, so our offers are interested must be different than it used to be # BPT09"
"@henrikMSL But your predecessor parties did: Heuss, for example, later went to the FDP and many from the center of 1933 to the CDU, right?"
"SG: We want to convince the majority of society, that change is possible, that abuses do not have to stay # BPT09"
It starts well :-) http://bit.ly/3AbRAn http://yfrog.com/e5hcmj
"SG on &quot;bourgeois parties&quot;: only one party has always defended bourgeois democracy, the SPD. Others were discouraged # BPT09"
SG: Schwarzgelb wants people to come to terms with ongoing competitive pressure and selfishness # BPT09
SG: The black and yellow image of man is that of selfish taxpayer # BPT09
"SG: Schwarzgelb is satisfied with the fact that 1/3 of people no longer expect democratic politics, we don&#39;t !!! # BPT09"
"SG: freedom, responsibility, justice and solidarity belong together # BPT09"
"SG: For us, the individual to freedom is capable of, but also for solidarity and responsibility for the community # BPT09"
SG: SPD was always strong when she was more than the &quot;lesser evil&quot;. SPD has a &quot;hope income&quot; reached # BPT09
SG: There is no point in turning pension at 67 back into pension at 65. We need more individualized and affordable solutions # BPT09
SG openly addresses errors by the SPD regarding the duration of unemployment benefits and temporary employment legislation # BPT09
SG: The journalists who called for the dismissal protection to be lifted should be happy that we prevented it from happening # BPT09
"SIgmar Gabriel: Forty years ago, Willy Brandt did not adjust the positions of the SPD, but convinced a majority # BPT09"
"SG: The center of society is not a place, but the questions and answers that convinced the majority of society"
Sigmar Gabriel: We have more than one choice lost ...
Ramsauer&#39;s car toll was an attempt to divert money from federal states with a high density of motorways (e.g. NRW) to Bavaria. Boldly!
now goes to Martinszug with his children
is now going to the political discussion with schoolchildren in Bonn&#39;s Ernst-Moritz-Arndt-Gymnasium.
RT @schumi_bonn: Just said again in the TV cameras: the Muslims have a right to their mosque. | Exactly
Artificial snow up to +30 degrees? Then climate change is no longer a problem :-( Now I understand the meaning of the word &quot;decadent&quot;
was just allowed to say a word of greeting at the 50th anniversary of INFAS. Congratulations to this Bonn company!
Important first decision by Saar-Jamaica: CDU parliamentary group leader changes to lavishly paid chief positions of the lottery company. Priorities?
Wolfgang Hürter (SPD) re-elected district mayor of Beuel. Deus (CDU) failed again
@schumi_bonn I am also looking forward to our continued good cooperation
&quot;Carrotmob Bonn&quot; http://j.mp/4oELyV | A really good idea ...
Helmut Kollig (SPD) is the new district mayor of Alt-Bonn
"@pkanzow If he only wanted to name things, Guttenberg should have been a journalist. He is a minister, he has to act (learn)!"
"Head of Cartel Office becomes Secretary of State for Economic Affairs? Well, recently warned that nuclear power plant extension would harm competition!"
considers Astrid Klug to be the optimal choice as the new SPD managing director. Environmental politicians are smart people :-)
waiting for the late night train from Berlin to Bonn
Every bet is that it will be uncomfortable for the CSU if Schwarzgelb opens the locks for agro-genetic engineering. We take care of that!
"Guttenberg remains true to himself: No decisions as Minister of Economy, no word as Minister of Defense about NATO report &quot;Tanker Truck&quot;"
on the way to Berlin. Small exam of the group leader and interviews (with me)
asks Schwarzgelb to keep the line from Rotschwarz: income from emissions trading for national and international climate protection!
recommends the comment of the Neue Osnabrücker Zeitung http://bit.ly/1ZpUgE Typisch Niebel on Niebel&#39;s populist China decision.
&quot;Bullying in the Saar-Greens&quot; http://j.mp/1nSUhp | Now I understand why my green friend Sterck is for direct democracy ... :-)
conducted red and red exploratory talks at the electronics retailer complaint counter today :-)
@AstridKlug And the SPD and the environmental movement will miss you. Come back soon and join us!
"Primitive game: Until the NRW election, Rüttgers can give the brakes against social cuts, then it starts off powerfully http://j.mp/dTyMb"
is on the way to Berlin. And tomorrow I dread the new division in the plenary. Sad!
@affenfein content? If that relates to Saarland: Greens had promised voters election of Meuse = word break! Reasons should be clear
&quot;Saar-Grünen boss Ulrich had a close professional connection to FDP man Hartmut Ostermann&quot; http://j.mp/QPGph | That is very interesting!
"If taxes are reduced by black and yellow by 24 billion euros, then half of them will already be red and black law on 1.1.2010!"
recommends participating in the vote on the black and yellow friendly BILD report on the coalition agreement http://j.mp/4DbqhZ
is happy about his 2500th friend on Facebook :-)
"on energy policy in the black and yellow coalition agreement: quickly costs 100,000 jobs and money by continuing oligopoly http://j.mp/2mEtcK"
"@FrankWallitzek Nana, you can trust me :-) Take the green electricity from Stadtwerke Bonn, it is really okay!"
"@FrankWallitzek TÜV label for suboptimal. Green electricity label, for example, much better, because only suppliers who get into new (!) Systems get it"
"@FrankWallitzek Only electricity from old systems that previously delivered in a general electricity mix. So the mix doesn&#39;t change. In addition, RWE subsidiary"
@ Mpet21502 140 characters?
"RT @tsghessen: Health reform with a flat rate per head is a huge mess. | Merkel had promised the opposite, Kauder had promised"
"@FrankWallitzek No, this is not real green electricity, but only redeclared electricity. Other customers now even dirtier !!!"
I don&#39;t think it&#39;s funny that Schwarzgeld-Schäuble is now becoming a black and yellow finance minister. The reputation of democracy is so damaged!
RT @FlorianPronold: wondering how black-yellow wants to degrade Guttenberg. | For another four years he couldn&#39;t get by with a show alone
Schwarzgelb did not say the untruth with &quot;more net&quot;. Just forget that this only applies to a few and the majority should pay! :-(
"@pkanzow And that speaks against the technology itself. Allies become enemies, sensible half-madness. The danger remains!"
Black and yellow want to give guarantees for nuclear exports again? Great idea: Nuclear technology was brought to Iran in the 1970s!
@alicantist Seven of nine was always a feast for the eyes :-)
"Prevent VAT on waste water, waste, etc. now"
"With the end for the shadow household, black and yellow shows that political pressure can make a difference!"
currently always has a knife in the car ... to take away forgotten campaign posters :-)
"Black and yellow coalition of headlines: targets for renewable energy and climate protection are raised, the corresponding funding is reduced. See through!"
@YoungSocialist SPD has worked very hard to identify traffic lights before the election! Take a look at Google &amp; Co.!
Black and yellow in the federal and state governments rejects traffic light labeling for food http://j.mp/rP9YT Consumer protection associations and SPD for this!
"@diapolo faction discipline is a good thing. But I voted against (!) Data retention, young man!"
still expects the Federal Constitutional Court to stop storing data!
&quot;Environmental Policy: How Black and Yellow Playful Wealth Chances - SPIEGEL ONLINE - News - Politics&quot; http://j.mp/1FHhIl My Speech !!!
"@andreashelsper Oh please, I&#39;ve explained everything about it, for example here: http://bit.ly/1akIHg"
RT @FlorianPronold: Black and yellow turns apartments into gaming chips in the casino http://ping.fm/JFh8f
"@pottblog Unfortunately, this question is correct ..."
really considers the suspension of online searches and Internet bans to be an FDP success ...
"In the Bonn General-Anzeiger, a citizen has an understanding of what the Saar-Greens have to say by letter to the reader. Googled for a moment: a CDU official!"
welcomes increase in Hartz IV savings assets! Was also in the SPD election program and had failed in the Federal Council in 2004 due to black and yellow!
"@campact To the phone demo: CSU-Göppel is really opposed to nuclear power, the employee was right!"
RT @campact: Take part in the telephone demo! Until 5 p.m. today. First feedback from callers: http://tinyurl.com/yjas9bq
@SPIEGEL_Top please? Where should the federal budget be relieved by reducing the feed-in tariff for renewables? Do some research !!!
has summarized the evaluation of the Bonn results of the Bundestag election by the city of Bonn http://bit.ly/sIqSq: red-green direct mandate
"@le_bloc_vert Congratulations from me, too, with the hope of using Jamaica only for vacation :-)"
@awiemers Would also fit the current SPD debate :-) But is my favorite quote from &quot;Brian&#39;s life&quot;
@DerWesten Every anti-imperialist group like ours must reflect such a divergence of interests within their power base
@ FR31H31T Typical in the Bundestag are about 830 euros for 19 hours a week for students
"@ FR31H31T With a full study position, social security contributions would be included!"
"RT @awiemers finds it extremely hypocritical that LINKE wants to abolish mini jobs, but advertises such jobs http://bit.ly/3rlKCC"
"There are some things you can rely on: the FDP is in the opposition for tax cuts, in the government ..."
Merkel offers FDP tax cuts on pumps? This is how Kohl ruined Germany ... The next generation will be burdened!
is pleased that the Rhenish SPD has nominated him for the SPD federal executive board. Take responsibility right now
Even though I would benefit personally: Increase child benefit and child allowance wrong. Better to invest money in schools and day care centers
@pkanzow But Post would have gone to Cologne without a tower and T-Com wanted to go to Frankfurt (Mr. Raizner)
"@pkanzow Post-Tower + Post-Campus (8.000 Jobs), T-Mobile (6.000 Jobs), Telekom Office Port (2.000 Jobs), Bonner Bogen (5.000 Jobs)!!!"
"FDP &quot;citizen benefit&quot; would be a massive cut, for example for single parents and for the unemployed in cities with high rents"
"Cabaret artist break: Bonn has become Germany&#39;s un-city through Bärbel Dieckmann! Pardon, of course, UN city! :-)"
@filterblog Federation of energy consumers thinks a few years ahead. Ending solar funding would prolong expensive monopoly
Very good: Federation of energy consumers against cuts in solar subsidies
"CDU demands lower taxation of biofuels? Funny, that&#39;s exactly what prevented them in the grand coalition!"
Nuclear economy should be careful: investments in nuclear power plants are expensive disposable investments when the government changes in 2013 ...
"suggests that the SPD talk less about the Left Party coalition in an abstract way, but make it clear where the Left Party needs to be able to govern"
@Energetiker My municipal utilities already offer flawless green electricity and build a highly efficient combined cycle power plant
@pkanzow I would especially fight for a German &quot;yes&quot;
@Tombisk Wow! Orally or in writing?
"If the party donation liar Koch became finance minister, it would be a new low in political morale in Germany"
"If black and yellow now fulfills all wishes of the energy companies, then customers should simply switch to the other providers"
"French government extends support for photovoltaics: http://j.mp/1Qlw1t. In Germany, there is a threat of clear-cutting due to black and yellow"
"My employee is currently eating the carrot of her rabbit, who was euthanized an hour ago. Somehow a little strange ..."
Solar bashing again from SPIEGEL http://j.mp/3TQQ54 Why is it never reported that Germany has long exported more than imported?
Zack-Zack-Niebel made his first decision as minister against his experts. Out of aid for poor regions in China: loss of influence
"RT @HELPfromGermany: Provides 1,650 families with construction materials after the earthquake on Sumatra. New photos on http://redir.ec/iN8p"
&quot;The Green Differences&quot; http://j.mp/2dv6lE | That should convince the last green party soldiers of the nonsense of the Saar-Jamaica deal
&quot;Black-yellow-green in Saarland: doubts about Jamaica grow - taz.de&quot; http://j.mp/3sSEiB | And also on the topic of Jamaica on the Saar
"&quot;TP: Jamaica is sinking into the green swamp&quot; http://j.mp/hdbp7 Even if Telepolis does not always research properly, that&#39;s interesting!"
Does Niebel know that he is not responsible for the &quot;economic cooperation&quot; with the lobby of the Apothekenverband &amp; Co?
"@ruedigerb Black yellow&#39;s roll call was complete this morning, so nine black yellow votes against Merkel"
"In the case of black and yellow, nine MPs are clapping for Merkel, who they just haven&#39;t chosen ..."
I&#39;m even less for Angela Merkel as Chancellor than four years ago :-)
"RT @alexbonde: Lafontaine receives double the diet, but goes on vacation instead of parliamentary work. http://tinyurl.com/yfss7lw"
Black and yellow does not go into the pot even when BT committees are constituted and government declarations are made. Merkel-Trott is contagious!
RT @juergennimptsch: Unknown letters from the composer Robert Schumann from 1853 have appeared. Discovery of the Bonn Schumann network.
&quot;Black and yellow plans: organic farmers criticize coalition agreement - taz.de&quot; http://j.mp/394bkI | A very good summary of the criticism
Primitive: Black and yellow half against SPD and left in the Bundestag presidium. The last time I supported their candidates
@pkanzow you have to have your logic chip checked :-)
"Good speech by the new President of the Bundestag, Norbert Lammert. He campaigns for a self-confident parliament, also towards the government and the media"
"Initially funny, then out of place, now nonsensical (&quot;forest extinction is defeated&quot;) speech by the old president Riesenhuber"
