"@affenfein Oh, that&#39;s why the wind blows ..."
@aflasbar I am impressed by this logical reasoning :-(
"@affenfein But you have no problem with merged recorders, do you?"
"is happy about its 1,500th follower"
has just been re-elected as deputy SPD parliamentary group leader :-)
@fukami So what? Are you not online on the go? -P
@alexandersempf The DB is like French nuclear power plants. Basic problem is concealed with excuses ...
@atomausstieg Atomausstieg2009: Atomrenaissance2009 2: 0 :-)
@le_bloc_vert Don&#39;t you want Abg. for the whole country? Then you have to endure cone groups from BM :-)
@hskzoom Good :-)
"Will Rüttgers dare to do a TV duel? It would be fair, he got some as a challenger in 2005!"
"now has a new background picture for Twitter, conjured up by an SPD member :-)"
"@hlux Yes, but you shouldn&#39;t delete it on purpose"
"wonders about people like @JuliaKloeckner, who simply delete their previous tweets when doing new tasks. Don&#39;t you ..."
"@homofaber Echt @kristinakoehler also tweeted at the time, I thought only @juliakloeckner and me !?"
"@The West Nana, unfortunately you weren&#39;t the only ones :-("
@HAZ would have been nice if no one had noticed :-)
"@ pgk1966 The F also import electricity from D like crazy, but only up to the upper limit of the coupling points between F and D -&gt; 9,000 MW"
"@kogekisha Logical, nevertheless 19% (FORSA two weeks ago) and 25% (political barometer two weeks ago) are an important difference ..."
"Mr. Güllner is now trying hard to get the values of the other survey institutes, # SPD + 2% in two weeks. Bet he&#39;ll go down soon"
"So this Laumann from Laumann is against tax cuts, especially for hotels? Black and yellow NRW government voted for him in the BR!"
Brave Güllner: That&#39;s where the other pollsters see. closed the CDU in the minus and the SPD in the plus. He continues to do politics
Utz Claasen changes sides in time. But he still underestimates the strengths of decentralized generation ...
@webrebell Thank you for the trust that we will soon put back in government :-)
@zeitrafferin We&#39;ll talk about the history of the Pirate Party in 2152 :-)
"The @fukami has already become a party soldier, pardon party pirate. Instead of looking forward to the change of heart in the SPD ..."
"@kogekisha kindergartens, insulation, sound insulation etc"
@timbeil Only black and yellow with record debts in 1997 and 2010
Economic stimulus package: More than 6.2 million euros called up. Bonn is one of the fastest municipalities in NRW | And who invented it? The Sozis!
"If St. Martin had been a black and yellow minister, he would have taken the rags from the beggar to accelerate growth"
Gabriel: Anyone who gives back the money at the education summit to steal tax cuts beforehand is a hoax
&quot;Left: Bonn is now on the Saar - who chooses green will be annoyed by black!&quot; http://j.mp/7tW3FB | If I were so hot ...
"In the Kunduz case, only one person can tell the truth: Guttenberg or Schneiderhahn. Baron Munchausen or a lying soldier?"
"Aigner therefore wants to &quot;put pressure on banks&quot;, but at the same time waive legal requirements. Who else falls for such linguistic highs?"
"@KESS_ NRWSPD will vote against Lex.Eon, but my &quot;quotes&quot; are reproduced incorrectly"
noticed that even the dust catchers in the German Bundestag are black-red-gold. Very patriotic http://yfrog.com/4gamtuj
"@aflasbar Not market price, price from socket! As a customer, only the final price is important to me!"
hopes that today is the beginning of the end of data retention
Stadtwerke worried about nuclear runtimes - FTD http://bit.ly/87MwcH / via @Anti_Atom_News I can confirm from a profitability study
recalls that a study by the Rhein-Sieg district showed that the 1 million inhabitants of the region could be supplied with 123% renewable energy
BM Röttgen (CDU-NRW) must prevent Rüttgers from removing climate protection from the state development law on Wed. Signal towards K&#39;hagen
"@aflasbar RWE and RWI are self-referencing systems. From 2013, PV electricity will be cheaper than electricity from a socket, it couldn&#39;t be more economical"
@fukami Isn&#39;t that available online? :-)
@ piepe46 Check out Eon &amp; Co&#39;s profits. Only more competition helps
@katjadoerner Green application in the BT has no relation to cogeneration and the fight against monopolies. Not well prepared ...
Black Yellow&#39;s first tax increase: VAT on postal services increased by € 500 million annually. Bet that 2011 will come even more?
@ pgk1966 Nuclear electricity can hardly be regulated. That is why F has huge problems in midsummer (cooling water) and winter (electric heating).
&quot;Electricity prices on the stock exchange below zero&quot; http://j.mp/4CpDbE The problem I had named in response to BM Röttgen&#39;s government declaration
@schumi_bonn you can think of something! Don&#39;t let the noise next door bother you ...
BM Röttgen too little self-critical when looking back at the UN climate conference. My answer to http://www.kelber.de
@schumi_bonn Wasn&#39;t the 27th also a Christmas holiday in the Middle Ages?
Found by SPON in Bonn :-) http://yfrog.com/4aah7zj
"lets @katjadoerner pass as red-green, which does not need new resolutions, but should stay with the old ones :-)"
France shakes its way into the electricity hole http://j.mp/93172Y / via @pantachorei Nuclear power fans hibernate in the dark with a cold butt :-)
"Party book policy: In the old development ministry 1 out of 3 heads of social democrats, under BM Niebel soon 3 out of 4 heads with FDP book"
is working on his answer tomorrow in plenary to Merkel&#39;s government statement on Copenhagen
"I give Guttenberg another 24 hours / via @le_bloc_vert Deceiving, he is hoping for a Christmas miracle and still has media helpers"
Any other minister would have to resign after such contradictions. Guttenberg draws (still) from the media bonus
"On December 16, 1979, the regional association of the North Rhine-Westphalian GREENS was founded in Hersel near Bonn. / via @gruenenrw Congratulations"
"wishes everyone a &quot;Merry Christmas&quot; today, also black yellow in the bundle and black green in Bonn! The latter also had good resolutions for 2010 :-)"
"@gudrunkopp End speculation, vote in May, truth in June! Did I understand the order correctly, Ms."
"Black and yellow in the federal government and black and green in Bonn: test orders and expert opinions, decisions (maybe) after the state parliament election. Dishonest"
"At Missfelder, the phrase &quot;primacy of politics&quot; takes on a whole new meaning :-)"
"@weissenfels He has multiple. SPD has correctness of bombing since 8.9. stressed several times, right?"
"@JuliaKloeckner With the reasoning, municipalities have to fear black yellow the most, in NRW municipal cash advances are the highest"
"@FlorianMM Poor CDU, whenever you are in government, the evil circumstances compel you to lobbyist gifts and record debts"
Guttenberg does not answer the crucial question: What information has been &quot;withheld&quot; from him?
"Guttenberg&#39;s brazen rescue attempt: He doesn&#39;t stand in front of the soldiers, but hides behind them to save his skin!"
Schwarzgrün in the Bonn city council rejects inclusion of climate resolution in the agenda.
"@FlorianMM Well, even as a CDU member, you cannot deny that record indebtedness No. 1, No. 2 and No. 3 stem from CDU / FDP times"
Petrified expressions on government bench after Guttenberg speech.
"I&#39;ve never seen anything like this: Guttenberg cowardly hides behind the soldiers. It&#39;s about his lies, not about the actions of BW!"
Trittin also makes mistakes to change the subject. It&#39;s about the clear evidence that Guttenberg lied !!!
@UlrichKelber Schockenhoff? / via @weissenfels so isses
Left Party :-( There the ball lies on the penalty spot (lies of the minister) and their speakers pour out again in general rhetoric
Significant: FDP only sends 3rd row to defend Guttenberg. What does Westerwelle say about this?
The same CDU speaker who already defended Jung now supports Guttenberg ...
"Hammelsprung in the Bundestag. Guttenberg is to comment on the letter from his former State Secretary, who denounces him to lie"
The Merkel government breaks the central promise of the Kyoto Treaty: climate protection funds in addition to poverty reduction funds. A shame ...
@le_bloc_vert Thank you
Schwarzgelb changes his own Kluma protection application. Money for this is now to be deducted from committed development aid
"State statisticians: Bonn overtakes Bochum, Bielefeld and Wuppertal by 2030. With&gt; 350,000 then the sixth largest NRW city"
46 Member of the Bundestag registered for the constitution of the Advisory Board BV Renewable Energies. The solar fraction ...
Federal government swims over questions about Kunduz bombing. Not even a clear answer as to when the Chancellery area knew
Minister of State Hoyer (FDP) relativises the putsch in Honduras again in the Bundestag with the same words as the FDP-related foundation ...
Discussion with BM Röttgen on the negotiation situation before the climate protection conference in Copenhagen. Question about measures behind nice words of the BM
has just given his vote as a jury member of the Bonn Citizens&#39; Prize. Written due to the Berlin meeting week
"@UlrichKelber Black-Green concerns you more than Black-Yellow, can that be? / via @ralphdiermann Because it&#39;s in my hometown"
"True, Bonn CDU criticize political style and then want black and green, does not fit RT @Querdenkerin: Identical action is credible"
@le_bloc_vert That&#39;s a word ...
"@le_bloc_vert Yes, but acting differently would be more credible ..."
What kind of heroes: Subsequent :-( RT @ pgk1966: @UlrichKelber: FDP not so faithful to the chef. Http://bit.ly/5ayPMl.
@le_bloc_vert don&#39;t you want to coalition with those in the city council?
thinks it is good that the right of establishment in the Bundestag is used for debates on SWIFT Governments must decide EU Parl. leave!
Why did Saar-Greens not demand a vote per #Brender from coalition partner Müller on the ZDF board of directors? SPD had asked several times
"On the contrary, RT @katjadoerner: @UlrichKelber You know yourself that the FDP never really wanted a traffic light"
"Majority without black would be there, Greens don&#39;t want RT @katjadoerner: @UlrichKelber overlooked the fact that red-green doesn&#39;t have a majority ;-)"
Not even an eighth of the planned black and yellow additional expenditure by 2013 goes to education! Hoteliers get almost as much ...
and the ICE simply fails - again. Replacement train without reservation :-(
@mediakontor All SPD members + two more
thanks Klaus #Brender for making CDU behavior public with the showdown
"The FDP, as the Hessian coalition partner, is fully responsible for everything that Koch burns"
is at the 4th Bonn AIDS Benefit Gala
I&#39;m in the bridge forum :-) RT @FrankWallitzek: And off to the Radio Bonn / Rhein-Sieg / Afterjobparty Christmas party in the park restaurant Rheinaue
@JuliaKloeckner Some (CDU) talk about debt brakes and make record debts! The others (SPD) just have less debt!
"@mideg Thank you, I have enough ideas for additional tasks :-) It&#39;s about clearing out. I can only recommend it to everyone!"
sits at the &quot;political garbage disposal&quot;: What I will not pursue next year as a topic. Create time for the essentials!
To worry about the global climate at -10 ° is weird. But this summit collapse :-( D has given up driving role
@ManuelBusch Why introduce VAT on 90% of shipments instead of abolishing them on 10%? This is a brazen tax increase from black yellow
&quot;Cities in NRW go bankrupt - WDR.de&quot; http://j.mp/7EfZsX Rüttgers voted today in the Federal Council for less income from these cities
"Hmmm, if you get money back for education from who took it from you, what did you do for it? Nothing!"
@alexandersempf The FDP is really not non-profit
now lecture at the pol. Seminar at the University of Bonn &quot;Energy and climate policy as new German concerns&quot;
Exhibition until December 23 Open on weekdays from 9 a.m. to 2 p.m.
"Discussion with students, then opening of the exhibition for the Wannsee conference in Bonn&#39;s Clara-Schumann-Gymnasium"
"Question to SPON: If PV costs are compared with the generation price ex power plant, who pays 5 cents per kWh?"
now has the 2000th tweet behind it :-)
how true RT @kogekisha @UlrichKelber Actually you should be satisfied !? No reg has made such a rapid false start since 49.
@kogekisha D has been exporting more solar systems than we import. Tax revenue greater than feed-in tariff
A few media have to be ashamed &quot;SPON: bank rescue and German funds only exhausted to a fraction&quot; http://j.mp/6GFbQu
@aflasbar Campact&#39;s only argument is that the SPD will not prevail and should therefore call BVG -&gt; apolitically
"Nonsense, your own action is more political than BundesVerfG RT @campact ZDF State Treaty: Beck&#39;s transparent maneuver ..."
"For the tenth time in a year, RWI is allowed to tap its nonsense at SPIEGEL ... http://j.mp/6kqf5n"
"@ pgk1966 among the blacks in red black there were also many GDR officials, such as the Vice Prime Minister"
@IsaBonn I&#39;ll follow up in seven years
Super talent Köhler http://yfrog.com/331j4j
FDP speaker confirms: It is not their social image to give the same amount of money for all children ... freezing cold
Not even half the black-and-yellow cabinet is present to debate their own tax plans ...
77 sqm and all mine! #first night in the new apartment. / via @IsaBonn But that&#39;s ecologically a lot for one person :-)
will vote today against the Money-to-Lobbyist Waste Law aka Growth Acceleration Law ...
"Guttenberg corrects assessment of bombing tank trucks. All right, but not enough: decisions have to be worked through"
"SPD presents bill on employee data protection. Schwarzgelb wants to refuse blood tests, psycho tests and video surveillance. stay allowed"
"Niebelkerzen: The main thing is that it looks good in the statistics, even if the pledged money to fight poverty is missing"
"Schwarzgrün in the Bonn City Council wants to put controversial environmental issues on hold for five years. High price, more would be possible with red-green!"
is on the way to Berlin
"@le_bloc_vert Congratulations. And now collect first votes for the SPD, then there are overhang and compensation mandates and place 24!"
They keep going with the lobby service &quot;Coalition wants to replace uncomfortable pharmaceutical controller - SPIEGEL&quot; http://j.mp/83YRaf
thank you RT @schumi_bonn: @UlrichKelber hope it is not swine flu !!!! get well
must cancel the remaining evening appointments due to rising fever!
@katjadoerner Strange criteria given your parliamentary group leaders in council and federal government: Every&gt; 50 years
"With the President of the NRW Tenants &#39;Association and former Chairman of the Federal Parents&#39; Council at LTW, Bonn-SPD can offer more than other Bonn parties"
"Christmas party of the Sebastianus shooters Bonn-Süd. I hand over beer kegs, voluntary atonement for wrong place naming at coronation"
"Felix von Grünberg gets 73.9%, Dörte Schall 26.1%"
Now ballot for the northern constituency. Felix von Grünberg and Dörte Schall are candidates
SPD nominates Renate Hendricks with 97.3% for the southern constituency of Bonn in the state election. Congratulations to the education expert
"By the way, Felix von Grünberg is President of the Tenants&#39; Association in NRW"
Votes for the southern constituency are counted. Felix von Grünberg speaks as the first candidate for the northern constituency ...
"Full house with the Bonn SPD, now the member of the state parliament Renate Hendricks speaks"
"@ pgk1966 You have to ask the FDP, which Koch is true to the Nibelungs, about all lies and machinations"
List of SPD state parliament candidates for Bonn starts
"@ pgk1966 The comparison between Koch and Ypsilanti is outrageous. One acted brutally (&quot;Jewish legacies&quot;), the other acted wrongly"
"Today I was finally able to have the high-efficiency heating pump installed, so far there was none for my heating. Saving up to 300 kWh / a"
Phew! At the raffle the trip to Ratingen just passed me :-)
RT @mediakontor: Not bad either: Are my GEZ fees now fresh black money for the CDU? #brender #zdf
the Power Puschels :-) at the AIDS gala http://yfrog.us/0gbw3z
@henrikMSL Still being broadcast! Be careful with your leading obedience ...
"BM Jung is talking now. At the beginning, those who just voted for us not to hear him clap. Wrong world"
"Ultra embarrassing: BM Jung refuses to provide information to parliament, but does TV interviews. SPD application, unclear majority, &quot;mutton jump&quot; ..."
"Praise to whom praise is due: In the Steinbach case, Guido Westerwelle demonstrates important steadfastness!"
Guttenberg dismisses Inspector General. and StS because they shouldn&#39;t have given him (!) knowledge about civilian victims. What did Jung know?
@awiemers Hoeneß has saved VfL Bochum financially enough
Westerwelle on armed questions in the Bundestag just as arrogant and sovereign as in the English journalists&#39; question
"@katjadoerner All the best in the &quot;maiden speech&quot;. Can&#39;t be there, talk to Polish, French. and German junior staff"
As I predicted: There is nothing left of the CSU&#39;s anti-genetic engineering line of choice: Aigner is voting for new types of GM maize
Rightly RT @schumi_bonn: RT @muenstercarre: A Bonn environmental Oscar goes to Münster-Carré http://www.muenster-carre.de/sustainable.htm
Embarrassing: Black and yellow cannot finance promised tax cuts and promises the next with the abolition of solos ...
@IsaBonn Welcome!
talks after the Global Green New Deal event at the reception of the German Farmers&#39; Association
"Significant: FORSA invents SPD low, EMNID, Allensbach and Infratest upward movement and 4 percentage points more than FORSA # FORSA-"
Stadtwerke Bonn keep price stable RT @SPIEGEL_Top: New price round: gas customers have to pay up to 120 euros more http://bit.ly/7cCa9q
"@kogekisha 40% + x unfortunately not, but in contrast to FORSA Infratest, Emnid &amp; Co report increasing values for SPD"
"If BM Röttgen is serious about his statements, then he may not implement large parts of the coalition agreement. Will do a reality check"
contradicts DENA boss. There is enormous potential for PV in Germany. Boom will take place from 2015 because it is cheaper than socket electricity
"@kogekisha 19% ???? Fnik, Fnik, Fnik ... Good sleep, FORSA ..."
@le_bloc_vert The with - depending on the poll - twice as many votes as your ;-P
@GabiHillerOhm But 5 out of 5 committee chairs and 8 out of 11 secretaries in the Bundestag presidium for SPD women
"And the penalty for the Oettinger nomination: second-rate department. Fortunately, even climate protection was removed from the Orttinger portfolio"
@katjadoerner I develop a hostility to Germans against women like Ms. Köhler ...
This is how it works in Merkel&#39;s world: The main qualification for ministerial succession is belonging to the national team. # CDU
RT @Ralf_Stegner: RT @whorbach: Jung resigns. He was already lying with the &quot;Jewish legacies&quot; http://tinyurl.com/y8lx9h4
"@ pgk1966 Above all, I want to give EU better people ..."
"Fortunately, Merkel has already mistreated German EU post with Oettinger, otherwise she would now praise Jung there # CDU-"
@mbkreuzberg In the case of those who passed on Jung and Merkel (shadow dept. to the Ministry of Defense)
Also applies to the subject of bank customer data RT @Volker_Beck: FDP can really smoke in the pipe when it comes to civil rights (discrimination).
"In Causa Jung, Merkel&#39;s leadership style takes revenge. He remains a burden until his unavoidable resignation. What information did Chancellor have?"
"Jung does not resign. So it remains with peasant victims, nobody takes political responsibility for the scandal of the public untruth"
FDP speakers are relativizing the coup in Honduras in plenary today. Break with German foreign policy
"@ pgk1966 Soso, want to drive old cars, but spoil the Christmas lights for people :-)"
@schumi_bonn We will elect the future members of the Bonn state parliament on Saturday
goes to the event from the Reichstag building and enjoys the weather and Christmas decorations http://yfrog.com/6o2bhj
let&#39;s prepare RT @kogekisha: @UlrichKelber you should bring this up: &quot;Black and yellow reveals bank customers&quot; see #ftd
"@henrikMSL Man, you already have your daily CDU card ... ... relax. Opinion without any idea in the matter brings nothing"
Why Merkel Koch covers: Debate about Brender creates scissors in the mind of öff.-rechtsl. Journalists on negative reports about CDU #Widerlich
"Good Morning. Today, among other things, speech on the ecological restructuring of our economy and at the reception of the German Farmers Association"
amuses himself about the amount of paper from the Aigner Ministry on &quot;extermination measures&quot; against a (!) caught beetle (corn rootworm)
@ pgk1966 SPD in new poll already 2% stronger than on September 27. And black and yellow shows impressively why they are not eligible
@FrankWallitzek What do I see in your hand? Gene Mueller milk?
Does that mean for NRW coalitions? RT @le_bloc_vert: Whenever I hear &quot;Foreign Minister Westerwelle&quot; it scares me ...
"That is the first location, Ms. State Secretary ;-) RT @JuliaKloeckner: Today I am at the Bonn location of the Ministry ..."
RT @jkahrs: the cdu / csu / fdp plan to significantly reduce the protection against dismissal for tenants is a real clearcut for the tenants
@ nordkurve2013 Or only in the office ...
is happy to have &quot;consumed&quot; only 87 kWh in his Berlin apartment within one year
Government experts accuse Schwarzgelb of wrong economic and environmental policies http://j.mp/5IpGqM Schwarzgelb not sustainable
Merkel&#39;s &quot;bribery&quot; attempt at the Association of Expellees is the brazen move into the state treasury to solve an intra-party problem
"SPD + Greens now have to defend ZDF-Brender against the CDU, the former member of the CDU youth organ. Young Union was. O tempora, o mores"
http://j.mp/7Cgjh5 RT @Nadim_A: @ulrichkelber source?
Priceless RT @FrankWallitzek: @UlrichKelber Cool! What does it cost if I want Westerwelle to be gone again?
Are we in a banana republic? Merkel has offered displaced persons (additional) tax money if they withdraw Steinbach! # CDU
How to become State Secretary in a foreign ministry: To be too conservative for the expulsion foundation ...
and that means? :-) RT @gruenenrw: Black-Yellow without a majority in NRW - Green third power. http://ow.ly/EOQ7
Only so far :-( RT @FriedrichB: @UlrichKelber What is the absolute form of increase for sure? Chernobyl :-)
"Nuclear plants are safe, safe, safe ... RT @SPIEGEL_Top: Three Mile Island: Radioactive radiation in US nuclear power plants leaked http://bit.ly/6ci6ig"
Another three degrees and the 23.11. would be considered a &quot;summer day&quot; :-(
Bonn Greens have every right to choose Koa partners freely. But protagonists should admit that they wanted black green from the start
wonders how BM Röttgen is still environmentally friendly after eco-sayings. Wants to implement Koa contract? SPD will do Röttgen reality check
will deal with the final preparations for the Gorleben investigation committee application this week. Black and yellow data falsifications
"@ pgk1966 Good times. Back then, not even 25% of people voted for parties that promised hundreds of billions of euros in tax cuts or spending cuts"
These Learned? Suddenly entire CDU think BMU is the Department of Energy ... after 4 years Bremserei black BMWi
"is on the way to Berlin, SPD federal executive board and session week Bundestag"
"@woegman NRW is infratest (reputable), Berlin Forsa (untrustworthy). Berlin surveys by other institutes see CDU weaker and SPD stronger"
No more majority for black and yellow in NRW RT @politweet: Poll: 11/22/2009 | North Rhine-Westphalia | Infratest dimap http://bit.ly/6mpdhy
"@JuliaKloeckner Schwarzgelb encourages the monopolists with love service for EON, RWE &amp; Co. Extension of term = extension of monopoly"
"Schäuble compares the fall of the Berlin Wall and the financial crisis? Fits, back then there was also a tax and levy increase despite promises to the contrary"
"comes from the big political family reunion at the 60th anniversary of the Cologne DGB, today DGB Cologne / Bonn"
@awiemers The second Albanian request to change insurance will no longer be so friendly :-)
General-Anzeiger reports on the black and green Paktchenpakt. Is that the core of the poodle? Or why did certain Green Ampelkoa torpedo?
@dorian_winter Classic German: Little ones on the market. Pizza (even better spaghetti alla Casa) La Crema Kölnstraße
"@dorian_winter Which direction? Sushi? At the gate! Italian? La Crema, Koenstrasse! Turkish? Opera at the Opera"
"was visiting the Bonn-based company &quot;true fruits&quot;, manufacturer of super smoothies :-) Startup with nice troops"
"CDU does it in black and yellow like in a grand coalition: first agree and then don&#39;t want to stick to it. This time, at least in terms of content ok"
NRW students need summer holidays :-) RT @gruenenrw Plumpe teacher scolding from Minister Sommer that teachers are to blame for the pressure to perform
"Why are unions so quiet about black and yellow head flat rate plans? In the future, the secretary will pay more than your boss!"
"@FriedrichB Exactly. Crucial mistake: I did not receive a single donation as a person, but the party. Just like other parties"
@Elke_Ferner You are in NRW?
@alexbonde Ever heard of the ADG?
"@cdu_news Well with the clientele party, the CDU has known itself since its foundation ..."
