Have a nice Thursday ;-)
Knut Kiesewetter - The Power in the State (FROM 1973 My music tip for you out there in digital orbit https://youtu.be/aHYcyQi4AlU
Refugee policy: CSU wants to send boat refugees back to Africa http://www.handelsblatt.com/politik/deutschland/fluechtlingspolitik-csu-will-bootsfluechtlinge-nach-afrika-zurueckschicken/19189256.html…
"More security through more police officers, exhaustion + application of existing law + selective, targeted adjustment instead of legal gravel (t)."
This is just the right cardboard mate that socialists are allegedly against public security. We are only against exclusion + stupid laws!
99.9% of the refugees are just as bad as 99.9 of the locals. SPD makes policies for social cohesion.
"We do not stir up sentiment against refugees, but we are against resentment for security. That distinguishes Social Democrats from rights!"
"Curious, like me rights, who always caricature the SPD attitude, want to change the mind. SPD is not against &quot;threats&quot; against refugees."
"I wish everyone a happy new year and a happy, healthy and peaceful 2017! Make something of it! pic.twitter.com/S8XVkM6pAB"
"&quot;You don&#39;t have to be right to choose the AFD, you just have to be stupid enough.&quot; (Urban Priol) Annual Review 2016"
Smart text! http://www.sueddeutsche.de/politik/kolumne-haltung-1.3315133…
"Happy New Year everyone! Enjoy those you love and show them. Happy, healthy 2017 Jahr"
There is reason for gratitude and satisfaction for many things. So I have positive expectations for the new year as a whole.
"Political hostility + criticism from the right, especially on the net, do not particularly affect me - they are the price for political attitudes."
"With me personally, the past year was generally rather good. Fortunately, the family and my private environment are doing well."
"Now an overall difficult year is saying goodbye with many challenges, sad occasions and setbacks - also good sides."
Good morning from Bordesholm. Yesterday evening with Filius at the traditional FDP price cat in the neighboring inn.
Van Morrison - Just Like Greta At the turn of the year my favorite song for you out there in digital orbit ;-) https://youtu.be/ivCCtRqq5mA
Right-wing provocateur AfD deputy Gauland fights for &quot;Mohrenkenken&quot; - Political News - Süddeutsche.de http://www.sueddeutsche.de/news/politik/parteien-afd-vize-gauland-kaempft-fuer-mohrenkoepfe-dpa. urn-newsml-dpa-com-20090101-161230-99-696640…
"On such occasions, my American professor at the Harvard University media center always said: &quot;It&#39;s called news not olds&quot; 😉 https://twitter.com/ard_bab/status/814812015537618948…"
Berlin: SPD does not want &#39;prisons on the border&#39; for migrants http://www.rp-online.de/politik/spd-will-keine-haftanstalten-an-der- Grenz-fuer-migranten-aid-1.6494399…
Good morning from Bordesholm. Cold winter morning in the north. Nice Friday ;-)
Good morning from Bordesholm. Have dinner with friends in Neumünster last night. Quiet days before the turn of the year. Have a nice Thursday!
Alphaville - &quot;Universal Daddy&quot; (Official Music Video) My music tip for you out there in digital orbit ;-) https://youtu.be/TI3zaHh0i14
1.More police 2. Effective repatriation agreements with North Africa 3. Hold detainees whose asylum application has been rejected. https://twitter.com/peter_simone/status/814040613163241472…
"What the Union is for: isolation, deterrence, deportation. In contrast, the SPD stands for integration and social cohesion in RLP! https://twitter.com/juliakloeckner/status/813855903334199296…"
Nice Wednesday ;-)
Somehow a shame if reading does not want to work out - you understand so little and have to write such nonsense. https://twitter.com/laboe78/status/813831019140972548…
Merry Christmas to you too! https://twitter.com/hpfriedrichcsu/status/812673811174789120…
Merry Christmas and a peaceful celebration with loved ones at home! Thoughts also with those who miss that. pic.twitter.com/7lvFUsub6w
"&quot;Intelligent&quot; comments from the media &quot;One will still be allowed to say parliamentary group&quot;. The danger is &quot;politcal correctness&quot;, not intolerance + violence."
"SPD is also in favor of more police officers and workable return agreements with North Africa. Nevertheless, detention pending deportation remains necessary. https://twitter.com/l_petersdotter/status/813801027925344259…"
@L_Petersdotter We are talking about a small number of asylum seekers whose application has already been legally rejected and could go underground.
Detention pending deportation against asylum seekers whose application for asylum has been finally rejected is quite another matter. Protect communities from real danger!
"You don&#39;t even become a &quot;threat&quot;. Islamists who have radicalized themselves, for example, offer themselves as suicide bombers."
"Stegner wants deportation detention for endangered people NDR.de - News - Schleswig-Holstein http://www.ndr.de/nachrichten/schleswig-holstein/Stegner-will-Abschiebehaft-fuer-Gefaehrder,abschiebehaft148.html…"
"Again to write down: Rejected asylum seekers do not automatically have to be deported. Endangerment that could go into hiding, but it does!"
Union in SH has not understood anything again: Refugee families do not belong in prison. Danger with rejected asylum application already!
"What sets us apart from the CDU is that we don&#39;t want a policy against refugees, no general suspicion, no harassment, no detention pending deportation."
"Nord Union pretends to suddenly follow her in the right triad of isolation, deterrence and deportation, which they would like to have."
Good morning from Bordesholm. Time to do &quot;between the years&quot;. A little relaxation before the start of the busy election year.
cat stevens - Miles From Nowhere My music tip for you out there in digital orbit ;-) https://youtu.be/DZ18oEHxab8
Now arrived in post-factual? When claims replace facts. Didn&#39;t say anything else than Eva Hoegl. https://twitter.com/linke_sh/status/813834254106947585…
Chronicle photos https://m.facebook.com/WhiteHouse/photos/a.158628314237.115142.63811549237/10155072127919238/?type=3…
Is it still a bit stupid? https://twitter.com/rioramscht/status/811832994373767168…
Have a nice Tuesday ;-)
In the evening a meeting of the party council 10 days before our state party conference.
Good morning from Bordesholm. Several requests for an interview after I published a WELT interview on domestic politics today.
Rednex - Spirit Of The Hawk (Official Music My music tip for you out there in digital orbit https://youtu.be/Yau8nHOXhug
Good morning from Bordesholm. Quiet Christmas days with the family at home. Happy 2nd Christmas holiday!
Jose Feliciano - Feliz Navidad My music tip for you out there in digital orbit ;-) https://youtu.be/xMtuVP8Mj4o
AfD-Bashing: Greens leader Anjes Tjarks lands viral hit | MOPO.de http://www.mopo.de/hamburg/politik/afd-bashing-gruenen-chef-anjes-tjarks-landet-viralen-hit-25367042?originalReferrer= https://www.facebook.com/&amp;originalReferrer = https% 3A% 2F% 2Fwww.google.de% 2F &amp; mobileSwitchPopupClick = 1…
 http://www.shz.de/regionales/schleswig-holstein/stegner-gegen-vermischung-von-fluechtlings-und-sicherheitsdebatte-id15678276.html?utm_source=dlvr.it&utm_medium=twitter …
Touching Christmas sermon in the Christmas mass in the small village church of Bruges.
Good morning from Bordesholm. Nice Christmas eve with the whole family. Storm and lightning outside. Merry Christmas!
Interesting: Inside Facebook: This is how the Arvato extinguishing team works - Digital - Süddeutsche.de http://www.sueddeutsche.de/digital/ex Exclusive-sz-magazin-recherche-inside-facebook-1.3297138?utm_source=Maileon&amp;utm_medium=email&amp;utm_campaign=SZ + Espresso + in the + morning + Fri. + 16.12.2016 &amp; utm_content = http% 3A% 2F% 2Fwww.sueddeutsche.de% 2Fdigital% 2Fexklusiv-sz-magazin-recherche-inside-facebook-1.3297138 &amp; utm_term = html…
Comments https://m.facebook.com/story.php?story_fbid=10155064920364238&amp;id=102574194237…
Photo https://m.facebook.com/284334418387317/photos/a.291780524309373.1073741829.284334418387317/727200310767390/?type=3 ...
wishes everyone a happy and peaceful Christmas!
"Good morning from Bordesholm. Market before breakfast, some last errands. The house is gradually filling up. Sons come home."
Chris Rea ~ Driving Home For Christmas (HQ) My music tip for you out there in digital orbit ;-) https://youtu.be/DDt3u2Ev1cI
Ralf Stegner (SPD) - &quot;This instrumentalization is downright disgusting&quot; http://www.deutschlandfunk.de/ralf-stegner-spd-dieses-instrumentalisieren-ist-geradezu.694.de.html?dram:article_id=374648…
The AfD and the Berlin attack: &quot;Planned provocation&quot; - taz.de https://www.taz.de/Die-AfD-und-der-Berliner-Anschlag/!5366254/…
"Otherwise, a few things to do before Christmas today. Nice Friday ;-)"
Good morning from Bordesholm. A radio interview with Deutschlandfunk on the debate on security and refugee policy.
Fifth Harmony - All I Want For Christmas Is You 2014] My music tip for you out there in digital orbit https://youtu.be/qAjreC0Z1bM
Rather nice tasting apples with rotten tomatoes 🍅 https://twitter.com/parlanet/status/811964328127721473…
I just enjoyed listening to your music on the new Büchergilde CD and admired your great voice. Thank you! 😀
"It is certain that the Bachmann is not completely tight, is it? https://twitter.com/doppelgeist60/status/811855423045246976…"
Nice Wednesday ;-)
Apparently price for always opposing right-wing nonsense. Some comments also show psychological problems for those affected. https://twitter.com/sofareporter/status/811467315153870848…
Prudence appears to be a rare commodity in the political response to this terrible attack. Respect for the victims would be the least.
"Results of the investigation are zero, but Seehofer is sometimes calling for a complete realignment of Merkel&#39;s refugee and security policy"
The newspapers are full of coverage of the Berlin attack. Martial rhetoric of the Saarland Minister of the Interior.
Good morning from Bordesholm. Today shortly in the representative of the party leader again to Berlin. Nice Wednesday ;-)
John Lennon - &quot;Happy Xmas (War Is Over)&quot; - Offical Video-HQ My music tip for you out there in digital orbit https://youtu.be/S84RLgnz7Rs
2:0 Wood!!!!! #nurderHSV
1: 0 miller !!!! #only the HSV
"Such people have lost nothing in parliaments, but rather in prisons! https://twitter.com/piratbernie/status/811123826834673664…"
"Even after the horror of Berlin, most political DIE statements remain wrong: THE Muslims, THE politics, THE press, THE refugees."
Cem Özdemir is right: it is a question of decency that democratic forces are now moving closer together. Grief and respect for the victims.
Today&#39;s appointments in the Kiel State House and citizens&#39; consultation in Bordesholm.
Mourning for the victims and respect for relatives and friends dictate something else. Careful investigation must be a priority!
"In any case, the hasty conclusions and the high-pitched tones from the right already overturn. From Trump to Pretzell ...."
Good morning from Bordesholm. No final clarity as to whether tragedy at the Berlin Christmas market was an attack yesterday - it seems so.
Sad piano (it&#39;s hard to say Goodbye) by Michael Ortega My music tip for you out there in digital orbit https://youtu.be/a_Am4cHMBKM
#BreitscheidplatzBerlin pic.twitter.com/0YCHYKdYjX
Compassion for the relatives and friends of the injured and killed from the Berlin Christmas market
Still hope that it was an accident tragedy and not a terrorist attack on the Christmas market on Berlin&#39;s Breitscheidplatz.
Incredible and disgusting! #Breitscheidplatz #Berlin pic.twitter.com/dgDzBBFgqV &quot;https://mobile.twitter.com/MatthiasMeisner/status/810943761949790209/photo/1…
"What is missing is not the alleged courage of the Red Greens to deport them, but the humanity in dealing with the issue at the Christian Union. https://twitter.com/ulfposh/status/810105920701235200…"
Promoting Afghanistan like a holiday country - not getting families with scared children out of bed with uniformed people at night! https://twitter.com/ulfposh/status/810105920701235200…
"Voluntary return or return to safety and dignity is okay. However, deportation of sick and disabled people is not! https://twitter.com/ulfposh/status/810105920701235200…"
"Of course, if the neighbor does something stupid, we should of course emulate it immediately. CSU logic leads to the world domination of the stupid 👎 https://twitter.com/hpfriedrichcsu/status/810429790725570560…"
The post-fact society also nebulizes conservative and radical market brains. https://twitter.com/facesworld/status/810430341890670592…
"Black green, on the other hand, is clearly the opposite of progressive or left. See Kretschmann&#39;s refugee and deportation policy ..... https://twitter.com/danielmack/status/810413537159999488…"
She is looking for answers to important questions in a national context - this is completely wrong! Your European policy is just not all left!
"In the WAMS interview, Sahra Wagenknecht rightly emphasizes that left is fundamentally different from right - but blurs the differences themselves."
"In the WAMS, the front page again polemicizes against the minimum wage - convincing is different!"
"Unfortunately, HSV left three points in Mainz, so on Tuesday there is particular pressure in the last home game against Schalke."
Good morning from Bordesholm. Today friends come for Advent coffee. In the evening we go to Berlin one last time this year.
Elton John - Step Into Christmas My music tip for you out there in digital orbit. Nice 4th Advent ;-) https://youtu.be/IbRtGMm96F8
The HSV has to run in Mainz. Hopefully as successful as in the last four games! Have a nice Weekend ;-)
Good morning from Bordesholm. Market before breakfast. Today some errands and drinking coffee with friends.
Slade &quot;Merry X-Mas Everybody&quot; (LIVE!) My music tip for you out there in digital orbit ;-) https://youtu.be/Xyl76z3EllY
Nord-Union on AFD course: Against Merkel + against dual citizenship. Children of foreign parents born here should be harassed!
Embarrassing and right. https://twitter.com/harms_lars/status/809715939352702980…
Union embarrasses and isolates itself from the right-wing position in the debate on dual citizenship in the state parliament of Schleswig-Holstein.
"Good morning from Bordesholm. Today, there is certainly a very controversial general debate about the 2017 state budget and the guidelines of state policy."
Queen - Don&#39;t Stop Me Now (Official Video) My music tip for you out there in digital orbit ;-) https://youtu.be/HgzGwKwLmgM
Human dignity is inviolable. We fight for social cohesion! Against resentment! #gegenhalten! pic.twitter.com/kowniurUoj
Sigmar Gabriel - Some believe with so-called ... | Facebook https://www.facebook.com/sigmar.gabriel/photos/a.272613802771349.69678.104493292916735/1394664927232892/?type=3&amp;theater…
The government&#39;s balance sheet is good - that annoys the opposition! In the daycare there would now be &quot;Howl&quot; calls: https://twitter.com/juliakloeckner/status/808677255798988801…
@MGrosseBroemer with &quot;All roads lead to Moscow&quot; -Retro campaign for Merkel. That has a beard soooooo
Union politicians for fines on &quot;fake news&quot; | MDR.DE http://www.mdr.de/nachrichten/politik/inland/unionspolitiker-wollen-fake-news-ahnden-100.html…
Only the automat speaks here 😉 https://twitter.com/aus_der_ubahn/status/808565863783743488…
Good morning from the completely congestion-free state capital Kiel ☕️☕️☕️
In the evening Christmas party of the SPD parliamentary group with farewell and welcome. Have a nice Tuesday ;-)
Good morning from Bordesholm. Today faction and coalition committees in the Kiel State House. Preparation of the plenary session.
Disturbed - The Sound Of Silence [Official Music Video] My music tip for you out there in digital orbit ;-) https://youtu.be/u9Dg-g7t2l4
Congratulations! https://twitter.com/fesonline/status/808351434672668673…
Have a good time in the US 🇺🇸 https://twitter.com/doppelgeist60/status/808330670942646277 …
Chronicle photos https://m.facebook.com/SPD/photos/a.73469452748.75861.47930567748/10154182014742749/?type=3…
FES online 4:30 p.m. #Livestream: @ Ralf_Stegner + Richard Stöß: What to do about #Right populism? https://twitter.com/sagwasnet/status/807579468772601856… &quot;https://mobile.twitter.com/FESonline/status/808236925450588160…
Bundestag election 2017: Red-red-green &#39;soundings&#39; in the federal government http://m.rp-online.de/politik/deutschland/rot-rot-gruene-sondierungen-im-bund-aid-1.6458011…
American version of the &quot;lies press&quot; - from a very professional mouth 👎 https://twitter.com/realdonaldtrump/status/808114703922843649…
Wish you a good week ;-)
"This week is again very full of appointments - plenary week in the state parliament, etc. - then it gradually goes into the Christmas break."
"New CEO at HSV. In sport, things are gradually moving upwards - now calm and professionalism in management 👍👍👍"
Good morning from Berlin. Today again leadership committees of the SPD in the Willy-Brandt-Haus. Later various media events and union council.
Emerson Lake &amp; Palmer - I Believe in Father Christmas.wmv My music tip for you out there in digital orbit ;-) https://youtu.be/t8facHjO_mU
Plain text from the Waterkant: Stegner warms the soul of the base - News - SPD-Kreis-Steinfurt http://www.spd-kreis-steinfurt.de/mmeldung/43042/218183/Klartext-von-der-Waterkant-Stegner-waermt- Soul-of-the-base.html…
Are you missing something? Do you have access to professional help? https://twitter.com/sarfeld/status/807979438898028545…
The regular &quot;We have to talk&quot; can not be overestimated for any kind of relationship 😉 forecast what comes out even more complicated 😎 https://twitter.com/ulfposh/status/807978731306446848…
"At the trilogue of the SPD, the Greens and the Left Party in the Berlin Reichstag."
Congratulations from the north too! 👍 https://twitter.com/d_stich/status/807925108660695040…
"Readable and worth considering! Murder in Freiburg - agitation, malice, but also a lot of uncertainty - Politics - Süddeutsche.de http://www.sueddeutsche.de/politik/mord-in-freiburg-die-straftat-als-zutat-1.3287790-2…"
Camron Fludd - Camron Fludd hat The Other 98%s Foto geteilt. | Facebook  https://www.facebook.com/camfludd/posts/1320817474646716 …
Three super important points for HSV against Augsburg yesterday. Nice 3rd Advent!
Good morning from Bordesholm. Today to the meeting of the SPD with Greens and Left Party in Berlin.
Frank Sinatra - Santa Claus Is Comin &#39;To Town My music tip for you out there in digital orbit ;-) https://youtu.be/CquXc3kMurg
That is definitely true 😊 https://twitter.com/dorobaer/status/807624996105363456…
Home win - sooooooo important! #only the HSV
1: 0 Kostic !!!!! #nurderHSV
Comments https://m.facebook.com/story.php?story_fbid=1172435219517727&amp;id=305250279569563…
Chronicle photos https://m.facebook.com/SPD/photos/a.73469452748.75861.47930567748/10154170835672749/?type=3…
The grand dame of German liberalism died with Hildegard Hamm-Brücher. Impressive fighter for freedom and liberality.
"Nope not at all, mom was really happy 😂 https://twitter.com/s_ueberbach/status/806887911304077312…"
Right shift against Merkel. https://twitter.com/faznet/status/807115608567545856…
"If one names the authorship of right-wing populist statements, Mr. Scheuer is also very close behind Höcke, Bachmann, Petry &amp; Co https://twitter.com/holger_stark/status/807138366013771777…"
"Duplicity at Nord CDU boss Günther: First praise Merkel&#39;s re-election, then stab her in the back with a double pass."
Ralf Stegner at the SPD district party conference: candidate ... http://m.wn.de/Muensterland/Kreis-Steinfurt/Steinfurt/2626682-Ralf-Stegner-beim-SPD-Kreisparteitag-Kandidat-und-Koalition-blieben-offen ...
Chronicle photos https://m.facebook.com/ruthe.de/photos/a.290780444416.142730.289955244416/10154734036809417/?type=3&amp;source=48…
Chronicle photos https://m.facebook.com/SPD/photos/a.73469452748.75861.47930567748/10154165988372749/?type=3…
"&quot;Mr. Erdogan can thank you&quot; http://m.schwaebische.de/politik/inland_artikel,-%E2%80%9EHerr-Erdogan-kann-sich-dafuer-bedanken%E2%80%9C-_arid,10578145. html…"
Stupid comments from Munich. https://twitter.com/n24/status/807103391776313344…
With Natascha Kohnen I visit the new Microsoft headquarters and then I go back to Hamburg. Nice Friday ;-)
"The current opinion poll for the state election in Schleswig-Holstein on May 7, 2017 will have to be commented on later."
At Bayerischer Rundfunk we are sitting on the donation telephone for children at the &quot;Sternstern&quot; campaign.
"Today I continue to Munich. There I visit the general secretary of the Bayern SPD, my colleague Natascha Kohnen."
"Michael Müller, the newly elected governing mayor of Berlin, also has his birthday. All the best!"
Congratulations on Erhard Eppler&#39;s 90th birthday. One of the very big ones in social democracy.
Good morning from Weingarten. Yesterday a good event here on the subject of &quot;social justice and cohesion&quot;.
View from the office window. Suitable for the birthday party for the best secretary in the world ;-) pic.twitter.com/zZCyL2tru7
Rheine 🏃🏼
Ibbenbüren-Esch 😃
Threesome 😉 https://twitter.com/ulfposh/status/806526472479539200…
Funny - she remembered it differently 😎 https://twitter.com/enricotokar/status/806522515073941505…
It won&#39;t work! https://twitter.com/ulfposh/status/806520595890503680…
"Ooch, everything was just a misunderstanding. Dashing Mr. Wendt has to row back! THREE QUESTIONS ... http://www.pnp.de/nachrichten/heute_in_ihrer_tageszeitung/journal/2321896_DREI-FRAGEN....html…"
"That was meant figuratively, dear sir. https://twitter.com/weisswoerth/status/806514278689886208…"
CSU General Scheuer says that a German passport is not a junk item that you simply take with you. Doctoral degree also not 😂
I&#39;m sure of it. Does that also apply to colleague Winfried Kretschmann? https://twitter.com/sylvialoehrmann/status/806490152407302144…
"That&#39;s right: No longer mother 2015, but raven mother 2016 👎 https://twitter.com/matthiasdeiss/status/806484060642181120…"
Can the MacAllister still sing along? https://twitter.com/phoenix_de/status/806484374447357952…
"Federal party conference of the CDU in Essen: Triple A instead of C party. Deter, partition, deport."
Mom to the company: &quot;You have to help me&quot; Sergeant Spahn: &quot;Will be done! Company stood still - The eyes rrrrrrrrrrrrrrrechts!&quot;
"Advent, Advent: With Christian Democrats Jens Spahn &amp; Co, the &quot;economic refugee&quot; + dual state Jesus would certainly be deported consistently."
"So is the black Christian Union: First vote Merkel with almost 90%, then mark the last remnants of her humanitarian refugee policy"
CDU wants to overturn regulation on dual citizenship
"Unfortunately, this is not humor but bitter sarcasm given the shift to the right in the Union. https://twitter.com/gfluchter/status/806471388341141505…"
That&#39;s the way it is! https://twitter.com/heiner_garg/status/806470417435295744…
We say goodbye after long years as press spokeswoman for the Petra Bräigentam faction and welcome Heimo Zwischenberger.
Good morning from Bordesholm. Today faction and coalition committees in the Kiel State House. Change of guard in the press office of the parliamentary group.
Stephan Sulke - Morals My music tip for you out there in digital orbit ;-) https://youtu.be/8qyUh2UY7j0
Freiburg: Federal government warns after the arrest in the case of Maria L. of blanket judgments - badische-zeitung.de http://www.badische-zeitung.de/freiburg/reaktionen-von-politikern-und-medien-auf-die-verhaftung- in-case-maria-l - 130660246.html…
Ralf Stegner: McKinsey must not pursue an asylum policy for the government
What a crap. Where&#39;s your problem? It was about violent crime and politically motivated assassinations. Both are reprehensible + hideous! https://twitter.com/andreasheinzgen/status/805806696782327809…
Claims that I am against police work are absurd! Support proper union GDP. I reject baiting of DPOLG boss Wendt (CDU)!
At the Cologne OB it was an assassination attempt on a democratic politician - understood? https://twitter.com/f_kierkegaard/status/805738990833901568…
Disgusting acts of violence are persecuted by an independent judiciary. Mourning friends + relatives do not deserve sympathy for political exploitation
Happy birthday https://twitter.com/mikellner/status/805729147356123136…
"The SPD will oppose the tight legal course of the Union, which wants to redistribute less welfare state and from bottom to top."
&quot;Less for everyone&quot; - true motto of the CDU federal party conference. Not Merkel but Strobl&#39;s father-in-law Schäuble is swinging Union scepter.
"CDU wants deportation records, longer work for falling pensions, tax cuts for the rich too. Merkel Trojan horse for redistributors."
"If you choose Merkel, you also get Strobl, Klöckner &amp; Scheuer and tight right course. Deport sick refugees so that the people&#39;s soul cooks."
"Student (19) raped, murdered - refugee (17) detained | How politics reacts to the murder case Maria - http://www.bild.de/politik/inland/todesfall/studentin-vergewaltigt-ermordet-49066016.bild.html…"
Stegner goes to Wendt sharply after Freiburg statement http://www.t-online.de/nachrichten/panorama/kriminalitaet/id_79734544/stegner-geht-wendt-nach-freiburg-aussage-scharf-an.html…
