Birkenstock is committed to systematic inequality between men and women. That&#39;s s (k) andalous!
@KarstenSchrder @ KerstinSeyfert1 @CDU @AlbigTorsten Forget it - it won&#39;t work. Black and yellow from yesterday - Coastal coalition good for SH!
"@drumheadberlin @BILD looks a bit like a multi-purpose hall in the Sauerland, doesn&#39;t it ?!"
"Where the right was, he was right ;-) “@MBL_de: @Ralf_Stegner oh yes, good old Peter Struck. ;) @ Doppelgeist60 ”"
Kiel looks a little gray this morning - must be because I&#39;ve already read so much about the CDU in the morning press 😉
"@drmfuchs @MGrosseBroemer Mr. Fuchs, you have stood still in terms of minimum wages and equality in the last century."
The Union&#39;s economic wing must now be very brave: there will be no substantial change in the SPD with the SPD!
"Neoliberal Tichy polemicizes against minimum wages, even Tauber nags. Do you understand it guys: minimum wage law remains, equal pay is coming!"
"Tauber claims that the SPD&#39;s immigration law is about economics, the CDU is about people. Quark, we want humanity! Union relies on deportation."
"Unions General Tauber is a joker. Describes me as &quot;Darth Vader&quot; of politics, but plays Sancho Panza on immigration policy!"
Paying women worse than men is impossible! SPD wants equal pay! Union is finally in the 21st century! #Weltfrauentag
Handy Uploads - Landesarbeitsgemeinschaft - LAG Migration and Diversity in the NRW SPD | Facebook https://www.facebook.com/vielfaltinderspd/photos/a.487926047971441.1073741834.444936262270420/724681937629183/?type=1&amp;theater…
@MGrosseBroemer Just no envy 😉
"How media politics is done: If you contradict conservative interpretation, not a critical comment, but a negative setting."
Media today: Authorized current interview. Content did not like the cover picture with pink glasses + negative headline. Old photo on the sheet.
"Joe Jackson - Real Men - Sydney, 1991 (9 of 17) My music tip for you today, thanks for the recommendation to Yasmin Fahimi http://youtu.be/aj9yd-LdLCM"
@ThomasOppermann @SPDSH Thank you very much!
@HaKlamm thank you very much!
@harms_lars @SPDSH Thank you very much!
@Torgator thank you!
@PrimoSantoro @SPDSH Thank you!
@peter_simone Thank you very much!
@FlorianPronold many thanks!
"@IngbertLiebing well, let&#39;s see if you can do it for 8 years and how you will do after the long years of opposition ;-)"
@j_uekermann thank you very much!
@RasmusAndresen Thank you very much!
@SSWpresse Thank you very much!
@tsghessen Thank you very much!
@ArminLaschet Many thanks and ditto 😉
"@ Doppelgeist60 As far as arms exports are concerned, I would say very kindly: They can give us a try ......"
@manomama a good morning to Augsburg ;-)
Without words! &quot;@DLF: Peter Ramsauer @cducsubt on arms exports to # Saudi Arabia in #DLF http://www.deutschlandfunk.de/ruestungsexporte-nach-saudi-arabien-sonst- Liefern-zehn.694.de.html?dram: article_id = 313666… pic.twitter.com/TZhG7LiDqL ”
"You have to practice a little more, colleague Liebing! If there was an attack, then pipe shredders shouldn&#39;t come out like on Fehmarn."
"CDU colleague Liebing mocked my campaign on Fehmarn as an aid to the CDU. SPD candidate 40%, CDU candidate eliminated! 😉"
@ Doppelgeist60 Journalistic impressions from the summer season? Doesn&#39;t sound like galley ;-)
@tsghessen what knew or covered your MP ?!
Read in the morning press about union neuroses a lá equality surveillance police and social democracy in a loden coat. What&#39;s going on mom
wishes everyone a good start to the week ;-)
"Tonight 4th regional conference &quot;Promised-Keeping&quot; of the SPD parliamentary group, this time with Minister of Social Affairs Kristin Alheit in Schleswig."
Good morning from Bordesholm. Then briefly to the Kiel office for a visit to the constituency with the parliamentary colleague Lars Winter in Ostholstein.
Rainhard Fendrich: From time to time this is my music tip for you today ;-) http://youtu.be/nTQ8kcgnU0M
Congratulations to Katrin Budde ... - Social Democratic Party of Germany (SPD) https://www.facebook.com/SPD/posts/10152753643722749?notif_t=notify_me…
"After a discussion in Düsseldorf, we head back north. Happy weekend everyone ;-)"
Politics in SH: Ralf Stegner in an interview: &quot;SPD must be the better alternative&quot; shz.de http://www.shz.de/schleswig-holstein/politik/ralf-stegner-im-interview-spd-muss-die-bessere-alternative-sein-id9151381.html…
"@rogerreloaded Because after a while you may be able to talk about documentation requirements, but not about legal substance!"
@rogerreloaded is not one either. NO change in the matter!
"@danielmack nothing there: SPD ensures minimum wages, rental price brakes, equal pay, fairer pension, governs well RP, SH, NRW, NDS, HH, HB, and much more"
"Shaking your head: Individual application recommended by the application committee for rejection for SPD state party conference on the front page, including negative comment."
"After press talks and other media appointments, the evening train takes you to Essen, where various NRW appointments are due tomorrow."
Various appointments together with our SPD Mayor candidate for Neumünster Elke Christina Roeder.
Good morning from Bordesholm. Only today in the Kiel office. Then I visited my constituency with my colleague Kirsten Eickhoff in Neumünster.
Send In The Clowns - Shirley Bassey (1987 Live in Berlin This is my music tip for you today ;-) http://youtu.be/KotOfeYbovk
@FreierWaehler @ Globetrotter0xF @spdbt Disgusting!
"@LarsWinter Run, Lars, Run!"
Isn&#39;t that cool ?! http://www.kn-online.de/Schleswig-Holstein/Aus-dem-Land/Serpil-Midyatli-Kandidatin-fuer-Schleswig-Holsteins-Heimatbund…
@ms_pieper The north is feverish with 😉
@danielakolbe @matthiaszimmer Let&#39;s call it Nonsense 😉
@_drsarkozy like today in Dresden ;-)
wishes you a good Thursday ;-)
Today back to SH. Various media dates and &quot;stumbling block&quot; - relocation in Schacht-Audorf in my constituency.
Good morning from Dresden. Yesterday there were talks on housing policy and an event on peace policy.
"Elliott Smith, Everything Means Nothing to Me, Live Performance on the Jon Brion Show
Das ist mein Musiktipp heute;-)  http://youtu.be/KmHU9Qlnhqk "
Good social democratic line! Clear edge against extrajudicial arbitration boards in commercial contracts SPD EUROPA http://www.spd-europa.de/pressemitteilungen/klare-kante- gegen-aussergerichtliche-schiedsstellen-handelsvertraegen-2023…
@psychmac and my music tips are of course really a matter of taste 😉
"@psychmac Well - I also tweeted my more detailed Facebook post - 140 characters are short, but what was wrong with the message?"
@dunjahayali @morgenmagazin Have a nice holiday and the best weather 😉
"@MGrosseBroemer @JanStoess no, colleague, but we stick to what Angela Merkel has represented so far, revenues are needed!"
@ Doppelgeist60 razor sharp analysis 😉
@tsghessen @SZ There are still no solutions that can be agreed upon that would be acceptable for countries.
wishes everyone a good Wednesday ;-)
"Good morning from Bordesholm. Today we go to Dresden to visit and meet up, in the evening at the Jusos on the subject of peace policy."
Buddy Buxbaum - Ballast (Official Video) Music tip today as a recommendation from a much younger (!) Colleague 😉 http://youtu.be/SzUtBPE3a9c
3rd regional conference of the SPD LANDTAGSFRATION &quot;Promised-Keeping&quot; in Bad Schwartau with Minister of Education Britta Ernst + good discussion.
"@ Bonds2trade @dgb_news @heuteshow said the actor, who also became US President thanks to &quot;Big Money&quot;."
This time we are with the regional conference of the SPD LANDTAGSFRAKTION in Bad Schwartau and have Minister of Education Britta Ernst as a guest.
Good morning from Bordesholm. Today faction and coalition committees in the Kiel State House. In the evening 3rd regional conference &quot;Keep promised&quot;.
Gipsy Kings Bamboleo This is my music tip for you today ;-) http://youtu.be/OpTZ6DEraBY
On to the 2nd regional conference of the SPD parliamentary group &quot;Promised-Keep&quot; in Bad Oldesloe.
On to the 2nd regional conference of the SPD parliamentary group &quot;Versürechen-Gehalten&quot;
"A personal commentary on the day&#39;s events, role models, mistakes and remorse. https://www.facebook.com/ralf.stegner/posts/845619605504244…"
"@SturmDaniel well (former) senators and deputies are already among the leaders who serve as role models, right?"
Calls to quit are what is now possible. Arbitration proceedings are carried out independently and according to formal criteria and rules.
"Social-democratic leaders must act as role models, which is why continuing party membership by Sarrazin or Edathy is harmful."
"No word for the victims, no insight or remorse + maximum political damage for our basic values-SPD wants to have nothing to do with it!"
"No insight or remorse, no wrongful awareness and maximum damage"
"Who justifies violence against children, which is not at all compatible with our basic values, has not understood anything and should leave SPD!"
Still very fit at 90 and a great club: that&#39;s the Friedrich Ebert Foundation!
"Congratulations from the Friedrich-Ebert-Stiftung + Chairman Kurt Beck on their 90th birthday! If they didn&#39;t exist, they would have to be invented!"
@dgb_news @heuteshow Strikes the current debate about the alleged bureaucracy in the minimum wage law better than some other post!
wishes everyone a good start to the week ;-)
Later back to SH. 2nd regional conference &quot;Promised-Keeping&quot; of the SPD parliamentary group in Bad Oldesloe. This time with Interior Minister Studt.
"Good morning from Berlin. Committee meetings at the Willy-Brandt Haus, as well as press talks and other appointments."
News from Minsk sounds positive - hopefully relaxation in the Ukraine is in sight!
Frank Mills - Music box dancer This is my music tip for you today ;-) http://youtu.be/2N_tmH6y7ng
@ Doppelgeist60 She simply has the better arguments on her side. It&#39;s as simple as that. #Jauch
Black and yellow propaganda sayings have just been shown again: &quot;The minimum wage is GDR without a wall and costs 100 thousand jobs&quot; #Yes
@ Doppelgeist60 Tichy&#39;s macho comment disqualifies itself ;-)
So sans “@ Doppelgeist60: Bit strange that Ilse Aigner takes on the role of the opposition. The #CSU is still in the government. #Jauch &quot;
"@andreaspetzold well, do you seriously mean that government overrides working tariff autonomy ?!"
Anyone who campaigns for fair minimum wages for workers is attacked. This also shows the round at &quot;Jauch&quot;. Abuse is denied.
@_drsarkozy Cool. 18-20 just don&#39;t fit! Congratulations 😉
@GerdKotoll @Guggulu @RolandTichy Why is it not surprising that you can&#39;t do anything with this term ?!
"@Guggulu @GerdKotoll @RolandTichy No idea of democracy, there are some in your circles."
@MatthiasBannas something like this might be talkable if the effects of the law are reviewed after a reasonable amount of time.
"We have nothing against foreigners, but .... We are not against the minimum wage, but .... nobody understands us, but ..... Well, what noticed?"
"We are not against the minimum wage - i where - NO, we just do not want its compliance to be checked. Oh sooo. Ask?!"
"On this rainy Sunday, a lot of anti-minimum wage trolls were apparently online. In the long run it would be a bit too boring for me."
"Anti-minimum wage law troop is really excited if you reject the nonsense here. Quite lousy, this freedom of argument."
"Find with satisfaction that the whole deal against the minimum wage law will be without consequences, so feel free to work on me😉"
@ victor5679 @RolandTichy The anti-minimum wage roar + crying about working time documentation 2013 should be intellectual discourse? Armes D.
@dasstimmvieh @RolandTichy @spdde so if you take such nonsense you are &quot;the sovereign&quot; - imagination is also an education.
@JurgenPresser @RolandTichy Dream on ;-)
What should you fear from this nonsense ?! “@RolandTichy:. @ Ralf_Stegner ... and here are the texts that the SPD fears http://www.rolandtichy.de/meinungen/politikerinnen-ohne-betriebspraktikum/…”
"@RolandTichy Not at all, dear @ RolandTichy, I&#39;ll take it on with you: Isn&#39;t it an intellectual overstrain now😉"
"@KaiDiekmann In terms of content, it may be differentiated instead of flat - even the not only flat (German) e Carstensen misunderstood! (2)"
"@KaiDiekmann Incidentally, as you know, I am quite (1) a boulevard-friendly politician and I am by no means squeamish."
"Incidentally, the Tichy polemicized against Nahles and Fahimi and loaded with clichés, but he doesn&#39;t get the minimum wage!"
"The Union type, which polemicized against Greek politicians in the Bundestag as a &quot;used car dealer&quot;, itself looked like a cone player!"
The type of Union that there in the Bundestag against Greek &quot;used car dealers&quot;
@KaiDiekmann I am very committed to arguing about the EU&#39;s Greece course; but then with an honest analysis of causes and effects
"Europe is not just an economic and monetary union, but a community of values that stands for social democracy, peace and freedom!"
@KaiDiekmann @spdde @FAZ_Wirtschaft this is really exactly the opposite of what I said or think is right!
"@KaiDiekmann You know, I am not part of the politicians&#39; club of pasters, but I also say my opinion when not everyone likes it"
@KaiDiekmann Barschel &amp; Co.?! I expressly share that! I am always for the truth! Just not everything that is said to be true!
"@KaiDiekmann @spdde that referred to your Prodi quote. Under certain conditions this may be the truth, one can doubt it!"
"@KaiDiekmann @RenateKuenast You see, for Europe + the Euro I am too, but for a market that is in conformity with democracy, not democratic market!"
"@KaiDiekmann @RenateKuenast You can read, but you have to, &quot;Who is more dangerous, the Russian or the Greek?&quot; (sic!) not good, right ?!"
"Bundeswehr needs good equipment, but it is wrong if Schäuble wants to give up black zero for armament instead of education + infrastructure!"
"In democracy, people vote out this kind of reforms - if you force them from outside, not democracy wins, but right-wingers!"
"What bankers and neo-liberals call &quot;good&quot; reforms means wage and pension cuts, privatization and mass layoffs - nothing good!"
"@KaiDiekmann @RenateKuenast @BILD @FAZ_NET is not about writing off claims, but about meaningful + bearable reform for people!"
"@KaiDiekmann @RenateKuenast @BILD @FAZ_NET doesn&#39;t change the fact that a campaign against the Greek people may arrive, but is wrong!"
@KaiDiekmann @RenateKuenast @BILD @FAZ_NET
@KaiDiekmann @RenateKuenast @BILD The truth is such a thing - everything always depends on requirements. Growth instead of austerity!
@KaiDiekmann @RenateKuenast @BILD How about growth policy for Europe instead of &quot;reforms&quot; that only affect the &quot;little ones&quot; ?!
@FDPWoerrstadt @Metaliberal strange that my criticism of abuse is answered as if they are not a few black sheep!
"What kind of self-pitying reactions you get when you get a little virtual with conservatives, neoliberals &amp; consorts😉"
@RolandTichy Read the characterization of Andrea Nahles + Yasmin Fahimi in your article - you don&#39;t have to be so self-envious!
"When it comes to normal (lower class) crime, people call for toughness! With white collars, tax crime, etc. it is very different!"
"Incidentally, undeclared work has always been punishable - just like that!"
"People who have violated long-standing working hours law now fly up when the minimum wage is checked, that&#39;s a problem!"
"In addition, constituency dates and local association round. Have a nice Thursday ;-)"
"Who has turned regular employment into precarious employment, misused what was intended as a bridge to the labor market ?!"
"@HugoMuellerVogg Less. Unfortunately, reliefs, for example in the case of temporary agency work, were systematically abused by employers - backlash!"
@HugoMuellerVogg I&#39;m sure that can be solved!
Tastes? Do you know Steinhaus&#39; source of money? Either you are lying or you are completely incompetent! # Crime scene # Keel
I do two jobs and you? You&#39;re just messing around! # Crime scene # Keel
In the evening union council in Kiel.
Cool! Federal Foreign Office - Chronicle Photos | Facebook https://www.facebook.com/AuswaertigesAmt/photos/a.310573139039863.63845.237282353035609/752487471515092/?type=1&amp;theater…
Document working hours - how can you tackle this huge challenge in 2015 ?! Papua New Guinea? No Germany!
The whole disaster started when the socialists introduced the same right to vote. Employers have been harassed since 1919.
Employers know what is good for their workers. Why does the state interfere at all ?!
The fact that these workers also want money for their work should be happy to have a job. Controls? Socialism!
What there is ...... 😉 “@martinhabersaat: V for Varoufakis https://www.youtube.com/watch?v=Afl9WFGJE0M…”
@HugoMuellerVogg is really not the problem here and you probably know that - there are completely different cases!
"@RolandTichy You are right after all, should have been a B instead of W - otherwise you have rather no good arguments!"
@ Doppelgeist60 where you can’t read anything today 😉
Fighting articles in the Frankfurter Allgemeine Sonntagszeitung against Hannelore Kraft and NRW SPD. Social Democratic line displeases conservatives!
It is simply terrible socialism if there is suddenly a lower wage limit that is also controlled by the state!
Mr. Tichy is in the WAMS against Andrea Nahles and Yasmin Fahimi- but above all against terrible bureaucracy? Where? Bingo: minimum wage!
Interesting contribution by Stefan Aust in the WAMS about Volker Bouffier and the NSU murder series.
Readable and worth considering! Ending the Creditor&#39;s Paradise | Jacobin https://www.jacobinmag.com/2015/02/germany-austerity-blyth-speech-spd/…
"Good morning from Bordesholm. Today, various appointments in the Kiel State House are on my daily schedule. Nice Friday ;-)"
Good morning from Bordesholm. Brunch with friends. Wonderful spring morning. Have a beautiful Sunday;-)
Alison Moyet - For you only This is my music tip for you today ;-) http://youtu.be/6B9OYXPo7WA
 https://www.facebook.com/andre.stinka/posts/10152756296508660 …
Good morning from Mülheim an der Ruhr. A radio interview at WDR 5. Appointments and greeting at the AG Migration of the NRW SPD.
Elton John - &quot;Dreamboat&quot; is my music tip for you today ;-) http://open.spotify.com/track/0rJ2vHDEu03hpyVYEOzRmG…
"CDU opposition in SH completely from the role: Opposition leader with solos sometimes for, sometimes against and crime statistics in Fantasialand."
More Greens in country responsibility than Union governments and then Seehofer blocks energy transition and Union makes big cheeks.
"Union you might have to say that contracts apply to adults, that without a SPD it has no majority + is shrinking in size in countries."
"Want to eliminate solos and cold progression at the same time, against minimum wages, equality + rent brake - is union still possible?"
Absurd theater about planned wage dumping in Dithmarschen. Whenever regulations are in force - tariff loyalty law with minimum wage applies!
"You&#39;re right! &quot;@RenateKuenast:. @ KaiDiekmann @BILD I think that&#39;s an irresponsible campaign. Bad for #EU, bad for #D.&quot;"
"Good morning from Bordesholm. Gray day, wet and cold and yesterday no points for HSV. Hmmmm ..... Still a nice Sunday everyone ;-)"
Rea Garvey - Oh My Love (featuring Amy MacDonald) This is my music tip for you today ;-) http://youtu.be/llFq13jR0_Q
1: 1 Stieber. What was important just before the break. #only the HSV
Such a crap. 1: 0 for Frankfurt by dubious penalty!
Now it&#39;s boys! #only the HSV
"@JTrittin @KaiDiekmann @atsipras @SWagenknecht in politics and the media, it&#39;s like in real life ;-)"
@ArminLaschet @MGrosseBroemer because of! Your billy goats held up properly yesterday - what is Alemannia doing?
@aristokitten feels good ;-)
@favstarmafia @ entropie42 We have now not quite reached the absolute majority 😉
"@MGrosseBroemer nothing there, Ludwig Erhard is taken more by the SPD on this point than by the Union! Speaking of point: 3 for HSV ?!"
@Steinhoefel Humor is when you laugh (me) anyway or don&#39;t remember why (you) 😉
"@MGrosseBroemer &quot;Peace is not everything, but without peace everything is nothing&quot; (Willy Brandt)"
@tsghessen Have fun! Welcome to the north!
"The Union is shooting against Schäuble&#39;s inheritance tax proposal, which is reasonable according to the constitutional court ruling. Reason?!"
@HeringAndreas @ fravi50 @ SabrinaJacob2 Warm greetings from the north to the capital ;-)
"Also very worth reading: SHZ interview with Wolfgang Arenhövel, the former chairman of the German Judges Association, because of scandal nonsense!"
Remarkable SHZ comment by Stephan Richter &quot;The storm in a water glass&quot; on the immoderation of the judicial debate in SH (comparison of dictatorships etc.)
wishes everyone the weekend they deserve 😉
Good morning from Bordesholm. Market before breakfast. Immediately off to the national conference of the Jusos in Flensburg. HSV in Frankfurt today!
"Still a class title, I think 😉"
Pink Floyd - Brain Damage / Eclipse (lyrics) Music tip that comes to mind when SH Justice is compared to dictatorships http://youtu.be/Sy8iUI_ayuo
Opposition is embarrassed by the claim that the independence of the judiciary is endangered in SH. Attempted scandalization failed!
"@SteEilts am pretty real, so unfortunately a bad actor ;-)"
Cordially laughed at the anti-SPD propaganda brochure of the Junge Union SH. We have a real educational problem in parts of society!
@RasmusAndresen @SteEilts @ awk244 @HouseofCards Günther &amp; Co. would probably fail during the casting for B-movies - outrage too fake!
@Steinhoefel not thin-skinned - simple level requirements also with humor- that goes - the mind is on the left 😉
"@zeitonline much of the article is worth considering, but the summary in the title is problematic."
@Steinhoefel Whoever blows out such stupid macho sayings in 2015 really deserves pity - so you&#39;re welcome!
"Is it even stupid? “@Steinhoefel: Swesig, below-average intelligent Barbie doll of the failure coalition http://fb.me/4kDKrWW3p”"
Tax capital gains progressively! Labor income must rise faster than capital gains! Workers generate wealth!
"Those with the highest incomes and assets get away too well in Germany! Capital gains increase more than wages, poverty increases - that&#39;s a fact!"
@exactlyobserved Just keep breathing - maybe it will get better soon ;-)
Thorsten Schäfer-Gümbel&#39;s clear interview on the black and green boycott of the investigation into NSU murders in the &quot;Frankfurter Rundschau&quot;.
"Landtag again today, then cold-anticipated anticipation for a quiet weekend. Nice Friday ;-)"
Steve Winwood - Valerie This is my music tip for you today ;-) http://youtu.be/cbKNICg-REA
@ulfposh @petertauber @welt @JTrittin @c_lindner @katjakipping @DoroBaer that would be something for Hollywood - the dear Bavarian German image!
"@ulfposh @petertauber @welt @JTrittin @c_lindner @katjakipping @DoroBaer for a German B-film version, Dr.Scheuer would be a must! 😉"
"@SteEilts @harms_lars That also applies, but Dobrindt and DB have to do their homework! If synchronization is missing, Ostholstein suffers!"
@ Doppelgeist60 But now you are a little hard with our sisters and brothers from the Union 😉
wishes everyone the Thursday they deserve 😉
"Good morning from Bordesholm, yesterday at Fehmarn, today mostly office appointments in the Kiel Landeshaus, evening preparation for the state party conference."
Rita Coolridge &amp; Tom Jones - Something &#39;bout You Baby (19/21) This is my music tip for you today ;-) http://youtu.be/t0EUDxPy0f8
Business talk with Mayor candidate Jörg Weber on Fehmarn. Now annual general meeting of the SPD Fehmarn in Bannesdorf.
Agreed rent brake comes. Documentation obligations for minimum wages are checked - hollowing out of the minimum wage can forget Union!
Good morning from Bordesholm. Today&#39;s appointments in the Kiel State House and later on Fehmarn. Happy Wednesday everyone ;-)
Chet Baker - I Get Along Without You Very Well (LIVE) This is my music tip for you today ;-) http://youtu.be/-BIZLTzWmXc
One-armed bandits need a strong parliamentary arm: Loud + Strong: Wolfgang Kubicki and Hans-Jörn Arp http://www.ltsh.de/presseticker/2015-02/24/12-26-49-6e1f/…
@tsghessen Then at least people realize that this is nonsense with social democratization of the Union and that the minimum wage comes from the SPD.
@Klaus_Mueller @JuliaKloeckner @petertauber The attempt of yesterday&#39;s politics to give a modern coat of paint is blossoming😉
Good morning from Bordesholm. Today faction and coalition committees in the Kiel State House. Evening discussion in Hamburg. Have a nice Tuesday ;-)
Bruce Hornsby &amp; the Range - The Way It Is This is my music tip for you today ;-) http://youtu.be/cOeKidp-iWo
Good mood at the 1st regional conference of the SPD parliamentary group &quot;Promised-Keeping&quot; with Torsten Albig in Neumünster today.
Ms. Siems (WELT) calls minimum wages &quot;social policies that drive spending&quot;. When taxpayers increase dumping wages it means market economy!
That’s part of it! “@ Doppelgeist60: Now Gabriel is getting something from #TTIP and is promoting the continuation of the détente policy with #Russia.”
"The goal is prosperity for everyone, not wealth for the few. Political primacy must also have priority at TTIP and CETA! (Sigmar Gabriel)"
