Good morning from Berlin. Today we start with an interview in #zdfmoma about Angela Merkel&#39;s announcement of candidacy. Later at NDR Info.
THE ROLLING STONES-You Better Move On 1964. My music tip for you out there in digital orbit ;-) https://youtu.be/xe9WZyM7-rs
"&quot;So Merkel starts again. Well, right?&quot; - How the opposition reacts http://www.huffingtonpost.de/2016/11/20/merkel-entscheidung-kandidatur-_n_13107266.html…"
FAZ describes tristesse of the North CDU and yet wishes so conservative success against my supposed &quot;coastal socialism&quot;. Putzig😉
"Mischief: You have made social cuts, job vacancy, wanted to close University of Lübeck, were voted out. We have corrected everything bit by bit! https://twitter.com/c_vogt/status/800053571865772036…"
Good morning from Bordesholm. Market before breakfast. After Husum to Mathias Ilgen&#39;s nomination conference for the Bundestag.
Does that make the statement wrong? It was your black and yellow plans to cut back on teachers and police that we have now stopped. https://twitter.com/c_vogt/status/800051990697017344…
Post-fact: de Maizière praises more federal police (was SPD initiative!) + Calls for more SH police (CDU cuts stopped by us!)
Congratulations from the north https://twitter.com/katarinabarley/status/800036814652260352…
"Two of the four top CDU candidates in 5 years. 6 state leaders, 4 parliamentary group leaders. SPD: 1 top candidate 1 LV / FV. https://twitter.com/abendblatt/status/799966764025032705…"
"Now, at the CDU SH state party conference, you complain about the &quot;left-green&quot; (lies?) Press. 😒😒😒 Coastal coalition - good for country and people 👍"
"At the state party convention, Mr. de Maizière polemicized against Albig, Stegner, Habeck &amp; Kubicki and thanked &quot;Ingolf&quot; Liebing. CDU SH? Any questions? 🤔🤔🤔"
We did it in Schleswig-Holstein! https://twitter.com/j_uekermann/status/799940636078198785…
Nord Union nods lead application in Neumünster in front of almost empty ranks without discussion. Personal quarrels instead of content - that&#39;s the difference!
Congratulations to the directly elected direct candidate in constituency 2 Matthias Ilgen!
"As is well known, politically led coalitions are not particularly good for you 😎 https://twitter.com/c_vogt/status/799937079971086336…"
"First we were treated to public black-green hype for years, now there is black-green-yellow Jamaica wave. It is not progressive!"
Happy birthday 🎈 to our Secretary General @katarinabarley
Disgusting hate role model neo-Nazis: AfD Nuremberg plans map to refugee accommodation - politics - Tagesspiegel http://m.tagesspiegel.de/politik/nach-vorbild-von-neonazis-afd-nuernberg-plant-karte-zu-fluechtlingsunterkuenften/14855794.html ? utm_referrer =…
"Nord Union elects a new chairman today. After Carstensen, von Boetticher, de Jager, Böge, Liebing Günther becomes my counterpart No. 6😎"
Difficult away hurdle for my HSV tomorrow in Hoffenheim.
Then to the Working Group of Social Democratic Women (ASF) in Neumünster. Have a nice Weekend ;-)
That must be one of the typical false reports of this &quot;lie press&quot;. https://twitter.com/zeitonline/status/798933822683447296…
Chronicle photos https://m.facebook.com/larscastellucci/photos/a.295382493944520.1073741828.295376017278501/746219402194158/?type=3…
This customer friendliness is really cool. Because of service desert Germany 😉 https://twitter.com/steeilts/status/798785573292883969…
Really now? Madness. One sensation chases the next. #RoettgenPacktAus https://twitter.com/shz_de/status/798784967861882882…
After deselection CDU: black numbers-red-green-blue politics. Coastal coalition is paying off debts; first balanced SH budget for decades!
+++ EILT ++ EILT ++ EILT CDU-MdB zapped to CNN: The GroKo Koa contract should state that the SPD occupied the Foreign Office. #RoettgenPacktAus
"This gives voters in SH a clear choice: We from the SPD and the coastal coalition want to relieve families, the CDU wants the opposite!"
In the state parliament CDU retro-application: Union wants to make it clear by name vote that it wants to take away parents in SH Kita money! OK then!
Nice Wednesday ;-)
Barack Obama visits Germany. One will still mourn this presidency between Bush and Trump.
Good morning from Bordesholm. Today the first plenary day of the state parliament session in the Kiel State House. Topic includes municipal finances.
The BossHoss feat. Common Linnets &amp; Uwe Ochsenknecht - Jolene My music tip for you out there in digital orbit https://youtu.be/OdsHb7mnD-Q
Personnel decisions in the Union. Running. https://twitter.com/christiansoeder/status/798593906384531456…
"Gruselig
Wilfred Chan  Twitter: ""I'm an American journalist. I majored in US politics. I was a White House intern, https://mobile.twitter.com/wilfredchan/status/796657824625553408 …"
Media full of the preliminary decision for Bellevue: Frank Steinmeier is the right president for our country! Have a nice Tuesday ;-)
Good morning from Bordesholm. Today again faction and coalition committees in the Kiel State House. In the evening membership ceremony in Büdelsdorf.
Peter Skellern - You&#39;re a Lady 1973 My music tip for you out there in digital orbit ;-) https://youtu.be/ihYHTIwISV0
Chronicle photos https://m.facebook.com/FrankWalterSteinmeier/photos/a.174156245485.240378.81073125485/10157757964010486/?type=3…
😉
Good morning from Berlin. Music tip for you out there in digital orbit Leon Russell - &quot;If I become a carpenter&quot; https://open.spotify.com/track/2lms2oOTluulnGEwfJik4O…
Union on the right front - ugh devil! https://twitter.com/mattfischler/status/797881684058222592…
Understandable - neither do I ;-) https://twitter.com/kn_online/status/797899405680590848…
"@kn_online Good anniversary location. Northern German, exciting, good story! To the next 1000👍"
"1.5. Exciting, entertaining, good plot. North German. Keep it up. To the next 1000 👍"
Photos and videos by Josh (@jbillinson) | Twitter https://mobile.twitter.com/jbillinson/media…
The realism of Wolfgang Kubicki&#39;s political forecasts is only surpassed by his notorious modesty 😉
"In terms of hairstyle, little Trump is clearly ahead - otherwise the giant statesman must first create the &quot;Make the FDP great again&quot; project Projekt https://twitter.com/rasmusandresen/status/797746809158385664…"
That's at least real stuff - Knock on Wood (red is the real color) https://twitter.com/peterbreuer/status/797784462025232384 …
"I don’t say anything like that, but hit dogs ..... 🐕 https://twitter.com/hugomuellervogg/status/797730676485267456…"
Klaus Doldinger &amp; Passport - crime scene music tip especially today for the 1000th crime scene from Hanover / Kiel. Have all 999 on DVD 👍 https://youtu.be/qsPdtdyZe1o
 pic.twitter.com/xl78RZrexo
Photo https://m.facebook.com/sigmar.gabriel/photos/a.272613802771349.69678.104493292916735/1359776884055030/?type=3 ...
Ideology lean quark from the right 👎 https://twitter.com/tichyseinblick/status/797085297381085185…
Good analysis of the Obama administration between Bush and Trump. https://twitter.com/newyorker/status/797695553270378496…
"Interessanter Blickwinkel auf US Wahlen
What So Many People Don’t Get About the U.S. Working Class  https://hbr.org/2016/11/what-so-many-people-dont-get-about-the-u-s-working-class …"
"Chappatte Cartoons auf Twitter: ""#trump2016 Trump becomes 45th president of the United States - © The New York Times https://mobile.twitter.com/PatChappatte/status/796260187439042561 …"
This should be excluded by changing the GG! https://twitter.com/roterclaus/status/797391703456018433…
Federal highway company was the Union price for agreement on financial equalization. We will not allow privatization!
We fight for the preservation of jobs in local motorway maintenance offices! State financial equalization contained NO privatization agreement!
Claim highways would be privatized is duck. Long-distance road company wanted Union. Privatization is excluded by the Basic Law!
Yep https://twitter.com/drwetti/status/797356064673071105 …
"Blue Feed, Red Feed -  http://WSJ.com   http://graphics.wsj.com/blue-feed-red-feed/ …"
I&#39;ve been winning for a very long time ... - Giorgina Kazungu-Hate | Facebook https://www.facebook.com/kazunguhass/posts/659805467531889…
Official White House Photographer Pete Souza Reveals His Favourite Photos Of Obama on 9GAG  http://m.9gag.com/gag/ajqEV90 
Have a nice Weekend ;-)
Much disorientation in the globalized world. This opens up opportunities to fight with passion for your own convictions!
"Even though elected US President Donald Trump has been shaking a lot of licorice in the past few days, there is little hope that the campaign trump is gone."
"Later to the AG Migration and Diversity of the Federal SPD, which meets in the Kiel State House. In the evening to the SPD leadership academy in Berlin."
Good morning from Bordesholm. Cold November morning. Market before breakfast. Immediately off to the GEW educators&#39; day in Neumünster.
Procol Harum - A Salty Dog My music tip for you out there in digital orbit ;-) https://youtu.be/mOj3kJKy-_U
Thomas Gorton auf Twitter: Trump on Twitter after Obama being elected vs.Trump on Twitter after Trump being elected https://mobile.twitter.com/AngstromHoot/status/796923418419470337 …
"Later events in Lauenburg, Schwarzenbek and Büchen. Nice Friday."
"In Kiel, presentation of the most important changes in the 2017 coastal coalition budget with my colleagues Eka von Kalben and Lars Harms."
Good morning from Berlin. A press conference yesterday and now back to Schleswig-Holstein.
Leonard Cohen - Bird On The Wire (Best Live Version Ever) My music tip for you out there in digital orbit (RIP) https://youtu.be/boMZEe9v_SA
Paul Ronzheimer on Twitter: &quot;The USA of the&quot; millennials &quot;would look like this. Pic.twitter.com/xD7HCUUasK&quot; https://mobile.twitter.com/ronzheimer/status/796442773939425280…
Right-wing populist Trump&#39;s supposed election victory should now really be the last wake-up call for the political left to fight for justice.
Paul Krugman: Our Unknown Country -  http://NYTimes.com   http://www.nytimes.com/interactive/projects/cp/opinion/election-night-2016/the-unknown-country?smid=fb-nytimes&smtyp=cur …
238: 209 for Trump in Electoral College - 270 votes are needed. Dark prospects # USWahl2016 #SPDWithHer
"If this right-wing populist and sexist hate preacher becomes US President, we can look forward to a political cold shock."
In the evening my series &quot;Stegner meets .... Martin Schulz&quot; in Kiel. Nice Wednesday ;-)
Today council of elders to prepare the parliamentary plenary and visit to Neumünster.
Good morning from Bordesholm. Long night with possibly a bad outcome to the US presidential election. Trump is now a favorite. #SPDWithHer
Play me the song of death - Man with the Harmonica My music tip for you out there in digital orbit ;-) https://youtu.be/pgd0zCmpMCQ
216: 209 for Trump at Electoral College - 270 are needed - exciting but negative trend at # USWahl2016 #SPDWithHer
"216: 197 for Trump at Electoral College (270 needed) - almost everything is possible, but it doesn&#39;t look good. # USWahl16 #SPDWithHer"
"Even if Hillary Clinton should still win, Bernie Sanders will push for urgently needed course changes. # USWahlen2016 #SPDWithHer"
It looks more than bad at the # USWahlen2016 #SPDWithHer
Incomprehensible. https://twitter.com/dw_deutsch/status/796199701867532290…
167: 131 currently at Electoral College (270 needed) Still not good prospects with # USWahl2016 #SPDWithHer
Will Michigan and Wisconsin decide the elections? # USWahl2016 #SPDWithHer
167: 109 for Trump at Electoral College (270 needed) - that looks really bad at # USWahl16 #SPDWithHer
Some of the areas where Bernie Sanders was particularly strong look bad for Hillary Clinton. # USWahl16 #SPDWithHer
139: 104 for Trump at Electoral College (270 needed) at the moment. # USWahl2016 #SPDWithHer
Virginia back in Hillary camp - little relief at # USWahl2016 #SPDWithHer
"Much more exciting than expected - trump unfortunately too strong - can be a long night, bad BREXIT surprise also at # USwahl16? #SPDWithHer"
"Later in Schierensee, honorary citizenship of the state of Schleswig-Holstein was given to the entrepreneur Günter Fielmann."
Good morning from Berlin. Yesterday at the &quot;think tank&quot; here in the federal capital.
Queen - Thank God It&#39;s Christmas music tip for you out there ... #Klingender_Adventskalender SPD parliamentary group https://youtu.be/5r8bZCXdVNA
DENKFABRIK (@denkfabrik_SPD) | Twitter https://mobile.twitter.com/denkfabrik_SPD
"Interesting
This is not America. – Frank Stauss  http://frank-stauss.de/index.php/this-is-not-america/ …"
Black-Blue Fantasies: The Clandestine Networking of CDU and AfD | Home | REPORT MAINZ | SWR.de http://www.swr.de/report/schwarz-blaue-fantasien-die-klammheimliche-vernetze-von-cdu-und-afd/-/id=233454/did=18498596/nid=233454/r5eb5s /index.html…
Stop criminals. https://twitter.com/bild_news/status/803963583889424384…
Nice Wednesday ;-)
Later union council meeting. In the evening in Berlin guest speaker at the &quot;think tank&quot;. It is about the majority on this side of the Union.
Good morning from Bordesholm. Today talks with the housing industry about affordable housing in the north.
Bosse - Steine (Official Video) My music tip for you out there in digital orbit ;-) https://youtu.be/45xxj3yBE4I
 http://www.tagesschau.de/inland/spd-kanzlerkandidatur-kraft-101.html …
"Are we really afraid of 50,000 women + children? Why is the Christian Union preventing family reunification for Syrian refugees?"
"Left Alliance of November 16, 2016: Power games with and from red-red-green | BR Media Library VIDEO http://www.br.de/mediathek/video/sendung/kontrovers/linksbuendnis-rot-rot-gruen-102.html#&amp;time=…"
Germany worth reading: How inequality inhibits growth
Much smarter than the story about Martin Schulz - it works ;-) https://twitter.com/christianwermke/status/803348185892667396…
Ralf Stegner: Schleswig-Holstein. Fair and modern. https://youtu.be/ZynTIMvF6OY
Interesting evening yesterday in the Kiel City Cinema. Discussion with Julia Friedrichs. pic.twitter.com/MCTavqXg2J
Office open tonight on the topic of &quot;daycare centers&quot;. Have a nice Tuesday ;-)
Don&#39;t worry - secret choice as always - for all list places in January! https://twitter.com/c_vogt/status/802805990743805952…
Congratulations! https://twitter.com/stefanboehnke/status/802827883055955968…
Back to Berlin this afternoon. Happy 1st Sunday of Advent ;-)
"Good morning from Bordesholm. After a great SPD state party conference yesterday in Neumünster, now start the election year with a tailwind!"
Marius Müller Westernhagen - I&#39;m back here - Basel 2012 My music tip for you out there in digital orbit https://youtu.be/8nzmM02iLGk
"Many thanks to the team of the SPD regional office at the Kuhberg in Kiel! As always, you did a sensationally good job at the party convention!"
"Great state party conference of the SH SPD. Government program decided, Torsten Albig nominated, closed, determined, happy! #We will do it"
Comments https://m.facebook.com/story.php?story_fbid=1869756183253766&amp;id=1431909580371764…
Have a nice Weekend ;-)
Explosive northern derby today in Hamburg. My HSV needs courage and luck to beat Werder.
Daily news: Fidel Castro died. Uli Hoeneß again president of Bavaria. Merkel in Neumünster and protests against v.Storch in Kiel.
It is about a package of measures agreed together to increase the turnout and polemics of CDU colleagues in the state parliament.
Warm greetings from the north to the federal conference of the Jusos in Dresden! Show your colors for social justice! # buko16
And forever the old Oskar greets ..... Sarah Wagenknecht speaks red-red-green broken - Politics - Süddeutsche.de http://www.sueddeutsche.de/politik/die-linke-wagenknecht-redet-rot-rot- gruen-kaputt-1.3262775? utm_source = Maileon &amp; utm_medium = email &amp; utm_campaign = SZ + Espresso + am + Morgen + 11/25/2016 &amp; utm_content = http% 3A% 2F% 2Fwww.sueddeutsche.de% 2Fpolitik% 2Fdie-links-wagenknecht-redet-rot-rot- rot- green-broken-1.3262775 &amp; utm_term = html…
"CDU Vice Julia Klöckner embarrassed Jauch &quot;Who wants to be a millionaire&quot; despite 64,000 euros - TV - Berliner Morgenpost http://m.morgenpost.de/kultur/tv/article208788281/Julia-Kloeckner-blamiert-sich-bei-Jauch- despite-64-000-euro.html…"
Fraeulein Bruenett on Twitter: &quot;It&#39;s getting a little embarrassing for Julia Klöckner #wwm pic.twitter.com/COsLtfKDzg&quot; https://mobile.twitter.com/Frl_Bruenett/status/801876854869200896…
Now CDU people are attacking me for things that have been mutually agreed between parties + groups. Bad location-bad style ?!
Preparations for tomorrow&#39;s SPD state party conference in Neumünster.
Good morning from Bordesholm. The early bird ... Off to Berlin. Meeting with South American ambassadors at the Friedrich Ebert Foundation.
Natalie Imbruglia - Torn [HD] My music tip for you out there in digital orbit ;-) https://youtu.be/SgNvWfCMMh0
Worth reading! Right rubbish as far as the eye can see! FALTER »Boris wanted to burn me | falter.at https://cms.falter.at/falter/2016/11/08/boris-wollte-mich-verbrennen/…
Afternoon talks on port policy. Evening SPD regional conference in Husum. Nice Wednesday ;-)
Good morning from Berlin. After appointments in the capital back to Schleswig-Holstein. Coalition round on the household.
Ain&#39;t nobody but me My music tip for you out there in digital orbit ;-) https://youtu.be/vK-1Odn4b9U
State election 2017 in Schleswig-Holstein: Ralf Stegner: &quot;This will be one of the hardest election campaigns&quot; shz.de http://www.shz.de/regionales/schleswig-holstein/politik/ralf-stegner-das-wird-einer-der-schwersten-wahlkaempfe-id15418801.html…
Social envy? I thought the laws apply to everyone. Certainly naive idea. Millions of tax evasion is serious crime! https://twitter.com/fcblogin/status/801094886112034816…
Two Stormarners lead new political body - Stormarn - Hamburger Abendblatt http://www.abendblatt.de/region/stormarn/article208765319/Zwei-Stormarner-fuehren-neues-politisches-Gremium.html…
SPD Chancellor Candidate: Stay Cool on the K Question | tagesschau.de https://www.tagesschau.de/inland/spd-kanzlerkandidatur-105.html…
🏃🏼🏃🏼🏃🏼🏃🏼🏃🏼 https://twitter.com/langejulian/status/800950750742450178 …
Fast ;-) https://twitter.com/martinhabersaat/status/800592152459886596 …
Network of right wing populists https://twitter.com/realdonaldtrump/status/800887087780294656 …
Why am I not surprised now ?! https://twitter.com/dneuerer/status/800931870896689153…
Incredibly wrong! https://twitter.com/ismail_kupeli/status/800803634074230784…
Berlin again in the evening. Have a nice Tuesday ;-)
Discussion with the state sports association and later citizens consultation in Bordesholm. Press conference for the upcoming state party convention.
Good morning from Bordesholm. Today continuation of the parliamentary group meeting and coalition committees in the Kiel State House.
SPD Vice Stegner - Merkel&#39;s myth of invincibility is over | Message | http://finanzen.net http://www.finanzen.net/news/aktien/SPD-Vize-Stegner-Merkels-Mythos-der-Unbesiegbarkeit-ist-vorbei-5195811…
Angela Merkel is the top candidate for CDZ / CSZ Christian Democratic / Social Discord. Neither underestimate nor overestimate.
"So Merkel starts again. So what? Not to be underestimated, but neither unbeatable nor &quot;savior of the free world&quot;."
Bernie Sanders blows to class struggle after US election - Politics - Süddeutsche.de http://www.sueddeutsche.de/politik/demokrats-nach-us-wahl-bernie-sanders-blaest-zum-klassenkampf-1.3256878…
In the evening to Berlin. 1001 crime scene. Have a beautiful Sunday ;-)
"Even if you can rely on yesterday&#39;s SH Union, which is drained of content and busy with personnel quarrels, it will be a tough election campaign!"
SH Union elects my sixth colleague with a meager result as chairman and overturns only urban woman from the closer regional board.
"Don&#39;t worry, I already know that anyone who has the damage as an HSV fan does not have to worry about ridicule."
"Incidentally, the resocialized tax &quot;designer&quot; should become Bayern president again - promptly lose those in Dortmund and top of the table 😎"
Good morning from Bordesholm. Everything stares to Berlin tonight: Should (again) be a girl ;-) Hooray! Will that save the globe?
santana- black magic woman My music tip for you out there in digital orbit - that&#39;s how some see it today ;-) https://youtu.be/wyQUCYl-ocs
Now you&#39;re really joking. Have fun with a fair election campaign. Before Kubicki &quot;SH great again&quot; maybe FDP back in the Bundestag ?! https://twitter.com/c_vogt/status/800059724104343552…
"Actually, you are far too clever to pull off this &quot;We had such a heavy government youth&quot; - misery number 😉 competition, colleague😀 https://twitter.com/c_vogt/status/800056712988344321…"
Your income + debt grew on average more than we did! So do not tell fairy tales. Post-factual Trump bond rather with you https://twitter.com/c_vogt/status/800056712988344321…
What is more credible? Our: Promise contents !? Or you: we had a hard time + would do everything completely different now !? Note yourself😉
We have consequently corrected what was supposedly without alternative and what you were voted out for. Policy change in education + social affairs! https://twitter.com/c_vogt/status/800054710216454144…
Cute accusation that we didn&#39;t correct your wrong anti-social policy quickly enough. We did it + debt repayment for the first time! https://twitter.com/c_vogt/status/800054710216454144…
"Good morning from Berlin. After attending the SPD leadership academy, we return to Schleswig-Holstein. Have a beautiful Sunday ;-)"
CARL DOUGLAS - Kung Fu Fighting OFFICIAL SONG My music tip for you out there in digital orbit ;-) https://youtu.be/SobQQWTmfbA
Congratulations from the north👍 https://twitter.com/karambadiaby/status/799668905887272962…
So are the blacks in Rhineland-Palatinate! Our excellent general secretary can&#39;t even meet the black money girls or boys! https://twitter.com/katarinabarley/status/799555889376227328…
Embarrassing: JU from RLP should rather deal with the CDU donation scandal. added a new photo. | Facebook https://www.facebook.com/photo.php?fbid=1346168325401701&amp;set=p.1346168325401701&amp;type=3&amp;theater…
Living in the world of dreams..... https://twitter.com/martinhabersaat/status/799544426955730945 …
Daily brutalization not only in social media - we have to face this consistently! https://twitter.com/im_himmelreich/status/799533814070571010…
"With Ex and Hopp at the management staff, CDU SH is very familiar - look forward to tomorrow: Freestyle for my 6th colleague as CDU country manager ;-) https://twitter.com/joewadephul/status/799524277208973312…"
Nice Friday ;-)
"Afterwards, parliamentary plenary part III. Topics include citizen insurance, federal-state financial equalization and tariff loyalty law."
I read the lyrics of Bob Dylan&#39;s songs &quot;Like a rolling stone&quot; and &quot;Don&#39;t think twice it&#39;s alright&quot;. #Vorlesetag
Good morning from Bordesholm. Reading day at Bordesholm Community School. High school English is about Nobel Prize winner Bob Dylan.
Van Morrison - Bright Side Of The Road (original-HD) My music tip for you out there in digital orbit ;-) https://youtu.be/pvS2OtG2SHc
"Read alleged SPD power struggles for foreign office + chancellor candidacy: In times of bird flu + avian influenza, there are already very miraculous ducks😎"
Possibly suitable for the Mr. Opposition leader from SH - maybe there will be educational successes 😉 https://twitter.com/welt/status/799201412471103489…
"Education debate in SH. Coastal coalition: balance sheet good, mood splendid Opposition: balance sheet miserable, post-factual orientation, pure sadness!"
"Well, who is going to exaggerate like this? Berlin Conservatives should not complain, but work on themselves and their majority ability ;-) https://twitter.com/ulfposh/status/799023911312748544…"
Today Landtag plenary part II. Government declaration on education policy. Debate about fair educational opportunities or black and yellow retro politics.
Amy Macdonald-This Is The Life Good Morning from Bordesholm My music tip for you out there in digital orbit ;-) https://youtu.be/iRYvuS9OxdA
I think it hacks 😂 https://twitter.com/christiansoeder/status/798198395416375298…
#hutab in front of all the many democracy workers in local councils + district days who get too little praise. You are doing a great job!
Readable text by Heribert Prantl on populism and its fight pic.twitter.com/6K0FqXp1I7
Column Power: The people have no worries - taz.de http://www.taz.de/!5353570/
Kiel - Stegner: &quot;Today is a good day for Germany&quot; - LN - Lübecker Nachrichten http://t.ln-online.de/Nachrichten/Politik/Politik-im-Norden/Stegner-Hoday-ist-ein-guter- Day for Germany ...
👍😉 https://twitter.com/laszloriedl/status/798154215579418624 …
"#hutab in front of my 25,000 followers on Twitter. Except for the few notorious trolls, I&#39;m happy about everyone who participates here."
She&#39;s really right about a lot! https://twitter.com/demokratie_plus/status/798104612322574336…
Exciting to read! https://twitter.com/demokratie_plus/status/798104612322574336…
extra3 on Twitter: &quot;Where is the CDU candidate? #Bundespraesident #Steinmeier (REPOST with picture) pic.twitter.com/iAbE3y4Sf5&quot; https://mobile.twitter.com/extra3/status/798123794766458880…
