"If V-Mann knew beforehand what happened at the later crime scene, did nothing + remained silent, there is at least initial suspicion of aid."
Why is the public prosecutor&#39;s office not taking action after new publications on the involvement of the Hessian man in NSU murder.
Good start every week ;-)
1st regional conference of the SPD parliamentary group &quot;Promised-Keeping&quot; in Neumünster. Prime Minister Torsten Albig here today.
"Good morning from Berlin. Presidium meeting, TTIP hearing in the Willy-Brandt-Haus, appointments. Back to SH in the evening."
Al Green - Simply beautiful This is my music tip for you today - you could hear it yesterday in the good &quot;Tatort&quot; in Frankfurt. http://youtu.be/nD3UgSLS8A8
@hruodberaht they may not !!!
@DrKissler @ArminLaschet Hardly.
@ArminLaschet @CDUNRW_Fraktion Rotgrün in NRW did not vote against the committee of inquiry!
@RasmusAndresen @SGFleHa Have fun doing it 😊
@ArminLaschet is a security officer suspected in NRW of having been involved in the murder? That is the case in Hessen.
It is bad enough that the black-green Hessian coalition shows zero interest in clarification in the NSU murder series. Victims don&#39;t deserve this!
"The Hessian NSU investigation committee, which was enforced against the will of Schwarzgrün, has plenty of educational work to do. What did Bouffier know?"
Such miserable crap! HSV has to accept compensation shortly before the end.
Worth reading “@tsghessen: #LangerTagdesBuches in Frankfurt. At 6:00 pm I present my new book“ Ownership Obliged ”in the Haus am Dom.
1: 0 Stieber. #nurderhsv
@_drsarkozy always happy 😉
"In view of the complexity of the world of business and work, one is startled that simple working time documentation should be too much!"
The least bureaucracy was in serfdom. Today workers even have the same right to vote. Caution: irony!
"If that should be too big a challenge for employers in 2015 (not 1815), then Germany is facing difficult times!"
"The fact is: Anyone who pays a minimum wage and documents the start, end and breaks of working hours every day has no problem as an employer."
@ CONSULTER_94 @GerdKotoll @petertauber Everyone can write down working hours - there has been this for 250 years.
"Ostmeier (CDU) praises opposition leader Günther. Very social, I think. Compassionate Christian Democrat after lousy Günther performance."
@ u98 it is difficult to accommodate you to such a level that even you understand it.
"In contrast, Günther is civil 😉 “@ismail_kupeli:. @ SamaelFalkner Also&quot; beautiful &quot;the recording from parliamentary debates # Turkey https://twitter.com/ismail_kupeli/status/568706819591438336/photo/1 pic.twitter.com/lMwGdt7fdQ”"
"Clever speeches by colleagues Rother + Peters on the subject of prison. Subterranean knowledge-free, untrue statements by the opposition leader novice."
Something 😉 “@DerBruesseler: It&#39;s good that things are a bit more civilized here in the state house ... http://www.spiegel.de/politik/ausland/tuerkei-schlaegerei-im-parlament-um-demonstrationsstrafrecht-a-1019452. html… ”
Evening in HH discussion about Ukraine + Russia largely in agreement with colleague Kubicki against political scientists and cold warrior Krause.
"Good morning from Bordesholm. Yesterday, a letdown for the opposition in its level-less hyperventilating attacks on the Minister of Justice."
"Little River Band - Lonesome Loser LIVE Music tip for colleagues who had to learn yesterday, audacity is not enough. http://youtu.be/BQ6T7mWeNho"
TSG is expressly right! Schäuble&#39;s immediate no is a ... - Thorsten Schäfer-Gümbel https://www.facebook.com/thorstenschaeferguembel/posts/10153067631388080…
Good event in Turkish theater in Berlin. https://www.facebook.com/AGMigrationNeukoelln/posts/269333193237051…
"Coalition with the CDU: Green credibility, comment - SPIEGEL ONLINE Hmmm .... our Northern Greens are different😉 http://www.spiegel.de/politik/deutschland/koalition-mit-der-cdu-gruene-glaubwuerdigkeit-kommentar -a-1019110.html…"
Political Ash Wednesday of the AFA and the North SPD in Marne was moody and typical of Dithmarschen yesterday.
Evening discussion event in Hamburg on German-Russian relations. Happy Thursday everyone ;-)
Good morning from Bordesholm. Landtag again today with debates on immigration law and justice in SH. Scandalized hype everywhere.
ROCKY HORROR PICTURE SHOW: Time Warp This is my music tip for you today ;-) http://youtu.be/QdbLirsZ_4Q
At the red political Ash Wednesday of AFA and Nord SPD in Marne / Dithmarschen with Claus Möller and Franz Thönnes. pic.twitter.com/URFf7tQ4Xx
"@ Doppelgeist60 you can not just limit that with the clear pronunciation to Ash Wednesday, then everything is fine ;-)"
@ArminLaschet @MiKellner In the north you sing: Rattata zong rattata zong away is the balcony (Jackhammer-Bernhard von Torfrock)
"@wettach @GRUENE_Hamburg well, everyone advertises for themselves, but don&#39;t worry, you &quot;ll never walk alone 😉"
@MiKellner @ArminLaschet Green is hope and ....... 😊
"@JurgenPresser Schlapper Reim, you poor impost CDU that is not possible Olaf Scholz is our man who can rule Hamburg well"
"@ArminLaschet As far as the rhyme is concerned, but in terms of content as always with me: Always only truth and clarity 😉"
"@inespohl But the bar is very high for such decisions, otherwise the loss of freedom would be really hard to bear!"
"@inespohl You are right. When it comes to concrete hazard notices, which of course cannot be published, protection of human life is No. 1"
"Hamburgers: Come down, line up, vote, that must be! The best thing to do is choose your SPD, Olaf Scholz, that&#39;s okay!"
"@inespohl No criticism of the measure, rather a call for freedom society not to be intimidated (freedom of expression etc.)"
"@inespohl Only know the security authorities who certainly do not take such serious measures lightly, but terror must not win!"
"Prove defensive democracy! “@Inespohl: fear defeats carnival: Braunschweig says move from http://www.ndr.de/nachrichten/niedersachsen/braunschweig_harz_goettingen/Karnevalsumzug-wegen-Terrorgefahr-abgesagt,schoduvel172.html…”"
@ulfposh cheer up ;-)
Today I&#39;m still going to Berlin. Happy Sunday everyone .... please without comments on the Bundesliga weekend ;-)
Good morning from Bordesholm. In Hamburg you choose ......... of course ..... with all votes Olaf Scholz and the SPD! Vote! #NurDieSPD
Ray Davies (KInks) Victoria Glastonbury 2010 My music tip today - maybe especially fits after 6pm ;-) http://youtu.be/brlLHo8fqJM
That&#39;s right 😀 “@DoroBaer: @laszloriedl The @Ralf_Stegner and I have never had any problems ...”
Have a nice Weekend ;-)
Good morning from Eckernförde. Second day of the group board meeting. Discuss the work program for the parliamentary group.
James Blunt - Postcards (Lyric Video) This is my music tip for you today ;-) http://youtu.be/uz0NV-HOT0M
"Allegedly, you don&#39;t understand anything about business if you work for decent wages, ideological hit everywhere!"
Practical problems with sports clubs etc. can and will be solved safely; the general attack on minimum wages only shows its correctness!
Those who have apparently disregarded the Working Hours Act for years are now caught because the working hours are documented with the minimum wage.
The permanent attacks against the supposedly excessive bureaucracy in the Minimum Wage Act show how important it was to enforce it!
Good morning from Bordesholm. Points have to be scored today at the home game of HSV against Gladbach. In the evening to Berlin. Have a beautiful Sunday ;-)
Hello - New York Groove - 1994 This is my music tip for you today ;-) http://youtu.be/rgBYSDfnq48
Social democratic TTIP would create primacy of democratic politics for a free and fair organization of trade relations. (GS)
(2) Gesine Schwan and Gustav Horn wrote this in a worthwhile guest post about TTIP for the Frankfurter Rundschau today.
"TTIP must not abolish politically desired regulation for freedom, justice, solidarity in favor of private particular interests. (1)"
"Of course, no reasons for whining and nagging against alleged bureaucracy, which is rather aimed at minimum wages themselves. (3)"
There are no reasons for the general shouting and nagging of the employers against the minimum wage and its review! (2)
Certainly you have to check documentation requirements for the minimum wage after a reasonable time and clarify real problems (sports clubs etc.). (1)
One has to be surprised: the so-called &quot;Association of Taxpayers&quot; awards right-wing populist anti-euro and migration policy (in) sense.
Comments on LAGE in SH. https://www.facebook.com/ralf.stegner/posts/841052535960951…
"@rkobylinski @henrikMSL You are an example that stupidity is not forbidden in democracy, but you should counter it!"
"Good morning from Bordesholm, wet and cold market before breakfast, gray and calm, hectic only in the morning press. Have a nice Weekend;-)"
Jacques Brel - Ne Me Quince Pas This is my music tip for you today ;-) http://youtu.be/i2wmKcBm4Ik
@henrikMSL @petertauber Mockery would be the assumption that entrepreneurs could not write down the working hours correctly - they don&#39;t want to!
@ CONSULTER_94 @GerdKotoll @petertauber is the alternative: either you can&#39;t do it (goofy) or you don&#39;t want it (crook) correct!
"Good morning from Bordesholm. Today state parliament with UKSH germ crisis, refugee policy and birthday of my deputy Martin Habersaat 😊"
Energy Air 2014: Family Of The Year - «Hero» This is my music tip for you today ;-) http://youtu.be/wZHJKZHRFdU
@am_klint It&#39;s just about documenting the beginning and end of working hours. That would have been done 250 years ago.
 https://tweepsmap.com/Map/ 
wishes everyone a nice Tuesday ;-)
"Good morning from Bordesholm, today faction and coalition committees in the Kieler Landeshaus, press talks, rehearsals for Ash Wednesday in Marne."
Simon &amp; Garfunkel - I Am A Rock [Remastered] This is my music tip for you today ;-) http://youtu.be/9lr24QlUyww
"SSW really cool: CDU is bad for Hamburg and for SH anyway. Actually general knowledge 😉 congratulations, Olaf Scholz http://www.ltsh.de/presseticker/2015-02/16/11-37-06-75b0/layout.html…"
SPD wants to enforce rules for good work too! Stegner should apologize for the insult! | AfD Schleswig-H. https://www.afd-schleswig-holstein.de/?p=1835
"Hamburg election: Stegner and Liebing say that NDR.de - Fernsehen - -Holstein Magazin http://www.ndr.de/fernsehen/sendung/schleswig-holstein_magazin/Hamburg-Wahl-Das-sagen-Stegner-und-Liebing,shmag32194.html…"
"Committee meetings in Berlin today and an event on refugee policy in the evening. Happy Rose Monday, whether foolish or like here ;-)"
Good morning from Berlin. Great election success for Olaf Scholz + the Hamburg SPD. It pays to do what you said before the election.
11th in the 11th again and again kölsche Lieder 2013 - Höhner - Viva Colonia music tip for Rosenmontag from Berlin to Cologne ;-) http://youtu.be/h69NIIXkxPM
@ Doppelgeist60 Do how Bavarian SPD is stronger than Hamburg CDU. What the hell?! How small does the CDU want to make itself ?! 😉
That remains the goal everywhere! “@Groote: #SPD is more than 30 percent ahead of # CDU. When did this happen? #wahlhamburg #wahlhh # hhbue15 # hhwahl15 ”
@wahl_beobachter @derRub @SiemensLisa @CDU_Hamburg who would want something like that?
"@RobertRossmann @ArminLaschet @MiKellner @faznet Stalin, Mao Gaddafi? But that is a little tough compared to the lovely colleague Laschet😉"
@ArminLaschet Laschet let the brooding rhyme Olaf bring the thing home. The north would rather choose red than Wersich&#39;s last contingent
"If proof of how good it is that the coastal coalition rules are needed, JVA attacks show the CDU &amp; FDP&#39;s incapacity to govern."
"If Anke Spoorendonk made findings from investigative proceedings public, she would be punishable, but opposition wants that."
An oppressive understanding of the rule of law by Kubicki &amp; Günther: They complain of Minister Spoorendonk&#39;s disregard for the law and ask them to break the law.
The truth in the press release by the CDU opposition leader Günther on the JVA Lübeck can only be found in trace elements with a magnifying glass.
Resignation?! “@Martinhabersaat: Prize question: Group leader calls for breach of law. How does his group deal with the rule of law? ”
Owls can turn their heads 360 degrees. “@ParlaNet: #LTSH #GRUENE Burkhard Peters to Daniel Günther + Wolfgang Kubicki http://ltsh.de/VN4TxHT1”
"Opposition leader Günther is sworn in by law and demands illegal behavior from the Minister of Justice, he is disqualified for his office!"
"CDU opposition leader Günther calls on the Justice Minister to make public statements in investigative proceedings, i.e. to openly violate the law!"
"Indecent lousy style: what the opposition experiences confidentially for good reasons, it uses in partisan politics to denounce the Minister of Justice!"
"Zero seriousness of the opposition at JVA Lübeck: Get all information in (due to preliminary investigation) internal meeting, rush publicly!"
"The &quot;red Jochen&quot; Steffen still shapes the culture of the North SPD. Strong in the north - left, thick-headed and free! https://www.facebook.com/ralf.stegner/posts/837040546362150:0…"
@harms_lars You are optimistic about the insight of black people 😉
wishes everyone a nice Friday ;-)
"Then in the evening to Eckernförde for the retreat of the executive faction board, tomorrow the faction board will join."
"First office appointments in Kiel, then a guest at a cabinet exam in Harrislee, later at a closed meeting of the SPD district association Schleswig / Flensburg."
"Good morning from Bordesholm. Hope for peace in Ukraine, rapprochement between EU and Greece, full working day ahead."
Neil Young - Harvest This music tip is one of my all-time favorites - have fun with it ;-) http://youtu.be/nXStKdubasA
"@SturmDaniel &quot;Not blamed is enough praised&quot;, is the saying in this country ;-)"
@SturmDaniel the initiative of Ms. Merkel and François Hollande already praised the SPD on Monday - too much praise is unusual in the north 😉
@StormDaniel I&#39;m rather frugal about pride 😉
Frank Steinmeier is the guarantor of peace and relaxation policy. His commitment is exemplary. The SPD can be very proud of that!
Greece would have no budget problem if illegal billion-dollar capital transfers to Swiss banks were successfully combated.
Swiss Leaks shows the extent of serious upper class crime. Billions in tax evasion is unscrupulous theft on the community!
@ Doppelgeist60 source surprise ?!
@Honourstone This is a problem of blatant distribution injustice!
wishes everyone a nice Wednesday ;-)
"Preparation of the next state plenary session in the Council of Elders, otherwise Kiel office appointments. The SPD state board meets in the evening."
Good morning from Bordesholm. Peace talks in Minsk are accompanied by many hopes. State act for Richard v. Weizsäcker in Berlin.
@AngieDor Congratulations and all the best ;-)
Wolf Maahn &amp; Wolfgang Niedecken - Like A Rolling Stone - Live in Cologne 2009 This is my music tip for you today ;-) http://youtu.be/FdQSuV6Hyt8
@CatEns Are you actually ashamed of nothing?
@GabySpreer thank you ;-)
wishes everyone a nice Tuesday ;-)
"Another cowardly arson attack on planned refugee accommodation - this time in Eschenburg / Duchy of Lauenburg. Fortunately, nobody hurt."
Good morning from Bordesholm. Today again the committees of the parliamentary group and coalition in the Kiel State House.
Riders on the Storm - The Doors HD This is my music tip for you today ;-) http://youtu.be/k9o78-f2mIM
"@andreaspetzold @sternde Some would like that - nothing there, you won&#39;t get rid of the real north ;-)"
wishes everyone a good start to the week.
"Today it continues with the topics of right-wing populism, Europe, economic policy and others. Later Berlin appointments regarding turnout."
"Good morning from Nauen. Second day of the SPD board meeting in Brandenburg. Yesterday foreign policy, work program and employee policy."
Mr. Mister &quot;Broken Wings&quot; - Live at the Ritz This is my music tip for you today ;-) http://youtu.be/F4LAO2NMz8Y
"@OdeonFan Well, freedom of expression is called democracy ;-)"
"@f_kierkegaard Nö - only find cockiness of elected government failures towards those who have to fix this, amazing!"
Sounds difficult after a lean diet! “@Martinhabersaat: FDP and pirates are&quot; the hand that feeds the UKSH &quot;? http://www.ltsh.de/presseticker/2015-02/05/17-18-01-11cf/… ”
Appointments in Kiel. Happy Friday everyone ;-)
Good morning from Berlin. Yesterday evening discussion with Jürgen Kocka about Picketty and growing inequality. Today back to SH.
Fair Weather - Natural Sinner This is my music tip for you today ;-) http://youtu.be/Q8R1tsOUpk8
@martinhabersaat absolutely!
Delicious robber gun 😉 “@ParlaNet: #LTSH #FDP Garg: Albig interview: broken relationship with the SPD faction leader. http://ltsh.de/VNM7MXUA ”
"Congratulations on your 66th birthday, dear Kurt Beck!"
wishes everyone a nice Thursday ;-)
"Good morning from Berlin. Yesterday evening the debate on Greece with Anne Will, today various dates in Berlin. Discussion about Piketty book."
Elton John - Sweet Painted Lady (Edinburgh 1976) This is my music tip for you today ;-) http://youtu.be/dpNnpg0srws
@martinhabersaat what did you have in coffee? Substantive work? Alternatives? You&#39;re talking about Günther &amp; Co. 😉
Exciting! “@Misik: Ulf Poschardt also answers my criticism of&quot; world &quot;. (his and my answer in comments) http://misik.at/2015/02/wie-die-springer-presse-yanis-varoufakis-zum-judenfeind-macht/#more-2279… ”
Me too ! “@CanselK: I signed this call with: http://cansel-kiziltepe.de/europa_neu_begruenden/…”
"On the way to Anne Will, where I am discussing Greece and the EU on ARD tonight. Reforms have to be fair for people!"
"@LarsWinter Hear Hear! The state chairman is happy, who of course is closely following this 😉"
"Stupidity deserves pity, because clever people can act stupid, the opposite is impossible."
"Stupidity is not forbidden in democracy, but it can and must be named + fought! Xenophobia is stupid and dangerous!"
"After an interesting visit to the West Coast University of Applied Sciences in Heide, we continue to Wedel to the local university of applied sciences."
@MGrosseBroemer At least partially - definitely on the topic: 3 points for the HSV in Paderborn 😉
 http://www.deutschlandfunk.de/karenzzeit-mit-der-union-war-nicht-mehr-drin.694.de.mhtml?dram:article_id=310613 …
Sigmar Gabriel - The Presidium of the Social Democratic ... https://www.facebook.com/sigmar.gabriel/posts/937310702968319…
SPD for Europe - Chronicle Photos | Facebook https://www.facebook.com/SPDfuerEuropa/photos/a.452442498150264.102694.442544569140057/852458081482035/?type=1&amp;theater…
"@MGrosseBroemer By the way, you should explain this to your Thuringian party friend Mohring!"
@MGrosseBroemer I have criticized this clearly! No commonality with right-wing populists - neither in Greece nor in Germany!
"What to do? Prohibit violence of all provenance, live tolerance and diversity! Promote freedom of expression - stand up against those who stir up fears!"
What to do? Strengthen the common good! It is not the case that there are no alternatives in politics. &quot;Without alternative&quot; = non-word of this time.
What to do? Promote peace and détente policies instead of breaking military taboos! Fighting causes of flight instead of weapons export records!
"What to do? Finally understand that Germany, the exporting country, is only doing well in the long run if its southern neighbors also have prospects!"
What to do? Investing in education and the future instead of breeding ground for populists and right-wing extremists! Solidarity instead of arrogance!
What to do? Strengthen democracy instead of tolerating the primacy of the economy! Develop Europe as a community of values not only as a monetary union!
What to do: Ruin taxes for the super rich instead of communities! Corporations that pay taxes where profits are made! Dry out tax havens!
What to do: European growth instead of austerity policy! Investments instead of youth unemployment! Reforms that don&#39;t subjugate the population!
Who is really surprised that the Greek voters were fed up with the ancien regime ?!
New England Patriots win the Super Bowl against the Seattle Seehawks.
"Good morning from Berlin. Presidium meeting and meeting with the EKD, later back to SH. Nice start to the week everyone ;-)"
"Dota - All you, all major /// Berlin Sessions (Bonus) This is my music tip for you today ;-) http://youtu.be/4CkrH8fyEqg"
From Hamburg to Berlin on the ICE in Thomas Piketty read &quot;Capital in the 21st Century&quot;. When will the progressive global capital tax come?
@ulfposh @welt So much delight with the little attack rhetoric? FDP obviously needs a lot of encouragement that there is so much joy about it.
"Interesting assessment, even if you don&#39;t have to share all of it. http://misik.at/2015/01/tal-der-ahnungslosen/…"
@gemstars
"@LukasKilian Super-so next opposition demands from our opposition heroes, who ruled so badly that after 2 1/2 years it was finito."
Good morning from Bordesholm. Today various discussions and appointments in the Kiel Landeshaus. Happy Friday for everyone who deserves it 😉
Very pretty - and it&#39;s still true ;-) “@martinhabersaat: opposition work inspired by Aesop. http://de.m.wikipedia.org/wiki/Der_Hirtenjunge_und_der_Wolf… ”
Van Morrison- Somerset This is my music tip for you today ;-) http://youtu.be/B_m39OA25rk
@Heiner_Garg @SteEilts @Oreo_Pirat was already after 2 1/2 years after work for Carstensen &amp; Kubicki- thanks to a clear vote!
"@Heiner_Garg @SteEilts @Oreo_Pirat You&#39;re wrong, in the worst government - not ever - but since Barschel, you were vice president for 2 1/2 years!"
Here once again Anja Reschke&#39;s impressive commentary on ARD for listening. She is so right !! http://www.ard.de/home/ard/ARD_Startseite/21920/index.html#…
@ Doppelgeist60 Simply bad comment ;-)
A little snowfall and some drivers can hardly cope with it. This is called winter - at least that&#39;s what it used to be called. Or not? 😉
"@SteEilts @Heiner_Garg @Oreo_Pirat Land is well governed, so everything is okay. But a bit of quality can also be with opposition, right?"
"One knows the behavior of captains who give sailing instructions from land. With pirates, core competence is less on land anyway ;-)"
The JVA debate showed that if proof was needed that opposition people should not be given government responsibility.
"Günther, Klug and Dudda from SH Opposition would rather have seen that JVA employees worked through the papers and made phone calls."
The courage and prudent behavior of the JVA staff ended hostage taking in Lübeck in a matter of minutes and prevented bloodshed.
Anja Reschke&#39;s comment on the Holocaust Memorial Day on the ARD is worth listening to! She is absolutely right!
2015 -any questions? “@Kaffeeringe:. @ VICE has sorted reactions to ARD&#39;s Holocaust commentary according to stupidity: http://www.vice.com/de/read/wir-haben-die-reaktionen-auf-den-holocaust-kommentar- the-ard-sorted-by-stupidity-271… ”
"Everywhere where black and yellow has wreaked havoc * cut three years later, more money and at the same time harder austerity is required!"
Berlin.
"So what?! “@Kn_online: # Head of the Court of Auditors, Schäfer, has sharply criticized the # federal government&#39;s budget policy. http://bit.ly/sparkus_anemahnt… ”"
Why does the term &quot;one-armed bandits&quot; come to mind only spontaneously 😉?!
"Yawning: Arp &amp; Kubicki, the black-and-yellow parliamentary arm of the gaming industry in SH, is once again beating against the State Treaty on Gambling in the 16 countries."
@evelinelemke Howling to the Moon ⛺️
"Complaining about minimum wages, you have to write down working hours &quot;now&quot; is ridiculous - if you can&#39;t even do that, you&#39;re a fool or crook!"
"@JurgenPresser you only scoff - Ms. Merkel is at the summit - there is only one direction from there, namely downwards and there is a lot of black nothing!"
@charles_h_marx so they say
@_drsarkozy but something of ... a few secrets should remain anyway ... not everyone&#39;s business .... 😉
"@BoehningB As long as you know it yourself, everything is fine 😉"
"@peteraltmaier but, social partners are particularly generous, ultimately doing 2/3 of the work in the federal cabinet ;-)"
Stupidity is not forbidden! But it has to be fought again and again! “@HollyGoMadly: # AfD- #HHWahl pic.twitter.com/EMaVokeX2t”
"@_drsarkozy but always, Madame - best morning greetings from north to south ;-)"
@peteraltmaier The Alemanni are generous people 😉
"CDU political scientist Bergsdorf gives SPD &quot;good&quot; advice in the WORLD - if we followed it, it would be more towards 20% instead of 30%."
Good morning from Bordesholm. Talk to the city association today. Later press conference for the upcoming SPD state party conference.
Mumford &amp; Sons - Little Lion Man (Live from Red Rocks) This is my music tip for you today ;-) http://youtu.be/LqjFznVr3wM
"@KillarNBathy USA withdraw Swiss banks&#39; license if they do not cooperate on tax crime, is worth considering, right ?!"
"As is well known, Mr. Güllner is a prime example of &quot;serious&quot; demoscopy! “@Sternde: #FDP manages 5 percent again. http://www.stern.de/politik/deutschland/fdp-wieder-auf-5- percentage-der-stern-rtl-wahltrend-2172473.html… (jr) ”"
