"On the way to Berlin to the base conference of the &quot;Magdeburg Platform&quot; of the SPD leftists of the party executive, parliamentary left and Jusos."
"Explanation: CDU &amp; FDP in SH fight our community schools on land, on water and in the air. Coastal Coalition for Educational Justice!"
"With lyrics from Nobel Prize winner Bob Dylan, I really enjoyed the state parliament debate on upper grades at community schools."
"CDU &amp; FDP responsibility for community schools in SH? It ain&#39;t you, babe. SPD commitment to upper grades: Don&#39;t think twice, it&#39;s alright."
There are no more questions! Unteachable yesterday! #NieWiederRechts act of arbitrary justice against the AfD http://www.freiewelt.net/news/akt-der-willkuerjustiz- Gegen-die-afd-10068841/…
Poersch nominated again shz.de http://www.shz.de/lokales/ostholsteiner-anzeiger/poersch-erneut-nominiert-id15085851.html…
Probably in paradise https://twitter.com/doppelgeist60/status/786800999071559681…
"Nobel Prize for Literature for Bob Dylan, scandal chronicle in Saxony, headlines like autumn leaves. Nice Friday ;-)"
Yesterday when Regina Poersch was nominated as a candidate for the state parliament. Then back to Berlin this afternoon. Base meeting of the SPD left.
Good morning from Bordesholm. Landtag plenary III. today with debates on animal protection and upper grades at community schools.
Bob Dylan - Don&#39;t Think Twice It&#39;s Alright My Nobel Prize music tip for you out there in digital orbit ;-) https://youtu.be/yZPh3hpxLKs
The assessment of the Karlsruhe judgment https://twitter.com/johannesvogel/status/786641730456133632…
Mostly still almost euphemistic - the man urgently needs specialist help against his delusions. https://twitter.com/kahrs/status/786635573884776448…
"Unfortunately, this is incredibly foolish! https://twitter.com/johannesvogel/status/786596371398856704…"
Good mood in Plön - we win the constituency! https://twitter.com/martinhabersaat/status/786637561028640769…
Good mood in Plön. https://twitter.com/martinhabersaat/status/786637561028640769…
Decades of CDU dominance in Saxony apparently not only caused a political twist to the right but also a swamp of the rule of law.
Good morning from Bordesholm. Leipzig: terrorist suspect died in detention cell. Saxony&#39;s police and judiciary in permanent political scandal mode.
Paul Simon - Slip Slidin &#39;Away + lyrics My music tip for you out there in digital orbit ;-) https://youtu.be/5_H-LY4Jb2M
Social market economy? CDU &amp; FDP: None. Business is there for people - not the other way around! Coastal coalition does good work.
Same wages for men and women with the same work? Not with the FDP in the state parliament. This is what the bureaucracy for companies calls.
Pirates reject the parental leave law in the state parliament. # incredibility
"What the Wahl-O-Mat has to offer 😉 Some sit at the cash register, others take care of social housing ;-) pic.twitter.com/Dbc2M7p0s6"
Today plenary session of the state parliament (1) with current hour on transport policy and general debate on integration policy. Nice Wednesday ;-)
Good morning from Bordesholm. Yesterday evening traditional reception of the state press conference - as always with all the news and ducks 😎
Jacques Brel: Les Bourgeois My music tip for you out there in digital orbit ;-) https://youtu.be/dCHi5apc1lQ
EILT ++ EILT SH CDU campaign campaign. Every CDU election campaigner&#39;s favorite is sensational election advertising. Black box office instead of red class. pic.twitter.com/HomDxn3IkG
"Usually shortly after those ""I am the greatest"" outbursts, a good doctor arrives to pass out the medicine.
A couple of pills...you calm down https://twitter.com/realdonaldtrump/status/785854588654092290 …"
"Real public welfare does not arise through aggressive exclusion but through diversity, tolerance and common basic values that apply to everyone!"
Why does the political right in Germany need scapegoats again and again? This WE (= different from DIE) is no good. Real WE is diversity!
"Syrian refugees have made it possible to arrest a terrorist suspect. Instead of thanks from Saxony&#39;s interior minister, general suspicion a la CSU."
It was something like that ;-) Giels - Chronik | Facebook https://www.facebook.com/Giels/videos/10154481709327674…
A really good plan 😀 https://youtu.be/lesuDcxitg8
Commentary on the 2nd US presidential debate is clear: Donald Trump is unqualified for the presidency in every respect.
In the evening the annual reception of the state press conference. Have a nice Tuesday ;-)
Aha - very interesting 😎Schuer and Söder again easy on cuddling course to the CDU - WELT https://www.welt.de/regionales/bayern/article158633233/Scheuer-und-Soeder-wieder- Leicht-auf-Schmusekurs-zur-CDU. html…
Interview with SPD Vice Ralf Stegner: Two against Angela Merkel - Politics - Tagesspiegel http://www.tagesspiegel.de/politik/spd-vize-ralf-stegner-im-interview-zwei- Gegen-angela-merkel/14659760. html…
Hmmmmm ...... https://twitter.com/welt/status/784710960833593345…
"Stegner: Protection of the constitution should observe AfD | NDR.de - News - Schleswig-Holstein http://www.ndr.de/nachrichten/schleswig-holstein/Stegner-Verfassungsschutz-soll-AfD-beobachten-,rgsh182.html…"
Ineligible guy! Donald Trump: Video with vulgar comments about women surfaced - Politics - FAZ http://m.faz.net/aktuell/politik/donald-trump-video-mit-vulgaeren-bemerkungen-ueber-frauen-aufgetaucht-14471612.html# GEPC; s30…
Warm greetings from the north 😀
Good luck to you and warm greetings to the comrades! https://twitter.com/soenkerix/status/784625717418090497…
Have a nice Weekend ;-)
"Congratulations to @stonie_kiel, who was able to assert himself yesterday in Kiel in an exciting candidate field for the nomination of the Bundestag."
Nomination of the candidates for the 3 constituencies in the Hanseatic city. My colleagues Rother and Baasch also come back there.
Good morning from Bordesholm. Market before breakfast. Go straight to the SPD district party conference in Lübeck.
Status Quo - Something &#39;Bout You Baby I Like / Rain My music tip for you out there in digital orbit ;-) https://youtu.be/RAG1nLVdOmU
Incredible - solidarity with the SPD in Bocholt! https://twitter.com/tagesschau/status/784414449461518336…
New AfD member Fest: &quot;Dangerous to the state or just stupid&quot; http://www.handelsblatt.com/politik/deutschland/afd-neumitlied-fest-staatsgefaehrdend-oder-einfach-nur-daemlich/14656294.html…
Chronicle photos https://m.facebook.com/DukeStRollins2.0/photos/a.549705105195824.1073741832.549421291890872/657520184414315/?type=3…
Later preparations for the state election campaign. Meeting of the state board and regional conference on the election program in Neumünster.
Fight or ignore AfD: Politicians about dealing with right-wing populists http://www.abendzeitung-muenchen.de/inhalt.debatte-ueber-rechtspopulisten-einfach-rechts-lieg- Lassen-ueber-den-umgang-mit-der-afd. 04faad32-5433-4fb7-ac90-bc2c65613f7a.html…
Desperate Popular Front from CDU to Left Party wants to overthrow Lübeck Mayor Bernd Saxe - without content to power? Look more times😎
Congratulations to Birte Pauls on the nomination in her constituency. pic.twitter.com/LyeIUQDbyL
Union MPs are campaigning more and more openly for cooperation or even coalition between the CDU / CSU and right-wing populists of the AFD.
Good morning from Bordesholm. Today various appointments in the Kiel State House. Nice Wednesday ;-)
Sha Na Na ~ At the hop My music tip for you out there in digital orbit ;-) https://youtu.be/dXijehacxgw
Rather stupid https://twitter.com/hillaryclinton/status/783382982463631360 …
Strong vote for my colleague Birte Pauls at the SPD nomination conference for the state constituency in Steinfeld.
Congratulations from the neighborhood too! https://twitter.com/manuelaschwesig/status/783329929089978368…
He is right! Martin Dulig: &quot;Pegida is a hate sect&quot; | MDR.DE http://www.mdr.de/nachrichten/politik/regional/dulig-bezeich-pegida-als-hasssekte100.html…
Have a nice Tuesday ;-)
Later regional conference of the SPD regional association in Rendsburg on election program. In the evening at my colleague Birte Paul&#39;s nomination conference.
"Good morning from Bordesholm. After the extended birthday and holiday weekend, faction and coalition committees in Kiel again today."
The Nitty Gritty Dirt Band - Mr. Bojangles My music tip for you out there in digital orbit ;-) https://youtu.be/j3YMyW0SqmU
What is there https://twitter.com/peter_simone/status/783014912985563136…
To judge this as a lack of historical knowledge would be a euphemism. https://twitter.com/jungerkollege/status/782996718417801216…
Colorful instead of brown! Brown is really nice ..... color. German unity with diversity instead of division through rabble simplicity! No to Pegidiotes!
Don&#39;t bury it but make it clear to those who roar in their stupid delusion &quot;We are the people&quot;. https://twitter.com/tagesschau/status/782929493174448128…
Indeed! https://twitter.com/konstantinnotz/status/782942971884961798…
"Well, Mrs. Klöckner and now? Where do you always appear on the morally high horse towards the SPD in Rhineland-Palatinate ?! https://twitter.com/sz_topnews/status/781947182161268736…"
Congratulations and all the best to today&#39;s birthday kids Klaus Wowereit and @tsghessen 😀🎂!
"Congratulations on the 80th birthday to Inge Wettig-Danielmeier, our committed politician and longtime treasurer of the SPD!"
The HSV is traveling for the first time under the leadership of the new coach Markus Gisdol to Hertha in Berlin. TOI Toi Toi! Nice (long) weekend ;-)
Good morning from Bordesholm. Market before breakfast. Later to the ceremony in Eutin: Schleswig-Holstein celebrates its 70th birthday.
The Rolling Stones - Waiting On A Friend - OFFICIAL PROMO My music tip for you out there in digital orbit ;-) https://youtu.be/MKLVmBOOqVU
Refugees in the Mediterranean: SPD open to de Maizières North Africa idea - WELT https://www.welt.de/politik/deutschland/article159295748/Kann-Europa-so-das-Fluechtlingssterben-auf-See-beenden.html…
"Very interesting reading! Andrew Sullivan: Trump, America, and the Abyss http://nymag.com/daily/intelligencer/2016/11/andrew-sullivan-trump-america-and-the-abyss.html…"
The man is right! https://twitter.com/ard_bab/status/795277410929377281…
"Stegner motivates the comrades in Niederfüllbach http://www.infranken.de/regional/coburg/Stegner-motiviert-in-Niederfuellbach-die-Genossen;art214,2310468…"
That&#39;s the way it is! https://twitter.com/rasmusandresen/status/795266846081613824…
The politically black don&#39;t understand anything either and prefer to pander to the right-wing populists! https://twitter.com/hpfriedrichcsu/status/795261133242466304…
SPD Vice Ralf Stegner - Eternal Junior Partner or Red-Red-Green? http://www.deutschlandradiokultur.de/spd-vize-ralf-stegner-ewiger-juniorpartner-oder-rot-rot.990.de.html?dram:article_id=370479…
The campaign machine is never fed up Politics &amp; Communication http://www.politik-kommunikation.de/ressorts/artikel/die-wahlkampfmaschine-ist-niemals-satt-962974214…
Good morning from Bordesholm. Wet and cold November morning. HSV swatter on Uwe Seeler&#39;s day of honor. Happy Sunday too ;-)
Udo Lindenberg - Through the difficult times (official video) My music tip for you out there in digital orbit https://youtu.be/hgwytOPOR5E
Congratulations from the north 👍 https://twitter.com/martinhaller/status/794865678633336832…
Herbert Hofmann honored with the Georg-von-Vollmar medal of the Bayern SPD. pic.twitter.com/xOxXTNw4jO
"TSG everywhwere 😉
@tsghessen pic.twitter.com/VK03kcEm4s"
House of Representatives election - SPD is smaller than ever before in Berlin http://www.deutschlandradiokultur.de/abhabenhaus-wahl-spd-ist-so-klein-wie-nie-zuvor-in.2165.de.html?dram : article_id = 366214…
Schleswig-Holstein - Political scheming stadium on the Kiel Fjord http://www.deutschlandradiokultur.de/schleswig-holstein-politisches-intrigantenstadl-an-der.1001.de.html?dram:article_id=370418…
Ahrensburg - Ralf Stegner happy about the nomination of social democrat Nina Scheer - LN - Lübecker Nachrichten http://m.ln-online.de/Lokales/Stormarn/Ralf-Stegner-froh-ueber-Nominierung-von-Sozialdemokratin-Nina-Scheer…
Comments https://m.facebook.com/story.php?story_fbid=1592367300790482&amp;id=100000516836162…
Have a nice Weekend ;-)
Congratulations on Uwe Seeler&#39;s 80th birthday. Hopefully a good omen for the HSV home game against Borussia Dortmund.
Interview with Deutschlandradio. I then honor Herbert Hofmann with the Georg von Vollmar medal. Then back to SH.
Good morning from Coburg. Yesterday evening a nice event with the SPD in the Coburg region. Today on to Nuremberg.
Frankie Gaye And Kim Weston - It Takes Two My music tip for you out there in digital orbit ;-) https://youtu.be/4-zzW6Ytv0M
"New press Coburg | SPD wants to lead next federal government http://www.np-coburg.de/lokal/coburg/coburg/SPD-will-naechste-Bundesregierung-fuehren;art83423,5185694…"
At the SPD in Coburger Land. pic.twitter.com/GFCbQQnTZB
Chronicle photos https://m.facebook.com/SPD/photos/a.73469452748.75861.47930567748/10154073612567749/?type=3…
Angela Merkel does not come to the CSU party conference. Maybe the cronies Orbàn + Höcke? The secretary&#39;s stupid rhetoric would fit.
"CSU: &quot;Left turn, red-red-green electoral fraud and political Islam&quot;. Scheuer &amp; Co. recognizable in the AFD &amp; Pegidioten sound. #CSU not governable!"
Good conversation with Hans-Jochen Vogel in Munich. It is always impressive to learn from his experience. pic.twitter.com/BPg85C18ye
Why should she? Condition in the Koa contract was: 1. Compatible with European law 2. No additional burden for German drivers - 3. Additional income https://twitter.com/rdk_bxl/status/794446640732078080…
CSU against &quot;shift to the left and political Islam&quot;? It&#39;s more about a shift to the right in Germany and a lot of things from Scheuer &amp; Co. is politically infamous. https://twitter.com/flueke/status/794420265518333953…
"Lindau: Ralf Stegner makes a detour to Lindau http://www.schwaebische.de/region_artikel,-Ralf-Stegner-macht-Abstecher-nach-Lindau-_arid,10556742_toid,441.html…"
Nice Friday ;-)
"Later it continues to Coburg. Editorial visit to the Neue Presse, a visit to the company and the evening event at the SPD."
"Today we continue to Munich. There I am looking forward to meeting Hans-Jochen Vogel, who also received this honor."
Good morning from Lindau. Yesterday a nice evening in Lindenberg at the awarding of the socialist hat by the SPD district association Lindau.
Great support for a great candidate! https://twitter.com/martinhabersaat/status/793540122818076672…
From the regional conference of the SPD in Lübeck to the nomination conference of my SPD colleague Nina Scheer in Schwarzenbek.
NDR reports on crisis of the North CDU. KV Nordfriesland criticizes back room policy. You are fed up with staff quarrels.
not literally - we northern lights are much too peaceful for that ;-)
Congratulations to the newly elected Prime Minister of Mecklenburg-Western Pomerania Erwin Sellering!
&quot;You only created top candidates + list 3 months ago.&quot; &quot;Nonsense - nobody buys this ancient junk.&quot; #Everything must Go
"Before the Bundestag election, neither Merkel attended the CSU party conference nor Seehofer visited the CDU party conference. Unity in the Union - running. 👍"
Please Come To Boston My music tip for you out there in digital orbit ;-) https://youtu.be/UDRLZFgEoGw
Cabal and love at the Nord Union 😉 Von Boetticher misses loyalty - Pinneberg - Hamburger Abendblatt http://www.abendblatt.de/region/pinneberg/article208623795/Von-Boetticher-vermisst-die-Loyalitaet.html…
"Ex-country chief + ex-candidate de Jager (also Eckernförde) also failed because of the state parliament entry, CDU Rochade has just clearly criticized."
CDU list revision could be bitterly necessary: We want to (also) win Eckernförde constituency and defeat it with Serpil Midyatli Günther.
Colleague Günther wants to scramble legal CDU country lists that have just been decided. Amber throws chunks at him.
"In the neoliberal zeitgeist, Ms. Koch (FAZ) criticizes agreement at Kaiser&#39;s Tengelmann. Sigmar Gabriel and the SPD on the side of the workers."
Happy Tuesday - make something out of it ;-)
In the evening SPD regional conference in Lübeck on the government program. Later in Schwarzenbek my colleague Nina Scheer&#39;s nomination conference.
Good morning from Bordesholm. Today faction and coalition committees in the Kiel State House. Good job for SH while heads roll at Union.
Alphaville - Forever Young Music Video (HD / HQ) My music tip for you out there in digital orbit ;-) https://youtu.be/A8FeNJ2nJfk
Sigmar Gabriel&#39;s efforts against market-radical and conservative criticism for thousands of jobs at Kaiser&#39;s Tengelmann have paid off!
"Polite wording, but he sizzles quite a bit .... Somehow better to take care of good politics like the coastal coalition does! https://twitter.com/harms_lars/status/793104082378579968…"
"Today on to Boston, where I have various appointments. Visit to the Boston Globe. Then to the Kennedy School of Government."
"What&#39;s new about it? They always want that, so they have to look for other partners. SPD does not want to fight the causes of flight, not refugees. https://twitter.com/sz_topnews/status/792728401752813569…"
Hamburg
Hour
"Good morning from Munich. After returning from the USA, we are waiting for the connection to Hamburg. Have a beautiful Sunday ;-)"
Elton John &amp; George Michael Don&#39;t Let The Sun Go Down On Me My music tip for you out there in digital orbit ;-) https://youtu.be/ljyt9_TFZd4
"Logan Airport Boston. Goodbye Boston, Farewell USA."
»We need a block of progressives who put pressure on the leadership« «LuXemburg magazine http://www.zeitschrift-luxemburg.de/wir-brauchen-einen-block-von-progressiven-die-druck-auf-die- leadership-exercise /…
Discussion with German students from the Kennedy School of Government at Harvard University and from MIT. pic.twitter.com/VwJDWvzsYp
Have a nice weekend in Germany or wherever you may be ;-)
In the evening a discussion with German students from the Kennedy School of Government and MIT.
Yesterday interesting conversations again at the Boston State House and at Harvard University. Plus an editorial visit to the Boston Globe.
Here the campaign between Hillary and Trump goes into the last round. in SH the CDU is kicking out its top candidate shortly before the elections.
Good morning from Boston. Last day of my trip to the USA before heading back to Hamburg via Munich this evening. Many exciting impressions.
Electric Light Orchestra - Calling America (HQ STUDIO / 1986) My music tip for you out there in digital orbit ;-) https://youtu.be/4t_PHcHBVhg
Back at the Kennedy School of Government at Harvard University. Was a great time here! pic.twitter.com/3mMgFuDtBv
No matter who gives the front man for the CDU: SPD is fighting to become the strongest force in SH and to continue a successful coastal coalition.
"Nord CDU exchanges its top candidates a few months before the state election. Old content, new hat. CDU unable to govern."
"Carstensen, deJager, from Boetticher, Böge, Liebing and now Günther ?! I am looking forward to the No.6 of my CDU colleagues."
Clear choice for America: Clinton or Trump: Whoever brings Ohio wins the election forward http://www.vorwaerts.de/artikel/clinton-trump-ohio-holt-gewinnt-wahl…
Nice Friday ;-)
Looking forward to returning to Harvard University and meeting Eerie Meyer and discussing with the McCloy Scholars.
"Good morning from Cleveland. Yesterday&#39;s exciting day with interesting appointments, front door election campaign, discussion with volunteers and students."
"Crosby, Stills, Nash &amp; Young Ohio 1970 Kent State University My music tip for you out there in digital orbit https://youtu.be/68g76j9VBvM"
Discussion at Baldwin Wallace University about the German perspective on the US elections. pic.twitter.com/Rr6uluyhvn
Nina Turner calls the influence of money in US politics &quot;legalized bribery&quot;.
Nina Turner is now there too - very impressive representative of the Progressive Caucus in Ohio and beyond.
Discussion with Bernie Sanders supporters about the oversized role money plays in the US election campaign.
Visit to the Progressive Caucus. Bernie Sander&#39;s campaign &quot;Feel the Bern&quot; made a big difference: Democrats focus much more on justice.
Impressive involvement of the numerous volunteers for Hillary Clinton in the presidential election campaign.
Ring the doorbell in Cleveland to support Hillary Clinton and the Democrats 👍 pic.twitter.com/kSq7cCvdhe
Dieter Paus has been loyal to the SPD for 50 years - Gunzenhausen - nordbayern.de http://www.nordbayern.de/region/gunzenhausen/dieter-paus-ist-der-spd-seit-50-jahren-treu-1.5571009?rssPage = R3VuemVuaGF1c2Vu…
Now it starts - ring the doorbell for Hillary 👍 https://twitter.com/alex_schweitzer/status/790569384867758081…
Breakfast with Judge Ellen Connally. Good discussion about campaign issues. pic.twitter.com/J3gJpHYPjg
Nice Monday ;-)
At Baldwin Wallace University we meet College Democrats + Republicans and compare election perspectives from a US and German perspective.
We meet volunteers from the Hillary Campaign. Also the Progressive Caucus and &quot;Black Lives Matter&quot;.
"Topics today are the police, the judiciary and the situation of African-Americans. Then labor market policy in this difficult industrial region."
Good morning from Cleveland. Interesting discussion yesterday evening about the state of the presidential campaign here in the USA.
"Don McLean - Vincent (Starry, Starry Night) With Lyrics My music tip for you out there in digital orbit ;-) https://youtu.be/oxHnRfhDmrk"
Back in Cleveland. Tonight discussion with Prof. Paul Beck and journalist Andrew Tobias about &quot;Ohio picks Presidents&quot;.
Conservatives and market radicals want trade deals at all costs. Socialists want fair trade with good rules and standards.
A skunk remains a skunk no matter how you name it. The fact that the Tagesschau no longer wants to call AFD right-wing populist doesn&#39;t change anything.
"The lunatic is on the grass .... the lunatic is in your head .... poor black youth, Mr. Scheuer has clouded the brain .... https://twitter.com/floriangathmann/status/788645719032926208…"
I&#39;ll be right there. Greetings to the great chairman of the strong Hesse SPD 😊 https://twitter.com/gertuwemende/status/788661049113321472…
"The direction is right and if we work hard until election day, the coastal coalition will be successful! https://twitter.com/wahlrecht_de/status/788657459611201536…"
Discuss with Andreas Speit about his book &quot;Bürgerliche Scharfmacher&quot; and right-wing populism at the Frankfurt Book Fair.
Prominent speaker - brisk and provocative on the road - Freising - Süddeutsche.de http://www.sueddeutsche.de/muenchen/freising/prominenter-redner-flott-und-provokant-unterwegs-1.3211020…
Union is doing everything it can to ensure that we in SH relieve parents of high daycare fees. We&#39;ll see each other again on election day. https://twitter.com/kn_online/status/788611983809601536…
For the fourth time in a row: Schleswig-Holsteiners are the happiest Germans. 4 years coastal coalition ..... A rogue who ....... 😀
Putzig: All of CSU General Scheuer warns of a &quot;left front&quot;. That says the man who speaks like the right-wing populists Höcke &amp; Co. 🤔
Later back to Schleswig-Holstein. Nice Wednesday ;-)
Then it&#39;s off to Frankfurt for the book fair. Tour and discussion about how to deal with the political right in Germany.
Good morning from Donauwörth. Yesterday nice 125th birthday party at the SPD in Oettingen. Radio interview about red-red-green.
The Spotnicks - If you could read my mind My music tip for you out there in digital orbit ;-) https://youtu.be/zhMswet4Txc
125 years of the SPD in Oettingen. Was there as a guest speaker - nice festive event in the cinema. pic.twitter.com/rCE62xHfOY
"Seehofer invites Orbàn, Merkel doesn&#39;t. SPD is holding talks with the Greens and the Left Party. Late autumn in the GroKo 😂"
"After returning from Brussels to Nuremberg, the SPD&#39;s 125th birthday is now in Oettingen."
No revolution without heavy drinking 🍺🍻🍻🍺 https://twitter.com/sturmdaniel/status/788402348855099396 …
"Good morning from Berlin. Today, the SPD management bodies meet in the Willy-Brandt-Haus. Later on to two events in Munich."
Ozzy Osbourne - &quot;Dreamer&quot; My music tip for you out there in digital orbit ;-) https://youtu.be/LCCiwPEdEpg
"I already know that Gladbach has a new stadium, but I thought it was at the old location - I learned something again 😉"
"""The lunatic is in my head"" (Donald Trump) https://twitter.com/realdonaldtrump/status/787699930718695425 …"
Have a beautiful Sunday ;-)
"My stations today are Hanover and Berlin, from there full days with appointments in Munich, Brussels, Nuremberg + Frankfurt and 10 days in the USA."
"Hard-fought, happy in the end, but still deserved points from HSV on Gladbacher Bökelberg. Now it will go up. #only the HSV"
"Good morning from Bordesholm. After the successful two-day basic conference of the SPD Linken in Berlin, we are going into program work"
Hildegard Knef Extra Wide It should rain red roses for me My music tip for you out there in digital orbit ;-) https://youtu.be/KpDYEihRXvs
After a surprising Gauck push | Would a Muslim President be good for Germany? - Politics - Bild.de http://www.bild.de/politik/inland/bundespraesident/waere-ein-muslimischer-bundespraesident-gut-fuer-deutschland-48293440.bild.html…
