wishes a lively Friday ;-)
Good morning from Bordesholm. The terrible plane crash over the French Alps determines all news and thoughts.
#nurderHSV let&#39;s go guys! Home win against Hertha! 😀
@ Doppelgeist60 The SPD rocks 😉
Violence is impossible - whether in Frankfurt or anywhere else!
wishes everyone the Wednesday they deserve ;-)
@spd_gerd Thanks!
Thank you for congratulations on my re-election as SPD state chairman in Schleswig-Holstein!
Off to the SPD State Party Congress in Neumünster #SPDSH
In the evening again for the political Ash Wednesday of the North SPD to Marne. Happy Wednesday everyone ;-)
"wishes you, HSV in Hoffenheim and us in Neumünster a nice weekend ;-)"
"TTIP and CETA must not undermine politically desired regulation, says Sigmar Gabriel."
Hopefully there will be an agreement in Minsk today to stop the dangerous escalation of the Ukraine crisis.
@ulfposh Fulminant! 😊
wishes everyone a nice Sunday ;-)
Come from the New Year&#39;s reception of the SPD in Heide. It continues to the SPD in Tangstedt.
Former New York governor Mario Cuomo has died. A brilliant speaker and progressive democrat!
@spd_gerd good luck! SPD Mayor for my hometown!
wishes everyone a nice Sunday ;-)
"Dobrindt is already whistling in the basement when he thinks about the EU compatibility of his international toll + Brussels, so dear Rossmann, we&#39;re still there!"
wishes everyone the best Tuesday of this week ;-)
@HolgerMuthig Do you know what? You can see me .....
@petertauber The only thing that is miserable in Bremen is what the Bremen CDU has done so far.
"When it comes to minimum wages, the SPD cannot be fooled. You can rely on us pillion! https://www.facebook.com/SPD/posts/10152801570437749…"
What I wanted to say ...... https://www.facebook.com/ralf.stegner/posts/860146214051583…
Strengthen the foundation - let&#39;s get started! Forward with the SPD! http://youtu.be/FLic09rvq6E
"With equal pay for men and women, regulation of temporary and agency work, solidarity pension, etc., there is still social democracy waiting!"
"@petertauber @RobertRossmann Nice experiment, colleague. If you come across as haughty, the banana peels are already available 😉"
Congratulations on your milestone birthday to the parliamentary group colleagues and Kiel district chairman Jürgen Weber!
"In the evening, the party council elected at the SPD state party conference is constituted as a decision-making body between the party conferences."
Good morning from Bordesholm. The last day of March in the north starts with snow. Today parliamentary and coalition bodies in the state house.
Paul McCartney Lady Madonna Live Montreal 2011 HD 1080P This is my music tip today - happy Tuesday ;-) http://youtu.be/HURqswGX-38
"Federal-state finance, TTIP and data retention are certainly not done in a black manner - nowhere is the CDU majority without the SPD."
@_drsarkozy always 😀 successfully completed the round of skating?
@HolgerMuthig Get well soon! Maybe you should think about adjusting your daily dose!
"@DrSiHansen In the end what counts is what comes out at the back - at least the cabbage was right, so wait and see when it comes to tolls - I&#39;m relaxed😉"
@AKDigiGes in Munich there is already evidence-based evidence of the plausibility of this thesis.
Rauschi is always on duty - area maintenance. # Crime scene # Keel
"Rossmann&#39;s defeatist commentary in the SZ on the situation of the SPD, the EU will decide that with Easter, Christmas and the toll. Wait!"
Good morning from Bordesholm. Weather-wise there is a lot of room for improvement. Start of the week with numerous talks and office appointments.
Van Morrison - What&#39;s wrong with this picture? This is my music tip for you today - good start to the week ;-) http://youtu.be/u23TarZQ5f8
What about Lassie now? Last question. Last tweet. # Crime scene # Keel
Now what? A right to love? A right to live? We also had good times together. Hmm. I couldn&#39;t have killed him. # Crime scene
I know more about such things than you do. I believe that. # Crime scene # Keel
I&#39;ll call you a taxi now and then sleep off your noise ..... # crime scene # keel
Rauschi - the lying - is a victim. That is the truth little neighbor. It was crappy. # Crime scene # Keel
Rauschi&#39;s murderous area care # crime scene # Kiel
Do you know what i believe? You don&#39;t want to solve the case at all. Oh how honest! He denies his motive for murder. # Crime scene # Keel
"Old man, wrestling is a kind of sport !! Hmmm .... North Frisian tradition ...... # crime scene #Kiel"
"Are you a little neighbor? Deal! Let&#39;s see what you&#39;ve learned so far, little neighbor. # Crime scene # Keel"
"When the Gaarden read, they don&#39;t even answer. Is that true? # Crime scene # Keel"
"The game is now called: I ask - you answer! We&#39;re not in vain here. That costs ten, Borowski. # Crime scene # Keel"
I have a colleague who finds everything that is floating around on the web # crime scene # keel
"Don&#39;t let any crap tell you - Rauschi, Knacki her - # Tatort #Kiel"
The video disappears from the net! Clear? So that&#39;s what you call open-ended determination ?! # Crime scene # Keel
The boss had the situation under control and then we are on. Like in real life 😉 # crime scene # keel
"On the way to NRW. First stop today: Frechen, where I support our SPD mayor candidate Ferdi Huck in the election campaign."
"Hey Hey Hey little neighbor - now relax. I looked at your personnel file. Watch out, little neighbor! # Crime scene # Keel"
Rule number 1 in Gaarden. You can either do everything wrong or completely wrong. There isn&#39;t really anything here in #Tatort #Kiel
What about Lassie? That is really the question of the questions in #Tatort #Kiel
Midnight Train To Georgia - Gladys Knight &amp; The Pips with lyrics My music tip for you today. Have a nice Sunday ;-) http://youtu.be/meaVNHch96o
"Congratulations to Lars Winter, the old and new SPD district chairman of Ostholstein!"
@martinhabersaat Let it burn! Happy 11th birthday- a ghost is going around in Wentorf ....... 😉
We Social Democrats are probably more of a public welfare party - classic clientele parties are really completely different!
He has head lice. That comes from touching children. # Crime scene # Keel
Why do I have it on my back again? Did the day care center burn down? # Crime scene # Keel
You haven&#39;t found the button yet? If you want I can help you find it. # Crime scene # Keel
I had pimples and you were &quot;the legend&quot; #tatort #Kiel
Life is complicated. # crime scene # keel
Rauschis Revierpflege Variant 2. # Tatort #Kiel
@kn_online Yep ;-)
@Aye feast switch on of course 😉
"Congratulations to Jörg Weber, the new mayor of Fehmarn - and of course he comes from the SPD!"
A man has to do what a man has to do ?! You are the Rauschi expert. Mr. Borowski? Present. # Crime scene # Keel
"@ArminLaschet @JuliaKloeckner Collective bargaining, minimum wages or employee-friendly co-determination laws never exist with black people!"
@JuliaKloeckner What else? They already know that Union governments have nothing to laugh about.
"@HugoMuellerVogg @ulfposh I didn&#39;t even mention the children - even clientele, although they are not allowed to vote ?!"
"@HugoMuellerVogg @ulfposh workers, women, pensioners, refugees - our clientele? Or rather sovereign in democracy ?!"
"@HugoMuellerVogg @kahrs @ulfposh Not much respect for the maturity of the citizens, what ?!"
@ Mayday18568706 @HugoMuellerVogg @ulfposh mischief. Whoever keeps what he promised before the election does what credibility in politics!
Does anyone know how Dody Riggs is and where she is? She used to be in charge of the McCloy program and it is her birthday today. Happy Birthday!
@_drsarkozy Always good cards 😉
"&quot;Purpose-based user financing&quot; - also linguistically no CSU luck, then bad luck was added. Here, the lederhosen don&#39;t think of the laptop."
Smart comment by Detlef Esslinger &quot;breach of trust&quot; in the Süddeutsche Zeitung. You rely on others a thousand times a day.
"@ulfposh comments in the WELT (&quot;Are you serious?&quot;) the CSU foreign toll as &quot;more lederhosen than laptop&quot;. In any case, he is right 😉"
"I said that car tolls come when Christmas + Easter are merged. Easter is soon, EU😉 decides on Dobrindt&#39;s Christmas present"
"Wait: Easter is coming soon, Dobrindts Christmas mail is coming from Brussels 😉 Nobody has the intention .. Thuringian General http://www.thueringer-allgemeine.de/startseite/detail/-/specific/Die-Meinung-N nobody-hat-die- Intent-1091361102…"
Elect Jörg Weber and the SPD on Fehmarn on Sunday! https://www.facebook.com/winter.lars/posts/10200350869051415…
@LarsWinter Greetings from Cologne to the strong Ostholstein SPD and the comrades. Good district party congress!
"Good morning from Siegburg. Yesterday OB election campaign tour in Frechen and Swisttal, in the evening at the SPD grated cake dinner in Lohmar - back to SH."
"Schubert, Symphony No. 8h minor &#39;Unfinished&#39; Georg Solti, Chicago Symphony Orchestra My music tip today http://youtu.be/1-p58OSYhG0"
Terrible tragedy in the Alps. Mourning for the victims of the plane crash of the German Wings plane and sympathy with relatives. # 4U9525
Good SPD campaign: single parents are the heroes of everyday life http://alleinerziehende.spd.de/
Good work and good mood. This afternoon a visit to the SOS Children&#39;s Village in Lütjenburg. Happy Tuesday everyone ;-)
Second day of the exam of our SPD parliamentary group. Yesterday discussion on key issues for the period leading up to the 2017 elections.
Good morning from Hohwacht on the Baltic Sea. My music tip today: Reinhard Mey - &quot;What a lucky man you are&quot; http://open.spotify.com/track/4MGVOCzTlYvp3FtvaUnQq1…
Loaaangweilig: Sozen-Bashing http://frank-stauss.de/index.php/laaaaangweilig-sozen-bashing/…
@DeisterEdith @_drsarkozy apparently the effects of the pills have waned. #Mitleidtweet
@_drsarkozy always a pleasure ☺️
"Good morning from Bordesholm. First to the Kiel office, later two-day faction exam in Hohwacht. Have a nice start to the week ;-)"
Music tip today: &quot;Supertramp-Take the long way home&quot; http://open.spotify.com/track/35AbyzzMB2T6YtUjJ5lgoa…
@ u98 @Torgator @Heiner_Garg Your explanations say more about yourself than you may think - definitely more than you would like!
@JuergenJoost The SPD least needs any instruction from right-wing populists. We face AFD Ungeist resolutely!
"Nice celebration of 150 years of SPD Pinneberg: Willy Brandt Medal for Dietrich Anders, exhibition, work music, contemporary witnesses."
Shameful stupidity in Angela Merkel&#39;s party Chronicle Photos - Young Union of Germany | Facebook https://www.facebook.com/jungeunion/photos/a.73184807293.72037.46098347293/10152600547942294/?type=1&amp;pnref=story…
Good morning from Bordesholm. Beautiful spring day. Just like the 150th anniversary of the SPD Pinneberg. Great democratic story!
CAT STEVENS - &quot;Morning Has Broken&quot; This is my music tip for you today ;-) http://youtu.be/GXWI6ISkzlI
Good morning from Bordesholm. Tragedy of HSV yesterday against Hertha. Rainy market before breakfast. Have a nice Weekend ;-)
Stefan Waggershausen - I Shoot You The Stars This is my music tip for you today ;-) http://youtu.be/DHIEDq7SC8A
@ Doppelgeist60 @Volker_Beck @peteraltmaier The political competition in the 140 class is after all more original and amusing than usual 😉
"Interior ministers were not convinced by alleged opposition arguments, but responsibility to avert the damage caused by the debate."
"Even in a press release after an honorable decision by Interior Minister Studt, the opposition leader has to spread brazen falsehoods."
wishes everyone the Friday they deserve ;-)
"The eclipse has obviously already influenced the morning press: factual errors, sloppy research, vain + self-righteous evaluation of politics."
"Good morning from Bordesholm. Landtag 3rd day with inheritance tax debate and teacher salary, among other things"
Electric Light Orchestra - Calling America This is my music tip for you today ;-) http://youtu.be/iw3MEWrf3yE
Electric Light Orchestra - Calling America This is my music tip for you today ;-) http://youtu.be/iw3MEWrf3yE
@ernst_klaus mobil.stegner@spd.de
There are speakers who manage to effortlessly overcome any intellectual pain barrier on a regular basis.
Not at all! The level of the messages is self-directed. “@DerBruesseler: I&#39;m curious how @Ralf_Stegner will counter the two PMs.”
"@ fronk23 Humor is great, witty wit, downright delightful, but we&#39;re not talking about that here, are we?"
"Otherwise, the Bundestag election campaign shows how successful such poses are. As Gaudi or a là Effenberg on the soccer field - for my part."
&quot;Live long and in peace!&quot; Vulcan greeting - tweeted a few days ago by Leonard Niemoy.
People really have other concerns than debate about the authenticity of outstretched fingers. Banalization + trivialization solve no problem!
Today we go back to Kiel. Parliamentary session continues with discussion about data retention. Happy Thursday everyone!
"Good morning from Berlin. Yesterday evening with Anne Will on ARD discussed poverty and wealth, inheritance tax and justice."
Deep Purple - Smoke On The Water (Live At Montreux 2006) This is my music tip for you today ;-) http://youtu.be/arpZ3fCwDEw
Happy birthday to Egon Bahr!
"Booming stock exchange today, great legacies - Are only the rich getting richer? | The First - Anne Will Archive https://daserste.ndr.de/annewill/archiv/Boomende-Boerse-grosse-Erbschaften-Werden-nur-die-Reichen-immer-reicher,thema124.html…"
Appointments in the federal capital and back in the evening. Nice start to the week for you - make something of this week ;-)
"Good morning from Bordesholm. After the SPD state party conference at the weekend, which is widely and mostly well reported, it goes to Berlin."
Hot Chocolate - Every 1&#39;s a Winner (1978) HQ My music tip for the SPD state party conference from the weekend - for the media ;-) http://youtu.be/JQsg6XXGxXQ
@EvaHoegl Thank you and best regards ;-)
Good state party conference of the SPD in Neumünster ended. Family. Rest Sunday. Nice.
"Sigmar Gabriel with encouraging, confident speech - good mood at the party evening. Happy Sunday everyone ;-)"
Good morning from Neumünster. State party congress of the SPD will continue after a good start yesterday. I look forward to the strong board team!
Very nice ceremony for the 150th birthday of Louise Zietz in the small theater in Bargteheide. Proud story of a strong social democrat!
Rainy gray day - goes particularly well with the time change and the stolen hour 😉
"Good morning from Bordesholm. Right after Bargteheide for the ceremony 150 years of Luise Zietz, first German parliamentarian in the Reichstag and SPD!"
Continue my visit to the Schleswig-Holstein universities today. The University of Lübeck is my goal today.
Bob Seger - Like a Rock (Music Video) This is my music tip for you today - have a nice weekend ;-) http://youtu.be/keIvA2wSPZc
Sounds more like &quot;The Plague is Coming&quot; 😉 “@petertauber: Voting marathon on the #Maut. I said yes: the toll is coming. pic.twitter.com/I1c5u4AAPD &quot;
&quot;Hein walks&quot; - In Heimerzheim together with SPD federal vice Ralf Stegner - Homepage - SPD - Swisttal http://www.spd-swisttal.de/mteilungen/24361/192559/Hein-spaziert-weiter---In -Heimerzheim-together-with-SPD-Federal-Vice-Ralf-Stegner.html…
Reports on the German-Danish ceremony show that the coalition of minority political shards by Carstensen &amp; Co. has eliminated.
In the evening in Lohmar at the traditional &quot;potato cake dinner&quot; of the SPD discussion event on TTIP and membership ceremonies.
"Good morning from Bordesholm. Immediately off to NRW: Frechen, Swisstal, Siegburg, Lohmar. Supporting the SPD in mayoral election campaigns."
George Harrison and Eric Clapton - While my guitar gently weeps This is my music tip for you-nice Friday! http://youtu.be/oDs2Bkq6UU4
"Game accident and our Eurocity from Berlin to Hamburg remains on the free route, probably the train has to be evacuated."
"If someone deliberately sends 149 innocent people to their deaths, it is not suicide but calculated mass murder."
Karamba is right: Union should stand up against right-wing populists! Chronicle photos -Dr. Karamba Diaby | Facebook https://www.facebook.com/DrKarambaDiaby/photos/a.338222996284447.70093.330061277100619/669489916491085/?type=1&amp;theater…
@DerBruesseler you really shouldn&#39;t take part in speculation - the public prosecutor&#39;s office evaluates your own findings.
"Incredibly cruel deed, if that is true, what the Marseille public prosecutor&#39;s office is saying about the plane crash today."
"Horrible! “@Faznet: +++ EIL +++ According to the public prosecutor, the copilot intentionally caused the # Germanwings aircraft to crash. # 4U9525 &quot;"
@tsghessen You get the impression even from a distance.
Black unteachability! Twitter https://mobile.twitter.com/RobertRossmann/status/580809886180724736…
"Good morning from Bordesholm. Today only appointments in Kiel, later to Berlin. Back in SH late in the evening."
Enya .. Orinoco Flow .. This is my music tip for you today. Happy Thursday everyone ;-) http://youtu.be/JaHpHcCwMcc
Not only black twitterers 😉 “@ bayern2: radioWelt: How politicians deal with #Twitter &amp; about&quot; Twitter Queen &quot;@DoroBaer &amp; @peteraltmaier”
In the evening with Anne Will on the ARD with the discussion about inheritance tax and the gap between rich and poor in rich Germany.
Good morning from Bordesholm. Today Parliament with debate about &quot;equal wages for the same work&quot; - crazy that one still has to discuss!
Money - Pink Floyd + Lyrics This is my music tip today - suitable for the state parliament theme and Anne Will talkthema ;-) http://youtu.be/JkhX5W7JoWI
That&#39;s how it is! “@Manomama: what. For. On. Day.&quot;
"Conduct discussion carefully, without any tactical link in daily politics, sensitively and without debating debates. http://www.spiegel.de/politik/deutschland/reparationen-politiker-wollen-griechenland-entschaedigen-a-1023797.html…"
Dorothea Siems is once again hurting in the WORLD for troubled entrepreneurs - this time because of the inheritance tax plans of the socialist Wolfgang Schäuble.
Nonsense: I clearly rejected the link! “@DerPolitspotter: @ Ralf_Stegner + Gesine #Schwan roll out Tsipra&#39;s red carpet! @ ChriFri71 &quot;
wishes everyone a good Tuesday here ;-)
"10 years since the blackest day of my professional life, the non-election of Heide Simonis. Sneakiness with long-term effects."
Open office in the evening on the subject of &quot;refugee policy&quot;.
Good morning from Bordesholm. Joy of Olympic opportunity for Hamburg and the whole north. Today faction and coalition committees in Kiel.
Stromae - Formidable (ceci n&#39;est pas une leçon) This is my music tip for you today ;-) http://youtu.be/S_xH7noaqTA
@JoernPL Reading helps!
@JoernPL nonsense: SH coalition agreement applies - no SH approval of VDS in the Federal Council!
"@DerBruesseler @JoernPL I negotiated a SPD party convention compromise, followed by an EU judgment."
"Because of many inquiries - here the text data retention: &quot;Within narrow limits&quot; -background - Rhein Neckar Zeitung http://www.rnz.de/politik/ background_articles, -Vorratsdatenspeichererung-In-engen-Grenzen-_arid,83350.html ..."
@JoernPL The interview is available online.
@JoernPL Defamatory nonsense: I mentioned the NSU murder series as an example of the need for specifically restricted data storage.
@JoernPL nonsense: I have always turned against mass + occasionless VDS and negotiated compromise for SPD party conference. Now EU judgment there.
"The mood in the state SPD is good. We stand for good work, social justice, educational opportunities for all children and young people!"
"Good morning from Bordesholm. Today SPD State Party Congress in Neumünster. I stand for re-election, elections, motions, Sigmar Gabriel&#39;s visit."
Status Quo - Whatever You Want Live At Monteraux 2009 My music tip today for you and also a bit for me😉 http://youtu.be/6NXRiZWKnJg
SPD linker Ralf Stegner: &quot;I am very annoyed by Steinbrück&#39;s contempt&quot; - Germany - Politics - Handelsblatt http://www.handelsblatt.com/politik/deutschland/spd-linker-ralf-stegner-an-steinbruecks-geringschaetze-stoere -I-me-very / 11501850.html…
The falcons are on the loose! “@ N24: McCain attacks Foreign Minister -&quot; Steinmeier has no credibility &quot;# N24 #News http://l.n24.de/18FVAGs”
"@Steinhoefel What is nice about democracy is that freedom of expression also prevails for attitudes like yours, but the majority decides differently."
"@Steinhoefel Aha, soft spot for cold warriors. Fortunately, Frank Steinmeier is our foreign minister and doesn&#39;t follow such foolish advice!"
In the evening party council with final preparations for our SPD state party conference at the weekend in Neumünster. Happy Friday for you ;-)
"Good morning from Bordesholm. Today only in the Kiel office, later a visit to the constituency with my colleague Beate Raudies in Elmshorn."
Amy Macdonald - 14 - What Happiness Means To Me (Live in Berlin 11-02-2010) .avi This is my music tip for you today http://youtu.be/LcXTNQ3revQ
@ Doppelgeist60 I am still completely enraptured 😉
@ Doppelgeist60 He even emphasized the SPD&#39;s merits for Bavaria and told me that our wind power would be taken from Bavaria.
Landed in Hamburg and on the way to Itzehoe for the regional conference of the SPD LANDTAGSFRAKTION &quot;Promised-Held&quot; with Reinhard Meyer.
Horst Seehofer lectures at the SPD parliamentary group conference in Munich.
"@HugoMuellerVogg @GerdKotoll @petertauber I didn&#39;t say none, but the Heideggers are a rather exceptional exception, right?"
"@HugoMuellerVogg @GerdKotoll @petertauber right was mostly the power in Germany, including the attacks on democracy, wars anyway."
"@HugoMuellerVogg @GerdKotoll @petertauber by the way, I am not familiar with intellectual achievements of rank on the right side!"
Confused article by WELT journalist Torsten Krauel about the &quot;SPD in the event of conflict&quot;. Somehow we don&#39;t do what conservatives want!
@HugoMuellerVogg @GerdKotoll some conservatives still believe they own the country and sozis should use servants.
@HugoMuellerVogg @GerdKotoll @petertauber SPD is the oldest democratic party in the country that has won almost all civil liberties.
"@HugoMuellerVogg @GerdKotoll @petertauber well, everyone puts on the shoe they like. Social democracy is only self-confident!"
"@HugoMuellerVogg if you admit that you are right, you know what you are doing. The mind is on the left ;-) The heart is on the left too!"
@JurgenPresser you probably now think Wolfgang Schäuble is also a leftist ideologist # shake your head
@manomama in Northern Germany we are more of a Republican 😉
Leave the colleague Schäuble alone: his proposal for inheritance tax is constitutional and reasonable!
"@HugoMuellerVogg @RolandTichy @petertauber for the rest, I criticized the pandering of the conservatives, especially the CSU, to right-wing populists."
"I did not say @HugoMuellerVogg @RolandTichy @petertauber, but the fact that Germany historically came from the right is true."
@martinhabersaat the Seehofer too ?!
Happy Thursday everyone ;-)
Tonight&#39;s next regional conference of the SPD parliamentary group &quot;Promised-Keeping&quot; this time with Reinhard Meyer in Itzehoe.
Good morning from Munich. SPD group chairman conference today including discussion with Horst Seehofer. Then back to Hamburg.
Weißferdl A car from line 8 My music tip today from Munich - already has a bit of patina 😉 http://youtu.be/WRoQM4plkKI
Hostility from right-wing extremists - &quot;It is important not to move back a millimeter&quot; http://www.deutschlandfunk.de/anfeindungen-durch-rechtsextreme-wichtig-ist-keinen.694.de.html?dram:article_id=313896…
"In the FR, Karl Dormens writes about social democratic advancement successes in the Arab culture: From dishwasher to top sheikh 😉"
Interview in the Detschlandfunk about Nazi pressure on mayors in Saxony-Anhalt and his resignation!
wishes everyone a successful Wednesday ;-)
Today council of elders to prepare the state parliament plenary. Later on to the group chairman conference in Munich.
Good morning from Bordesholm. Interview on Deutschlandfunk about resignation of mayor. There is no way backing away from the Nazis!
The Police - Message in a Bottle 2008 Live Video HD This is my music tip for you today ;-) http://youtu.be/0e2CuyIG7x8
At the 4th World Conference on Women in 1995 ... - Manuela Schwesig https://www.facebook.com/ManuelaSchwesig/posts/10152639642237441…
@Heiner_Garg Better title: Everything about the new liberal policy for compulsory grading in primary schools - against self-determination of schools.
That a mayor has to give way to Nazis is not possible! This must be resolutely countered! Never brown anymore!
"@_drsarkozy always, merci 😉"
wishes everyone a nice Tuesday ;-)
"In addition, a press conference with Michael Müller, who is our guest in Kiel today regarding nuclear waste storage."
In the evening the last meeting of the SPD state board before the state party conference in Neumünster.
"Good morning from Bordesholm. Yesterday 4th regional conference of the SPD parliamentary group &quot;Promised-Keeping&quot; in Schleswig, today committee meetings."
CAROLE KING (Live) - I Feel The Earth Move This is my music tip for you today ;-) http://youtu.be/hoHuxpa4h48
@ Doppelgeist60 already spoken to Diekmann on the mailbox? 😊
The #Birkenstockgate invites you to a black sandal campaign. Would be a change to red socks campaigns ;-)
