"The last speech of Joachim #Gauck as # Federal President was thoughtful, admonishing - but also encouraging. Thank you for the courage, Mr. President! pic.twitter.com/4xM92HYEMl"
"Dear @Die_Gruenen, sorry, we have a little T weakness. But otherwise we&#39;re pretty much stronger than many think. https://twitter.com/spdde/status/821678035556507650…"
"Maizière has failed at the BAMF, too few police officers &amp; withdrawal from Responsible for asylum seekers, @sigmargabriel at #berlindirekt"
"We would like to say congratulations, dear Karin @GoeringEckardt and dear @cem_oezdemir! :) On a fair election campaign! # btw17 pic.twitter.com/F3tnfiYtJT"
One of us: @ FilizCetin1976 shows attitude towards racism. Take part! http: ///www.stimmefuervernunft.de # vote for reason # counterpick pic.twitter.com/zV2rcpfp6X
# Höcke says that remembering our history makes us weak. We say: responsibility is never weak. But rush. #AfD # dd1701 pic.twitter.com/3XJLh5Y9zf
. @ katarinabarley: It is important to have a clear and closed attitude d. #EU. This also includes maintaining the uniform. Eur. Internal market. #Brexit pic.twitter.com/YRkjAkoiMa
"Great, @nrwspd, @HanneloreKraft and @NowaboFM! We are happy for and with NRW. 🙂 pic.twitter.com/BdxR4J7kaJ"
Colleagues wanted: https://eintret.spd.de #ibes pic.twitter.com/KVFgP5Js4x
Tonight at 10.15 p.m. @ZDF: @HeikoMaas visiting @maybritillner on the subject of internal security. Turn on! #afeLiving https://twitter.com/maybritillner/status/818851945175810049…
"How long are you going to block, @cducsubt? # For all pic.twitter.com/w8L7ewetUx"
Our struggle for affordable housing continues! @sigmargabriel calls for social housing campaign: http://spdlink.de/s4Pq #icherLeben pic.twitter.com/uuctuecYRz
"Great, @manuelaschwesig! The Law for More #Wage Justice is Coming! The rights of millions of employees are strengthened # equal is more pic.twitter.com/AlRU8pXyoq"
SPD leader @sigmargabriel calls for a decisive fight against terrorism and Islamism - also in the cultural field. #berlindirekt
Impressive message from @BarackObama: &quot;Democracy is always at risk if you believe it.&quot; @POTUS #ObamaFarewell pic.twitter.com/nJGficKm2K
Congratulations! Frank-Walter #Steinmeier was honored in #Frankfurt #FFM with the Ignatz # Bubis Prize for commitment to understanding. pic.twitter.com/rhrrdrIYVu
Jetzt Statement @HeikoMaas: https://twitter.com/BMJV_Bund/status/818844235654832128…
You have to # counter against unwords and their supporters: http://eintret.spd.de! #UnwortDesJahres #Unwort #AfD pic.twitter.com/zIyh6toKa7
"If there are several candidates, the members of German social democracy will decide"
We are pleased about the media interest in SPD! But on the #KQuestion these are all speculations. It remains: We decide on January 29th.
Rights of use have been bought.
Um: &quot;Picture&quot; means picture / photo / picture. The photo comes from the dpa ;-)
Solidarity with #Jerusalem. We condemn this act and every form of terrorism in the strongest possible terms. (Picture: dpa) pic.twitter.com/saptUZCdZZ
"European only. Solutions help, not national ones. It&#39;s a good thing that the EU Commission has paid Apple back tax payments of € 13 billion"
Comrade Philipp. Who is responsible for identifying party colors at your company? This is the original CDU corporate design. pic.twitter.com/kAybMupTYg
"A &quot;breathing lid&quot; for refugees? Seriously, # CDU / # CSU? Take a deep breath + read paper from @sigmargabriel! http://spdlink.de/sf9k #Seeon pic.twitter.com/9UsTwlQJSl"
"Do it like the @zimmermeister: Show attitude for cohesion, against exclusion. Now! http://www.stimmefuervernunft.de #StimmeFuerVernunft pic.twitter.com/PWj7nihNO1"
"61 years and a lot before. Dear Frank-Walter #Steinmeier, we congratulate you from the bottom of our hearts! 🎉 pic.twitter.com/9gYInzDCdg"
We want to help mothers from the part-time trap. #Nahles suggestion: right to return full-time. More: http://bit.ly/2ibi3kw pic.twitter.com/0a3vmv7s1V
It&#39;s getting cold tonight. You can save the lives of homeless people! In an emergency EMERGENCY CALL 110 (police) or 112 (fire service / emergency services) pic.twitter.com/vVee9dsw3S
Put an end to the # part-time trap! We want a legal Introduce right to return from # part-time to full-time. https://twitter.com/tagesschau/status/816584463975063552…
"Dear @DerSPIEGEL, we congratulate on the 70th. Nice that you exist! #The mirror # 70year mirror pic.twitter.com/27umk9DU9p"
. @ sigmargabriel on the security debate: https://www.welt.de/politik/video160819184/Viel-mehr-Praevention-viel-mehr-Salafisten-Moscheen-schliessen.html…
"Solidarity does not require anything in return. Showing them after the attacks in Paris, Brussels or Istanbul is no pandering"
"@pete_rjackson Every country expresses its solidarity differently. Most expressed their solidarity in letters, including Turkey."
"Solidarity with Istanbul doesn&#39;t seem to be yours. Of course, condolences came from Turkey."
A great city that stretches between two continents will not be divided by vile acts of terrorism. #Reina #Istanbul #IstanbulAttack pic.twitter.com/1Kb6Y2m8nd
We mourn with #Istanbul. Terror can´t prevent us from defending our open society. #BerlinForIstanbul #Reina 😢 pic.twitter.com/HaqlnoTwMW
"Whether in care, social work, police, fire brigade, street cleaning or emergency services. #Thanks to all full-time and volunteers! pic.twitter.com/81eozXSTDv"
"Remember yourself, right? &quot;For cohesion.&quot;"
Do as Isabell: Stand together with us for cohesion. Against agitation. Now: http://eintret.spd.de/ We look forward to you! pic.twitter.com/E4AXhWCjbI
😀
"&quot;The struggle for freedom, justice and democracy has been symbolized by three letters in Germany for over 150 years: S - P - D!&quot;"
&quot;My message to the young new members is: You are now part of a family.&quot; # zeitfürmartin pic.twitter.com/OXaDd5IndZ
&quot;The SPD is back! We are back! That is good news for the people in Germany + good news for Europe.&quot;
". @ sigmargabriel: &quot;Thank you - and good luck!&quot; Thanks are all on our side! Good luck, dear Sigmar! #ZeitfuerMartin pic.twitter.com/xVhm2xKyto"
&quot;We have to invest in the future of our country.&quot; @Sigmargabriel #ZeitfuerMartin pic.twitter.com/tOsiQOXDDd
"“You need a hot heart and a cool mind. Martin, you have both. “@Sigmargabriel #ZeitfuerMartin https://twitter.com/spdde/status/843425771326705664…"
#Working Connected “There is no justice as long as an individual injustice happens to us. I&#39;m fighting for justice! &quot;
