"&quot;Let us make our country fairer, let us leave the despondent&quot; keep it up &quot;!&quot; @MartinSchulz full of zest for action. 💪🏽 # Time For Martin"
unfortunately no longer possible. House is already packed. You can find the live stream on SPD.de :-).
People! Leave a little space for @MartinSchulz! The designated # Chancellor candidate is about to introduce himself. Now is #ZeitfuerMartin ☺ pic.twitter.com/M4Cj7AjZkk
White smoke over the Willy-Brandt-Haus. We congratulate! #ZeitfuerMartin @MartinSchulz https://twitter.com/katarinabarley/status/825657687698464768…
From 12.50 p.m. - switch on! The presentation of our chancellor candidate live from the Willy-Brandt-Haus! On SPD.de &amp; Facebook. #ZeitfuerMartin pic.twitter.com/LWhm4EwCx8
That&#39;s not true. https://twitter.com/katarinabarley/status/825388907219017730…
"Good Morning! All good things are ... 4! Facebook, Twitter, Instagram and ... Snapchat! Our first snap is out 🎉. #ZeitfuerMartin"
Time for more justice. Time for Martin Schulz. Tomorrow from 12:50 p.m. live on Facebook and SPD.de pic.twitter.com/bMdYXnuEMb
"Congratulations, dear Torsten Albig. It&#39;s going to be a really good election campaign! #WirMachenDas https://twitter.com/SPDSH/status/825297876431544322…"
Time for more justice. Time for Martin Schulz. Tomorrow from 12:50 p.m. we will broadcast the event from the WBH on spd.de pic.twitter.com/bgivBw8L2m
&quot;I want to be a role model for my daughter.&quot; Kerstin joined the SPD the day before yesterday. Her story: https://www.spd.de/unterstuetzen/kerstin_fenske/… pic.twitter.com/SocNFoRrZv
Also from us: congratulations! 👏🏻 https://twitter.com/enricotokar/status/825049245732450305…
@delarabur @Ralf_Stegner You have to be very precise ☺👍🏼
For a strong Germany in a safe world: Congratulations @sigmargabriel and @brigittezypries! pic.twitter.com/gIB6PuVoAo
"You were our tireless chief diplomat, you will give new courage as President Germany. Thanks for everything, Frank-Walter #Steinmeier! pic.twitter.com/Tdc0d2auNZ"
"Friendly, courteous, one of us. The people from # Würselen know what @MartinSchulz is all about. http://spon.de/vhsjo"
"&quot;The country needs her, her words, her courage.&quot; @tsghessen awards the Turkish journalists&#39; union @tgs_org_tr the Willy Brandt Prize. pic.twitter.com/n6ybErqZVp"
"&quot;D #UNHCR&#39;s task more important than ever. Refugees need not only humanitarian, but also political support.&quot; @sigmargabriel pic.twitter.com/x1mwbMQE7t"
&quot;Helping people in need dictate decency &amp; humanity - and our constitution!&quot; @sigmargabriel awards Willy Brandt Prize to #UNHCR.
"&quot;Willy Brandt&#39;s fate of flight has shaped our party to this day, it is our legacy and obligation.&quot; @sigmargabriel on #UNHCR pic.twitter.com/z6AlUj5U78"
Full house shortly before the 5th International Willy Brandt Prize was awarded to #UNHCR and @tgs_org_tr. pic.twitter.com/2ySMLP3e7C
The difference: We ran a party exclusion process + our entire top / party is against Sarrazin&#39;s views.
The difference: We have had a party exclusion process and our entire top / party is against Sarrazin&#39;s views.
#AfD does not want # Höcke to be excluded from the party. She continues to tolerate his right-wing agitation and history-twisting. We say: #hold! pic.twitter.com/OPQxj0u5fJ
"What we can expect from #Trump, #AfD &amp; Co is on the table. So show your attitude, #hold and enter: https://eintret.spd.de pic.twitter.com/uADR5MgcKn"
#koblenzbleibtbunt was a great success. Thanks to everyone in the #Mention chain against the shift to the right in Europe. https://twitter.com/i/moments/823482577600253952…
Good Morning! Today with us PK &amp; Willy Brandt Prize. And with you? We wish you a beautiful Start in the week! #mondaymotivation pic.twitter.com/KJZnYlzD5Z
"Not only today on the German-French day, but always: Vive l&#39;amitié franco-allemande! Long live Franco-German friendship! pic.twitter.com/hmJ3Fj4q3S"
Many thanks to all participants in #Koblenz and here on Twitter in the #Mention chain! #Koblenzbleibtbunt # Counter hold pic.twitter.com/UG5oHDRMau
With #KoblenzBleibtBunt we are sending a strong signal against the right today. # counter hold #mention chain #koblenz pic.twitter.com/M7BO9fql92
We are now reducing the retweets and publishing the tweets collectively this evening as Twitter moments. Thanks for the hint.
Many are already part of our #mention chain. Be there and make yourself strong for tolerance &amp; humanity! #Koblenz # counter hold pic.twitter.com/x4eICe8Foh
"In 2016, the state raised 6 billion euros more than planned. We are the right of way for investments in dilapidated schools, houses and bridges. pic.twitter.com/8wZ82oXXfN"
Clear words from @katarinabarley: We will be resolutely # held against old and new right-wing populists. No matter whether in #NPD or #AfD. pic.twitter.com/SDwNqotssX
"Dear @MartinSchulz, you have changed #Europe for the better. We thank you! pic.twitter.com/gJOarCS42v"
Now live: Federal Minister of Labor Andrea #Nahles at the conference on #working hours from @dgb_news and @FESonline. https://twitter.com/dgb_news/status/821297546156974082…
"@katarinabarley: The network enables exchange. That&#39;s great! On the other hand, anger and disrespect are a problem # d64hurray"
"In Germany, the 36 richest people have as much wealth as the poor half of the population."
8 richest billionaires own as much as poorer half of the world&#39;s population. Not like that! Therefore: fair taxes + equal educational opportunities! pic.twitter.com/CdMrhlUeNe
Because the european. Meet right-wing extremists and populists in Koblenz on Saturday.
Against European Right-wing populists &amp; extremists help # counter. #Koblenzbleibtbunt on Saturday! https://www.facebook.com/events/1618408341800114/… # VoiceForVernunft pic.twitter.com/pX62hndtbt
. @ sigmargabriel in @faznet: Need #investment and targeted relief instead of tax reduction competitions! &gt;&gt; http://plus.faz.net/evr-editions/2017-01-16/41884/310243.html… pic.twitter.com/aFGLxkdyjI
Our demand: a good start to the week for everyone! #mondaymotivation pic.twitter.com/9haqDKb8hO
For the interview please go here: https://www.facebook.com/bild.video/videos/402042406805360/… https://twitter.com/TobiasDuenow/status/820887893212274688…
Tonight 9:45 p.m. @AnneWillTalk @DasErste: How do you deal with criminal immigrants? With @OlafScholz. Turn on! pic.twitter.com/c8P7Lr0sKw
Who can solve the mystery of our # secretary general? 🤓 https://twitter.com/katarinabarley/status/820260385924284419…
So that nobody says he / she didn&#39;t suspect. OB #Clausen quoted from # AfD-program: http://www.nw.de/lokal/bielefeld/mitte/mitte/21544022_Neujahrsempfang-Oberbuergermeister-leg-nach-in-der-Kritik-an-der-AfD.html… This is how #counter goes! Take part!
Targeted relief and broad investments in our infrastructure - instead of the watering can principle and idle plumbing of our future. pic.twitter.com/H6d3VoHNUV
"Can you do this without insulting yourself? If so, we would be happy to discuss what you specifically miss at the SPD."
Property obliges! Apple doesn&#39;t feel that way. We are working on changing that: No more tax trickery! # 10YearsOfiPhone pic.twitter.com/60oudZFpqH
Strong speech by Meryl Streep at @goldenglobes. # counter hold https://twitter.com/SZ/status/818384488174645248…
"&quot;We will decide on January 29 whether I will become a candidate for SPD chancellor,&quot; says @sigmargabriel at #berlindirekt #KFrage"
"&quot;Parteipol. Dispute is nonsensical in matters of inn. Safety. Ideol. We don&#39;t need a fight &quot;, @sigmargabriel #berlinindirekt"
"According to de Maizière&#39;s omissions, accusations are &quot;not fair dealing, then pointing the finger at others&quot;, @sigmargabriel #berlindirekt."
"Sahra Wagenknecht fishing. Great, Klaus #Stuttmann: http://www.stuttmann-karakteren.de/karessin/6269"
Today | 7:10 pm | ZDF | @sigmargabriel @ @ berlindirekt conversation #berlindirekt pic.twitter.com/thQo9rdZMw
TV tip: Today at 19:10 on ZDF: @sigmargabriel in conversation at @berlindirekt
"Wrong, he called people who attack foreigners and set fire to refugee homes. Were you among these racists?"
CDU-Tauber compares FDP boss Lindner with #Gauland. Kubicki calls it #Taubernuss. Memories of #Wildsau &amp; #Gurkentruppe awake.
"&quot;De # Maizière only distracts from your own failure,&quot; says @katarinabarley: http://www.deutschlandfunk.de/ Sicherheitsdebatte-barley-spd-kontert-kritik-de-maizieres.447.de.html?drn:news_id = 697036 ..."
"We mourn Mário #Soares. He was a staunch democrat, committed European, special friend of Germany and our party. https://twitter.com/sigmargabriel/status/817802182393298945…"
We commemorate the victims of the #CharlieHebdo attack. But the story of the magazine encourages. Let&#39;s keep our freedom &amp; joy. pic.twitter.com/keuM00lfgZ
"&quot;The strength of the SPD leader is that he struggles for balance between freedom and security. On the other hand, the strength of de Maizières is just: volume.&quot; https://twitter.com/DLF/status/817675231863177221…"
Small reading tip: A conversation with @sigmargabriel in the current mirror https://twitter.com/sigmargabriel/status/817722405862998016…
"If there are any risks or side effects, please contact the @ CDU / @ CSU."
We agree with that. 😀
"Whether 😴 or 💪, we wish you a good start to the week! #mondaymotivation pic.twitter.com/9mEbPg1B3q"
. @ MartinSchulz in Würzburg - from 11.30 in the livestream on our Facebook page or on http://KAMPA17.SPD.de/. Turn on! # Time for Martin pic.twitter.com/KWYw96uo84
Dear @sigmargabriel: Congratulations! And can say: Thea is in the best hands. https://twitter.com/sigmargabriel/status/837931220096933888…
Full house at @MartinSchulz&#39;s speech at the @jusos youth conference in the Willy-Brandt-Haus. pic.twitter.com/5tJW5FasDK
Now LIVE: @MartinSchulz at the @Jusos youth conference 2017 in the Willy-Brandt-Haus. Join the discussion: # fair17! https://twitter.com/jusos/status/837709611583094784…
", with us you can also become an Austrian member. There are also guest memberships. https://eintreten.spd.de"
"10,000 people have joined us since @MartinSchulz became a candidate for chancellor. Be there too: https://eintret.spd.de pic.twitter.com/mb8Gwwjupm"
Have fun with #RobinHood! But remember: there can only be one @MartinSchulz!
"Political Ash Wednesday: The others are joking, we are serious. # pam17 pic.twitter.com/Ix7NkwA3Lf"
"Pop star, heartbreaker, civil rights activist - we congratulate Harry #Belafonte on the 90th! pic.twitter.com/sqT6WHmO4G"
Our former general secretary Klaus-Uwe #Benneter turns 70 - congratulations! All the best!
Now LIVE: @MartinSchulz at the # PAM17 of @BayernSPD in #Vilshofen in the stream on https://bayernspd.de. Turn on! https://twitter.com/BayernSPD/status/836855452570894341…
Martin Schulz does not drink alcohol.
Hearty music is now playing on https://www.spd.de/. Live from # PAM17 in Vilshofen. With @FlorianPronold @KernChri and @MartinSchulz.
We condemn the pre-trial detention for the journalist Deniz # Yücel in # Turkey and we demand his immediate release! #FreeDeniz pic.twitter.com/mCUuyzb6Do
"#Helau and #Alaaf, we wish you all a great #Rose Monday! #mondaymotivation pic.twitter.com/AXvImBmdlH"
"#Leipzig, that was great! Come home well. Have a nice Sunday! #zeitfuermartin pic.twitter.com/5j9Vjy9ehx"
"Never forget! 74 years ago today, the Nazi regime murdered Hans and Sophie Scholl and Christoph Probst, members of the “White Rose”. pic.twitter.com/qaOTJwqXwo"
#Goodworkconnected &quot;We will abolish the possibility of unfounded fixed-term contracts!&quot;
Why now in the SPD? Asks Frank #Plasberg our new member Katharina Litz. You will love your answer! # ZeitFürMartin pic.twitter.com/5d5xbSV8Q1
We don&#39;t understand everything the Saar comrades are saying. But we know that @AnkeRehlinger has the right ideas for Saarland. :) https://twitter.com/SPD_Saar/status/834041586396909568…
Welcome!
Time for more justice. Time for @MartinSchulz! More: http://spdlink.de/Gute_Arbeit_verbindet… #GuteArbeitverbindet #ZeitfuerMartin pic.twitter.com/UdyrfO1nGO
What will @MartinSchulz: http://spdlink.de/Gute_Arbeit_verbindet… #GuteArbeitverbindet #ZeitfuerMartin pic.twitter.com/a35GeuSPHz
#Goodworkconnected &quot;We want to live in a society in which there is no master and no servant. But mature citizens.&quot;
#goodworkconnected &quot;We must improve the world that we have inherited and not pass it down to our children!&quot;
#goodworkconnected &quot;We have to get things back on track a few years ago.&quot;
#gutarbeitverbindet &quot;We reject the demarcation between private and work life.&quot;
"#gutarbeitverbindet &quot;Competitiveness in the 21st century does not depend on wage dumping, but on employee qualification!&quot;"
"#Goodworkconnected &quot;Education must be free of charge, from daycare to university!&quot;"
#Goodwork connected &quot;We will expand the special protection against dismissal for the initiators of works council elections.&quot;
"#goodworkconnected &quot;If you want to organize a works council, you shouldn&#39;t be kicked out!&quot;"
#goodworkconnected: “Co-determination in the company is a model for the future. Unfortunately not everyone understood that yet! &quot;
#goodworkconnected &quot;We want a cultural change in working time policy u. enable people to work more independently! &quot;
#goodworkconnected &quot;It&#39;s about respect for people&#39;s lifetime achievement!&quot;
#goodworkconnected “People who have worked hard can fall into basic security in a short time. We have to change that!&quot;
#gutarbeitverbindet &quot;We have to work on the fixed-term contracts of many jobs. The CDU and CSU are walling here.&quot;
#goodworkconnected &quot;We also made mistakes! Making mistakes is not an honor. It is important to recognize them and correct them. &quot;
#goodworkconnected: &quot;The neoliberal mainstream has declared all the advantages of our social market economy to be obstacles to growth.&quot;
#goodworkconnected “Inequality is increasing. Feels AND actually. &quot;
#Workingconnected “It&#39;s not all bad. But not all is well either. And we have to talk about it if it is going to get better. &quot;
&quot;Unions and Social democracy know: progress u. Prosperity does not fall from the sky. You will be won. Together!&quot;
#goodworkconnected &quot;Only together with the unions can we make our country better and fairer.&quot;
Now @MartinSchulz talks about work in Germany. Live on Facebook &amp; live ticker below here on Twitter. #goodworkconnects pic.twitter.com/35s4mGE59z
Our hashtag for today&#39;s event with @MartinSchulz in Bielefeld is #GuteArbeitverbindet. #Servicetweet
From 11 a.m. LIVE on SPD.de and from around 11:10 a.m. LIVE on Facebook by @MartinSchulz: our #SPD employee conference. . # Good work connects pic.twitter.com/jpkiBno0Aq
Start the new week with high energy! Watch live stream with @MartinSchulz at spd.de from 11 a.m. #mondaymotivation #goodworkconnects pic.twitter.com/STx5LGTiWU
At 11 a.m. LIVE on Facebook: @MartinSchulz at the employee conference in Bielefeld on &quot;Work in Germany&quot;. #GuteWorkconnects pic.twitter.com/48WcUnpZVr
. @ MartinSchulz speaks at 11:00 in Lübeck. Be live on Facebook! The Jusos have built him a school train before ... :) pic.twitter.com/w87st8jO49
. @ MartinSchulz speaks in Lübeck and you can join us on Facebook at 11 a.m. on Sunday. Switch on! # Time for Martin pic.twitter.com/BltCdgu2rh
Today is state party conference in North Rhine-Westphalia! # lpt17 #NRWIR https://twitter.com/nrwspd/status/832867441734721536…
And where can you find the SPD fan shop? Here with us: https://shop.spd.de/ #zeitfuermartin https://twitter.com/WesterwaldSPD/status/832571499542347776…
Be there! Support @MartinSchulz and the #SPD. Register now: http://kampa17.spd.de #ZeitfuerMartin pic.twitter.com/v8E6mZhhuS
Turn on! Tonight at 9:45 p.m. @HanneloreKraft is at #AnneWill. https://twitter.com/annewilltalk/status/830778730477998087…
"&quot;Let&#39;s be brave!&quot; We will, dear Frank-Walter #Steinmeier. With you at our side. Congratulations and good luck! pic.twitter.com/E3vaNZC10D"
"With 931 votes, Frank-Walter #Steinmeier was elected as the new Federal President. Congratulations, dear Frank! 💐🎊😊 # bpw17"
"welcome, dear Hannah! :-)"
"Lammert: Thanks and respect for the outgoing # Federal President Joachim #Gauck, for his services to social cohesion."
# Counting lapel @spdbt on the election of the # federal president. We are many! #Federal Assembly pic.twitter.com/E0nqcvqe6p
"Frank-Walter at the reception at the #Bundesammlung about his wife: &quot;Without you, dear Elke, I didn&#39;t want it &amp; I couldn&#39;t do it.&quot;"
"The # Federal President is elected on Sunday. Tweet your # Steinmeier selfie with #MyPresident or RT, if he&#39;s also your President! pic.twitter.com/LrHcRzZKK4"
So many new entrants: SPD Freiburg is making party books &gt;&gt; http://www.spd-lottstetten.de/mmeldung/spd-in-freiburg-bastelt-neue-parteibuecher/… Now in the SPD: http: //eintret.spd. de # occur
Surprising incident at our newsroom. #HoheEnergie! #ZeitfuerMartin pic.twitter.com/g96hvHznXk
"We&#39;re sorry. Unfortunately, due to the large number of visitors, this currently sometimes takes longer. Stay tuned!"
Decided today in the cabinet: even better protection for police officers and rescue workers. Because we too have to protect those who protect us! pic.twitter.com/q6ejgg4hnL
Live now! @MartinSchulz in Ahrensburg https://twitter.com/spdde/status/829352809422319616…
The @abendblatt has #ZeitfuerMartin at 5.45 p.m. and streams the event live with @MartinSchulz. http://bit.ly/2lobWL6
"Today, 7 p.m. in Münster: @Ralf_Stegner at the university dialogue of @jusohsgn. https://twitter.com/jusohsgn/status/828984711846453249…"
Good morning 😊. Another week until the application deadline. So hit the buttons and apply for the SPD hackathon! #SPDHack https://twitter.com/henningtillmann/status/829056558743052288…
"Our Secretary General answered your questions on Twitter today. For example, here is her answer to citizens&#39; insurance. #FragKatarina https://twitter.com/katarinabarley/status/828958763256254465…"
3: 0 for @AnkeRehlinger on justice. We want more social justice in the country. Cohesion and strength. #saartalk # Anke17
"2: 0 for @AnkeRehlinger b. Economics. If you work hard, you have to feel it: in your wallet &amp; with a secure job # Anke17 #Saartalk"
1-0 for @AnkeRehlinger. Education has to be free! Eliminate childcare costs. # End G8 murks. # Anke17 #saartalk #saartext
"A spirit of optimism in Saarland, throughout the country, in the SPD. Let&#39;s go with @MartinSchulz + @AnkeRehlinger. #saartalk # anke17"
Let&#39;s go @AnkeRehlinger! Now switch on. # Anke17 #Saartalk https://twitter.com/SPD_Saar/status/826827393159557120…
"&quot;Politics, you don&#39;t just do it with your head, you do it with your heart!&quot; @MartinSchulz knows what it&#39;s really about. #ZeitfuerMartin pic.twitter.com/Bmy53fjxLo"
"We only change Germany together. Not by complaining, but by participating. Time for you: https://eintret.spd.de/ #ZeitfuerMartin pic.twitter.com/Ct0u7UVfBB"
help 😞
😀 Welcome!
We&#39;ll look into it. That is actually not wanted. Our previous information is different: https://support.google.com/adwords/answer/2383007?hl=de…
Thank you! We are working on it. Our program process will continue soon. We look forward to your contribution.
Thanks for d. Note. Are you sure about that (&quot;not skipable&quot;)? The display should actually be skipped after 5 seconds
"It depends on the local club. With the large number of new entrants currently, it may take some time."
&quot;Democracy needs young people to stand up for it.&quot; What @MartinSchulz says. #entry http://www.entry.spd.de pic.twitter.com/2d0qPaWn54
Martin Schulz is so blatant that he has just sold over 2000 books - without a bookshop. Who still wants: https://eintret.spd.de #SchulzFacts pic.twitter.com/HXWiBREzzX
"Tomorrow it starts, in the country, in the party! @MartinSchulz is happy. And we, we do it too! 😁 #ZeitfuerMartin pic.twitter.com/ac6PlYtlsH"
What @MartinSchulz says: &quot;You have to straighten your back and declare war on the radicals!&quot; #ZeitfuerMartin # object hold pic.twitter.com/S5JvioKl0n
"&quot;The Höcke party is not an alternative for Germany, but a shame for the Federal Republic!&quot; @MartinSchulz on the AfD #ZeitfuerMartin"
. @ MartinSchulz: &quot;A Chancellor doesn&#39;t just have to understand everyday worries - he must be able to feel them!&quot; #ZeitfuerMartin
@MartinSchulz: &quot;Tax cuts instead of investments in our children? Just shows that we need an SPD finance minister&quot; #ZeitfuerMartin
&quot;The fact that a US president attacks minorities is a taboo breach - it is unbearable.&quot; @MartinSchulz on #MuslimBan #ZeitfuerMartin
Nothing to add. #ZeitfuerMartin pic.twitter.com/NIrmEuXoWc
&quot;We need a government run by a social democrat!&quot; Says @MartinSchulz. We know who he means. 🤓 # Time For Martin
&quot;Tax justice and combating tax evasion - these will be the central issues in this campaign!&quot; #zeitfuermartin # btw2017
"Full house, strong speech from @MartinSchulz! Time for justice, #ZeitfuerMartin! pic.twitter.com/8MnHjg9QSs"
&quot;We are joining # btw2017 to become the strongest force in our country - &amp; me to become Chancellor!&quot; @MartinSchulz #zeitfuermartin
&quot;A moving moment for me - I&#39;m happy to share it with you!&quot; @MartinSchulz touched on his nomination. #ZeitfuerMartin
#ZeitfuerMartin! pic.twitter.com/rXSjBusrli
We can confirm that;)
"#ZeitfuerMartin, because: &quot;It couldn&#39;t be more social democratic than your biography, dear @MartinSchulz!&quot; so @sigmargabriel"
&quot;The SPD needs a new start and nobody embodies it better than @MartinSchulz!&quot; @sigmargabriel says #ZeitfuerMartin is now
That&#39;s what we call it;) https://twitter.com/henhman/status/825677647946592257…
The @MartinSchulz introduces itself immediately. And we have a livestream: https://www.facebook.com/martinschulz.eu/videos/10154578897053462/… #zeitfuermartin
Insanity mood in WBH. Minutes of applause. Now is #ZeitfuerMartin! pic.twitter.com/bja9qr4KWl
Auschwitz-Birkenau has been liberated for 72 years. Our responsibility remains: never again fascism! # counter hold pic.twitter.com/M91BzDkv1T
Sunday from 12.50 p.m .: The livestream for the nomination of our chancellor candidate on SPD.de &amp; Facebook! More information: https://www.facebook.com/events/1910733452482043/… pic.twitter.com/vMwdrqDjhh
We are against any form of torture. Always and everywhere. # counter hold pic.twitter.com/ArdGE9znJ1
". @ sigmargabriel today presented #annual economic report. More and more people have jobs and higher wages. Good thing, we keep fighting! pic.twitter.com/KBbYdaRN9A"
"Dear @EMMA_Magazin, congratulations on the 40th Thank you for holding out! Keep fighting. All the best! pic.twitter.com/nvH1mE7a2I"
"Congratulations, Mr. # Federal President @vanderbellen! pic.twitter.com/UD9CEX2Y3p"
Now live: Government statement by Federal Minister of Economics @sigmargabriel on the #year economic report: https://www.bundestag.de/mediathek
. @ MartinSchulz steps up. And you? Enter: https://eintret.spd.de/ pic.twitter.com/x2vFZnZGfA
. @ MartinSchulz inspires people. It is important to convert this spirit of optimism into a good election campaign. @katarinabarley @heutejournal
@katarinabarley @heutejournal: It will be the first election campaign without a coalition statement. One thing is clear: we want to lead the next government.
. @ sigmargabriel: &quot;@MartinSchulz is a political offer to voters in Germany to change the status quo.&quot; #jetztistschulz pic.twitter.com/7lm85gdPs0
Congratulations! #Oscars #Oscarnoms #ToniErdmann pic.twitter.com/OFAcs8zBtv
"For the #TagderKomplimente, we thank @ManuelaSchwesig and @BMFSFJ for their great work &amp; assertiveness in the #Entertainment advance! pic.twitter.com/37NxuIqdjW"
#Single parents can breathe a sigh of relief: The #maintenance advance will be extended from July 2017! More: http://spdlink.de/sUKm pic.twitter.com/fmmA64bxXa
Good news for the oceans! 🐠🐠🐠🐟🐠 https://twitter.com/bmub/status/823549339796668417…
The #Dschungelcamp 2017 is about to start. Our favorite? Kader Loth. With kind regards from the &quot;Social ... Political ... Union&quot;! #ibes pic.twitter.com/D6iQEt0Q6V
Not at #KoblenzBleibtBunt? Then join our #Mention chain gg right! Below is how to do it. @SigmarGabriel @KatarinaBarley pic.twitter.com/0liTM27DiD
"Comes on January 21 to Koblenz! Together against Europe&#39;s rights. For democracy, respect &amp; diversity: http://bit.ly/2jwUQuX #KoblenzBleibtBunt pic.twitter.com/Wsq7MZRsbK"
"#THANKYOU, @BarackObama! pic.twitter.com/DITNwQN01C"
Turn on Facebook now! https://twitter.com/katarinabarley/status/822407476893143040…
Germany&#39;s future lies in a Europe that holds together. Fight with us for a modern Germany! https://eintret.spd.de #Trump pic.twitter.com/aihnUS8p2X
"75 years ago today, the Nazis swore by the #Wannsee to the #Holocaust. Against forgetting: never again! #Wanseekonferenz #Hoecke pic.twitter.com/NIYrBJJ4xL"
"We didn&#39;t learn #vomrap, but when it comes to beef with Nazis, no one can fool us. pic.twitter.com/U3TCPmYkoS"
The #AfD has shown its true face with Höcke&#39;s misanthropic speech. This is a clear case for the protection of the constitution. It is time! pic.twitter.com/wgiwfViOSE
"Comes on January 21 to Koblenz! Together against Europe&#39;s rights. For democracy, respect &amp; diversity: https://www.facebook.com/events/1618408341800114/… #KoblenzBleibtBunt pic.twitter.com/hwUACxga4O"
