"however, we all pay the price for this &quot;gift&quot; together."
#gutarbeitverbindet “A lot still fails today because of the resistance of the Union. That needs to change!&quot;
#ZeitFuerMartin pic.twitter.com/KlJgol1R8g
&quot;SPD party chairman is the greatest office in politics.&quot; @sigmargabriel #zeitfuermartin
btw: You don&#39;t follow us. And that as MdBB. ;)
Unions and social democrats know that progress and prosperity must be fought - together! # Time for Martin pic.twitter.com/y3iLKPisQ1
"On #WorldWomen&#39;s Day we present our 10,000th new member: Welcome, Laura! # IWD2017 pic.twitter.com/ReLEnnjP0l"
"We are overwhelmed! 15,000 have become part of our &quot;family&quot; since the beginning of the year. Take part! http://eintret.spd.de #zeitfuermartin pic.twitter.com/iFA9nCQ4r7"
Our reading tip!
Emergency relief! Over 23 million people in Africa are at risk of starvation. Help @ ADH102030 to save lives on site - now with your donation! pic.twitter.com/L6rnppvaAF
We still have a lot to do. But this is another important step for more #wage equity. http://spdlink.de/sVfW pic.twitter.com/4S3MZWCVwA
We want to limit manager salaries. CDU / CSU refuse. Why is that a question d. Justice is shown by @Lothar_Binding #zeitfuermartin pic.twitter.com/lUMKPBiwfa
The colleagues now know and will solve the problem promptly.
. @ LambyStephan also accompanied @katarinabarley for a year. Politics up close! On April 19th @The First #nervoeserepublik https://twitter.com/annewilltalk/status/847165000997310465…
. @ katarinabarley: The current mood is not hype. We are now reaping the fruits of our years of work. # ZeitfürMartin
"Finally there is justice for the § 175 victims! We are so proud, @HeikoMaas. @CDU + @CSU, now also # introduce marriage for everyone! pic.twitter.com/InE7hXOMTq"
"Sworn in. It can start, Mr. #Bundespraesident #Steinmeier! We&#39;re glad. pic.twitter.com/bc14YOdk6k"
With us you are not just a decimal place: http://entry.SPD.de #PiDay # ZeitfürMartin
"No matter whether hot or cold shower: With 1 m³ of water, man / woman / dog can shower 20 times. Let us handle water carefully. #weltwassertag pic.twitter.com/soxm8enK2v"
Everyone he can. #welttagderpoesie pic.twitter.com/CZbi2sKZEj
"# counter hold - # vote for reason - the born Heilbronnner Sibel Kekilli, known from @Tatort + @GameOfThrones, campaigns for women&#39;s rights pic.twitter.com/4Ue9UYkPS3"
"Hello #Saarland, let&#39;s go to the final sprint with @CulchaBerlin @ElaizaBand @AnkeRehlinger @HeikoMaas! # Anke17 https://twitter.com/SPD_Saar/status/841934710783774721…"
We have been the most determined opponent of misanthropy &amp; #Racism since 1863. Join us: https://eintret.spd.de/ # Gegenhalten pic.twitter.com/NgHQjnX6qd
"We are on the move! For more dignity, respect &amp; justice. And happy over 13,000 new members! #InternationalDayOfHappiness pic.twitter.com/jVkZS2CQrm"
"&quot;I live to make the world better.&quot; @katarinabarley quotes @Gesine_Schwan, which receives the August Bebel Prize today. pic.twitter.com/5lQ2VwgjCc"
Still flashed from yesterday. #mondaymotivation # 100ProzentMartin #ZeitfuerMartin pic.twitter.com/pLzdWQ2MPD
This was the federal party convention. We are a little speechless. Thanks to everyone who was there! And now: # Time for Martin! pic.twitter.com/3lF5GOeU8g
Our general secretary @katarinabarley is also there 😎. Turn on! https://twitter.com/annewilltalk/status/847080785513451520…
Enter instead of leaving! For a better and stronger Europe - join us: https://eintret.spd.de #brexit pic.twitter.com/VMIQPOa85C
". @ katarinabarley: &quot;If we continue like this, we will be chancellor in September.&quot; #zeitfuermartin # Best General Secretary pic.twitter.com/DLuyaCtQrh"
"Angela, stop feeling gut! Jump over your shadow and agree to our bill. #EsIstZeit #Ehefueralle pic.twitter.com/AwLGpwlKwb"
"Whether Mia, Serkan or Anna - we want them to be able to sue for their rights. Children&#39;s rights in the Basic Law - now! # I always have rights pic.twitter.com/pW3Rgx8NJW"
Always on. #MondayMotivation pic.twitter.com/VLBKIjAluU
"Sorry, we misunderstood. As a matter of fact. Will be passed on immediately. Thank you."
"This is the usual sender for automated processes. If you have service questions, the correct address is kampa17@spd.de"
Madness: 100%! We congratulate our new chairman and candidate for chancellor @MartinSchulz! # ZeitfürMartin pic.twitter.com/wGTVYopr4o
Right. We have not yet.
Malu #Dreyer at @AnneWillTalk for # ltwsaar17. Turn on! pic.twitter.com/IY6UT86ElE
Thanks to @AnkeRehlinger + @SPD_Saar for catching up. Congratulations to @_A_K_K_! We continue to fight for government changes in the federal government!
&quot;This result is the beginning of the conquest of the chancellery.&quot; @MartinSchulz #zeitfuermartin
Already 5pm? Hurry up now! The polling stations in #Saarland are still open for an hour. Here we go! # anke17 # ltw17 @AnkeRehlinger pic.twitter.com/ToECQkkM9z
"Time for a little refreshment! And then go to the polling stations, dear #Saarland. Every vote counts! # anke17 # ltw17 @AnkeRehlinger pic.twitter.com/7RBVLKRGNl"
"Awake? Well then it can start, dear #Saarland. Brush your teeth and go to the polling station! # anke17 # ltw17 pic.twitter.com/VA01WQXbS3"
605 out of 605 valid votes for @MartinSchulz. #ZeitfuerMartin
"Hello #Saarland, you want more social justice? Then go vote! Every voice matters! # Anke17 # ltw17 pic.twitter.com/2qlRyen8GL"
"The clocks will be advanced by 1 hour tonight. But hey, the polling stations in #Saarland are open until 6 p.m. So: go vote! # Anke17 pic.twitter.com/GXhNbT59p4"
He is one of us. #ZeitfuerMartin pic.twitter.com/VCI6DDbd50
". @ j_uekermann: Dear @MartinSchulz, the @Jusos are behind you! # ZeitfürMartin"
&quot;I want to be the next Chancellor of the Federal Republic of Germany.&quot; #zeitfuermartin pic.twitter.com/jy0O3Bz7Q7
&quot;The enemies of freedom have a determined opponent in the SPD and me - and we are going to declare the fight for you!&quot; #zeitfuermartin pic.twitter.com/puvCOGobZ4
For a society in which people help each other and are strong in community. #zeitfuermartin pic.twitter.com/gOvrGEyRmC
The foundation on which the EU is built was laid 60 years ago in Rome. Enemies became friends and partners. Happy Birthday! # EU60 https://twitter.com/katarinabarley/status/845553204242853888…
"84 years ago, we were the only party to vote against Hitler&#39;s # empowerment law. Take part! For our democracy: https://eintret.spd.de pic.twitter.com/hNY3wLbnXu"
We are sad. Our thoughts are with the victims and their families. #Londonattacks pic.twitter.com/EqA8MtobJv
&quot;I&#39;m fighting for a society in which people help each other and are strong in community.&quot; @MartinSchulz #zeitfuermartin
"&quot;We want to further relieve families: time for children, time for care and time for work must be reconciled.&quot; #zeitfuermartin"
&quot;We want education to be free of charge; from daycare to university; also for master and professional training courses&quot; #zeitfuermartin
"&quot;We want education to be inclusive. Because education means dignity, regardless of whether someone is impaired or not.&quot; #zeitfuermartin"
"&quot;We are not the better people. The other Democrats are not the enemy. Ideally, the election campaign is a great moment for democracy.&quot;"
&quot;The wage gap between men and women must stop. The same wages for the same work; for men and women.&quot; #zeitfuermartin
"&quot;If we don&#39;t make things fairer in this country, nobody else will.&quot; @MartinSchulz #zeitfuermartin"
&quot;Würselen is great. But Berlin is not bad either. You will feel comfortable here as Chancellor!&quot; Michael Müller #ZeitfuerMartin
&quot;Dear @sigmargabriel: We are proud of you. And we are grateful. &quot;@HanneloreKraft #zeitfuermartin
&quot;We stand for a free and colorful Europe!&quot; @HanneloreKraft #zeitfuermartin
Now live from the Federal Party Congress. #ZeitFuerMartin https://www.pscp.tv/w/a50EjzQ5OTk3MHwxWXFKRFhMb1FvQUpW9A03eAQmfL35RqdkfQmmO2PGPWzoTDcs0q5KzaaLLRg=…
The livestream starts at https://www.spd.de. Wit also stream in English and with sign language. # ZeitFürMartin
What @Schmidtlepp says. # ZeitFürMartin https://twitter.com/Schmidtlepp/status/843388935887880194…
Women get 21% less salaries than men. Fight it with us! For the equal pay law by @ManuelaSchwesig! #EqualPayDay pic.twitter.com/xfsrnIANwW
"All the best and thank you very much, Mr. President! Enjoy the freedom. #gauck #zapfenstreich pic.twitter.com/6iTWffqcaU"
Sunday from 11.20 a.m. LIVE on Periscope: Our federal party conference elects our chairman + candidate for chancellor. Be there! # Time for Martin pic.twitter.com/32LKJGoeHZ
. @ AnkeRehlinger: Social justice must be the linchpin of politics. # anke17 # ltw17
"Hello #Saarland, make a note of it now: in the final sprint next Tuesday with @CulchaBerlin @ElaizaBand @AnkeRehlinger @HeikoMaas https://twitter.com/SPD_Saar/status/841934710783774721…"
#Netherlands send strong signal against populism &amp; for democratic Europe! Get involved: https://eintret.SPD.de pic.twitter.com/Cj9B3H02SF
. @ sigmargabriel with 99% nominated as SPD candidate in his constituency. @MartinSchulz congratulates on site. pic.twitter.com/7274joohMN
. @ MartinSchulz: &quot;Social democracy has won decisive rights for people at the national level. We can do that globally.&quot;
. @ MartinSchulz: &quot;We can only solve global problems globally. And we have to do that too.&quot; #PAconvention
. @ MartinSchulz welcomes the heads of government @SwedishPM Löfven from Sweden and @antoniocostapm from Portugal.
#goodworkconnected &quot;I&#39;m not talking bad about our good country. I want to do it even better! &quot;
. @ MartinSchulz is speaking at the Willy-Brandt-Haus about the Progressive Alliance - soz.-dem. Politicians from all over the world. #PAconvention pic.twitter.com/ygiTRafif0
. @ MartinSchulz now LIVE on https://www.facebook.com/martinschulz/ at the #paconvention
Off to the new week! We wish you a good start. #mondaymotivation pic.twitter.com/Dcg32QyPIL
"Too bad. If anything changes, you already know where to find us 😊"
Quite a lot. http://www.spdfraktion.de/gesagtgetangerecht…
"We not only dream of a freer and more just world, we also work for it. Take part!"
Membership of the Red Hawks is taken into account.
"We are wide awake! And work for more freedom, justice and solidarity. For over 150 years 😎"
Sounds good. We are in ;)
It&#39;s difficult to discuss on Twitter. Therefore only so much: We have more plans. But for that we need a strong election result.
Combating tax avoidance by multinational corporations &amp; relieving hard-working people would have been different
💪
Then download the membership form;) https://www.spd.de/fileadmin/Dokumente/Servicedokumente/beitrittserklaerung_neu.pdf…
Nope. Membership in the Red Hawks is taken into account. Hence the long membership.
 pic.twitter.com/plkG9ZzpXi
Martin!
"We act. Rental price brakes, the quota for women, minimum wages or even an increase in parental allowance have advanced the country."
"&quot;Shaping our future - for freedom, justice and solidarity&quot; - this is the motto for @progressive_all in Berlin. Pic.twitter.com/I8gMhn3GYV"
Luise Nordhold became a member of the Falcons in 1927. This time is taken into account.
"Luise Nordhold has been in the SPD for almost 90 years, making us our longest member. Happy 100th birthday! https://www.youtube.com/watch?v=tsXMtM7hGd8…"
We&#39;ll be live in a few minutes! Log in to Kampa17 now or experience @MartinSchulz live on Facebook. #zeitfuermartin # https://twitter.com/spdde/status/840274508233728000…
. @ MartinSchulz: &quot;The small companies pay taxes &amp; the multinationals evade their duty. That is not fair.&quot;
. @ MartinSchulz now LIVE at the state party conference of @spdbawue: https://www.spd-bw.de/ #spdbw
Congratulations @LeniBreymaier! #SPDBW https://twitter.com/spdbawue/status/840513605615419392…
Sunday is @MartinSchulz at @nrwspd in #Kamen. Live stream from 11 a.m. on Facebook &amp; http://kampa17.spd.de! # Time for Martin pic.twitter.com/eP4CQ6EebW
. @ peteraltmaier Where we&#39;re talking about mood. Direct comparison then on Sunday in the live stream from Kamen! 😀 pic.twitter.com/pDKmDE7boa
A little later because of sleep deprivation and ongoing projects &gt;&gt; https://www.spd.de/aktuelles/detail/news/spd-hackathon-spdhack/10/03/2017/… @AKDigiGes @larsklingbeil @katarinabarley
&quot;My SPD? That I can still experience that! ”Our review with a view of the projects from #SPDHack &gt;&gt; https://www.spd.de/aktuelles/detail/news/spd-hackathon-spdhack/10/03/2017/…
Working with us with high energy: Helene from the ESBZ @NeueOberstufe. It was a great week. Thank you! # lex17 pic.twitter.com/GEyhwJlFaG
Legal right to qualification + unemployment benefit Q for a fairer and stronger Germany! More on this: http://spdlink.de/ALGQ #ALGQ pic.twitter.com/8pzDujYC3c
We want to double the savings in basic security + strengthen qualifications in the country. More on this: http://spdlink.de/ALGQ #ALGQ pic.twitter.com/IDgxAriaXT
Spring feelings? Every 8 minutes someone is joining the SPD. For the love of democracy. You also? https://Eintret.SPD.de # ZeitfürMartin pic.twitter.com/Q7JwI72yUL
"For emancipation and equality, against populists and chauvinists - sign now: http://spd-link.de/zeitfuerfrauen # ZeitfürFrauen pic.twitter.com/EnygVT3IPE"
Make a note and switch on! Tonight at 10:45 p.m. @HanneloreKraft is at Maischberger on @DasErste. https://twitter.com/HanneloreKraft/status/839528373974155268…
Welcome!
Who chose which song? The Who&#39;s Who for the playlist #WorldWomen&#39;s Day # IWD2017 pic.twitter.com/5boVvHObql
For #World Women’s Day: Our top women recommend top songs by top musicians &gt;&gt; http://spd-link.de/frauentagmusik # ZeitfürFrauen # IWD2017
Sign our resolution for #Women&#39;s Day now! Against right-wing populists and chauvinists: http://spd-link.de/zeitfuerfrauen # ZeitfürFrauen pic.twitter.com/SYkTItSogm
It is time for # MarriageForEveryone. It&#39;s time for adoption for same-sex couples. It&#39;s #ForMartin. pic.twitter.com/SoRw6Einfi
"For emancipation and equality, against populists and chauvinists - sign now: http://spd-link.de/zeitfuerfrauen # ZeitfürFrauen pic.twitter.com/7W0NgyNUPF"
"Why does the cheese have holes and the cheesecake doesn&#39;t? Happy birthday, dear &quot;show with the mouse&quot;! @DieMaus @DasErste @WDR pic.twitter.com/VRuSPpunDM"
We also! You can find Alice here: @alicephoebelou or here: http://www.alicephoebelou.com
". @ ManuelaSchwesig: Union is block on the leg when modernizing the country. Need strong #SPD, need @MartinSchulz! # Time for women pic.twitter.com/IeVAilqQ28"
. @ MartinSchulz: No place in democracy for their enemies! # Time for women pic.twitter.com/Pbi52DlOKi
. @ ManuelaSchwesig: Must stand up against right-wing populists and defend women&#39;s rights! # Time for women pic.twitter.com/AK1aOQhUO9
&quot;Women: Solidarity!&quot; @inespohl in a talk with @MartinSchulz and @HaticeAkyuen at # ZeitfürFrauen. pic.twitter.com/LOMtVCX8jm
. @ MartinSchulz: Need legal right to return part-time full-time. # ZeitfürFrauen
Full house at the Red Salon for #World Women’s Day with @MartinSchulz and @katarinabarley. # ZeitfürFrauen! pic.twitter.com/lKcuseGwmE
We rely on better qualifications for job seekers. Our concept for more chances of work: http://spdlink.de/ALGQ #ALGQ pic.twitter.com/vIc1fgZTOY
"For emancipation and equality, against populists and chauvinists - sign now: http://spd-link.de/zeitfuerfrauen # ZeitfürFrauen pic.twitter.com/29TbgVq5AW"
We are currently preparing and tomorrow there will be a first résumé.
Nahles at #spdpk: want to introduce unemployment benefit Q - &#39;Q&#39; for &#39;qualification&#39;. If you accept v advanced training up to 48 months ALG I.
Andrea Nahles: Want to strengthen qualifications with the right to further training. Need federal agency for work and qualification.
Now switch on @phoenix_de and follow it live &gt;&gt; http://www.phoenix.de/livestream/ https://twitter.com/phoenix_kom/status/838711510163652608…
"After such a weekend with # fair17 and #SPDHack, the #monday motivation is easy for us. pic.twitter.com/T9vL8QXJcb"
Not everything Jens Spahn posts on Facebook is wrong. Sometimes you just have to look very closely for the truth. pic.twitter.com/15CsoMEAdk
Tonight at 9:45 p.m .: @HeikoMaas at @AnneWillTalk - switch on! https://twitter.com/AnneWillTalk/status/838091934321291266…
". @ katarinabarley and @larsklingbeil take a look at the #SPDhack tools. Madness, what was created in 24 hours. 🤓 pic.twitter.com/H7g2rRXV92"
Visiting @katarinabarley at the #SPDHack: &quot;I am very happy that you are there. I look forward to your ideas.&quot; pic.twitter.com/Pv9VTxsU7G
"Yes, on http://kampa17.spd.de"
#SPDHack is in full swing. Everything from projects to the interface and @MartinSchulz. pic.twitter.com/NgvzmEO4Zc
This afternoon @MartinSchulz is at @spdrlp in Worms. Live stream from 4 p.m. on http://kampa17.spd.de - switch on! # Time for Martin pic.twitter.com/xjZPSpWRHy
Live stream is running! Take a look - on our or Martin&#39;s Facebook channel or on http://kampa17.spd.de! https://twitter.com/spdde/status/837964945627152385…
He&#39;s about to start: Our first SPD hackathon in the Willy-Brandt-Haus! We wish you lots of fun and good luck! #SPDHack pic.twitter.com/hZ6clDCPsJ
The livestream is unfortunately delayed for a moment. https://twitter.com/spdde/status/837964945627152385…
Now LIVE from #Leipzig: @MartinSchulz on https://www.facebook.com/martinschulz/ Switch on! Time for more justice. #zeitfuermartin
"Wow, full house in #Leipzig! Be there live when @MartinSchulz speaks at 2 p.m. https://www.facebook.com/martinschulz/ Happy Sunday #zeitfuermartin pic.twitter.com/lQDgwpWIs9"
@ 2:00 p.m. in #Leipzig. Be there live at https://www.facebook.com/martinschulz/ or http://www.kampa17.de #zeitfuermartin pic.twitter.com/mxib90wsbq
"Sebastian Sieg, 17, wanted to &quot;show public colors &amp; make it clear to my surroundings that you have to do something.&quot; http://dradiowissen.de/beitrag/politik-viele-neumitglieder-bei-parteien… # ZeitFürMartin"
. @ MartinSchulz in an @ LVZ interview: &quot;There is a deep need for justice in our country.&quot; Http://www.lvz.de/Nachrichten/Politik/Martin-Schulz-Es-gibt-ein-tiefes-Beduerfnis- after-justice ... # time for martin
"Currently unclear. As soon as a visit to Munich is due, we will publish the appointment on spd.de."
"Of course, we don&#39;t have and don&#39;t want a troll army. We fight for open debates based on arguments."
Surely @AuswaertigesAmt and / or @sigmargabriel are active there &gt;&gt; https://twitter.com/AuswaertigesAmt/status/832671027876466688…
"You can do one without leaving the other. @NielsAnnen u @nouripour were active, for example: http://www.noz.de/deutschland-welt/politik/artikel/856037/160-abrange-forder-freillassung-von-deniz-yuecel-1… #FreeDeniz"
. @ MartinSchulz posts on Facebook that he wants to talk to the people and @hogesatzbau (great job against the right) reports. ❤️ Internet pic.twitter.com/u8rKIdWccA
Federal Foreign Minister @sigmargabriel says 120 million euros in aid for Chad region and Nigeria at #OsloHumConf &gt;&gt; http://www.auswaertiges-amt.de/DE/Infoservice/Presse/Reden/2017/170224_BM_Tschadsee-Konferenz.html… pic.twitter .com / 7MXibnIBDc
"Very funny, Mr. Tauber! #alaaf pic.twitter.com/Wb5IrZKkOm"
". @ sigmargabriel: Security is more than just counting military hardware. It is also conflict prevention, development pole. + humanitarian aid. pic.twitter.com/ihcebfgy2T"
Do you remember? # Time for Martin pic.twitter.com/NnueWNuwxB
". @ MartinSchulz asked Ford employees: What do you need in your job, where can the state support you? That is her answer. pic.twitter.com/leO6BHQB98"
We think so too. From an attitude. # Best General Secretary 👌 https://twitter.com/lilly_blaudszun/status/831935166851473408…
Another success in the fight against child poverty: Our reform of the #tertainment payment is in the Bundestag today. More information: http://bit.ly/2kVrfNU pic.twitter.com/YiN1gC3nBd
We have improved the disability pension today. Because incapacity to work can affect everyone. More information: http://spdlink.de/szqb pic.twitter.com/kLSLR7PWbB
Great commitment and #hoheEnergie! https://twitter.com/henningtillmann/status/831819702938787840…
Be there! Facebook Live tonight at 7:00 p.m. with the SPD general secretary. You can also ask in advance at #FragKatarina. https://twitter.com/katarinabarley/status/831534647389589504…
You can still apply until tomorrow ;-): https://spd-hackathon.de
Welcome back!
Happy Valentines Day! Make your loved one happy and send them this link: http://eintret.spd.de! ❤️ pic.twitter.com/3vEFpnntrf
Beat us until 28.2. projects worth supporting for the Gustav Heinemann Citizen Prize 2017! More: http://spdlink.de/ghb2017 pic.twitter.com/yIuyAd1yGb
"# Berlinale2017 Preview on Monday, 8 p.m. in the Willy-Brandt-Haus. Register today: kulturforum@spd.de. Bring personal information https://youtu.be/TW6JgLk2PIE"
Lessons learned: @MartinSchulz translated the French leading actresses @katarinabarley&#39;s speech live at our Berlinale evening. :) pic.twitter.com/T5FpeB9nHi
. @ MartinSchulz: &quot;Films can open our eyes to the things in our world that we just sometimes don&#39;t recognize.&quot; # Berlinale2017
". @ katarinabarley: Where the climate is harsher and populists are hitting us, we need you creative artists even more. # Berlinale2017 pic.twitter.com/IoW9tF3T7S"
We are many - and we will be more! Also join: http://eintret.spd.de pic.twitter.com/cDaVKxjdRW
Welcome!
Have a good start into your week! #mondaymotivation pic.twitter.com/WqjcIymWAw
"In SPIEGEL, @MartinSchulz comments on Bannon&#39;s appointment in Nat. Security Council: &quot;Play with the security of the western world.&quot; #AnneWill"
Speaking of ... On the topic at #AnneWill: @MartinSchulz in an interview with SPIEGEL: &quot;Do you think #Trump is a threat to democracy?&quot; &quot;Highly.&quot;
&quot;Trump doesn&#39;t seem to understand the separation of powers.&quot; @HeikoMaas asks about the rule of law of Trump&#39;s decisions. #AnneWill
We too! Let&#39;s get started ... @HeikoMaas at #AnneWill on #Trump https://twitter.com/HeikoMaas/status/828294444252291072…
The @HeikoMaas tonight at #AnneWill on #Trump. It will be exciting. Turn on! https://twitter.com/annewilltalk/status/827931939508203520…
"We agree with that. All the best, Kurt! https://twitter.com/ralf_stegner/status/828177730894229506…"
Are you also modern and want to help Germany stay that way? You can #entry here: http://www.eintret.spd.de
"Justice never grows old, just like the SPD. 😊 @MartinSchulz tells you why. #ZeitfuerMartin pic.twitter.com/Mt0bjiFgwk"
&quot;I will do whatever I can to keep Europe together.&quot; A &quot;declaration of love&quot; from @katarinabarley to Europe: https://www.spd.de/aktuelles/detail/news/europa-ist-unsere-zukunft/04/02/2017/…
"We congratulate you, dear Horst, wholeheartedly on your proud anniversary! :) pic.twitter.com/95LGf2hsm3"
&quot;Can you promise #justice?&quot; Asked @DerSPIEGEL @MartinSchulz. That was his answer. #ZeitfuerMartin pic.twitter.com/BARJUiMauY
SPD eats french fries. pic.twitter.com/EWxUKx8WTe
"Well, in which city center is @MartinSchulz currently walking? #ZeitFuerMartin pic.twitter.com/wVcHExV1GM"
"91 years! Congratulations, dear Hans-Jochen Vogel! We wish you a nice party! pic.twitter.com/94v3upyV5l"
. @ AnkeRehlinger shows how it&#39;s done: she fights for a strong and socially just Saarland. #saartalk #saartext # Anke17 pic.twitter.com/94nQBQJ0ej
Strong performance by @AnkeRehlinger. Fighting for more social justice and cohesion in our society. #saartalk # Anke17
From 1 p.m. we will broadcast the press conference with @MartinSchulz on https://www.spd.de/ in the livestream. #ZeitfuerMartin
What an exciting Sunday: Our Twitter moments for #ZeitfuerMartin! &gt;&gt; https://twitter.com/i/moments/826013821009539072…
"Our #Monday motivation: tackle, make the country fairer, #ZeitfuerMartin! Join in: http://eintret.spd.de! pic.twitter.com/Ft5BvDDEPg"
&quot;I want to win. I&#39;m a fighter by nature and want to fight for people&#39;s trust.&quot; @MartinSchulz at #AnneWill
&quot;I want to be a politician that people know about: he can understand the concerns we have.&quot; @MartinSchulz #annewill
&quot;Everything is possible if we make it clear to people that the state is there for the hard-working middle class.&quot; @martinschulz at @AnneWillTalk
&quot;The waiver is a great character achievement of @sigmargabriel.&quot; @Martinschulz at @AnneWillTalk #ZeitfuerMartin
We say: This will be fine and will switch on. @The First 9:45 p.m. #ZeitfuerMartin #Servicetweet 🤓 https://twitter.com/AnneWillTalk/status/825635466951139328…
". @ MartinSchulz: &quot;The #SPD is jerking, the whole country is jerking!&quot; Be there !: http://eintret.spd.de #ZeitfuerMartin pic.twitter.com/YdFlWnoax2"
"No inauguration yet, but also quite good. ;) #ZeitfuerMartin pic.twitter.com/QbjOOUU1N2"
Willy also liked it very much. We thank you for this great day! From now on it says: #ZeitfuerMartin! Here we go! pic.twitter.com/Nbc4H1bPKS
Beloved hotspot during the sessions. #ZeitfuerMartin pic.twitter.com/S9sa44tat1
Good conversations during the sessions. #ZeitfuerMartin pic.twitter.com/IHS4eNhbN9
Time for Martin. Time for you. Be there: http://spdlink.de/martin2017 #ZeitfuerMartin pic.twitter.com/lcTumIcMb4
&quot;suddenly&quot;? 🤔
Minutes of standing ovations after a big speech by @MartinSchulz. #ZeitfuerMartin pic.twitter.com/ccqterHrMr
